Sheet: curvi
J1: max BA (1) | K1: max BA (2)
J2: of:=MAX([.J5:.J45]) -> 0.0252048918264033 | K2: of:=MAX([.K5:.K45]) -> -0.000000000025402069522872
B4: Rc | C4: Rt total (1) | D4: Rt total (2) | E4: NNT total (1) | F4: RR total (1) | G4: OR total (1) | H4: Rt+ | I4: Rt- | J4: BA (1) | K4: BA (2) | L4: pas | N4: dose | O4: gamma | P4: ED50 | Q4: S | R4: Emax
A5: 1 | B5: 0.0000000001 | C5: of:=[.H5] -> 0.0000000000904020695228722 | D5: of:=[.H5]+[.I5] -> 0.000000000125402069522872 | E5: of:=1/([.B5]-[.C5]) -> 104189127268.949 | F5: of:=[.C5]/[.B5] -> 0.904020695228721 | G5: of:=([.C5]/(1-[.C5]))/([.B5]/(1-[.B5])) -> 0.904020695220045 | H5: of:=([.B5]*[.$M$5])/(1-[.B5]+([.B5]*[.$M$5])) -> 0.0000000000904020695228722 | I5: of:=[.$L$7]*[.B5] -> 0.000000000035 | J5: of:=[.B5]-[.C5] -> 0.00000000000959793047712785 | K5: of:=[.B5]-[.D5] -> -0.000000000025402069522872 | L5: 0.025 | M5: of:=([.Q5]*[.R5]*(POWER([.N5];[.O5])))/((POWER([.P5];[.O5]))+(POWER([.N5];[.O5]))) -> 0.904020695220045 | N5: 5 | O5: 2.7 | P5: 29 | Q5: 3 | R5: 35
A6: of:=[.A5]+1 -> 2 | B6: of:=[.B5]+[.$L$5] -> 0.0250000001 | C6: of:=[.H6] -> 0.0226548774558228 | D6: of:=[.H6]+[.I6] -> 0.0314048774908228 | E6: of:=1/([.B6]-[.C6]) -> 426.416930680756 | F6: of:=[.C6]/[.B6] -> 0.90619509460813 | G6: of:=([.C6]/(1-[.C6]))/([.B6]/(1-[.B6])) -> 0.904020695220045 | H6: of:=([.B6]*[.$M$5])/(1-[.B6]+([.B6]*[.$M$5])) -> 0.0226548774558228 | I6: of:=[.$L$7]*[.B6] -> 0.008750000035 | J6: of:=[.B6]-[.C6] -> 0.00234512264417725 | K6: of:=[.B6]-[.D6] -> -0.00640487739082279 | L6: coeff iatro
A7: of:=[.A6]+1 -> 3 | B7: of:=[.B6]+[.$L$5] -> 0.0500000001 | C7: of:=[.H7] -> 0.0454189990494687 | D7: of:=[.H7]+[.I7] -> 0.0629189990844687 | E7: of:=1/([.B7]-[.C7]) -> 218.292899078035 | F7: of:=[.C7]/[.B7] -> 0.908379979172614 | G7: of:=([.C7]/(1-[.C7]))/([.B7]/(1-[.B7])) -> 0.904020695220045 | H7: of:=([.B7]*[.$M$5])/(1-[.B7]+([.B7]*[.$M$5])) -> 0.0454189990494687 | I7: of:=[.$L$7]*[.B7] -> 0.017500000035 | J7: of:=[.B7]-[.C7] -> 0.00458100105053129 | K7: of:=[.B7]-[.D7] -> -0.0129189989844687 | L7: 0.35
A8: of:=[.A7]+1 -> 4 | B8: of:=[.B7]+[.$L$5] -> 0.0750000001 | C8: of:=[.H8] -> 0.0682931569620443 | D8: of:=[.H8]+[.I8] -> 0.0945431569970443 | E8: of:=1/([.B8]-[.C8]) -> 149.101444514298 | F8: of:=[.C8]/[.B8] -> 0.91057542494649 | G8: of:=([.C8]/(1-[.C8]))/([.B8]/(1-[.B8])) -> 0.904020695220045 | H8: of:=([.B8]*[.$M$5])/(1-[.B8]+([.B8]*[.$M$5])) -> 0.0682931569620443 | I8: of:=[.$L$7]*[.B8] -> 0.026250000035 | J8: of:=[.B8]-[.C8] -> 0.00670684313795569 | K8: of:=[.B8]-[.D8] -> -0.0195431568970443
A9: of:=[.A8]+1 -> 5 | B9: of:=[.B8]+[.$L$5] -> 0.1000000001 | C9: of:=[.H9] -> 0.0912781509603602 | D9: of:=[.H9]+[.I9] -> 0.12627815099536 | E9: of:=1/([.B9]-[.C9]) -> 114.654585740896 | F9: of:=[.C9]/[.B9] -> 0.91278150869082 | G9: of:=([.C9]/(1-[.C9]))/([.B9]/(1-[.B9])) -> 0.904020695220045 | H9: of:=([.B9]*[.$M$5])/(1-[.B9]+([.B9]*[.$M$5])) -> 0.0912781509603602 | I9: of:=[.$L$7]*[.B9] -> 0.035000000035 | J9: of:=[.B9]-[.C9] -> 0.00872184913963986 | K9: of:=[.B9]-[.D9] -> -0.02627815089536
A10: of:=[.A9]+1 -> 6 | B10: of:=[.B9]+[.$L$5] -> 0.1250000001 | C10: of:=[.H10] -> 0.114374788580545 | D10: of:=[.H10]+[.I10] -> 0.158124788615545 | E10: of:=1/([.B10]-[.C10]) -> 94.115773428977 | F10: of:=[.C10]/[.B10] -> 0.91499830791236 | G10: of:=([.C10]/(1-[.C10]))/([.B10]/(1-[.B10])) -> 0.904020695220045 | H10: of:=([.B10]*[.$M$5])/(1-[.B10]+([.B10]*[.$M$5])) -> 0.114374788580545 | I10: of:=[.$L$7]*[.B10] -> 0.043750000035 | J10: of:=[.B10]-[.C10] -> 0.0106252115194552 | K10: of:=[.B10]-[.D10] -> -0.033124788515545
A11: of:=[.A10]+1 -> 7 | B11: of:=[.B10]+[.$L$5] -> 0.1500000001 | C11: of:=[.H11] -> 0.137583885222618 | D11: of:=[.H11]+[.I11] -> 0.190083885257618 | E11: of:=1/([.B11]-[.C11]) -> 80.5404919232566 | F11: of:=[.C11]/[.B11] -> 0.917225900872637 | G11: of:=([.C11]/(1-[.C11]))/([.B11]/(1-[.B11])) -> 0.904020695220045 | H11: of:=([.B11]*[.$M$5])/(1-[.B11]+([.B11]*[.$M$5])) -> 0.137583885222618 | I11: of:=[.$L$7]*[.B11] -> 0.052500000035 | J11: of:=[.B11]-[.C11] -> 0.0124161148773819 | K11: of:=[.B11]-[.D11] -> -0.040083885157618
A12: of:=[.A11]+1 -> 8 | B12: of:=[.B11]+[.$L$5] -> 0.1750000001 | C12: of:=[.H12] -> 0.160906264246449 | D12: of:=[.H12]+[.I12] -> 0.222156264281449 | E12: of:=1/([.B12]-[.C12]) -> 70.9535080259121 | F12: of:=[.C12]/[.B12] -> 0.919464366597159 | G12: of:=([.C12]/(1-[.C12]))/([.B12]/(1-[.B12])) -> 0.904020695220045 | H12: of:=([.B12]*[.$M$5])/(1-[.B12]+([.B12]*[.$M$5])) -> 0.160906264246449 | I12: of:=[.$L$7]*[.B12] -> 0.061250000035 | J12: of:=[.B12]-[.C12] -> 0.0140937358535508 | K12: of:=[.B12]-[.D12] -> -0.047156264181449
A13: of:=[.A12]+1 -> 9 | B13: of:=[.B12]+[.$L$5] -> 0.2000000001 | C13: of:=[.H13] -> 0.184342757069123 | D13: of:=[.H13]+[.I13] -> 0.254342757104123 | E13: of:=1/([.B13]-[.C13]) -> 63.8682045126308 | F13: of:=[.C13]/[.B13] -> 0.921713784884759 | G13: of:=([.C13]/(1-[.C13]))/([.B13]/(1-[.B13])) -> 0.904020695220045 | H13: of:=([.B13]*[.$M$5])/(1-[.B13]+([.B13]*[.$M$5])) -> 0.184342757069123 | I13: of:=[.$L$7]*[.B13] -> 0.070000000035 | J13: of:=[.B13]-[.C13] -> 0.0156572430308768 | K13: of:=[.B13]-[.D13] -> -0.054342757004123
A14: of:=[.A13]+1 -> 10 | B14: of:=[.B13]+[.$L$5] -> 0.2250000001 | C14: of:=[.H14] -> 0.207894203263741 | D14: of:=[.H14]+[.I14] -> 0.286644203298741 | E14: of:=1/([.B14]-[.C14]) -> 58.4597145384243 | F14: of:=[.C14]/[.B14] -> 0.923974236317081 | G14: of:=([.C14]/(1-[.C14]))/([.B14]/(1-[.B14])) -> 0.904020695220045 | H14: of:=([.B14]*[.$M$5])/(1-[.B14]+([.B14]*[.$M$5])) -> 0.207894203263741 | I14: of:=[.$L$7]*[.B14] -> 0.078750000035 | J14: of:=[.B14]-[.C14] -> 0.0171057968362593 | K14: of:=[.B14]-[.D14] -> -0.061644203198741
A15: of:=[.A14]+1 -> 11 | B15: of:=[.B14]+[.$L$5] -> 0.2500000001 | C15: of:=[.H15] -> 0.231561450659674 | D15: of:=[.H15]+[.I15] -> 0.319061450694674 | E15: of:=1/([.B15]-[.C15]) -> 54.234201190087 | F15: of:=[.C15]/[.B15] -> 0.926245802268198 | G15: of:=([.C15]/(1-[.C15]))/([.B15]/(1-[.B15])) -> 0.904020695220045 | H15: of:=([.B15]*[.$M$5])/(1-[.B15]+([.B15]*[.$M$5])) -> 0.231561450659674 | I15: of:=[.$L$7]*[.B15] -> 0.087500000035 | J15: of:=[.B15]-[.C15] -> 0.0184385494403259 | K15: of:=[.B15]-[.D15] -> -0.069061450594674
A16: of:=[.A15]+1 -> 12 | B16: of:=[.B15]+[.$L$5] -> 0.2750000001 | C16: of:=[.H16] -> 0.255345355444307 | D16: of:=[.H16]+[.I16] -> 0.351595355479307 | E16: of:=1/([.B16]-[.C16]) -> 50.8785591150521 | F16: of:=[.C16]/[.B16] -> 0.92852856491438 | G16: of:=([.C16]/(1-[.C16]))/([.B16]/(1-[.B16])) -> 0.904020695220045 | H16: of:=([.B16]*[.$M$5])/(1-[.B16]+([.B16]*[.$M$5])) -> 0.255345355444307 | I16: of:=[.$L$7]*[.B16] -> 0.096250000035 | J16: of:=[.B16]-[.C16] -> 0.0196546446556926 | K16: of:=[.B16]-[.D16] -> -0.076595355379307
A17: of:=[.A16]+1 -> 13 | B17: of:=[.B16]+[.$L$5] -> 0.3000000001 | C17: of:=[.H17] -> 0.279246782266283 | D17: of:=[.H17]+[.I17] -> 0.384246782301283 | E17: of:=1/([.B17]-[.C17]) -> 48.1852986853601 | F17: of:=[.C17]/[.B17] -> 0.930822607244002 | G17: of:=([.C17]/(1-[.C17]))/([.B17]/(1-[.B17])) -> 0.904020695220045 | H17: of:=([.B17]*[.$M$5])/(1-[.B17]+([.B17]*[.$M$5])) -> 0.279246782266283 | I17: of:=[.$L$7]*[.B17] -> 0.105000000035 | J17: of:=[.B17]-[.C17] -> 0.0207532178337171 | K17: of:=[.B17]-[.D17] -> -0.084246782201283
A18: of:=[.A17]+1 -> 14 | B18: of:=[.B17]+[.$L$5] -> 0.3250000001 | C18: of:=[.H18] -> 0.303266604340284 | D18: of:=[.H18]+[.I18] -> 0.417016604375284 | E18: of:=1/([.B18]-[.C18]) -> 46.0121377743253 | F18: of:=[.C18]/[.B18] -> 0.933128013067603 | G18: of:=([.C18]/(1-[.C18]))/([.B18]/(1-[.B18])) -> 0.904020695220045 | H18: of:=([.B18]*[.$M$5])/(1-[.B18]+([.B18]*[.$M$5])) -> 0.303266604340284 | I18: of:=[.$L$7]*[.B18] -> 0.113750000035 | J18: of:=[.B18]-[.C18] -> 0.0217333957597162 | K18: of:=[.B18]-[.D18] -> -0.092016604275284
A19: of:=[.A18]+1 -> 15 | B19: of:=[.B18]+[.$L$5] -> 0.3500000001 | C19: of:=[.H19] -> 0.327405703553376 | D19: of:=[.H19]+[.I19] -> 0.449905703588376 | E19: of:=1/([.B19]-[.C19]) -> 44.2589570308802 | F19: of:=[.C19]/[.B19] -> 0.93544486702809 | G19: of:=([.C19]/(1-[.C19]))/([.B19]/(1-[.B19])) -> 0.904020695220044 | H19: of:=([.B19]*[.$M$5])/(1-[.B19]+([.B19]*[.$M$5])) -> 0.327405703553376 | I19: of:=[.$L$7]*[.B19] -> 0.122500000035 | J19: of:=[.B19]-[.C19] -> 0.0225942965466241 | K19: of:=[.B19]-[.D19] -> -0.099905703488376
A20: of:=[.A19]+1 -> 16 | B20: of:=[.B19]+[.$L$5] -> 0.3750000001 | C20: of:=[.H20] -> 0.35166497057294 | D20: of:=[.H20]+[.I20] -> 0.48291497060794 | E20: of:=1/([.B20]-[.C20]) -> 42.8540276257352 | F20: of:=[.C20]/[.B20] -> 0.937773254611099 | G20: of:=([.C20]/(1-[.C20]))/([.B20]/(1-[.B20])) -> 0.904020695220045 | H20: of:=([.B20]*[.$M$5])/(1-[.B20]+([.B20]*[.$M$5])) -> 0.35166497057294 | I20: of:=[.$L$7]*[.B20] -> 0.131250000035 | J20: of:=[.B20]-[.C20] -> 0.0233350295270606 | K20: of:=[.B20]-[.D20] -> -0.10791497050794
A21: of:=[.A20]+1 -> 17 | B21: of:=[.B20]+[.$L$5] -> 0.4000000001 | C21: of:=[.H21] -> 0.376045304956215 | D21: of:=[.H21]+[.I21] -> 0.516045304991215 | E21: of:=1/([.B21]-[.C21]) -> 41.7454696875755 | F21: of:=[.C21]/[.B21] -> 0.940113262155509 | G21: of:=([.C21]/(1-[.C21]))/([.B21]/(1-[.B21])) -> 0.904020695220045 | H21: of:=([.B21]*[.$M$5])/(1-[.B21]+([.B21]*[.$M$5])) -> 0.376045304956215 | I21: of:=[.$L$7]*[.B21] -> 0.140000000035 | J21: of:=[.B21]-[.C21] -> 0.0239546951437853 | K21: of:=[.B21]-[.D21] -> -0.116045304891215
A22: of:=[.A21]+1 -> 18 | B22: of:=[.B21]+[.$L$5] -> 0.4250000001 | C22: of:=[.H22] -> 0.400547615261494 | D22: of:=[.H22]+[.I22] -> 0.549297615296494 | E22: of:=1/([.B22]-[.C22]) -> 40.895806548295 | F22: of:=[.C22]/[.B22] -> 0.942464976864112 | G22: of:=([.C22]/(1-[.C22]))/([.B22]/(1-[.B22])) -> 0.904020695220045 | H22: of:=([.B22]*[.$M$5])/(1-[.B22]+([.B22]*[.$M$5])) -> 0.400547615261494 | I22: of:=[.$L$7]*[.B22] -> 0.148750000035 | J22: of:=[.B22]-[.C22] -> 0.0244523848385059 | K22: of:=[.B22]-[.D22] -> -0.124297615196494
A23: of:=[.A22]+1 -> 19 | B23: of:=[.B22]+[.$L$5] -> 0.4500000001 | C23: of:=[.H23] -> 0.425172819160985 | D23: of:=[.H23]+[.I23] -> 0.582672819195986 | E23: of:=1/([.B23]-[.C23]) -> 40.2784352543445 | F23: of:=[.C23]/[.B23] -> 0.94482848681445 | G23: of:=([.C23]/(1-[.C23]))/([.B23]/(1-[.B23])) -> 0.904020695220045 | H23: of:=([.B23]*[.$M$5])/(1-[.B23]+([.B23]*[.$M$5])) -> 0.425172819160985 | I23: of:=[.$L$7]*[.B23] -> 0.157500000035 | J23: of:=[.B23]-[.C23] -> 0.0248271809390147 | K23: of:=[.B23]-[.D23] -> -0.132672819095986
A24: of:=[.A23]+1 -> 20 | B24: of:=[.B23]+[.$L$5] -> 0.4750000001 | C24: of:=[.H24] -> 0.449921843555378 | D24: of:=[.H24]+[.I24] -> 0.616171843590378 | E24: of:=1/([.B24]-[.C24]) -> 39.8753392507415 | F24: of:=[.C24]/[.B24] -> 0.947203880969806 | G24: of:=([.C24]/(1-[.C24]))/([.B24]/(1-[.B24])) -> 0.904020695220045 | H24: of:=([.B24]*[.$M$5])/(1-[.B24]+([.B24]*[.$M$5])) -> 0.449921843555378 | I24: of:=[.$L$7]*[.B24] -> 0.166250000035 | J24: of:=[.B24]-[.C24] -> 0.0250781565446219 | K24: of:=[.B24]-[.D24] -> -0.141171843490378
A25: of:=[.A24]+1 -> 21 | B25: of:=[.B24]+[.$L$5] -> 0.5000000001 | C25: of:=[.H25] -> 0.474795624690144 | D25: of:=[.H25]+[.I25] -> 0.649795624725144 | E25: of:=1/([.B25]-[.C25]) -> 39.6756509034121 | F25: of:=[.C25]/[.B25] -> 0.949591249190369 | G25: of:=([.C25]/(1-[.C25]))/([.B25]/(1-[.B25])) -> 0.904020695220045 | H25: of:=([.B25]*[.$M$5])/(1-[.B25]+([.B25]*[.$M$5])) -> 0.474795624690144 | I25: of:=[.$L$7]*[.B25] -> 0.175000000035 | J25: of:=[.B25]-[.C25] -> 0.0252043754098562 | K25: of:=[.B25]-[.D25] -> -0.149795624625144
A26: of:=[.A25]+1 -> 22 | B26: of:=[.B25]+[.$L$5] -> 0.5250000001 | C26: of:=[.H26] -> 0.499795108273597 | D26: of:=[.H26]+[.I26] -> 0.683545108308597 | E26: of:=1/([.B26]-[.C26]) -> 39.6748379992035 | F26: of:=[.C26]/[.B26] -> 0.951990682244567 | G26: of:=([.C26]/(1-[.C26]))/([.B26]/(1-[.B26])) -> 0.904020695220045 | H26: of:=([.B26]*[.$M$5])/(1-[.B26]+([.B26]*[.$M$5])) -> 0.499795108273597 | I26: of:=[.$L$7]*[.B26] -> 0.183750000035 | J26: of:=[.B26]-[.C26] -> 0.0252048918264033 | K26: of:=[.B26]-[.D26] -> -0.158545108208597
A27: of:=[.A26]+1 -> 23 | B27: of:=[.B26]+[.$L$5] -> 0.5500000001 | C27: of:=[.H27] -> 0.524921249596752 | D27: of:=[.H27]+[.I27] -> 0.717421249631752 | E27: of:=1/([.B27]-[.C27]) -> 39.8743948535425 | F27: of:=[.C27]/[.B27] -> 0.954402271820566 | G27: of:=([.C27]/(1-[.C27]))/([.B27]/(1-[.B27])) -> 0.904020695220045 | H27: of:=([.B27]*[.$M$5])/(1-[.B27]+([.B27]*[.$M$5])) -> 0.524921249596752 | I27: of:=[.$L$7]*[.B27] -> 0.192500000035 | J27: of:=[.B27]-[.C27] -> 0.0250787505032483 | K27: of:=[.B27]-[.D27] -> -0.167421249531752
A28: of:=[.A27]+1 -> 24 | B28: of:=[.B27]+[.$L$5] -> 0.5750000001 | C28: of:=[.H28] -> 0.550175013655007 | D28: of:=[.H28]+[.I28] -> 0.751425013690007 | E28: of:=1/([.B28]-[.C28]) -> 40.2819958115899 | F28: of:=[.C28]/[.B28] -> 0.956826110537955 | G28: of:=([.C28]/(1-[.C28]))/([.B28]/(1-[.B28])) -> 0.904020695220045 | H28: of:=([.B28]*[.$M$5])/(1-[.B28]+([.B28]*[.$M$5])) -> 0.550175013655007 | I28: of:=[.$L$7]*[.B28] -> 0.201250000035 | J28: of:=[.B28]-[.C28] -> 0.0248249864449934 | K28: of:=[.B28]-[.D28] -> -0.176425013590007
A29: of:=[.A28]+1 -> 25 | B29: of:=[.B28]+[.$L$5] -> 0.6000000001 | C29: of:=[.H29] -> 0.575557375271685 | D29: of:=[.H29]+[.I29] -> 0.785557375306685 | E29: of:=1/([.B29]-[.C29]) -> 40.9121363611304 | F29: of:=[.C29]/[.B29] -> 0.959262291959597 | G29: of:=([.C29]/(1-[.C29]))/([.B29]/(1-[.B29])) -> 0.904020695220045 | H29: of:=([.B29]*[.$M$5])/(1-[.B29]+([.B29]*[.$M$5])) -> 0.575557375271685 | I29: of:=[.$L$7]*[.B29] -> 0.210000000035 | J29: of:=[.B29]-[.C29] -> 0.0244426248283156 | K29: of:=[.B29]-[.D29] -> -0.185557375206685
A30: of:=[.A29]+1 -> 26 | B30: of:=[.B29]+[.$L$5] -> 0.6250000001 | C30: of:=[.H30] -> 0.601069319223468 | D30: of:=[.H30]+[.I30] -> 0.819819319258468 | E30: of:=1/([.B30]-[.C30]) -> 41.7873609680968 | F30: of:=[.C30]/[.B30] -> 0.961710910603674 | G30: of:=([.C30]/(1-[.C30]))/([.B30]/(1-[.B30])) -> 0.904020695220045 | H30: of:=([.B30]*[.$M$5])/(1-[.B30]+([.B30]*[.$M$5])) -> 0.601069319223468 | I30: of:=[.$L$7]*[.B30] -> 0.218750000035 | J30: of:=[.B30]-[.C30] -> 0.0239306808765326 | K30: of:=[.B30]-[.D30] -> -0.194819319158468
A31: of:=[.A30]+1 -> 27 | B31: of:=[.B30]+[.$L$5] -> 0.6500000001 | C31: of:=[.H31] -> 0.626711840367758 | D31: of:=[.H31]+[.I31] -> 0.854211840402758 | E31: of:=1/([.B31]-[.C31]) -> 42.9402757236978 | F31: of:=[.C31]/[.B31] -> 0.964172061955908 | G31: of:=([.C31]/(1-[.C31]))/([.B31]/(1-[.B31])) -> 0.904020695220045 | H31: of:=([.B31]*[.$M$5])/(1-[.B31]+([.B31]*[.$M$5])) -> 0.626711840367758 | I31: of:=[.$L$7]*[.B31] -> 0.227500000035 | J31: of:=[.B31]-[.C31] -> 0.0232881597322423 | K31: of:=[.B31]-[.D31] -> -0.204211840302758
A32: of:=[.A31]+1 -> 28 | B32: of:=[.B31]+[.$L$5] -> 0.6750000001 | C32: of:=[.H32] -> 0.652485943771997 | D32: of:=[.H32]+[.I32] -> 0.888735943806998 | E32: of:=1/([.B32]-[.C32]) -> 44.4166961933111 | F32: of:=[.C32]/[.B32] -> 0.966645842481974 | G32: of:=([.C32]/(1-[.C32]))/([.B32]/(1-[.B32])) -> 0.904020695220045 | H32: of:=([.B32]*[.$M$5])/(1-[.B32]+([.B32]*[.$M$5])) -> 0.652485943771997 | I32: of:=[.$L$7]*[.B32] -> 0.236250000035 | J32: of:=[.B32]-[.C32] -> 0.022514056328003 | K32: of:=[.B32]-[.D32] -> -0.213735943706998
A33: of:=[.A32]+1 -> 29 | B33: of:=[.B32]+[.$L$5] -> 0.7000000001 | C33: of:=[.H33] -> 0.678392644844985 | D33: of:=[.H33]+[.I33] -> 0.923392644879985 | E33: of:=1/([.B33]-[.C33]) -> 46.2805367985916 | F33: of:=[.C33]/[.B33] -> 0.969132349640101 | G33: of:=([.C33]/(1-[.C33]))/([.B33]/(1-[.B33])) -> 0.904020695220044 | H33: of:=([.B33]*[.$M$5])/(1-[.B33]+([.B33]*[.$M$5])) -> 0.678392644844985 | I33: of:=[.$L$7]*[.B33] -> 0.245000000035 | J33: of:=[.B33]-[.C33] -> 0.0216073552550158 | K33: of:=[.B33]-[.D33] -> -0.223392644779985
A34: of:=[.A33]+1 -> 30 | B34: of:=[.B33]+[.$L$5] -> 0.7250000001 | C34: of:=[.H34] -> 0.704432969470224 | D34: of:=[.H34]+[.I34] -> 0.958182969505224 | E34: of:=1/([.B34]-[.C34]) -> 48.6215058459738 | F34: of:=[.C34]/[.B34] -> 0.971631681893876 | G34: of:=([.C34]/(1-[.C34]))/([.B34]/(1-[.B34])) -> 0.904020695220045 | H34: of:=([.B34]*[.$M$5])/(1-[.B34]+([.B34]*[.$M$5])) -> 0.704432969470224 | I34: of:=[.$L$7]*[.B34] -> 0.253750000035 | J34: of:=[.B34]-[.C34] -> 0.0205670306297765 | K34: of:=[.B34]-[.D34] -> -0.233182969405224
A35: of:=[.A34]+1 -> 31 | B35: of:=[.B34]+[.$L$5] -> 0.7500000001 | C35: of:=[.H35] -> 0.730607954141342 | D35: of:=[.H35]+[.I35] -> 0.993107954176342 | E35: of:=1/([.B35]-[.C35]) -> 51.5675345516341 | F35: of:=[.C35]/[.B35] -> 0.974143938725236 | G35: of:=([.C35]/(1-[.C35]))/([.B35]/(1-[.B35])) -> 0.904020695220045 | H35: of:=([.B35]*[.$M$5])/(1-[.B35]+([.B35]*[.$M$5])) -> 0.730607954141342 | I35: of:=[.$L$7]*[.B35] -> 0.262500000035 | J35: of:=[.B35]-[.C35] -> 0.0193920459586585 | K35: of:=[.B35]-[.D35] -> -0.243107954076342
A36: of:=[.A35]+1 -> 32 | B36: of:=[.B35]+[.$L$5] -> 0.7750000001 | C36: of:=[.H36] -> 0.756918646099612 | D36: of:=[.H36]+[.I36] -> 1.02816864613461 | E36: of:=1/([.B36]-[.C36]) -> 55.3055927105081 | F36: of:=[.C36]/[.B36] -> 0.976669220647671 | G36: of:=([.C36]/(1-[.C36]))/([.B36]/(1-[.B36])) -> 0.904020695220045 | H36: of:=([.B36]*[.$M$5])/(1-[.B36]+([.B36]*[.$M$5])) -> 0.756918646099612 | I36: of:=[.$L$7]*[.B36] -> 0.271250000035 | J36: of:=[.B36]-[.C36] -> 0.0180813540003885 | K36: of:=[.B36]-[.D36] -> -0.25316864603461
A37: of:=[.A36]+1 -> 33 | B37: of:=[.B36]+[.$L$5] -> 0.8000000001 | C37: of:=[.H37] -> 0.783366103473622 | D37: of:=[.H37]+[.I37] -> 1.06336610350862 | E37: of:=1/([.B37]-[.C37]) -> 60.1182045591257 | F37: of:=[.C37]/[.B37] -> 0.979207629219625 | G37: of:=([.C37]/(1-[.C37]))/([.B37]/(1-[.B37])) -> 0.904020695220044 | H37: of:=([.B37]*[.$M$5])/(1-[.B37]+([.B37]*[.$M$5])) -> 0.783366103473622 | I37: of:=[.$L$7]*[.B37] -> 0.280000000035 | J37: of:=[.B37]-[.C37] -> 0.0166338966263789 | K37: of:=[.B37]-[.D37] -> -0.263366103408619
A38: of:=[.A37]+1 -> 34 | B38: of:=[.B37]+[.$L$5] -> 0.825000000100001 | C38: of:=[.H38] -> 0.809951395421125 | D38: of:=[.H38]+[.I38] -> 1.09870139545613 | E38: of:=1/([.B38]-[.C38]) -> 66.4513435856099 | F38: of:=[.C38]/[.B38] -> 0.981759267058119 | G38: of:=([.C38]/(1-[.C38]))/([.B38]/(1-[.B38])) -> 0.904020695220045 | H38: of:=([.B38]*[.$M$5])/(1-[.B38]+([.B38]*[.$M$5])) -> 0.809951395421125 | I38: of:=[.$L$7]*[.B38] -> 0.288750000035 | J38: of:=[.B38]-[.C38] -> 0.0150486046788759 | K38: of:=[.B38]-[.D38] -> -0.273701395356129
A39: of:=[.A38]+1 -> 35 | B39: of:=[.B38]+[.$L$5] -> 0.850000000100001 | C39: of:=[.H39] -> 0.836675602273116 | D39: of:=[.H39]+[.I39] -> 1.13417560230812 | E39: of:=1/([.B39]-[.C39]) -> 75.0502959302476 | F39: of:=[.C39]/[.B39] -> 0.984324237852569 | G39: of:=([.C39]/(1-[.C39]))/([.B39]/(1-[.B39])) -> 0.904020695220045 | H39: of:=([.B39]*[.$M$5])/(1-[.B39]+([.B39]*[.$M$5])) -> 0.836675602273116 | I39: of:=[.$L$7]*[.B39] -> 0.297500000035 | J39: of:=[.B39]-[.C39] -> 0.0133243978268841 | K39: of:=[.B39]-[.D39] -> -0.284175602208119
A40: of:=[.A39]+1 -> 36 | B40: of:=[.B39]+[.$L$5] -> 0.875000000100001 | C40: of:=[.H40] -> 0.863539815680175 | D40: of:=[.H40]+[.I40] -> 1.16978981571517 | E40: of:=1/([.B40]-[.C40]) -> 87.2586306962051 | F40: of:=[.C40]/[.B40] -> 0.986902646378839 | G40: of:=([.C40]/(1-[.C40]))/([.B40]/(1-[.B40])) -> 0.904020695220044 | H40: of:=([.B40]*[.$M$5])/(1-[.B40]+([.B40]*[.$M$5])) -> 0.863539815680175 | I40: of:=[.$L$7]*[.B40] -> 0.306250000035 | J40: of:=[.B40]-[.C40] -> 0.011460184419826 | K40: of:=[.B40]-[.D40] -> -0.294789815615169
A41: of:=[.A40]+1 -> 37 | B41: of:=[.B40]+[.$L$5] -> 0.900000000100001 | C41: of:=[.H41] -> 0.890545138761104 | D41: of:=[.H41]+[.I41] -> 1.2055451387961 | E41: of:=1/([.B41]-[.C41]) -> 105.765697047937 | F41: of:=[.C41]/[.B41] -> 0.989494598513504 | G41: of:=([.C41]/(1-[.C41]))/([.B41]/(1-[.B41])) -> 0.904020695220044 | H41: of:=([.B41]*[.$M$5])/(1-[.B41]+([.B41]*[.$M$5])) -> 0.890545138761104 | I41: of:=[.$L$7]*[.B41] -> 0.315000000035 | J41: of:=[.B41]-[.C41] -> 0.00945486133889673 | K41: of:=[.B41]-[.D41] -> -0.305545138696099
A42: of:=[.A41]+1 -> 38 | B42: of:=[.B41]+[.$L$5] -> 0.925000000100001 | C42: of:=[.H42] -> 0.917692686253931 | D42: of:=[.H42]+[.I42] -> 1.24144268628893 | E42: of:=1/([.B42]-[.C42]) -> 136.849192612401 | F42: of:=[.C42]/[.B42] -> 0.992100201248347 | G42: of:=([.C42]/(1-[.C42]))/([.B42]/(1-[.B42])) -> 0.904020695220045 | H42: of:=([.B42]*[.$M$5])/(1-[.B42]+([.B42]*[.$M$5])) -> 0.917692686253931 | I42: of:=[.$L$7]*[.B42] -> 0.323750000035 | J42: of:=[.B42]-[.C42] -> 0.00730731384606931 | K42: of:=[.B42]-[.D42] -> -0.316442686188929
A43: of:=[.A42]+1 -> 39 | B43: of:=[.B42]+[.$L$5] -> 0.950000000100001 | C43: of:=[.H43] -> 0.944983584669292 | D43: of:=[.H43]+[.I43] -> 1.27748358470429 | E43: of:=1/([.B43]-[.C43]) -> 199.3455314483 | F43: of:=[.C43]/[.B43] -> 0.994719562705073 | G43: of:=([.C43]/(1-[.C43]))/([.B43]/(1-[.B43])) -> 0.904020695220045 | H43: of:=([.B43]*[.$M$5])/(1-[.B43]+([.B43]*[.$M$5])) -> 0.944983584669292 | I43: of:=[.$L$7]*[.B43] -> 0.332500000035 | J43: of:=[.B43]-[.C43] -> 0.0050164154307083 | K43: of:=[.B43]-[.D43] -> -0.327483584604289
A44: of:=[.A43]+1 -> 40 | B44: of:=[.B43]+[.$L$5] -> 0.975000000100001 | C44: of:=[.H44] -> 0.972418972446254 | D44: of:=[.H44]+[.I44] -> 1.31366897248125 | E44: of:=1/([.B44]-[.C44]) -> 387.442574878378 | F44: of:=[.C44]/[.B44] -> 0.997352792150275 | G44: of:=([.C44]/(1-[.C44]))/([.B44]/(1-[.B44])) -> 0.904020695220046 | H44: of:=([.B44]*[.$M$5])/(1-[.B44]+([.B44]*[.$M$5])) -> 0.972418972446254 | I44: of:=[.$L$7]*[.B44] -> 0.341250000035 | J44: of:=[.B44]-[.C44] -> 0.0025810276537469 | K44: of:=[.B44]-[.D44] -> -0.338668972381249
A45: of:=[.A44]+1 -> 41 | B45: of:=[.B44]+[.$L$5] -> 1.0000000001 | C45: of:=[.H45] -> 1.00000000011062 | D45: of:=[.H45]+[.I45] -> 1.35000000014562 | E45: of:=1/([.B45]-[.C45]) -> -94188008519.7218 | F45: of:=[.C45]/[.B45] -> 1.00000000001062 | G45: of:=([.C45]/(1-[.C45]))/([.B45]/(1-[.B45])) -> 0.904020249799834 | H45: of:=([.B45]*[.$M$5])/(1-[.B45]+([.B45]*[.$M$5])) -> 1.00000000011062 | I45: of:=[.$L$7]*[.B45] -> 0.350000000035 | J45: of:=[.B45]-[.C45] -> -0.0000000000106170627844904 | K45: of:=[.B45]-[.D45] -> -0.350000000045619
J46: of:=SUM([.J5:.J45])/[.A45] -> 0.0163911581203096

Sheet: linéaire
F1: max BA (1) | G1: max BA (2)
F2: of:=MAX([.F5:.F45]) -> 0.2 | G2: of:=MAX([.G5:.G45]) -> 0
A4: Rc | B4: Rt total (1) | C4: Rt total (2) | D4: Rt+ | E4: Rt- | F4: BA (1) | G4: BA (2) | H4: NNT (1) | J4: pas | K4: RR
A5: 0 | B5: of:=[.D5] -> 0 | C5: of:=[.D5]+[.E5] -> 0 | D5: of:=[.A5]*[.$K$5] -> 0 | E5: of:=[.$J$7]*[.A5] -> 0 | F5: of:=[.A5]-[.B5] -> 0 | G5: of:=[.A5]-[.C5] -> 0 | H5: of:=1/[.F5] ->  | J5: 0.025 | K5: 0.8
A6: of:=[.A5]+[.$J$5] -> 0.025 | B6: of:=[.D6] -> 0.02 | C6: of:=[.D6]+[.E6] -> 0.02875 | D6: of:=[.A6]*[.$K$5] -> 0.02 | E6: of:=[.$J$7]*[.A6] -> 0.00875 | F6: of:=[.A6]-[.B6] -> 0.005 | G6: of:=[.A6]-[.C6] -> -0.00375 | H6: of:=1/[.F6] -> 200 | J6: coeff iatro
A7: of:=[.A6]+[.$J$5] -> 0.05 | B7: of:=[.D7] -> 0.04 | C7: of:=[.D7]+[.E7] -> 0.0575 | D7: of:=[.A7]*[.$K$5] -> 0.04 | E7: of:=[.$J$7]*[.A7] -> 0.0175 | F7: of:=[.A7]-[.B7] -> 0.01 | G7: of:=[.A7]-[.C7] -> -0.0075 | H7: of:=1/[.F7] -> 100 | J7: 0.35
A8: of:=[.A7]+[.$J$5] -> 0.075 | B8: of:=[.D8] -> 0.06 | C8: of:=[.D8]+[.E8] -> 0.08625 | D8: of:=[.A8]*[.$K$5] -> 0.06 | E8: of:=[.$J$7]*[.A8] -> 0.02625 | F8: of:=[.A8]-[.B8] -> 0.015 | G8: of:=[.A8]-[.C8] -> -0.01125 | H8: of:=1/[.F8] -> 66.6666666666667
A9: of:=[.A8]+[.$J$5] -> 0.1 | B9: of:=[.D9] -> 0.08 | C9: of:=[.D9]+[.E9] -> 0.115 | D9: of:=[.A9]*[.$K$5] -> 0.08 | E9: of:=[.$J$7]*[.A9] -> 0.035 | F9: of:=[.A9]-[.B9] -> 0.02 | G9: of:=[.A9]-[.C9] -> -0.015 | H9: of:=1/[.F9] -> 50
A10: of:=[.A9]+[.$J$5] -> 0.125 | B10: of:=[.D10] -> 0.1 | C10: of:=[.D10]+[.E10] -> 0.14375 | D10: of:=[.A10]*[.$K$5] -> 0.1 | E10: of:=[.$J$7]*[.A10] -> 0.04375 | F10: of:=[.A10]-[.B10] -> 0.025 | G10: of:=[.A10]-[.C10] -> -0.01875 | H10: of:=1/[.F10] -> 40
A11: of:=[.A10]+[.$J$5] -> 0.15 | B11: of:=[.D11] -> 0.12 | C11: of:=[.D11]+[.E11] -> 0.1725 | D11: of:=[.A11]*[.$K$5] -> 0.12 | E11: of:=[.$J$7]*[.A11] -> 0.0525 | F11: of:=[.A11]-[.B11] -> 0.03 | G11: of:=[.A11]-[.C11] -> -0.0225 | H11: of:=1/[.F11] -> 33.3333333333333
A12: of:=[.A11]+[.$J$5] -> 0.175 | B12: of:=[.D12] -> 0.14 | C12: of:=[.D12]+[.E12] -> 0.20125 | D12: of:=[.A12]*[.$K$5] -> 0.14 | E12: of:=[.$J$7]*[.A12] -> 0.06125 | F12: of:=[.A12]-[.B12] -> 0.035 | G12: of:=[.A12]-[.C12] -> -0.02625 | H12: of:=1/[.F12] -> 28.5714285714286
A13: of:=[.A12]+[.$J$5] -> 0.2 | B13: of:=[.D13] -> 0.16 | C13: of:=[.D13]+[.E13] -> 0.23 | D13: of:=[.A13]*[.$K$5] -> 0.16 | E13: of:=[.$J$7]*[.A13] -> 0.07 | F13: of:=[.A13]-[.B13] -> 0.04 | G13: of:=[.A13]-[.C13] -> -0.03 | H13: of:=1/[.F13] -> 25
A14: of:=[.A13]+[.$J$5] -> 0.225 | B14: of:=[.D14] -> 0.18 | C14: of:=[.D14]+[.E14] -> 0.25875 | D14: of:=[.A14]*[.$K$5] -> 0.18 | E14: of:=[.$J$7]*[.A14] -> 0.07875 | F14: of:=[.A14]-[.B14] -> 0.045 | G14: of:=[.A14]-[.C14] -> -0.03375 | H14: of:=1/[.F14] -> 22.2222222222222
A15: of:=[.A14]+[.$J$5] -> 0.25 | B15: of:=[.D15] -> 0.2 | C15: of:=[.D15]+[.E15] -> 0.2875 | D15: of:=[.A15]*[.$K$5] -> 0.2 | E15: of:=[.$J$7]*[.A15] -> 0.0875 | F15: of:=[.A15]-[.B15] -> 0.05 | G15: of:=[.A15]-[.C15] -> -0.0375 | H15: of:=1/[.F15] -> 20
A16: of:=[.A15]+[.$J$5] -> 0.275 | B16: of:=[.D16] -> 0.22 | C16: of:=[.D16]+[.E16] -> 0.31625 | D16: of:=[.A16]*[.$K$5] -> 0.22 | E16: of:=[.$J$7]*[.A16] -> 0.09625 | F16: of:=[.A16]-[.B16] -> 0.055 | G16: of:=[.A16]-[.C16] -> -0.04125 | H16: of:=1/[.F16] -> 18.1818181818182
A17: of:=[.A16]+[.$J$5] -> 0.3 | B17: of:=[.D17] -> 0.24 | C17: of:=[.D17]+[.E17] -> 0.345 | D17: of:=[.A17]*[.$K$5] -> 0.24 | E17: of:=[.$J$7]*[.A17] -> 0.105 | F17: of:=[.A17]-[.B17] -> 0.0600000000000001 | G17: of:=[.A17]-[.C17] -> -0.045 | H17: of:=1/[.F17] -> 16.6666666666667
A18: of:=[.A17]+[.$J$5] -> 0.325 | B18: of:=[.D18] -> 0.26 | C18: of:=[.D18]+[.E18] -> 0.37375 | D18: of:=[.A18]*[.$K$5] -> 0.26 | E18: of:=[.$J$7]*[.A18] -> 0.11375 | F18: of:=[.A18]-[.B18] -> 0.065 | G18: of:=[.A18]-[.C18] -> -0.04875 | H18: of:=1/[.F18] -> 15.3846153846154
A19: of:=[.A18]+[.$J$5] -> 0.35 | B19: of:=[.D19] -> 0.28 | C19: of:=[.D19]+[.E19] -> 0.4025 | D19: of:=[.A19]*[.$K$5] -> 0.28 | E19: of:=[.$J$7]*[.A19] -> 0.1225 | F19: of:=[.A19]-[.B19] -> 0.07 | G19: of:=[.A19]-[.C19] -> -0.0525 | H19: of:=1/[.F19] -> 14.2857142857143
A20: of:=[.A19]+[.$J$5] -> 0.375 | B20: of:=[.D20] -> 0.3 | C20: of:=[.D20]+[.E20] -> 0.43125 | D20: of:=[.A20]*[.$K$5] -> 0.3 | E20: of:=[.$J$7]*[.A20] -> 0.13125 | F20: of:=[.A20]-[.B20] -> 0.075 | G20: of:=[.A20]-[.C20] -> -0.05625 | H20: of:=1/[.F20] -> 13.3333333333333
A21: of:=[.A20]+[.$J$5] -> 0.4 | B21: of:=[.D21] -> 0.32 | C21: of:=[.D21]+[.E21] -> 0.46 | D21: of:=[.A21]*[.$K$5] -> 0.32 | E21: of:=[.$J$7]*[.A21] -> 0.14 | F21: of:=[.A21]-[.B21] -> 0.08 | G21: of:=[.A21]-[.C21] -> -0.06 | H21: of:=1/[.F21] -> 12.5
A22: of:=[.A21]+[.$J$5] -> 0.425 | B22: of:=[.D22] -> 0.34 | C22: of:=[.D22]+[.E22] -> 0.48875 | D22: of:=[.A22]*[.$K$5] -> 0.34 | E22: of:=[.$J$7]*[.A22] -> 0.14875 | F22: of:=[.A22]-[.B22] -> 0.085 | G22: of:=[.A22]-[.C22] -> -0.06375 | H22: of:=1/[.F22] -> 11.7647058823529
A23: of:=[.A22]+[.$J$5] -> 0.45 | B23: of:=[.D23] -> 0.36 | C23: of:=[.D23]+[.E23] -> 0.5175 | D23: of:=[.A23]*[.$K$5] -> 0.36 | E23: of:=[.$J$7]*[.A23] -> 0.1575 | F23: of:=[.A23]-[.B23] -> 0.09 | G23: of:=[.A23]-[.C23] -> -0.0675000000000001 | H23: of:=1/[.F23] -> 11.1111111111111
A24: of:=[.A23]+[.$J$5] -> 0.475 | B24: of:=[.D24] -> 0.38 | C24: of:=[.D24]+[.E24] -> 0.54625 | D24: of:=[.A24]*[.$K$5] -> 0.38 | E24: of:=[.$J$7]*[.A24] -> 0.16625 | F24: of:=[.A24]-[.B24] -> 0.095 | G24: of:=[.A24]-[.C24] -> -0.07125 | H24: of:=1/[.F24] -> 10.5263157894737
A25: of:=[.A24]+[.$J$5] -> 0.5 | B25: of:=[.D25] -> 0.4 | C25: of:=[.D25]+[.E25] -> 0.575 | D25: of:=[.A25]*[.$K$5] -> 0.4 | E25: of:=[.$J$7]*[.A25] -> 0.175 | F25: of:=[.A25]-[.B25] -> 0.1 | G25: of:=[.A25]-[.C25] -> -0.0750000000000001 | H25: of:=1/[.F25] -> 10
A26: of:=[.A25]+[.$J$5] -> 0.525 | B26: of:=[.D26] -> 0.42 | C26: of:=[.D26]+[.E26] -> 0.60375 | D26: of:=[.A26]*[.$K$5] -> 0.42 | E26: of:=[.$J$7]*[.A26] -> 0.18375 | F26: of:=[.A26]-[.B26] -> 0.105 | G26: of:=[.A26]-[.C26] -> -0.07875 | H26: of:=1/[.F26] -> 9.52380952380953
A27: of:=[.A26]+[.$J$5] -> 0.55 | B27: of:=[.D27] -> 0.44 | C27: of:=[.D27]+[.E27] -> 0.6325 | D27: of:=[.A27]*[.$K$5] -> 0.44 | E27: of:=[.$J$7]*[.A27] -> 0.1925 | F27: of:=[.A27]-[.B27] -> 0.11 | G27: of:=[.A27]-[.C27] -> -0.0825 | H27: of:=1/[.F27] -> 9.09090909090909
A28: of:=[.A27]+[.$J$5] -> 0.575 | B28: of:=[.D28] -> 0.46 | C28: of:=[.D28]+[.E28] -> 0.66125 | D28: of:=[.A28]*[.$K$5] -> 0.46 | E28: of:=[.$J$7]*[.A28] -> 0.20125 | F28: of:=[.A28]-[.B28] -> 0.115 | G28: of:=[.A28]-[.C28] -> -0.0862499999999999 | H28: of:=1/[.F28] -> 8.69565217391305
A29: of:=[.A28]+[.$J$5] -> 0.6 | B29: of:=[.D29] -> 0.48 | C29: of:=[.D29]+[.E29] -> 0.69 | D29: of:=[.A29]*[.$K$5] -> 0.48 | E29: of:=[.$J$7]*[.A29] -> 0.21 | F29: of:=[.A29]-[.B29] -> 0.12 | G29: of:=[.A29]-[.C29] -> -0.09 | H29: of:=1/[.F29] -> 8.33333333333333
A30: of:=[.A29]+[.$J$5] -> 0.625 | B30: of:=[.D30] -> 0.5 | C30: of:=[.D30]+[.E30] -> 0.71875 | D30: of:=[.A30]*[.$K$5] -> 0.5 | E30: of:=[.$J$7]*[.A30] -> 0.21875 | F30: of:=[.A30]-[.B30] -> 0.125 | G30: of:=[.A30]-[.C30] -> -0.0937500000000001 | H30: of:=1/[.F30] -> 8
A31: of:=[.A30]+[.$J$5] -> 0.65 | B31: of:=[.D31] -> 0.52 | C31: of:=[.D31]+[.E31] -> 0.7475 | D31: of:=[.A31]*[.$K$5] -> 0.52 | E31: of:=[.$J$7]*[.A31] -> 0.2275 | F31: of:=[.A31]-[.B31] -> 0.13 | G31: of:=[.A31]-[.C31] -> -0.0975 | H31: of:=1/[.F31] -> 7.69230769230769
A32: of:=[.A31]+[.$J$5] -> 0.675 | B32: of:=[.D32] -> 0.54 | C32: of:=[.D32]+[.E32] -> 0.77625 | D32: of:=[.A32]*[.$K$5] -> 0.54 | E32: of:=[.$J$7]*[.A32] -> 0.23625 | F32: of:=[.A32]-[.B32] -> 0.135 | G32: of:=[.A32]-[.C32] -> -0.10125 | H32: of:=1/[.F32] -> 7.40740740740741
A33: of:=[.A32]+[.$J$5] -> 0.7 | B33: of:=[.D33] -> 0.56 | C33: of:=[.D33]+[.E33] -> 0.805 | D33: of:=[.A33]*[.$K$5] -> 0.56 | E33: of:=[.$J$7]*[.A33] -> 0.245 | F33: of:=[.A33]-[.B33] -> 0.14 | G33: of:=[.A33]-[.C33] -> -0.105 | H33: of:=1/[.F33] -> 7.14285714285714
A34: of:=[.A33]+[.$J$5] -> 0.725 | B34: of:=[.D34] -> 0.58 | C34: of:=[.D34]+[.E34] -> 0.83375 | D34: of:=[.A34]*[.$K$5] -> 0.58 | E34: of:=[.$J$7]*[.A34] -> 0.25375 | F34: of:=[.A34]-[.B34] -> 0.145 | G34: of:=[.A34]-[.C34] -> -0.10875 | H34: of:=1/[.F34] -> 6.89655172413793
A35: of:=[.A34]+[.$J$5] -> 0.75 | B35: of:=[.D35] -> 0.6 | C35: of:=[.D35]+[.E35] -> 0.8625 | D35: of:=[.A35]*[.$K$5] -> 0.6 | E35: of:=[.$J$7]*[.A35] -> 0.2625 | F35: of:=[.A35]-[.B35] -> 0.15 | G35: of:=[.A35]-[.C35] -> -0.1125 | H35: of:=1/[.F35] -> 6.66666666666667
A36: of:=[.A35]+[.$J$5] -> 0.775 | B36: of:=[.D36] -> 0.62 | C36: of:=[.D36]+[.E36] -> 0.89125 | D36: of:=[.A36]*[.$K$5] -> 0.62 | E36: of:=[.$J$7]*[.A36] -> 0.27125 | F36: of:=[.A36]-[.B36] -> 0.155 | G36: of:=[.A36]-[.C36] -> -0.11625 | H36: of:=1/[.F36] -> 6.45161290322581
A37: of:=[.A36]+[.$J$5] -> 0.8 | B37: of:=[.D37] -> 0.64 | C37: of:=[.D37]+[.E37] -> 0.92 | D37: of:=[.A37]*[.$K$5] -> 0.64 | E37: of:=[.$J$7]*[.A37] -> 0.28 | F37: of:=[.A37]-[.B37] -> 0.16 | G37: of:=[.A37]-[.C37] -> -0.12 | H37: of:=1/[.F37] -> 6.25
A38: of:=[.A37]+[.$J$5] -> 0.825 | B38: of:=[.D38] -> 0.66 | C38: of:=[.D38]+[.E38] -> 0.94875 | D38: of:=[.A38]*[.$K$5] -> 0.66 | E38: of:=[.$J$7]*[.A38] -> 0.28875 | F38: of:=[.A38]-[.B38] -> 0.165 | G38: of:=[.A38]-[.C38] -> -0.12375 | H38: of:=1/[.F38] -> 6.06060606060606
A39: of:=[.A38]+[.$J$5] -> 0.85 | B39: of:=[.D39] -> 0.68 | C39: of:=[.D39]+[.E39] -> 0.9775 | D39: of:=[.A39]*[.$K$5] -> 0.68 | E39: of:=[.$J$7]*[.A39] -> 0.2975 | F39: of:=[.A39]-[.B39] -> 0.17 | G39: of:=[.A39]-[.C39] -> -0.1275 | H39: of:=1/[.F39] -> 5.88235294117647
A40: of:=[.A39]+[.$J$5] -> 0.875 | B40: of:=[.D40] -> 0.7 | C40: of:=[.D40]+[.E40] -> 1.00625 | D40: of:=[.A40]*[.$K$5] -> 0.7 | E40: of:=[.$J$7]*[.A40] -> 0.30625 | F40: of:=[.A40]-[.B40] -> 0.175 | G40: of:=[.A40]-[.C40] -> -0.13125 | H40: of:=1/[.F40] -> 5.71428571428571
A41: of:=[.A40]+[.$J$5] -> 0.9 | B41: of:=[.D41] -> 0.72 | C41: of:=[.D41]+[.E41] -> 1.035 | D41: of:=[.A41]*[.$K$5] -> 0.72 | E41: of:=[.$J$7]*[.A41] -> 0.315 | F41: of:=[.A41]-[.B41] -> 0.18 | G41: of:=[.A41]-[.C41] -> -0.135 | H41: of:=1/[.F41] -> 5.55555555555555
A42: of:=[.A41]+[.$J$5] -> 0.925 | B42: of:=[.D42] -> 0.74 | C42: of:=[.D42]+[.E42] -> 1.06375 | D42: of:=[.A42]*[.$K$5] -> 0.74 | E42: of:=[.$J$7]*[.A42] -> 0.32375 | F42: of:=[.A42]-[.B42] -> 0.185 | G42: of:=[.A42]-[.C42] -> -0.13875 | H42: of:=1/[.F42] -> 5.4054054054054
A43: of:=[.A42]+[.$J$5] -> 0.950000000000001 | B43: of:=[.D43] -> 0.76 | C43: of:=[.D43]+[.E43] -> 1.0925 | D43: of:=[.A43]*[.$K$5] -> 0.76 | E43: of:=[.$J$7]*[.A43] -> 0.3325 | F43: of:=[.A43]-[.B43] -> 0.190000000000001 | G43: of:=[.A43]-[.C43] -> -0.142499999999999 | H43: of:=1/[.F43] -> 5.26315789473684
A44: of:=[.A43]+[.$J$5] -> 0.975000000000001 | B44: of:=[.D44] -> 0.78 | C44: of:=[.D44]+[.E44] -> 1.12125 | D44: of:=[.A44]*[.$K$5] -> 0.78 | E44: of:=[.$J$7]*[.A44] -> 0.34125 | F44: of:=[.A44]-[.B44] -> 0.195000000000001 | G44: of:=[.A44]-[.C44] -> -0.146249999999999 | H44: of:=1/[.F44] -> 5.12820512820513
A45: of:=[.A44]+[.$J$5] -> 1 | B45: of:=[.D45] -> 0.8 | C45: of:=[.D45]+[.E45] -> 1.15 | D45: of:=[.A45]*[.$K$5] -> 0.8 | E45: of:=[.$J$7]*[.A45] -> 0.35 | F45: of:=[.A45]-[.B45] -> 0.2 | G45: of:=[.A45]-[.C45] -> -0.15 | H45: of:=1/[.F45] -> 5

Sheet: curvi metrics
A1: of:=[$curvi.B4] -> Rc | B1: of:=[$curvi.J4] -> BA (1) | C1: of:=[$curvi.E4] -> NNT total (1) | D1: of:=[$curvi.F4] -> RR total (1) | E1: of:=[$curvi.G4] -> OR total (1)
A2: Rc | B2: AB | C2: NNT | D2: RR | E2: OR
A3: of:=[$curvi.B6] -> 0.0250000001 | B3: of:=[$curvi.J6] -> 0.00234512264417725 | C3: of:=[$curvi.E6] -> 426.416930680756 | D3: of:=[$curvi.F6] -> 0.90619509460813 | E3: of:=[$curvi.G6] -> 0.904020695220045
A4: of:=[$curvi.B7] -> 0.0500000001 | B4: of:=[$curvi.J7] -> 0.00458100105053129 | C4: of:=[$curvi.E7] -> 218.292899078035 | D4: of:=[$curvi.F7] -> 0.908379979172614 | E4: of:=[$curvi.G7] -> 0.904020695220045
A5: of:=[$curvi.B8] -> 0.0750000001 | B5: of:=[$curvi.J8] -> 0.00670684313795569 | C5: of:=[$curvi.E8] -> 149.101444514298 | D5: of:=[$curvi.F8] -> 0.91057542494649 | E5: of:=[$curvi.G8] -> 0.904020695220045
A6: of:=[$curvi.B9] -> 0.1000000001 | B6: of:=[$curvi.J9] -> 0.00872184913963986 | C6: of:=[$curvi.E9] -> 114.654585740896 | D6: of:=[$curvi.F9] -> 0.91278150869082 | E6: of:=[$curvi.G9] -> 0.904020695220045
A7: of:=[$curvi.B10] -> 0.1250000001 | B7: of:=[$curvi.J10] -> 0.0106252115194552 | C7: of:=[$curvi.E10] -> 94.115773428977 | D7: of:=[$curvi.F10] -> 0.91499830791236 | E7: of:=[$curvi.G10] -> 0.904020695220045
A8: of:=[$curvi.B11] -> 0.1500000001 | B8: of:=[$curvi.J11] -> 0.0124161148773819 | C8: of:=[$curvi.E11] -> 80.5404919232566 | D8: of:=[$curvi.F11] -> 0.917225900872637 | E8: of:=[$curvi.G11] -> 0.904020695220045
A9: of:=[$curvi.B12] -> 0.1750000001 | B9: of:=[$curvi.J12] -> 0.0140937358535508 | C9: of:=[$curvi.E12] -> 70.9535080259121 | D9: of:=[$curvi.F12] -> 0.919464366597159 | E9: of:=[$curvi.G12] -> 0.904020695220045
A10: of:=[$curvi.B13] -> 0.2000000001 | B10: of:=[$curvi.J13] -> 0.0156572430308768 | C10: of:=[$curvi.E13] -> 63.8682045126308 | D10: of:=[$curvi.F13] -> 0.921713784884759 | E10: of:=[$curvi.G13] -> 0.904020695220045
A11: of:=[$curvi.B14] -> 0.2250000001 | B11: of:=[$curvi.J14] -> 0.0171057968362593 | C11: of:=[$curvi.E14] -> 58.4597145384243 | D11: of:=[$curvi.F14] -> 0.923974236317081 | E11: of:=[$curvi.G14] -> 0.904020695220045
A12: of:=[$curvi.B15] -> 0.2500000001 | B12: of:=[$curvi.J15] -> 0.0184385494403259 | C12: of:=[$curvi.E15] -> 54.234201190087 | D12: of:=[$curvi.F15] -> 0.926245802268198 | E12: of:=[$curvi.G15] -> 0.904020695220045
A13: of:=[$curvi.B16] -> 0.2750000001 | B13: of:=[$curvi.J16] -> 0.0196546446556926 | C13: of:=[$curvi.E16] -> 50.8785591150521 | D13: of:=[$curvi.F16] -> 0.92852856491438 | E13: of:=[$curvi.G16] -> 0.904020695220045
A14: of:=[$curvi.B17] -> 0.3000000001 | B14: of:=[$curvi.J17] -> 0.0207532178337171 | C14: of:=[$curvi.E17] -> 48.1852986853601 | D14: of:=[$curvi.F17] -> 0.930822607244002 | E14: of:=[$curvi.G17] -> 0.904020695220045
A15: of:=[$curvi.B18] -> 0.3250000001 | B15: of:=[$curvi.J18] -> 0.0217333957597162 | C15: of:=[$curvi.E18] -> 46.0121377743253 | D15: of:=[$curvi.F18] -> 0.933128013067603 | E15: of:=[$curvi.G18] -> 0.904020695220045
A16: of:=[$curvi.B19] -> 0.3500000001 | B16: of:=[$curvi.J19] -> 0.0225942965466241 | C16: of:=[$curvi.E19] -> 44.2589570308802 | D16: of:=[$curvi.F19] -> 0.93544486702809 | E16: of:=[$curvi.G19] -> 0.904020695220044
A17: of:=[$curvi.B20] -> 0.3750000001 | B17: of:=[$curvi.J20] -> 0.0233350295270606 | C17: of:=[$curvi.E20] -> 42.8540276257352 | D17: of:=[$curvi.F20] -> 0.937773254611099 | E17: of:=[$curvi.G20] -> 0.904020695220045
A18: of:=[$curvi.B21] -> 0.4000000001 | B18: of:=[$curvi.J21] -> 0.0239546951437853 | C18: of:=[$curvi.E21] -> 41.7454696875755 | D18: of:=[$curvi.F21] -> 0.940113262155509 | E18: of:=[$curvi.G21] -> 0.904020695220045
A19: of:=[$curvi.B22] -> 0.4250000001 | B19: of:=[$curvi.J22] -> 0.0244523848385059 | C19: of:=[$curvi.E22] -> 40.895806548295 | D19: of:=[$curvi.F22] -> 0.942464976864112 | E19: of:=[$curvi.G22] -> 0.904020695220045
A20: of:=[$curvi.B23] -> 0.4500000001 | B20: of:=[$curvi.J23] -> 0.0248271809390147 | C20: of:=[$curvi.E23] -> 40.2784352543445 | D20: of:=[$curvi.F23] -> 0.94482848681445 | E20: of:=[$curvi.G23] -> 0.904020695220045
A21: of:=[$curvi.B24] -> 0.4750000001 | B21: of:=[$curvi.J24] -> 0.0250781565446219 | C21: of:=[$curvi.E24] -> 39.8753392507415 | D21: of:=[$curvi.F24] -> 0.947203880969806 | E21: of:=[$curvi.G24] -> 0.904020695220045
A22: of:=[$curvi.B25] -> 0.5000000001 | B22: of:=[$curvi.J25] -> 0.0252043754098562 | C22: of:=[$curvi.E25] -> 39.6756509034121 | D22: of:=[$curvi.F25] -> 0.949591249190369 | E22: of:=[$curvi.G25] -> 0.904020695220045
A23: of:=[$curvi.B26] -> 0.5250000001 | B23: of:=[$curvi.J26] -> 0.0252048918264033 | C23: of:=[$curvi.E26] -> 39.6748379992035 | D23: of:=[$curvi.F26] -> 0.951990682244567 | E23: of:=[$curvi.G26] -> 0.904020695220045
A24: of:=[$curvi.B27] -> 0.5500000001 | B24: of:=[$curvi.J27] -> 0.0250787505032483 | C24: of:=[$curvi.E27] -> 39.8743948535425 | D24: of:=[$curvi.F27] -> 0.954402271820566 | E24: of:=[$curvi.G27] -> 0.904020695220045
A25: of:=[$curvi.B28] -> 0.5750000001 | B25: of:=[$curvi.J28] -> 0.0248249864449934 | C25: of:=[$curvi.E28] -> 40.2819958115899 | D25: of:=[$curvi.F28] -> 0.956826110537955 | E25: of:=[$curvi.G28] -> 0.904020695220045
A26: of:=[$curvi.B29] -> 0.6000000001 | B26: of:=[$curvi.J29] -> 0.0244426248283156 | C26: of:=[$curvi.E29] -> 40.9121363611304 | D26: of:=[$curvi.F29] -> 0.959262291959597 | E26: of:=[$curvi.G29] -> 0.904020695220045
A27: of:=[$curvi.B30] -> 0.6250000001 | B27: of:=[$curvi.J30] -> 0.0239306808765326 | C27: of:=[$curvi.E30] -> 41.7873609680968 | D27: of:=[$curvi.F30] -> 0.961710910603674 | E27: of:=[$curvi.G30] -> 0.904020695220045
A28: of:=[$curvi.B31] -> 0.6500000001 | B28: of:=[$curvi.J31] -> 0.0232881597322423 | C28: of:=[$curvi.E31] -> 42.9402757236978 | D28: of:=[$curvi.F31] -> 0.964172061955908 | E28: of:=[$curvi.G31] -> 0.904020695220045
A29: of:=[$curvi.B32] -> 0.6750000001 | B29: of:=[$curvi.J32] -> 0.022514056328003 | C29: of:=[$curvi.E32] -> 44.4166961933111 | D29: of:=[$curvi.F32] -> 0.966645842481974 | E29: of:=[$curvi.G32] -> 0.904020695220045
A30: of:=[$curvi.B33] -> 0.7000000001 | B30: of:=[$curvi.J33] -> 0.0216073552550158 | C30: of:=[$curvi.E33] -> 46.2805367985916 | D30: of:=[$curvi.F33] -> 0.969132349640101 | E30: of:=[$curvi.G33] -> 0.904020695220044
A31: of:=[$curvi.B34] -> 0.7250000001 | B31: of:=[$curvi.J34] -> 0.0205670306297765 | C31: of:=[$curvi.E34] -> 48.6215058459738 | D31: of:=[$curvi.F34] -> 0.971631681893876 | E31: of:=[$curvi.G34] -> 0.904020695220045
A32: of:=[$curvi.B35] -> 0.7500000001 | B32: of:=[$curvi.J35] -> 0.0193920459586585 | C32: of:=[$curvi.E35] -> 51.5675345516341 | D32: of:=[$curvi.F35] -> 0.974143938725236 | E32: of:=[$curvi.G35] -> 0.904020695220045
A33: of:=[$curvi.B36] -> 0.7750000001 | B33: of:=[$curvi.J36] -> 0.0180813540003885 | C33: of:=[$curvi.E36] -> 55.3055927105081 | D33: of:=[$curvi.F36] -> 0.976669220647671 | E33: of:=[$curvi.G36] -> 0.904020695220045
A34: of:=[$curvi.B37] -> 0.8000000001 | B34: of:=[$curvi.J37] -> 0.0166338966263789 | C34: of:=[$curvi.E37] -> 60.1182045591257 | D34: of:=[$curvi.F37] -> 0.979207629219625 | E34: of:=[$curvi.G37] -> 0.904020695220044
A35: of:=[$curvi.B38] -> 0.825000000100001 | B35: of:=[$curvi.J38] -> 0.0150486046788759 | C35: of:=[$curvi.E38] -> 66.4513435856099 | D35: of:=[$curvi.F38] -> 0.981759267058119 | E35: of:=[$curvi.G38] -> 0.904020695220045
A36: of:=[$curvi.B39] -> 0.850000000100001 | B36: of:=[$curvi.J39] -> 0.0133243978268841 | C36: of:=[$curvi.E39] -> 75.0502959302476 | D36: of:=[$curvi.F39] -> 0.984324237852569 | E36: of:=[$curvi.G39] -> 0.904020695220045
A37: of:=[$curvi.B40] -> 0.875000000100001 | B37: of:=[$curvi.J40] -> 0.011460184419826 | C37: of:=[$curvi.E40] -> 87.2586306962051 | D37: of:=[$curvi.F40] -> 0.986902646378839 | E37: of:=[$curvi.G40] -> 0.904020695220044
A38: of:=[$curvi.B41] -> 0.900000000100001 | B38: of:=[$curvi.J41] -> 0.00945486133889673 | C38: of:=[$curvi.E41] -> 105.765697047937 | D38: of:=[$curvi.F41] -> 0.989494598513504 | E38: of:=[$curvi.G41] -> 0.904020695220044
A39: of:=[$curvi.B42] -> 0.925000000100001 | B39: of:=[$curvi.J42] -> 0.00730731384606931 | C39: of:=[$curvi.E42] -> 136.849192612401 | D39: of:=[$curvi.F42] -> 0.992100201248347 | E39: of:=[$curvi.G42] -> 0.904020695220045
A40: of:=[$curvi.B43] -> 0.950000000100001 | B40: of:=[$curvi.J43] -> 0.0050164154307083 | C40: of:=[$curvi.E43] -> 199.3455314483 | D40: of:=[$curvi.F43] -> 0.994719562705073 | E40: of:=[$curvi.G43] -> 0.904020695220045
A41: of:=[$curvi.B44] -> 0.975000000100001 | B41: of:=[$curvi.J44] -> 0.0025810276537469 | C41: of:=[$curvi.E44] -> 387.442574878378 | D41: of:=[$curvi.F44] -> 0.997352792150275 | E41: of:=[$curvi.G44] -> 0.904020695220046
A44: figure
A45: of:=[.A2] -> Rc | B45: of:=[.B2] -> AB | C45: NNT/ | D45: of:=[.D2] -> RR | E45: of:=[.E2] -> OR
A46: of:=[.A3] -> 0.0250000001 | B46: of:=[.B3] -> 0.00234512264417725 | C46: of:=[.C3]/[.$F$46] -> 0.852833861361511 | D46: of:=[.D3] -> 0.90619509460813 | E46: of:=[.E3] -> 0.904020695220045 | F46: 500
A47: of:=[.A4] -> 0.0500000001 | B47: of:=[.B4] -> 0.00458100105053129 | C47: of:=[.C4]/[.$F$46] -> 0.436585798156071 | D47: of:=[.D4] -> 0.908379979172614 | E47: of:=[.E4] -> 0.904020695220045
A48: of:=[.A5] -> 0.0750000001 | B48: of:=[.B5] -> 0.00670684313795569 | C48: of:=[.C5]/[.$F$46] -> 0.298202889028596 | D48: of:=[.D5] -> 0.91057542494649 | E48: of:=[.E5] -> 0.904020695220045
A49: of:=[.A6] -> 0.1000000001 | B49: of:=[.B6] -> 0.00872184913963986 | C49: of:=[.C6]/[.$F$46] -> 0.229309171481792 | D49: of:=[.D6] -> 0.91278150869082 | E49: of:=[.E6] -> 0.904020695220045
A50: of:=[.A7] -> 0.1250000001 | B50: of:=[.B7] -> 0.0106252115194552 | C50: of:=[.C7]/[.$F$46] -> 0.188231546857954 | D50: of:=[.D7] -> 0.91499830791236 | E50: of:=[.E7] -> 0.904020695220045
A51: of:=[.A8] -> 0.1500000001 | B51: of:=[.B8] -> 0.0124161148773819 | C51: of:=[.C8]/[.$F$46] -> 0.161080983846513 | D51: of:=[.D8] -> 0.917225900872637 | E51: of:=[.E8] -> 0.904020695220045
A52: of:=[.A9] -> 0.1750000001 | B52: of:=[.B9] -> 0.0140937358535508 | C52: of:=[.C9]/[.$F$46] -> 0.141907016051824 | D52: of:=[.D9] -> 0.919464366597159 | E52: of:=[.E9] -> 0.904020695220045
A53: of:=[.A10] -> 0.2000000001 | B53: of:=[.B10] -> 0.0156572430308768 | C53: of:=[.C10]/[.$F$46] -> 0.127736409025262 | D53: of:=[.D10] -> 0.921713784884759 | E53: of:=[.E10] -> 0.904020695220045
A54: of:=[.A11] -> 0.2250000001 | B54: of:=[.B11] -> 0.0171057968362593 | C54: of:=[.C11]/[.$F$46] -> 0.116919429076849 | D54: of:=[.D11] -> 0.923974236317081 | E54: of:=[.E11] -> 0.904020695220045
A55: of:=[.A12] -> 0.2500000001 | B55: of:=[.B12] -> 0.0184385494403259 | C55: of:=[.C12]/[.$F$46] -> 0.108468402380174 | D55: of:=[.D12] -> 0.926245802268198 | E55: of:=[.E12] -> 0.904020695220045
A56: of:=[.A13] -> 0.2750000001 | B56: of:=[.B13] -> 0.0196546446556926 | C56: of:=[.C13]/[.$F$46] -> 0.101757118230104 | D56: of:=[.D13] -> 0.92852856491438 | E56: of:=[.E13] -> 0.904020695220045
A57: of:=[.A14] -> 0.3000000001 | B57: of:=[.B14] -> 0.0207532178337171 | C57: of:=[.C14]/[.$F$46] -> 0.0963705973707202 | D57: of:=[.D14] -> 0.930822607244002 | E57: of:=[.E14] -> 0.904020695220045
A58: of:=[.A15] -> 0.3250000001 | B58: of:=[.B15] -> 0.0217333957597162 | C58: of:=[.C15]/[.$F$46] -> 0.0920242755486506 | D58: of:=[.D15] -> 0.933128013067603 | E58: of:=[.E15] -> 0.904020695220045
A59: of:=[.A16] -> 0.3500000001 | B59: of:=[.B16] -> 0.0225942965466241 | C59: of:=[.C16]/[.$F$46] -> 0.0885179140617604 | D59: of:=[.D16] -> 0.93544486702809 | E59: of:=[.E16] -> 0.904020695220044
A60: of:=[.A17] -> 0.3750000001 | B60: of:=[.B17] -> 0.0233350295270606 | C60: of:=[.C17]/[.$F$46] -> 0.0857080552514704 | D60: of:=[.D17] -> 0.937773254611099 | E60: of:=[.E17] -> 0.904020695220045
A61: of:=[.A18] -> 0.4000000001 | B61: of:=[.B18] -> 0.0239546951437853 | C61: of:=[.C18]/[.$F$46] -> 0.0834909393751509 | D61: of:=[.D18] -> 0.940113262155509 | E61: of:=[.E18] -> 0.904020695220045
A62: of:=[.A19] -> 0.4250000001 | B62: of:=[.B19] -> 0.0244523848385059 | C62: of:=[.C19]/[.$F$46] -> 0.08179161309659 | D62: of:=[.D19] -> 0.942464976864112 | E62: of:=[.E19] -> 0.904020695220045
A63: of:=[.A20] -> 0.4500000001 | B63: of:=[.B20] -> 0.0248271809390147 | C63: of:=[.C20]/[.$F$46] -> 0.080556870508689 | D63: of:=[.D20] -> 0.94482848681445 | E63: of:=[.E20] -> 0.904020695220045
A64: of:=[.A21] -> 0.4750000001 | B64: of:=[.B21] -> 0.0250781565446219 | C64: of:=[.C21]/[.$F$46] -> 0.079750678501483 | D64: of:=[.D21] -> 0.947203880969806 | E64: of:=[.E21] -> 0.904020695220045
A65: of:=[.A22] -> 0.5000000001 | B65: of:=[.B22] -> 0.0252043754098562 | C65: of:=[.C22]/[.$F$46] -> 0.0793513018068243 | D65: of:=[.D22] -> 0.949591249190369 | E65: of:=[.E22] -> 0.904020695220045
A66: of:=[.A23] -> 0.5250000001 | B66: of:=[.B23] -> 0.0252048918264033 | C66: of:=[.C23]/[.$F$46] -> 0.0793496759984071 | D66: of:=[.D23] -> 0.951990682244567 | E66: of:=[.E23] -> 0.904020695220045
A67: of:=[.A24] -> 0.5500000001 | B67: of:=[.B24] -> 0.0250787505032483 | C67: of:=[.C24]/[.$F$46] -> 0.0797487897070851 | D67: of:=[.D24] -> 0.954402271820566 | E67: of:=[.E24] -> 0.904020695220045
A68: of:=[.A25] -> 0.5750000001 | B68: of:=[.B25] -> 0.0248249864449934 | C68: of:=[.C25]/[.$F$46] -> 0.0805639916231797 | D68: of:=[.D25] -> 0.956826110537955 | E68: of:=[.E25] -> 0.904020695220045
A69: of:=[.A26] -> 0.6000000001 | B69: of:=[.B26] -> 0.0244426248283156 | C69: of:=[.C26]/[.$F$46] -> 0.0818242727222608 | D69: of:=[.D26] -> 0.959262291959597 | E69: of:=[.E26] -> 0.904020695220045
A70: of:=[.A27] -> 0.6250000001 | B70: of:=[.B27] -> 0.0239306808765326 | C70: of:=[.C27]/[.$F$46] -> 0.0835747219361937 | D70: of:=[.D27] -> 0.961710910603674 | E70: of:=[.E27] -> 0.904020695220045
A71: of:=[.A28] -> 0.6500000001 | B71: of:=[.B28] -> 0.0232881597322423 | C71: of:=[.C28]/[.$F$46] -> 0.0858805514473955 | D71: of:=[.D28] -> 0.964172061955908 | E71: of:=[.E28] -> 0.904020695220045
A72: of:=[.A29] -> 0.6750000001 | B72: of:=[.B29] -> 0.022514056328003 | C72: of:=[.C29]/[.$F$46] -> 0.0888333923866221 | D72: of:=[.D29] -> 0.966645842481974 | E72: of:=[.E29] -> 0.904020695220045
A73: of:=[.A30] -> 0.7000000001 | B73: of:=[.B30] -> 0.0216073552550158 | C73: of:=[.C30]/[.$F$46] -> 0.0925610735971832 | D73: of:=[.D30] -> 0.969132349640101 | E73: of:=[.E30] -> 0.904020695220044
A74: of:=[.A31] -> 0.7250000001 | B74: of:=[.B31] -> 0.0205670306297765 | C74: of:=[.C31]/[.$F$46] -> 0.0972430116919476 | D74: of:=[.D31] -> 0.971631681893876 | E74: of:=[.E31] -> 0.904020695220045
A75: of:=[.A32] -> 0.7500000001 | B75: of:=[.B32] -> 0.0193920459586585 | C75: of:=[.C32]/[.$F$46] -> 0.103135069103268 | D75: of:=[.D32] -> 0.974143938725236 | E75: of:=[.E32] -> 0.904020695220045
A76: of:=[.A33] -> 0.7750000001 | B76: of:=[.B33] -> 0.0180813540003885 | C76: of:=[.C33]/[.$F$46] -> 0.110611185421016 | D76: of:=[.D33] -> 0.976669220647671 | E76: of:=[.E33] -> 0.904020695220045
A77: of:=[.A34] -> 0.8000000001 | B77: of:=[.B34] -> 0.0166338966263789 | C77: of:=[.C34]/[.$F$46] -> 0.120236409118251 | D77: of:=[.D34] -> 0.979207629219625 | E77: of:=[.E34] -> 0.904020695220044
A78: of:=[.A35] -> 0.825000000100001 | B78: of:=[.B35] -> 0.0150486046788759 | C78: of:=[.C35]/[.$F$46] -> 0.13290268717122 | D78: of:=[.D35] -> 0.981759267058119 | E78: of:=[.E35] -> 0.904020695220045
A79: of:=[.A36] -> 0.850000000100001 | B79: of:=[.B36] -> 0.0133243978268841 | C79: of:=[.C36]/[.$F$46] -> 0.150100591860495 | D79: of:=[.D36] -> 0.984324237852569 | E79: of:=[.E36] -> 0.904020695220045
A80: of:=[.A37] -> 0.875000000100001 | B80: of:=[.B37] -> 0.011460184419826 | C80: of:=[.C37]/[.$F$46] -> 0.17451726139241 | D80: of:=[.D37] -> 0.986902646378839 | E80: of:=[.E37] -> 0.904020695220044
A81: of:=[.A38] -> 0.900000000100001 | B81: of:=[.B38] -> 0.00945486133889673 | C81: of:=[.C38]/[.$F$46] -> 0.211531394095873 | D81: of:=[.D38] -> 0.989494598513504 | E81: of:=[.E38] -> 0.904020695220044
A82: of:=[.A39] -> 0.925000000100001 | B82: of:=[.B39] -> 0.00730731384606931 | C82: of:=[.C39]/[.$F$46] -> 0.273698385224801 | D82: of:=[.D39] -> 0.992100201248347 | E82: of:=[.E39] -> 0.904020695220045
A83: of:=[.A40] -> 0.950000000100001 | B83: of:=[.B40] -> 0.0050164154307083 | C83: of:=[.C40]/[.$F$46] -> 0.398691062896601 | D83: of:=[.D40] -> 0.994719562705073 | E83: of:=[.E40] -> 0.904020695220045
A84: of:=[.A41] -> 0.975000000100001 | B84: of:=[.B41] -> 0.0025810276537469 | C84: of:=[.C41]/[.$F$46] -> 0.774885149756757 | D84: of:=[.D41] -> 0.997352792150275 | E84: of:=[.E41] -> 0.904020695220046

Sheet: NPE vs pop 2
B1: Two populations, with different Rc distributions, different Rc, same size
B2: Rc | C2: pop C | D2: pop A | E2: # events C | F2: # events A | G2: NPEs C | H2: NPEs A | J2: Rt pop C | K2: Rt pop A | L2: ABi pop C | M2: ABi pop A | N2: ni*Rci pop C | O2: ni*Rci pop A | P2: ni*Rti pop C | Q2: ni*Rti pop A | R2: ni*Abi pop C | S2: ni*Abi pop A | T2: NNTi pop C | U2: NNTi pop A | V2: ni NNTi pop C | W2: ni NNTi pop A
A3: 1 | B3: of:=[$curvi.B5] -> 0.0000000001 | C3: 13950 | D3: 8290 | E3: of:=[.B3]*[.C3] -> 0.000001395 | F3: of:=[.B3]*[.D3] -> 0.000000829 | G3: of:=[.C3]*[$curvi.$J5] -> 0.000000133891130155934 | H3: of:=[.D3]*[$curvi.$J5] -> 0.0000000795668436553899 | J3: of:=([.E3]-[.G3])/[.C3] -> 0.0000000000904020695228721 | K3: of:=([.F3]-[.H3])/[.D3] -> 0.0000000000904020695228722 | L3: of:=[.B3]-[.J3] -> 0.00000000000959793047712786 | M3: of:=[.B3]-[.K3] -> 0.00000000000959793047712785 | N3: of:=[.C3]*[.$B3] -> 0.000001395 | O3: of:=[.D3]*[.$B3] -> 0.000000829 | R3: of:=[.C3]*[.L3] -> 0.000000133891130155934 | S3: of:=[.D3]*[.M3] -> 0.0000000795668436553899 | T3: of:=1/[.L3] -> 104189127268.949 | U3: of:=1/[.M3] -> 104189127268.949 | V3: of:=[.B3]*[.T3] -> 10.4189127268949 | W3: of:=[.C3]*[.U3] -> 1453438325401840
A4: of:=[.A3]+1 -> 2 | B4: of:=[$curvi.B6] -> 0.0250000001 | C4: 9810 | D4: 6540 | E4: of:=[.B4]*[.C4] -> 245.250000981 | F4: of:=[.B4]*[.D4] -> 163.500000654 | G4: of:=[.C4]*[$curvi.$J6] -> 23.0056531393788 | H4: of:=[.D4]*[$curvi.$J6] -> 15.3371020929192 | I4: of:=[.C50] -> 0 | J4: of:=([.E4]-[.G4])/[.C4] -> 0.0226548774558228 | K4: of:=([.F4]-[.H4])/[.D4] -> 0.0226548774558228 | L4: of:=[.B4]-[.J4] -> 0.00234512264417725 | M4: of:=[.B4]-[.K4] -> 0.00234512264417725 | N4: of:=[.C4]*[.$B4] -> 245.250000981 | O4: of:=[.D4]*[.$B4] -> 163.500000654 | R4: of:=[.C4]*[.L4] -> 23.0056531393788 | S4: of:=[.D4]*[.M4] -> 15.3371020929192 | T4: of:=1/[.L4] -> 426.416930680756 | U4: of:=1/[.M4] -> 426.416930680756 | V4: of:=[.B4]*[.T4] -> 10.6604233096606 | W4: of:=[.C4]*[.U4] -> 4183150.08997821
A5: of:=[.A4]+1 -> 3 | B5: of:=[$curvi.B7] -> 0.0500000001 | C5: 7000 | D5: 5080 | E5: of:=[.B5]*[.C5] -> 350.0000007 | F5: of:=[.B5]*[.D5] -> 254.000000508 | G5: of:=[.C5]*[$curvi.$J7] -> 32.067007353719 | H5: of:=[.D5]*[$curvi.$J7] -> 23.2714853366989 | I5: of:=[.E53] -> 0.2163737501 | J5: of:=([.E5]-[.G5])/[.C5] -> 0.0454189990494687 | K5: of:=([.F5]-[.H5])/[.D5] -> 0.0454189990494687 | L5: of:=[.B5]-[.J5] -> 0.00458100105053129 | M5: of:=[.B5]-[.K5] -> 0.00458100105053129 | N5: of:=[.C5]*[.$B5] -> 350.0000007 | O5: of:=[.D5]*[.$B5] -> 254.000000508 | R5: of:=[.C5]*[.L5] -> 32.067007353719 | S5: of:=[.D5]*[.M5] -> 23.2714853366989 | T5: of:=1/[.L5] -> 218.292899078035 | U5: of:=1/[.M5] -> 218.292899078035 | V5: of:=[.B5]*[.T5] -> 10.9146449757311 | W5: of:=[.C5]*[.U5] -> 1528050.29354625
A6: of:=[.A5]+1 -> 4 | B6: of:=[$curvi.B8] -> 0.0750000001 | C6: 6250 | D6: 3700 | E6: of:=[.B6]*[.C6] -> 468.750000625 | F6: of:=[.B6]*[.D6] -> 277.50000037 | G6: of:=[.C6]*[$curvi.$J8] -> 41.9177696122231 | H6: of:=[.D6]*[$curvi.$J8] -> 24.8153196104361 | I6: of:=[.I5]-[.F53] -> -0.13464725 | J6: of:=([.E6]-[.G6])/[.C6] -> 0.0682931569620443 | K6: of:=([.F6]-[.H6])/[.D6] -> 0.0682931569620443 | L6: of:=[.B6]-[.J6] -> 0.00670684313795569 | M6: of:=[.B6]-[.K6] -> 0.00670684313795569 | N6: of:=[.C6]*[.$B6] -> 468.750000625 | O6: of:=[.D6]*[.$B6] -> 277.50000037 | R6: of:=[.C6]*[.L6] -> 41.9177696122231 | S6: of:=[.D6]*[.M6] -> 24.8153196104361 | T6: of:=1/[.L6] -> 149.101444514298 | U6: of:=1/[.M6] -> 149.101444514298 | V6: of:=[.B6]*[.T6] -> 11.1826083534825 | W6: of:=[.C6]*[.U6] -> 931884.028214362
A7: of:=[.A6]+1 -> 5 | B7: of:=[$curvi.B9] -> 0.1000000001 | C7: 5300 | D7: 3250 | E7: of:=[.B7]*[.C7] -> 530.00000053 | F7: of:=[.B7]*[.D7] -> 325.000000325 | G7: of:=[.C7]*[$curvi.$J9] -> 46.2258004400913 | H7: of:=[.D7]*[$curvi.$J9] -> 28.3460097038295 | J7: of:=([.E7]-[.G7])/[.C7] -> 0.0912781509603602 | K7: of:=([.F7]-[.H7])/[.D7] -> 0.0912781509603602 | L7: of:=[.B7]-[.J7] -> 0.00872184913963986 | M7: of:=[.B7]-[.K7] -> 0.00872184913963987 | N7: of:=[.C7]*[.$B7] -> 530.00000053 | O7: of:=[.D7]*[.$B7] -> 325.000000325 | R7: of:=[.C7]*[.L7] -> 46.2258004400913 | S7: of:=[.D7]*[.M7] -> 28.3460097038296 | T7: of:=1/[.L7] -> 114.654585740896 | U7: of:=1/[.M7] -> 114.654585740896 | V7: of:=[.B7]*[.T7] -> 11.4654585855551 | W7: of:=[.C7]*[.U7] -> 607669.304426749
A8: of:=[.A7]+1 -> 6 | B8: of:=[$curvi.B10] -> 0.1250000001 | C8: 4500 | D8: 3100 | E8: of:=[.B8]*[.C8] -> 562.50000045 | F8: of:=[.B8]*[.D8] -> 387.50000031 | G8: of:=[.C8]*[$curvi.$J10] -> 47.8134518375483 | H8: of:=[.D8]*[$curvi.$J10] -> 32.9381557103111 | J8: of:=([.E8]-[.G8])/[.C8] -> 0.114374788580545 | K8: of:=([.F8]-[.H8])/[.D8] -> 0.114374788580545 | L8: of:=[.B8]-[.J8] -> 0.0106252115194552 | M8: of:=[.B8]-[.K8] -> 0.0106252115194552 | N8: of:=[.C8]*[.$B8] -> 562.50000045 | O8: of:=[.D8]*[.$B8] -> 387.50000031 | R8: of:=[.C8]*[.L8] -> 47.8134518375483 | S8: of:=[.D8]*[.M8] -> 32.9381557103111 | T8: of:=1/[.L8] -> 94.115773428977 | U8: of:=1/[.M8] -> 94.1157734289768 | V8: of:=[.B8]*[.T8] -> 11.7644716880337 | W8: of:=[.C8]*[.U8] -> 423520.980430396
A9: of:=[.A8]+1 -> 7 | B9: of:=[$curvi.B11] -> 0.1500000001 | C9: 3850 | D9: 2850 | E9: of:=[.B9]*[.C9] -> 577.500000385 | F9: of:=[.B9]*[.D9] -> 427.500000285 | G9: of:=[.C9]*[$curvi.$J11] -> 47.8020422779202 | H9: of:=[.D9]*[$curvi.$J11] -> 35.3859274005383 | J9: of:=([.E9]-[.G9])/[.C9] -> 0.137583885222618 | K9: of:=([.F9]-[.H9])/[.D9] -> 0.137583885222618 | L9: of:=[.B9]-[.J9] -> 0.0124161148773819 | M9: of:=[.B9]-[.K9] -> 0.0124161148773819 | N9: of:=[.C9]*[.$B9] -> 577.500000385 | O9: of:=[.D9]*[.$B9] -> 427.500000285 | R9: of:=[.C9]*[.L9] -> 47.8020422779202 | S9: of:=[.D9]*[.M9] -> 35.3859274005383 | T9: of:=1/[.L9] -> 80.5404919232566 | U9: of:=1/[.M9] -> 80.5404919232566 | V9: of:=[.B9]*[.T9] -> 12.0810737965425 | W9: of:=[.C9]*[.U9] -> 310080.893904538
A10: of:=[.A9]+1 -> 8 | B10: of:=[$curvi.B12] -> 0.1750000001 | C10: 3700 | D10: 2700 | E10: of:=[.B10]*[.C10] -> 647.50000037 | F10: of:=[.B10]*[.D10] -> 472.50000027 | G10: of:=[.C10]*[$curvi.$J12] -> 52.1468226581379 | H10: of:=[.D10]*[$curvi.$J12] -> 38.0530868045871 | J10: of:=([.E10]-[.G10])/[.C10] -> 0.160906264246449 | K10: of:=([.F10]-[.H10])/[.D10] -> 0.160906264246449 | L10: of:=[.B10]-[.J10] -> 0.0140937358535508 | M10: of:=[.B10]-[.K10] -> 0.0140937358535508 | N10: of:=[.C10]*[.$B10] -> 647.50000037 | O10: of:=[.D10]*[.$B10] -> 472.50000027 | R10: of:=[.C10]*[.L10] -> 52.146822658138 | S10: of:=[.D10]*[.M10] -> 38.0530868045871 | T10: of:=1/[.L10] -> 70.9535080259119 | U10: of:=1/[.M10] -> 70.9535080259121 | V10: of:=[.B10]*[.T10] -> 12.4168639116299 | W10: of:=[.C10]*[.U10] -> 262527.979695875
A11: of:=[.A10]+1 -> 9 | B11: of:=[$curvi.B13] -> 0.2000000001 | C11: 3500 | D11: 2650 | E11: of:=[.B11]*[.C11] -> 700.00000035 | F11: of:=[.B11]*[.D11] -> 530.000000265 | G11: of:=[.C11]*[$curvi.$J13] -> 54.8003506080687 | H11: of:=[.D11]*[$curvi.$J13] -> 41.4916940318234 | J11: of:=([.E11]-[.G11])/[.C11] -> 0.184342757069123 | K11: of:=([.F11]-[.H11])/[.D11] -> 0.184342757069123 | L11: of:=[.B11]-[.J11] -> 0.0156572430308768 | M11: of:=[.B11]-[.K11] -> 0.0156572430308768 | N11: of:=[.C11]*[.$B11] -> 700.00000035 | O11: of:=[.D11]*[.$B11] -> 530.000000265 | R11: of:=[.C11]*[.L11] -> 54.8003506080688 | S11: of:=[.D11]*[.M11] -> 41.4916940318234 | T11: of:=1/[.L11] -> 63.8682045126307 | U11: of:=1/[.M11] -> 63.8682045126308 | V11: of:=[.B11]*[.T11] -> 12.773640908913 | W11: of:=[.C11]*[.U11] -> 223538.715794208
A12: of:=[.A11]+1 -> 10 | B12: of:=[$curvi.B14] -> 0.2250000001 | C12: 3350 | D12: 2600 | E12: of:=[.B12]*[.C12] -> 753.750000335 | F12: of:=[.B12]*[.D12] -> 585.00000026 | G12: of:=[.C12]*[$curvi.$J14] -> 57.3044194014686 | H12: of:=[.D12]*[$curvi.$J14] -> 44.4750717742742 | J12: of:=([.E12]-[.G12])/[.C12] -> 0.207894203263741 | K12: of:=([.F12]-[.H12])/[.D12] -> 0.207894203263741 | L12: of:=[.B12]-[.J12] -> 0.0171057968362593 | M12: of:=[.B12]-[.K12] -> 0.0171057968362593 | N12: of:=[.C12]*[.$B12] -> 753.750000335 | O12: of:=[.D12]*[.$B12] -> 585.00000026 | R12: of:=[.C12]*[.L12] -> 57.3044194014686 | S12: of:=[.D12]*[.M12] -> 44.4750717742742 | T12: of:=1/[.L12] -> 58.4597145384243 | U12: of:=1/[.M12] -> 58.4597145384243 | V12: of:=[.B12]*[.T12] -> 13.1534357769914 | W12: of:=[.C12]*[.U12] -> 195840.043703721
A13: of:=[.A12]+1 -> 11 | B13: of:=[$curvi.B15] -> 0.2500000001 | C13: 3250 | D13: 2583 | E13: of:=[.B13]*[.C13] -> 812.500000325 | F13: of:=[.B13]*[.D13] -> 645.7500002583 | G13: of:=[.C13]*[$curvi.$J15] -> 59.9252856810591 | H13: of:=[.D13]*[$curvi.$J15] -> 47.6267732043618 | J13: of:=([.E13]-[.G13])/[.C13] -> 0.231561450659674 | K13: of:=([.F13]-[.H13])/[.D13] -> 0.231561450659674 | L13: of:=[.B13]-[.J13] -> 0.0184385494403259 | M13: of:=[.B13]-[.K13] -> 0.0184385494403259 | N13: of:=[.C13]*[.$B13] -> 812.500000325 | O13: of:=[.D13]*[.$B13] -> 645.7500002583 | R13: of:=[.C13]*[.L13] -> 59.9252856810591 | S13: of:=[.D13]*[.M13] -> 47.6267732043617 | T13: of:=1/[.L13] -> 54.234201190087 | U13: of:=1/[.M13] -> 54.2342011900871 | V13: of:=[.B13]*[.T13] -> 13.5585503029452 | W13: of:=[.C13]*[.U13] -> 176261.153867783
A14: of:=[.A13]+1 -> 12 | B14: of:=[$curvi.B16] -> 0.2750000001 | C14: 3150 | D14: 2578 | E14: of:=[.B14]*[.C14] -> 866.250000315 | F14: of:=[.B14]*[.D14] -> 708.9500002578 | G14: of:=[.C14]*[$curvi.$J16] -> 61.9121306654317 | H14: of:=[.D14]*[$curvi.$J16] -> 50.6696739223756 | J14: of:=([.E14]-[.G14])/[.C14] -> 0.255345355444307 | K14: of:=([.F14]-[.H14])/[.D14] -> 0.255345355444307 | L14: of:=[.B14]-[.J14] -> 0.0196546446556926 | M14: of:=[.B14]-[.K14] -> 0.0196546446556926 | N14: of:=[.C14]*[.$B14] -> 866.250000315 | O14: of:=[.D14]*[.$B14] -> 708.9500002578 | R14: of:=[.C14]*[.L14] -> 61.9121306654317 | S14: of:=[.D14]*[.M14] -> 50.6696739223756 | T14: of:=1/[.L14] -> 50.8785591150521 | U14: of:=1/[.M14] -> 50.8785591150521 | V14: of:=[.B14]*[.T14] -> 13.9916037617272 | W14: of:=[.C14]*[.U14] -> 160267.461212414
A15: of:=[.A14]+1 -> 13 | B15: of:=[$curvi.B17] -> 0.3000000001 | C15: 3050 | D15: 2574 | E15: of:=[.B15]*[.C15] -> 915.000000305 | F15: of:=[.B15]*[.D15] -> 772.2000002574 | G15: of:=[.C15]*[$curvi.$J17] -> 63.2973143928371 | H15: of:=[.D15]*[$curvi.$J17] -> 53.4187827039878 | J15: of:=([.E15]-[.G15])/[.C15] -> 0.279246782266283 | K15: of:=([.F15]-[.H15])/[.D15] -> 0.279246782266283 | L15: of:=[.B15]-[.J15] -> 0.0207532178337171 | M15: of:=[.B15]-[.K15] -> 0.0207532178337171 | N15: of:=[.C15]*[.$B15] -> 915.000000305 | O15: of:=[.D15]*[.$B15] -> 772.2000002574 | R15: of:=[.C15]*[.L15] -> 63.2973143928371 | S15: of:=[.D15]*[.M15] -> 53.4187827039878 | T15: of:=1/[.L15] -> 48.1852986853601 | U15: of:=1/[.M15] -> 48.1852986853601 | V15: of:=[.B15]*[.T15] -> 14.4555896104266 | W15: of:=[.C15]*[.U15] -> 146965.160990348
A16: of:=[.A15]+1 -> 14 | B16: of:=[$curvi.B18] -> 0.3250000001 | C16: 2950 | D16: 2570 | E16: of:=[.B16]*[.C16] -> 958.750000295 | F16: of:=[.B16]*[.D16] -> 835.250000257 | G16: of:=[.C16]*[$curvi.$J18] -> 64.1135174911629 | H16: of:=[.D16]*[$curvi.$J18] -> 55.8548271024707 | J16: of:=([.E16]-[.G16])/[.C16] -> 0.303266604340284 | K16: of:=([.F16]-[.H16])/[.D16] -> 0.303266604340284 | L16: of:=[.B16]-[.J16] -> 0.0217333957597162 | M16: of:=[.B16]-[.K16] -> 0.0217333957597162 | N16: of:=[.C16]*[.$B16] -> 958.750000295 | O16: of:=[.D16]*[.$B16] -> 835.250000257 | R16: of:=[.C16]*[.L16] -> 64.1135174911629 | S16: of:=[.D16]*[.M16] -> 55.8548271024707 | T16: of:=1/[.L16] -> 46.0121377743253 | U16: of:=1/[.M16] -> 46.0121377743253 | V16: of:=[.B16]*[.T16] -> 14.9539447812569 | W16: of:=[.C16]*[.U16] -> 135735.80643426
A17: of:=[.A16]+1 -> 15 | B17: of:=[$curvi.B19] -> 0.3500000001 | C17: 2850 | D17: 2560 | E17: of:=[.B17]*[.C17] -> 997.500000285 | F17: of:=[.B17]*[.D17] -> 896.000000256 | G17: of:=[.C17]*[$curvi.$J19] -> 64.3937451578787 | H17: of:=[.D17]*[$curvi.$J19] -> 57.8413991593577 | J17: of:=([.E17]-[.G17])/[.C17] -> 0.327405703553376 | K17: of:=([.F17]-[.H17])/[.D17] -> 0.327405703553376 | L17: of:=[.B17]-[.J17] -> 0.0225942965466241 | M17: of:=[.B17]-[.K17] -> 0.0225942965466241 | N17: of:=[.C17]*[.$B17] -> 997.500000285 | O17: of:=[.D17]*[.$B17] -> 896.000000256 | R17: of:=[.C17]*[.L17] -> 64.3937451578787 | S17: of:=[.D17]*[.M17] -> 57.8413991593577 | T17: of:=1/[.L17] -> 44.2589570308802 | U17: of:=1/[.M17] -> 44.2589570308802 | V17: of:=[.B17]*[.T17] -> 15.490634965234 | W17: of:=[.C17]*[.U17] -> 126138.027538009
A18: of:=[.A17]+1 -> 16 | B18: of:=[$curvi.B20] -> 0.3750000001 | C18: 2750 | D18: 2555 | E18: of:=[.B18]*[.C18] -> 1031.250000275 | F18: of:=[.B18]*[.D18] -> 958.1250002555 | G18: of:=[.C18]*[$curvi.$J20] -> 64.1713311994166 | H18: of:=[.D18]*[$curvi.$J20] -> 59.6210004416398 | J18: of:=([.E18]-[.G18])/[.C18] -> 0.351664970572939 | K18: of:=([.F18]-[.H18])/[.D18] -> 0.351664970572939 | L18: of:=[.B18]-[.J18] -> 0.0233350295270606 | M18: of:=[.B18]-[.K18] -> 0.0233350295270606 | N18: of:=[.C18]*[.$B18] -> 1031.250000275 | O18: of:=[.D18]*[.$B18] -> 958.1250002555 | R18: of:=[.C18]*[.L18] -> 64.1713311994167 | S18: of:=[.D18]*[.M18] -> 59.6210004416399 | T18: of:=1/[.L18] -> 42.8540276257351 | U18: of:=1/[.M18] -> 42.8540276257351 | V18: of:=[.B18]*[.T18] -> 16.0702603639361 | W18: of:=[.C18]*[.U18] -> 117848.575970772
A19: of:=[.A18]+1 -> 17 | B19: of:=[$curvi.B21] -> 0.4000000001 | C19: 2600 | D19: 2548 | E19: of:=[.B19]*[.C19] -> 1040.00000026 | F19: of:=[.B19]*[.D19] -> 1019.2000002548 | G19: of:=[.C19]*[$curvi.$J21] -> 62.2822073738418 | H19: of:=[.D19]*[$curvi.$J21] -> 61.0365632263649 | J19: of:=([.E19]-[.G19])/[.C19] -> 0.376045304956215 | K19: of:=([.F19]-[.H19])/[.D19] -> 0.376045304956215 | L19: of:=[.B19]-[.J19] -> 0.0239546951437853 | M19: of:=[.B19]-[.K19] -> 0.0239546951437853 | N19: of:=[.C19]*[.$B19] -> 1040.00000026 | O19: of:=[.D19]*[.$B19] -> 1019.2000002548 | R19: of:=[.C19]*[.L19] -> 62.2822073738418 | S19: of:=[.D19]*[.M19] -> 61.0365632263649 | T19: of:=1/[.L19] -> 41.7454696875755 | U19: of:=1/[.M19] -> 41.7454696875755 | V19: of:=[.B19]*[.T19] -> 16.6981878792047 | W19: of:=[.C19]*[.U19] -> 108538.221187696
A20: of:=[.A19]+1 -> 18 | B20: of:=[$curvi.B22] -> 0.4250000001 | C20: 2500 | D20: 2545 | E20: of:=[.B20]*[.C20] -> 1062.50000025 | F20: of:=[.B20]*[.D20] -> 1081.6250002545 | G20: of:=[.C20]*[$curvi.$J22] -> 61.1309620962648 | H20: of:=[.D20]*[$curvi.$J22] -> 62.2313194139976 | J20: of:=([.E20]-[.G20])/[.C20] -> 0.400547615261494 | K20: of:=([.F20]-[.H20])/[.D20] -> 0.400547615261494 | L20: of:=[.B20]-[.J20] -> 0.024452384838506 | M20: of:=[.B20]-[.K20] -> 0.0244523848385059 | N20: of:=[.C20]*[.$B20] -> 1062.50000025 | O20: of:=[.D20]*[.$B20] -> 1081.6250002545 | R20: of:=[.C20]*[.L20] -> 61.130962096265 | S20: of:=[.D20]*[.M20] -> 62.2313194139974 | T20: of:=1/[.L20] -> 40.8958065482949 | U20: of:=1/[.M20] -> 40.8958065482951 | V20: of:=[.B20]*[.T20] -> 17.3807177871149 | W20: of:=[.C20]*[.U20] -> 102239.516370738
A21: of:=[.A20]+1 -> 19 | B21: of:=[$curvi.B23] -> 0.4500000001 | C21: 2350 | D21: 2538 | E21: of:=[.B21]*[.C21] -> 1057.500000235 | F21: of:=[.B21]*[.D21] -> 1142.1000002538 | G21: of:=[.C21]*[$curvi.$J23] -> 58.3438752066846 | H21: of:=[.D21]*[$curvi.$J23] -> 63.0113852232193 | J21: of:=([.E21]-[.G21])/[.C21] -> 0.425172819160986 | K21: of:=([.F21]-[.H21])/[.D21] -> 0.425172819160985 | L21: of:=[.B21]-[.J21] -> 0.0248271809390146 | M21: of:=[.B21]-[.K21] -> 0.0248271809390147 | N21: of:=[.C21]*[.$B21] -> 1057.500000235 | O21: of:=[.D21]*[.$B21] -> 1142.1000002538 | R21: of:=[.C21]*[.L21] -> 58.3438752066844 | S21: of:=[.D21]*[.M21] -> 63.0113852232193 | T21: of:=1/[.L21] -> 40.2784352543446 | U21: of:=1/[.M21] -> 40.2784352543445 | V21: of:=[.B21]*[.T21] -> 18.1252958684829 | W21: of:=[.C21]*[.U21] -> 94654.3228477096
A22: of:=[.A21]+1 -> 20 | B22: of:=[$curvi.B24] -> 0.4750000001 | C22: 2100 | D22: 2535 | E22: of:=[.B22]*[.C22] -> 997.50000021 | F22: of:=[.B22]*[.D22] -> 1204.1250002535 | G22: of:=[.C22]*[$curvi.$J24] -> 52.6641287437059 | H22: of:=[.D22]*[$curvi.$J24] -> 63.5731268406164 | J22: of:=([.E22]-[.G22])/[.C22] -> 0.449921843555378 | K22: of:=([.F22]-[.H22])/[.D22] -> 0.449921843555378 | L22: of:=[.B22]-[.J22] -> 0.0250781565446219 | M22: of:=[.B22]-[.K22] -> 0.0250781565446219 | N22: of:=[.C22]*[.$B22] -> 997.50000021 | O22: of:=[.D22]*[.$B22] -> 1204.1250002535 | R22: of:=[.C22]*[.L22] -> 52.6641287437059 | S22: of:=[.D22]*[.M22] -> 63.5731268406164 | T22: of:=1/[.L22] -> 39.8753392507415 | U22: of:=1/[.M22] -> 39.8753392507415 | V22: of:=[.B22]*[.T22] -> 18.9407861480898 | W22: of:=[.C22]*[.U22] -> 83738.2124265572
A23: of:=[.A22]+1 -> 21 | B23: of:=[$curvi.B25] -> 0.5000000001 | C23: 1850 | D23: 2535 | E23: of:=[.B23]*[.C23] -> 925.000000185 | F23: of:=[.B23]*[.D23] -> 1267.5000002535 | G23: of:=[.C23]*[$curvi.$J25] -> 46.628094508234 | H23: of:=[.D23]*[$curvi.$J25] -> 63.8930916639855 | J23: of:=([.E23]-[.G23])/[.C23] -> 0.474795624690144 | K23: of:=([.F23]-[.H23])/[.D23] -> 0.474795624690144 | L23: of:=[.B23]-[.J23] -> 0.0252043754098562 | M23: of:=[.B23]-[.K23] -> 0.0252043754098562 | N23: of:=[.C23]*[.$B23] -> 925.000000185 | O23: of:=[.D23]*[.$B23] -> 1267.5000002535 | R23: of:=[.C23]*[.L23] -> 46.628094508234 | S23: of:=[.D23]*[.M23] -> 63.8930916639855 | T23: of:=1/[.L23] -> 39.6756509034121 | U23: of:=1/[.M23] -> 39.6756509034121 | V23: of:=[.B23]*[.T23] -> 19.8378254556736 | W23: of:=[.C23]*[.U23] -> 73399.9541713125
A24: of:=[.A23]+1 -> 22 | B24: of:=[$curvi.B26] -> 0.5250000001 | C24: 1550 | D24: 2530 | E24: of:=[.B24]*[.C24] -> 813.750000155 | F24: of:=[.B24]*[.D24] -> 1328.250000253 | G24: of:=[.C24]*[$curvi.$J26] -> 39.0675823309251 | H24: of:=[.D24]*[$curvi.$J26] -> 63.7683763208003 | J24: of:=([.E24]-[.G24])/[.C24] -> 0.499795108273597 | K24: of:=([.F24]-[.H24])/[.D24] -> 0.499795108273597 | L24: of:=[.B24]-[.J24] -> 0.0252048918264033 | M24: of:=[.B24]-[.K24] -> 0.0252048918264033 | N24: of:=[.C24]*[.$B24] -> 813.750000155 | O24: of:=[.D24]*[.$B24] -> 1328.250000253 | R24: of:=[.C24]*[.L24] -> 39.0675823309251 | S24: of:=[.D24]*[.M24] -> 63.7683763208003 | T24: of:=1/[.L24] -> 39.6748379992035 | U24: of:=1/[.M24] -> 39.6748379992035 | V24: of:=[.B24]*[.T24] -> 20.8292899535494 | W24: of:=[.C24]*[.U24] -> 61495.9988987655
A25: of:=[.A24]+1 -> 23 | B25: of:=[$curvi.B27] -> 0.5500000001 | C25: 1250 | D25: 2520 | E25: of:=[.B25]*[.C25] -> 687.500000125 | F25: of:=[.B25]*[.D25] -> 1386.000000252 | G25: of:=[.C25]*[$curvi.$J27] -> 31.3484381290603 | H25: of:=[.D25]*[$curvi.$J27] -> 63.1984512681856 | J25: of:=([.E25]-[.G25])/[.C25] -> 0.524921249596752 | K25: of:=([.F25]-[.H25])/[.D25] -> 0.524921249596752 | L25: of:=[.B25]-[.J25] -> 0.0250787505032483 | M25: of:=[.B25]-[.K25] -> 0.0250787505032483 | N25: of:=[.C25]*[.$B25] -> 687.500000125 | O25: of:=[.D25]*[.$B25] -> 1386.000000252 | R25: of:=[.C25]*[.L25] -> 31.3484381290603 | S25: of:=[.D25]*[.M25] -> 63.1984512681856 | T25: of:=1/[.L25] -> 39.8743948535425 | U25: of:=1/[.M25] -> 39.8743948535425 | V25: of:=[.B25]*[.T25] -> 21.9309171734359 | W25: of:=[.C25]*[.U25] -> 49842.9935669282
A26: of:=[.A25]+1 -> 24 | B26: of:=[$curvi.B28] -> 0.5750000001 | C26: 1100 | D26: 2515 | E26: of:=[.B26]*[.C26] -> 632.50000011 | F26: of:=[.B26]*[.D26] -> 1446.1250002515 | G26: of:=[.C26]*[$curvi.$J28] -> 27.3074850894928 | H26: of:=[.D26]*[$curvi.$J28] -> 62.4348409091585 | J26: of:=([.E26]-[.G26])/[.C26] -> 0.550175013655007 | K26: of:=([.F26]-[.H26])/[.D26] -> 0.550175013655007 | L26: of:=[.B26]-[.J26] -> 0.0248249864449934 | M26: of:=[.B26]-[.K26] -> 0.0248249864449934 | N26: of:=[.C26]*[.$B26] -> 632.50000011 | O26: of:=[.D26]*[.$B26] -> 1446.1250002515 | R26: of:=[.C26]*[.L26] -> 27.3074850894928 | S26: of:=[.D26]*[.M26] -> 62.4348409091585 | T26: of:=1/[.L26] -> 40.2819958115899 | U26: of:=1/[.M26] -> 40.2819958115899 | V26: of:=[.B26]*[.T26] -> 23.1621475956924 | W26: of:=[.C26]*[.U26] -> 44310.1953927488
A27: of:=[.A26]+1 -> 25 | B27: of:=[$curvi.B29] -> 0.6000000001 | C27: 800 | D27: 2510 | E27: of:=[.B27]*[.C27] -> 480.00000008 | F27: of:=[.B27]*[.D27] -> 1506.000000251 | G27: of:=[.C27]*[$curvi.$J29] -> 19.5540998626525 | H27: of:=[.D27]*[$curvi.$J29] -> 61.3509883190722 | J27: of:=([.E27]-[.G27])/[.C27] -> 0.575557375271685 | K27: of:=([.F27]-[.H27])/[.D27] -> 0.575557375271685 | L27: of:=[.B27]-[.J27] -> 0.0244426248283156 | M27: of:=[.B27]-[.K27] -> 0.0244426248283156 | N27: of:=[.C27]*[.$B27] -> 480.00000008 | O27: of:=[.D27]*[.$B27] -> 1506.000000251 | R27: of:=[.C27]*[.L27] -> 19.5540998626525 | S27: of:=[.D27]*[.M27] -> 61.3509883190722 | T27: of:=1/[.L27] -> 40.9121363611304 | U27: of:=1/[.M27] -> 40.9121363611304 | V27: of:=[.B27]*[.T27] -> 24.5472818207695 | W27: of:=[.C27]*[.U27] -> 32729.7090889043
A28: of:=[.A27]+1 -> 26 | B28: of:=[$curvi.B30] -> 0.6250000001 | C28: 600 | D28: 2500 | E28: of:=[.B28]*[.C28] -> 375.00000006 | F28: of:=[.B28]*[.D28] -> 1562.50000025 | G28: of:=[.C28]*[$curvi.$J30] -> 14.3584085259196 | H28: of:=[.D28]*[$curvi.$J30] -> 59.8267021913315 | J28: of:=([.E28]-[.G28])/[.C28] -> 0.601069319223468 | K28: of:=([.F28]-[.H28])/[.D28] -> 0.601069319223468 | L28: of:=[.B28]-[.J28] -> 0.0239306808765326 | M28: of:=[.B28]-[.K28] -> 0.0239306808765327 | N28: of:=[.C28]*[.$B28] -> 375.00000006 | O28: of:=[.D28]*[.$B28] -> 1562.50000025 | R28: of:=[.C28]*[.L28] -> 14.3584085259196 | S28: of:=[.D28]*[.M28] -> 59.8267021913318 | T28: of:=1/[.L28] -> 41.7873609680968 | U28: of:=1/[.M28] -> 41.7873609680966 | V28: of:=[.B28]*[.T28] -> 26.1171006092393 | W28: of:=[.C28]*[.U28] -> 25072.416580858
A29: of:=[.A28]+1 -> 27 | B29: of:=[$curvi.B31] -> 0.6500000001 | C29: 500 | D29: 2450 | E29: of:=[.B29]*[.C29] -> 325.00000005 | F29: of:=[.B29]*[.D29] -> 1592.500000245 | G29: of:=[.C29]*[$curvi.$J31] -> 11.6440798661211 | H29: of:=[.D29]*[$curvi.$J31] -> 57.0559913439936 | J29: of:=([.E29]-[.G29])/[.C29] -> 0.626711840367758 | K29: of:=([.F29]-[.H29])/[.D29] -> 0.626711840367758 | L29: of:=[.B29]-[.J29] -> 0.0232881597322424 | M29: of:=[.B29]-[.K29] -> 0.0232881597322423 | N29: of:=[.C29]*[.$B29] -> 325.00000005 | O29: of:=[.D29]*[.$B29] -> 1592.500000245 | R29: of:=[.C29]*[.L29] -> 11.6440798661212 | S29: of:=[.D29]*[.M29] -> 57.0559913439936 | T29: of:=1/[.L29] -> 42.9402757236976 | U29: of:=1/[.M29] -> 42.9402757236978 | V29: of:=[.B29]*[.T29] -> 27.9111792246975 | W29: of:=[.C29]*[.U29] -> 21470.1378618489
A30: of:=[.A29]+1 -> 28 | B30: of:=[$curvi.B32] -> 0.6750000001 | C30: 450 | D30: 2400 | E30: of:=[.B30]*[.C30] -> 303.750000045 | F30: of:=[.B30]*[.D30] -> 1620.00000024 | G30: of:=[.C30]*[$curvi.$J32] -> 10.1313253476013 | H30: of:=[.D30]*[$curvi.$J32] -> 54.0337351872071 | J30: of:=([.E30]-[.G30])/[.C30] -> 0.652485943771997 | K30: of:=([.F30]-[.H30])/[.D30] -> 0.652485943771997 | L30: of:=[.B30]-[.J30] -> 0.022514056328003 | M30: of:=[.B30]-[.K30] -> 0.022514056328003 | N30: of:=[.C30]*[.$B30] -> 303.750000045 | O30: of:=[.D30]*[.$B30] -> 1620.00000024 | R30: of:=[.C30]*[.L30] -> 10.1313253476013 | S30: of:=[.D30]*[.M30] -> 54.0337351872071 | T30: of:=1/[.L30] -> 44.4166961933111 | U30: of:=1/[.M30] -> 44.4166961933111 | V30: of:=[.B30]*[.T30] -> 29.9812699349267 | W30: of:=[.C30]*[.U30] -> 19987.51328699
A31: of:=[.A30]+1 -> 29 | B31: of:=[$curvi.B33] -> 0.7000000001 | C31: 450 | D31: 2300 | E31: of:=[.B31]*[.C31] -> 315.000000045 | F31: of:=[.B31]*[.D31] -> 1610.00000023 | G31: of:=[.C31]*[$curvi.$J33] -> 9.7233098647571 | H31: of:=[.D31]*[$curvi.$J33] -> 49.6969170865363 | J31: of:=([.E31]-[.G31])/[.C31] -> 0.678392644844985 | K31: of:=([.F31]-[.H31])/[.D31] -> 0.678392644844985 | L31: of:=[.B31]-[.J31] -> 0.0216073552550157 | M31: of:=[.B31]-[.K31] -> 0.0216073552550158 | N31: of:=[.C31]*[.$B31] -> 315.000000045 | O31: of:=[.D31]*[.$B31] -> 1610.00000023 | R31: of:=[.C31]*[.L31] -> 9.72330986475705 | S31: of:=[.D31]*[.M31] -> 49.6969170865363 | T31: of:=1/[.L31] -> 46.2805367985919 | U31: of:=1/[.M31] -> 46.2805367985916 | V31: of:=[.B31]*[.T31] -> 32.3963757636424 | W31: of:=[.C31]*[.U31] -> 20826.2415593662
A32: of:=[.A31]+1 -> 30 | B32: of:=[$curvi.B34] -> 0.7250000001 | C32: 400 | D32: 2150 | E32: of:=[.B32]*[.C32] -> 290.00000004 | F32: of:=[.B32]*[.D32] -> 1558.750000215 | G32: of:=[.C32]*[$curvi.$J34] -> 8.2268122519106 | H32: of:=[.D32]*[$curvi.$J34] -> 44.2191158540195 | J32: of:=([.E32]-[.G32])/[.C32] -> 0.704432969470224 | K32: of:=([.F32]-[.H32])/[.D32] -> 0.704432969470224 | L32: of:=[.B32]-[.J32] -> 0.0205670306297765 | M32: of:=[.B32]-[.K32] -> 0.0205670306297765 | N32: of:=[.C32]*[.$B32] -> 290.00000004 | O32: of:=[.D32]*[.$B32] -> 1558.750000215 | R32: of:=[.C32]*[.L32] -> 8.2268122519106 | S32: of:=[.D32]*[.M32] -> 44.2191158540195 | T32: of:=1/[.L32] -> 48.6215058459738 | U32: of:=1/[.M32] -> 48.6215058459738 | V32: of:=[.B32]*[.T32] -> 35.2505917431932 | W32: of:=[.C32]*[.U32] -> 19448.6023383895
A33: of:=[.A32]+1 -> 31 | B33: of:=[$curvi.B35] -> 0.7500000001 | C33: 360 | D33: 1850 | E33: of:=[.B33]*[.C33] -> 270.000000036 | F33: of:=[.B33]*[.D33] -> 1387.500000185 | G33: of:=[.C33]*[$curvi.$J35] -> 6.98113654511706 | H33: of:=[.D33]*[$curvi.$J35] -> 35.8752850235182 | J33: of:=([.E33]-[.G33])/[.C33] -> 0.730607954141342 | K33: of:=([.F33]-[.H33])/[.D33] -> 0.730607954141342 | L33: of:=[.B33]-[.J33] -> 0.0193920459586584 | M33: of:=[.B33]-[.K33] -> 0.0193920459586585 | N33: of:=[.C33]*[.$B33] -> 270.000000036 | O33: of:=[.D33]*[.$B33] -> 1387.500000185 | R33: of:=[.C33]*[.L33] -> 6.98113654511702 | S33: of:=[.D33]*[.M33] -> 35.8752850235182 | T33: of:=1/[.L33] -> 51.5675345516344 | U33: of:=1/[.M33] -> 51.5675345516341 | V33: of:=[.B33]*[.T33] -> 38.6756509188826 | W33: of:=[.C33]*[.U33] -> 18564.3124385883
A34: of:=[.A33]+1 -> 32 | B34: of:=[$curvi.B36] -> 0.7750000001 | C34: 350 | D34: 1670 | E34: of:=[.B34]*[.C34] -> 271.250000035 | F34: of:=[.B34]*[.D34] -> 1294.250000167 | G34: of:=[.C34]*[$curvi.$J36] -> 6.32847390013596 | H34: of:=[.D34]*[$curvi.$J36] -> 30.1958611806487 | J34: of:=([.E34]-[.G34])/[.C34] -> 0.756918646099612 | K34: of:=([.F34]-[.H34])/[.D34] -> 0.756918646099612 | L34: of:=[.B34]-[.J34] -> 0.0180813540003886 | M34: of:=[.B34]-[.K34] -> 0.0180813540003885 | N34: of:=[.C34]*[.$B34] -> 271.250000035 | O34: of:=[.D34]*[.$B34] -> 1294.250000167 | R34: of:=[.C34]*[.L34] -> 6.328473900136 | S34: of:=[.D34]*[.M34] -> 30.1958611806487 | T34: of:=1/[.L34] -> 55.3055927105077 | U34: of:=1/[.M34] -> 55.3055927105081 | V34: of:=[.B34]*[.T34] -> 42.8618343561741 | W34: of:=[.C34]*[.U34] -> 19356.9574486778
A35: of:=[.A34]+1 -> 33 | B35: of:=[$curvi.B37] -> 0.8000000001 | C35: 300 | D35: 1505 | E35: of:=[.B35]*[.C35] -> 240.00000003 | F35: of:=[.B35]*[.D35] -> 1204.0000001505 | G35: of:=[.C35]*[$curvi.$J37] -> 4.99016898791368 | H35: of:=[.D35]*[$curvi.$J37] -> 25.0340144227003 | J35: of:=([.E35]-[.G35])/[.C35] -> 0.783366103473622 | K35: of:=([.F35]-[.H35])/[.D35] -> 0.783366103473622 | L35: of:=[.B35]-[.J35] -> 0.0166338966263789 | M35: of:=[.B35]-[.K35] -> 0.0166338966263789 | N35: of:=[.C35]*[.$B35] -> 240.00000003 | O35: of:=[.D35]*[.$B35] -> 1204.0000001505 | R35: of:=[.C35]*[.L35] -> 4.99016898791368 | S35: of:=[.D35]*[.M35] -> 25.0340144227003 | T35: of:=1/[.L35] -> 60.1182045591257 | U35: of:=1/[.M35] -> 60.1182045591257 | V35: of:=[.B35]*[.T35] -> 48.0945636533124 | W35: of:=[.C35]*[.U35] -> 18035.4613677377
A36: of:=[.A35]+1 -> 34 | B36: of:=[$curvi.B38] -> 0.825000000100001 | C36: 260 | D36: 1350 | E36: of:=[.B36]*[.C36] -> 214.500000026 | F36: of:=[.B36]*[.D36] -> 1113.750000135 | G36: of:=[.C36]*[$curvi.$J38] -> 3.91263721650774 | H36: of:=[.D36]*[$curvi.$J38] -> 20.3156163164825 | J36: of:=([.E36]-[.G36])/[.C36] -> 0.809951395421125 | K36: of:=([.F36]-[.H36])/[.D36] -> 0.809951395421125 | L36: of:=[.B36]-[.J36] -> 0.0150486046788759 | M36: of:=[.B36]-[.K36] -> 0.0150486046788759 | N36: of:=[.C36]*[.$B36] -> 214.500000026 | O36: of:=[.D36]*[.$B36] -> 1113.750000135 | R36: of:=[.C36]*[.L36] -> 3.91263721650774 | S36: of:=[.D36]*[.M36] -> 20.3156163164825 | T36: of:=1/[.L36] -> 66.4513435856099 | U36: of:=1/[.M36] -> 66.4513435856099 | V36: of:=[.B36]*[.T36] -> 54.8223584647733 | W36: of:=[.C36]*[.U36] -> 17277.3493322586
A37: of:=[.A36]+1 -> 35 | B37: of:=[$curvi.B39] -> 0.850000000100001 | C37: 245 | D37: 980 | E37: of:=[.B37]*[.C37] -> 208.2500000245 | F37: of:=[.B37]*[.D37] -> 833.000000098001 | G37: of:=[.C37]*[$curvi.$J39] -> 3.26447746758661 | H37: of:=[.D37]*[$curvi.$J39] -> 13.0579098703464 | J37: of:=([.E37]-[.G37])/[.C37] -> 0.836675602273116 | K37: of:=([.F37]-[.H37])/[.D37] -> 0.836675602273116 | L37: of:=[.B37]-[.J37] -> 0.0133243978268841 | M37: of:=[.B37]-[.K37] -> 0.0133243978268841 | N37: of:=[.C37]*[.$B37] -> 208.2500000245 | O37: of:=[.D37]*[.$B37] -> 833.000000098001 | R37: of:=[.C37]*[.L37] -> 3.26447746758661 | S37: of:=[.D37]*[.M37] -> 13.0579098703464 | T37: of:=1/[.L37] -> 75.0502959302476 | U37: of:=1/[.M37] -> 75.0502959302476 | V37: of:=[.B37]*[.T37] -> 63.7927515482155 | W37: of:=[.C37]*[.U37] -> 18387.3225029107
A38: of:=[.A37]+1 -> 36 | B38: of:=[$curvi.B40] -> 0.875000000100001 | C38: 200 | D38: 755 | E38: of:=[.B38]*[.C38] -> 175.00000002 | F38: of:=[.B38]*[.D38] -> 660.6250000755 | G38: of:=[.C38]*[$curvi.$J40] -> 2.2920368839652 | H38: of:=[.D38]*[$curvi.$J40] -> 8.65243923696862 | J38: of:=([.E38]-[.G38])/[.C38] -> 0.863539815680174 | K38: of:=([.F38]-[.H38])/[.D38] -> 0.863539815680175 | L38: of:=[.B38]-[.J38] -> 0.0114601844198261 | M38: of:=[.B38]-[.K38] -> 0.0114601844198259 | N38: of:=[.C38]*[.$B38] -> 175.00000002 | O38: of:=[.D38]*[.$B38] -> 660.6250000755 | R38: of:=[.C38]*[.L38] -> 2.29203688396522 | S38: of:=[.D38]*[.M38] -> 8.65243923696854 | T38: of:=1/[.L38] -> 87.2586306962043 | U38: of:=1/[.M38] -> 87.258630696206 | V38: of:=[.B38]*[.T38] -> 76.3513018679047 | W38: of:=[.C38]*[.U38] -> 17451.7261392412
A39: of:=[.A38]+1 -> 37 | B39: of:=[$curvi.B41] -> 0.900000000100001 | C39: 190 | D39: 575 | E39: of:=[.B39]*[.C39] -> 171.000000019 | F39: of:=[.B39]*[.D39] -> 517.5000000575 | G39: of:=[.C39]*[$curvi.$J41] -> 1.79642365439038 | H39: of:=[.D39]*[$curvi.$J41] -> 5.43654526986562 | J39: of:=([.E39]-[.G39])/[.C39] -> 0.890545138761104 | K39: of:=([.F39]-[.H39])/[.D39] -> 0.890545138761104 | L39: of:=[.B39]-[.J39] -> 0.00945486133889661 | M39: of:=[.B39]-[.K39] -> 0.00945486133889684 | N39: of:=[.C39]*[.$B39] -> 171.000000019 | O39: of:=[.D39]*[.$B39] -> 517.5000000575 | R39: of:=[.C39]*[.L39] -> 1.79642365439036 | S39: of:=[.D39]*[.M39] -> 5.43654526986568 | T39: of:=1/[.L39] -> 105.765697047938 | U39: of:=1/[.M39] -> 105.765697047935 | V39: of:=[.B39]*[.T39] -> 95.1891273537208 | W39: of:=[.C39]*[.U39] -> 20095.4824391077
A40: of:=[.A39]+1 -> 38 | B40: of:=[$curvi.B42] -> 0.925000000100001 | C40: 150 | D40: 276 | E40: of:=[.B40]*[.C40] -> 138.750000015 | F40: of:=[.B40]*[.D40] -> 255.3000000276 | G40: of:=[.C40]*[$curvi.$J42] -> 1.0960970769104 | H40: of:=[.D40]*[$curvi.$J42] -> 2.01681862151513 | J40: of:=([.E40]-[.G40])/[.C40] -> 0.917692686253931 | K40: of:=([.F40]-[.H40])/[.D40] -> 0.917692686253931 | L40: of:=[.B40]-[.J40] -> 0.0073073138460692 | M40: of:=[.B40]-[.K40] -> 0.00730731384606942 | N40: of:=[.C40]*[.$B40] -> 138.750000015 | O40: of:=[.D40]*[.$B40] -> 255.3000000276 | R40: of:=[.C40]*[.L40] -> 1.09609707691038 | S40: of:=[.D40]*[.M40] -> 2.01681862151516 | T40: of:=1/[.L40] -> 136.849192612403 | U40: of:=1/[.M40] -> 136.849192612398 | V40: of:=[.B40]*[.T40] -> 126.585503180157 | W40: of:=[.C40]*[.U40] -> 20527.3788918598
A41: of:=[.A40]+1 -> 39 | B41: of:=[$curvi.B43] -> 0.950000000100001 | C41: 110 | D41: 158 | E41: of:=[.B41]*[.C41] -> 104.500000011 | F41: of:=[.B41]*[.D41] -> 150.1000000158 | G41: of:=[.C41]*[$curvi.$J43] -> 0.551805697377913 | H41: of:=[.D41]*[$curvi.$J43] -> 0.792593638051911 | J41: of:=([.E41]-[.G41])/[.C41] -> 0.944983584669292 | K41: of:=([.F41]-[.H41])/[.D41] -> 0.944983584669292 | L41: of:=[.B41]-[.J41] -> 0.0050164154307083 | M41: of:=[.B41]-[.K41] -> 0.00501641543070819 | N41: of:=[.C41]*[.$B41] -> 104.500000011 | O41: of:=[.D41]*[.$B41] -> 150.1000000158 | R41: of:=[.C41]*[.L41] -> 0.551805697377913 | S41: of:=[.D41]*[.M41] -> 0.792593638051894 | T41: of:=1/[.L41] -> 199.3455314483 | U41: of:=1/[.M41] -> 199.345531448305 | V41: of:=[.B41]*[.T41] -> 189.37825489582 | W41: of:=[.C41]*[.U41] -> 21928.0084593135
A42: of:=[.A41]+1 -> 40 | B42: of:=[$curvi.B44] -> 0.975000000100001 | C42: 95 | D42: 95 | E42: of:=[.B42]*[.C42] -> 92.6250000095001 | F42: of:=[.B42]*[.D42] -> 92.6250000095001 | G42: of:=[.C42]*[$curvi.$J44] -> 0.245197627105956 | H42: of:=[.D42]*[$curvi.$J44] -> 0.245197627105956 | J42: of:=([.E42]-[.G42])/[.C42] -> 0.972418972446254 | K42: of:=([.F42]-[.H42])/[.D42] -> 0.972418972446254 | L42: of:=[.B42]-[.J42] -> 0.0025810276537469 | M42: of:=[.B42]-[.K42] -> 0.0025810276537469 | N42: of:=[.C42]*[.$B42] -> 92.6250000095001 | O42: of:=[.D42]*[.$B42] -> 92.6250000095001 | R42: of:=[.C42]*[.L42] -> 0.245197627105956 | S42: of:=[.D42]*[.M42] -> 0.245197627105956 | T42: of:=1/[.L42] -> 387.442574878378 | U42: of:=1/[.M42] -> 387.442574878378 | V42: of:=[.B42]*[.T42] -> 377.756510545163 | W42: of:=[.C42]*[.U42] -> 36807.0446134459
A43: of:=[.A42]+1 -> 41 | B43: of:=[$curvi.B45] -> 1.0000000001 | C43: 30 | D43: 30 | E43: of:=[.B43]*[.C43] -> 30.000000003 | F43: of:=[.B43]*[.D43] -> 30.000000003 | G43: of:=[.C43]*[$curvi.$J45] -> -0.000000000318511883534711 | H43: of:=[.D43]*[$curvi.$J45] -> -0.000000000318511883534711 | J43: of:=([.E43]-[.G43])/[.C43] -> 1.00000000011062 | K43: of:=([.F43]-[.H43])/[.D43] -> 1.00000000011062 | L43: of:=[.B43]-[.J43] -> -0.0000000000106170627844904 | M43: of:=[.B43]-[.K43] -> -0.0000000000106170627844904 | N43: of:=[.C43]*[.$B43] -> 30.000000003 | O43: of:=[.D43]*[.$B43] -> 30.000000003 | R43: of:=[.C43]*[.L43] -> -0.000000000318511883534711 | S43: of:=[.D43]*[.M43] -> -0.000000000318511883534711 | T43: of:=1/[.L43] -> -94188008519.7218 | U43: of:=1/[.M43] -> -94188008519.7218 | V43: of:=[.B43]*[.T43] -> -94188008529.1406 | W43: of:=[.C43]*[.U43] -> -2825640255591.65
I44: averagess | J44: of:=SUM([.L3:.L43])/[.C48] -> 0.00000672037482932693 | K44: of:=SUM([.M3:.M43])/[.D48] -> 0.00000672037482932694 | L44: of:=SUM([.L3:.L43])/[.C48] -> 0.00000672037482932693 | M44: of:=SUM([.M3:.M43])/[.D48] -> 0.00000672037482932693 | N44: of:=SUM([.N3:.N43])/[.C48] -> 0.2163737501 | O44: of:=SUM([.O3:.O43])/[.D48] -> 0.3510210001 | R44: of:=SUM([.R3:.R43]) -> 1264.7659063041 | S44: of:=SUM([.S3:.S43]) -> 1580.09919513455 | T44: of:=SUM([.T3:.T43]) -> 10001122124.4691 | U44: of:=SUM([.U3:.U43]) -> 10001122124.4692 | V44: of:=SUM([.V3:.V43]) -> -94188006877.1717 | W44: of:=SUM([.W3:.W43]) -> 1.45061269564191E+015
J46: NPE computated with current metrics | M46: deviation from the true NPE | P46: diagrams
C47: pop C | D47: pop A | G47: pop C | H47: pop A | K47: pop C | L47: pop A | M47: pop C | N47: pop A | Q47: of:=[.M47] -> pop C | R47: of:=[.N47] -> pop A
B48: N | C48: of:=SUM([.C3:.C43]) -> 100000 | D48: of:=SUM([.D3:.D43]) -> 100000 | F48: NPE | G48: of:=SUM([.G3:.G43]) -> 1264.7659063041 | H48: of:=SUM([.H3:.H43]) -> 1580.09919513455 | J48: OR | K48: of:=[.E52]*(([.E54]/(1-[.E54]))/([.E53]/(1-[.E53]))) -> 20049.0196814283 | L48: of:=[.F52]*(([.F54]/(1-[.F54]))/([.F53]/(1-[.F53]))) -> 32725.2246309229 | M48: of:=[.K48]/[.$G$48] -> 15.8519608897552 | N48: of:=[.L48]/[.$H$48] -> 20.7108672238367 | P48: of:=[.J48] -> OR | Q48: of:=[.M48] -> 15.8519608897552 | R48: of:=[.N48] -> 20.7108672238367
B49: taill cible | C49: 100000 | D49: 100000 | F49: average AB | G49: of:=[.G48]/[.C48] -> 0.012647659063041 | H49: of:=[.H48]/[.D48] -> 0.0158009919513455 | J49: RR | K49: of:=[.E52]*([.E54]/[.E53]) -> 20372.6091036959 | L49: of:=[.F52]*([.F54]/[.F53]) -> 33522.0008148655 | M49: of:=[.K49]/[.$G$48] -> 16.1078101505984 | N49: of:=[.L49]/[.$H$48] -> 21.2151242897196 | P49: of:=[.J49] -> RR | Q49: of:=[.M49] -> 16.1078101505984 | R49: of:=[.N49] -> 21.2151242897196
B50: écart | C50: of:=[.C48]-[.D48] -> 0 | D50: of:=[.D49]-[.D48] -> 0 | J50: average AB | K50: of:=[.C48]*[.G49] -> 1264.7659063041 | L50: of:=[.D48]*[.H49] -> 1580.09919513455 | M50: of:=[.K50]/[.$G$48] -> 1 | N50: of:=[.L50]/[.$H$48] -> 1 | P50: of:=[.J50] -> average AB | Q50: of:=[.M50] -> 1 | R50: of:=[.N50] -> 1
E51: pop C | F51: pop A
D52: total events | E52: of:=SUM([.E3:.E43]) -> 21637.37501 | F52: of:=SUM([.F3:.F43]) -> 35102.10001
D53: average Rc | E53: of:=[.E52]/[.C48] -> 0.2163737501 | F53: of:=[.F52]/[.D48] -> 0.3510210001
D54: average Rt | E54: of:=([.E52]-[.G48])/[.C48] -> 0.203726091036959 | F54: of:=[.F53]-[.H49] -> 0.335220008148655
J55: pop NPE computated with current metrics and trial 1 summary data | M55: deviation from the true NPE
K56: pop C | L56: pop A | M56: pop C | N56: pop A | Q56: of:=[.M56] -> pop C | R56: of:=[.N56] -> pop A
J57: OR | K57: of:=[.E52]*(([.E63]/(1-[.E63]))/([.E62]/(1-[.E62]))) -> 20172.2391943515 | L57: of:=[.F52]*(([.E63]/(1-[.E63]))/([.E62]/(1-[.E62]))) -> 32725.2246309229 | M57: of:=[.K57]/[.$G$48] -> 15.9493856482097 | N57: of:=[.L57]/[.$H$48] -> 20.7108672238367 | P57: of:=[.J57] -> OR | Q57: of:=[.M57] -> 15.9493856482097 | R57: of:=[.N57] -> 20.7108672238367
J58: RR | K58: of:=[.E52]*([.E63]/[.E62]) -> 20663.3820344121 | L58: of:=[.F52]*([.E63]/[.E62]) -> 33522.0008148655 | M58: of:=[.K58]/[.$G$48] -> 16.33771271934 | N58: of:=[.L58]/[.$H$48] -> 21.2151242897196 | P58: of:=[.J58] -> RR | Q58: of:=[.M58] -> 16.33771271934 | R58: of:=[.N58] -> 21.2151242897196
J59: average AB | K59: of:=[.C48]*([.E62]-[.E63]) -> 1580.09919513455 | L59: of:=[.D48]*([.E62]-[.E63]) -> 1580.09919513455 | M59: of:=[.K59]/[.$G$48] -> 1.24932146514917 | N59: of:=[.L59]/[.$H$48] -> 0.999999999999998 | P59: of:=[.J59] -> average AB | Q59: of:=[.M59] -> 1.24932146514917 | R59: of:=[.N59] -> 0.999999999999998
D62: trial 1 Rc | E62: of:=[.F53] -> 0.3510210001 | J62: pop NPE computated with current metrics and trial 2 summary data | M62: deviation from the true NPE
D63: trial 1 Rt | E63: of:=[.F54] -> 0.335220008148655 | K63: pop C | L63: pop A | M63: pop C | N63: pop A | Q63: of:=[.M63] -> pop C | R63: of:=[.N63] -> pop A
J64: OR | K64: of:=[.E52]*(([.D74]/(1-[.D74]))/([.D73]/(1-[.D73]))) -> 19765.1997999861 | L64: of:=[.F52]*(([.D74]/(1-[.D74]))/([.D73]/(1-[.D73]))) -> 32064.888637189 | M64: of:=[.K64]/[.$G$48] -> 15.6275558199889 | N64: of:=[.L64]/[.$H$48] -> 20.2929592875709 | P64: of:=[.J64] -> OR | Q64: of:=[.M64] -> 15.6275558199889 | R64: of:=[.N64] -> 20.2929592875709
J65: RR | K65: of:=[.E52]*([.D74]/[.D73]) -> 20104.6735013305 | L65: of:=[.F52]*([.D74]/[.D73]) -> 32615.6134737205 | M65: of:=[.K65]/[.$G$48] -> 15.8959641472946 | N65: of:=[.L65]/[.$H$48] -> 20.6414974288644 | P65: of:=[.J65] -> RR | Q65: of:=[.M65] -> 15.8959641472946 | R65: of:=[.N65] -> 20.6414974288644
D66: trial 2 Rc | E66: of:=[.D73] -> 0.195149387639399 | J66: average AB | K66: of:=[.C48]*([.D73]-[.D74]) -> 1382.35696664963 | L66: of:=[.D48]*([.D73]-[.D74]) -> 1382.35696664963 | M66: of:=[.K66]/[.$G$48] -> 1.09297456530051 | N66: of:=[.L66]/[.$H$48] -> 0.874854547680417 | P66: of:=[.J66] -> average AB | Q66: of:=[.M66] -> 1.09297456530051 | R66: of:=[.N66] -> 0.874854547680417
D67: trial 2 Rt | E67: of:=[.D74] -> 0.181325817972903
C68: trial 2 summary data
C69: N | D69: of:=SUM([.D4:.D20]) -> 52983 | J69: comparing the five NNTs (trial 2) | M69: % of the ref NNT
C70: NPE | D70: of:=SUM([.H4:.H20]) -> 732.414191639973 | K70: pop C | L70: pop A | M70: pop C | N70: pop A
C71: trial 2 AB | D71: of:=[.D70]/[.D69] -> 0.0138235696664963 | I71: 1 | J71: NNT ave | K71: of:=1/([.E53]-[.E54]) -> 79.0660149056519 | L71: of:=1/([.F53]-[.F54]) -> 63.2871659626944 | M71: of:=[.K71]/[.K74] -> 1 | N71: of:=[.L71]/[.L74] -> 1
C72: total events | D72: of:=SUM([.F4:.F20]) -> 10339.6000052983 | I72: 2 | J72: NNT ave sec | K72: of:=1/(SUM([.L3:.L43])) -> 1.48801223949015 | L72: of:=1/(SUM([.M3:.M43])) -> 1.48801223949015 | M72: of:=[.K72]/[.K74] -> 0.0188198714867035 | N72: of:=[.L72]/[.L74] -> 0.0235120694196875
C73: trial 2 Rc | D73: of:=[.D72]/[.D69] -> 0.195149387639399 | I73: 3 | J73: NNT transp trial 2 | K73: of:=1/([.E53]*(1-([.D75]/[.D74]))) -> 4.62163270515872 | L73: of:=1/([.F53]*(1-([.D75]/[.D74]))) -> 2.8488324052268 | M73: of:=[.K73]/[.K74] -> 0.0584528347694472 | N73: of:=[.L73]/[.L74] -> 0.0450143779057209
C74: trial 2 Rt | D74: of:=([.D72]-[.D70])/[.D69] -> 0.181325817972903 | I74: 4 | J74: NNT ref | K74: of:=[.C48]/[.G48] -> 79.0660149056519 | L74: of:=[.D48]/[.H48] -> 63.2871659626943 | M74: of:=[.K74]/[.K74] -> 1 | N74: of:=[.L74]/[.L74] -> 1
I75: 5 | J75: NNT 5 | K75: of:=(1/[.V44])/[.C48] -> -1.06170629696419E-016 | L75: of:=(1/[.W44])/[.D48] -> 6.89363882588583E-021 | M75: of:=[.K75]/[.K74] -> -1.34280992690869E-018 | N75: of:=[.L75]/[.L74] -> 1.08926331603305E-022
J78: comparing NNT pop with NNT trials | M78: % of the ref NNT
K79: pop C | L79: pop A | M79: pop C | N79: pop A
I80: 1 | J80: NNT trial 1 | K80: of:=1/([.E62]-[.E63]) -> 63.2871659626944 | L80: of:=1/([.E62]-[.E63]) -> 63.2871659626944 | M80: of:=[.K80]/[.K84] -> 0.800434498162249 | N80: of:=[.L80]/[.L84] -> 1
I81: 2 | J81: NNT trial 2 | K81: of:=1/([.E66]-[.E67]) -> 72.3402148739964 | L81: of:=1/([.E66]-[.E67]) -> 72.3402148739964 | M81: of:=[.K81]/[.K84] -> 0.914934374273432 | N81: of:=[.L81]/[.L84] -> 1.14304715298262
I82: 3 | J82: NNT transp trial 1 | K82: of:=1/([.E53]*(1-[.E63]/[.E62])) -> 102.670144966534 | L82: of:=1/([.F53]*(1-[.E63]/[.E62])) -> 63.2871659626944 | M82: of:=[.K82]/[.$K$84] -> 1.29853698948972 | N82: of:=[.L82]/[.$L$84] -> 1
I83: 3 | J83: NNT transp trial 2 | K83: of:=1/([.E53]*(1-([.E67]/[.E66]))) -> 65.2442758321587 | L83: of:=1/([.F53]*(1-([.E67]/[.E66]))) -> 40.2173904989765 | M83: of:=[.K83]/[.K84] -> 0.825187356540146 | N83: of:=[.L83]/[.L84] -> 0.635474663578447
I84: 4 | J84: NNT ref | K84: of:=[.K74] -> 79.0660149056519 | L84: of:=[.L74] -> 63.2871659626943 | M84: of:=[.K84]/[.K84] -> 1 | N84: of:=[.L84]/[.L84] -> 1
K88: NPE
K89: pop C trial 1 | L89: pop C trial 2 | M89: pop A trial 1 | N89: pop A trial 2
J90: of:=[.J66] -> average AB | K90: of:=[.M59] -> 1.24932146514917 | L90: of:=[.M66] -> 1.09297456530051 | M90: of:=[.N59] -> 0.999999999999998 | N90: of:=[.N66] -> 0.874854547680417

Sheet: NPE vs pop 1
B1: Two populations with different Rc distributions, same size (100,000), same average Rc (0,35102)
B2: Rc | C2: pop B | D2: pop A | E2: # events B | F2: # events A | G2: NPEs B | H2: NPEs A | J2: Rt pop B | K2: Rt pop A | L2: ABi pop B | M2: ABi pop A | N2: ni*Rci pop B | O2: ni*Rci pop A | P2: ni*Rti pop B | Q2: ni*Rti pop A | R2: ni*Abi pop B | S2: ni*Abi pop A | T2: NNTi pop B | U2: NNTi pop A | V2: ni NNTi pop B | W2: ni NNTi pop A
A3: 1 | B3: of:=[$curvi.B5] -> 0.0000000001 | C3: 10 | D3: 8290 | E3: of:=[.B3]*[.C3] -> 0.000000001 | F3: of:=[.B3]*[.D3] -> 0.000000829 | G3: of:=[.C3]*[$curvi.$J5] -> 0.0000000000959793047712785 | H3: of:=[.D3]*[$curvi.$J5] -> 0.0000000795668436553899 | J3: of:=([.E3]-[.G3])/[.C3] -> 0.0000000000904020695228722 | K3: of:=([.F3]-[.H3])/[.D3] -> 0.0000000000904020695228722 | L3: of:=[.B3]-[.J3] -> 0.00000000000959793047712785 | M3: of:=[.B3]-[.K3] -> 0.00000000000959793047712785 | N3: of:=[.C3]*[.$B3] -> 0.000000001 | O3: of:=[.D3]*[.$B3] -> 0.000000829 | R3: of:=[.C3]*[.L3] -> 0.0000000000959793047712785 | S3: of:=[.D3]*[.M3] -> 0.0000000795668436553899 | T3: of:=1/[.L3] -> 104189127268.949 | U3: of:=1/[.M3] -> 104189127268.949 | V3: of:=[.B3]*[.T3] -> 10.4189127268949 | W3: of:=[.C3]*[.U3] -> 1041891272689.49
A4: of:=[.A3]+1 -> 2 | B4: of:=[$curvi.B6] -> 0.0250000001 | C4: 20 | D4: 6540 | E4: of:=[.B4]*[.C4] -> 0.500000002 | F4: of:=[.B4]*[.D4] -> 163.500000654 | G4: of:=[.C4]*[$curvi.$J6] -> 0.046902452883545 | H4: of:=[.D4]*[$curvi.$J6] -> 15.3371020929192 | I4: of:=[.C50] -> 0 | J4: of:=([.E4]-[.G4])/[.C4] -> 0.0226548774558228 | K4: of:=([.F4]-[.H4])/[.D4] -> 0.0226548774558228 | L4: of:=[.B4]-[.J4] -> 0.00234512264417725 | M4: of:=[.B4]-[.K4] -> 0.00234512264417725 | N4: of:=[.C4]*[.$B4] -> 0.500000002 | O4: of:=[.D4]*[.$B4] -> 163.500000654 | R4: of:=[.C4]*[.L4] -> 0.046902452883545 | S4: of:=[.D4]*[.M4] -> 15.3371020929192 | T4: of:=1/[.L4] -> 426.416930680755 | U4: of:=1/[.M4] -> 426.416930680755 | V4: of:=[.B4]*[.T4] -> 10.6604233096606 | W4: of:=[.C4]*[.U4] -> 8528.33861361511
A5: of:=[.A4]+1 -> 3 | B5: of:=[$curvi.B7] -> 0.0500000001 | C5: 50 | D5: 5080 | E5: of:=[.B5]*[.C5] -> 2.500000005 | F5: of:=[.B5]*[.D5] -> 254.000000508 | G5: of:=[.C5]*[$curvi.$J7] -> 0.229050052526564 | H5: of:=[.D5]*[$curvi.$J7] -> 23.2714853366989 | I5: of:=[.E53] -> 0.3510212501 | J5: of:=([.E5]-[.G5])/[.C5] -> 0.0454189990494687 | K5: of:=([.F5]-[.H5])/[.D5] -> 0.0454189990494687 | L5: of:=[.B5]-[.J5] -> 0.00458100105053128 | M5: of:=[.B5]-[.K5] -> 0.00458100105053129 | N5: of:=[.C5]*[.$B5] -> 2.500000005 | O5: of:=[.D5]*[.$B5] -> 254.000000508 | R5: of:=[.C5]*[.L5] -> 0.229050052526564 | S5: of:=[.D5]*[.M5] -> 23.2714853366989 | T5: of:=1/[.L5] -> 218.292899078036 | U5: of:=1/[.M5] -> 218.292899078035 | V5: of:=[.B5]*[.T5] -> 10.9146449757311 | W5: of:=[.C5]*[.U5] -> 10914.6449539018
A6: of:=[.A5]+1 -> 4 | B6: of:=[$curvi.B8] -> 0.0750000001 | C6: 100 | D6: 3700 | E6: of:=[.B6]*[.C6] -> 7.50000001 | F6: of:=[.B6]*[.D6] -> 277.50000037 | G6: of:=[.C6]*[$curvi.$J8] -> 0.670684313795569 | H6: of:=[.D6]*[$curvi.$J8] -> 24.8153196104361 | I6: of:=[.I5]-[.F53] -> 0.000000249999999868411 | J6: of:=([.E6]-[.G6])/[.C6] -> 0.0682931569620443 | K6: of:=([.F6]-[.H6])/[.D6] -> 0.0682931569620443 | L6: of:=[.B6]-[.J6] -> 0.00670684313795569 | M6: of:=[.B6]-[.K6] -> 0.00670684313795569 | N6: of:=[.C6]*[.$B6] -> 7.50000001 | O6: of:=[.D6]*[.$B6] -> 277.50000037 | R6: of:=[.C6]*[.L6] -> 0.670684313795569 | S6: of:=[.D6]*[.M6] -> 24.8153196104361 | T6: of:=1/[.L6] -> 149.101444514298 | U6: of:=1/[.M6] -> 149.101444514298 | V6: of:=[.B6]*[.T6] -> 11.1826083534825 | W6: of:=[.C6]*[.U6] -> 14910.1444514298
A7: of:=[.A6]+1 -> 5 | B7: of:=[$curvi.B9] -> 0.1000000001 | C7: 200 | D7: 3250 | E7: of:=[.B7]*[.C7] -> 20.00000002 | F7: of:=[.B7]*[.D7] -> 325.000000325 | G7: of:=[.C7]*[$curvi.$J9] -> 1.74436982792797 | H7: of:=[.D7]*[$curvi.$J9] -> 28.3460097038295 | J7: of:=([.E7]-[.G7])/[.C7] -> 0.0912781509603602 | K7: of:=([.F7]-[.H7])/[.D7] -> 0.0912781509603602 | L7: of:=[.B7]-[.J7] -> 0.00872184913963987 | M7: of:=[.B7]-[.K7] -> 0.00872184913963987 | N7: of:=[.C7]*[.$B7] -> 20.00000002 | O7: of:=[.D7]*[.$B7] -> 325.000000325 | R7: of:=[.C7]*[.L7] -> 1.74436982792797 | S7: of:=[.D7]*[.M7] -> 28.3460097038296 | T7: of:=1/[.L7] -> 114.654585740896 | U7: of:=1/[.M7] -> 114.654585740896 | V7: of:=[.B7]*[.T7] -> 11.4654585855551 | W7: of:=[.C7]*[.U7] -> 22930.9171481792
A8: of:=[.A7]+1 -> 6 | B8: of:=[$curvi.B10] -> 0.1250000001 | C8: 400 | D8: 3100 | E8: of:=[.B8]*[.C8] -> 50.00000004 | F8: of:=[.B8]*[.D8] -> 387.50000031 | G8: of:=[.C8]*[$curvi.$J10] -> 4.25008460778207 | H8: of:=[.D8]*[$curvi.$J10] -> 32.9381557103111 | J8: of:=([.E8]-[.G8])/[.C8] -> 0.114374788580545 | K8: of:=([.F8]-[.H8])/[.D8] -> 0.114374788580545 | L8: of:=[.B8]-[.J8] -> 0.0106252115194552 | M8: of:=[.B8]-[.K8] -> 0.0106252115194552 | N8: of:=[.C8]*[.$B8] -> 50.00000004 | O8: of:=[.D8]*[.$B8] -> 387.50000031 | R8: of:=[.C8]*[.L8] -> 4.25008460778207 | S8: of:=[.D8]*[.M8] -> 32.9381557103111 | T8: of:=1/[.L8] -> 94.1157734289768 | U8: of:=1/[.M8] -> 94.1157734289768 | V8: of:=[.B8]*[.T8] -> 11.7644716880337 | W8: of:=[.C8]*[.U8] -> 37646.3093715907
A9: of:=[.A8]+1 -> 7 | B9: of:=[$curvi.B11] -> 0.1500000001 | C9: 800 | D9: 2850 | E9: of:=[.B9]*[.C9] -> 120.00000008 | F9: of:=[.B9]*[.D9] -> 427.500000285 | G9: of:=[.C9]*[$curvi.$J11] -> 9.93289190190549 | H9: of:=[.D9]*[$curvi.$J11] -> 35.3859274005383 | J9: of:=([.E9]-[.G9])/[.C9] -> 0.137583885222618 | K9: of:=([.F9]-[.H9])/[.D9] -> 0.137583885222618 | L9: of:=[.B9]-[.J9] -> 0.0124161148773819 | M9: of:=[.B9]-[.K9] -> 0.0124161148773819 | N9: of:=[.C9]*[.$B9] -> 120.00000008 | O9: of:=[.D9]*[.$B9] -> 427.500000285 | R9: of:=[.C9]*[.L9] -> 9.93289190190549 | S9: of:=[.D9]*[.M9] -> 35.3859274005383 | T9: of:=1/[.L9] -> 80.5404919232564 | U9: of:=1/[.M9] -> 80.5404919232564 | V9: of:=[.B9]*[.T9] -> 12.0810737965425 | W9: of:=[.C9]*[.U9] -> 64432.3935386053
A10: of:=[.A9]+1 -> 8 | B10: of:=[$curvi.B12] -> 0.1750000001 | C10: 1600 | D10: 2700 | E10: of:=[.B10]*[.C10] -> 280.00000016 | F10: of:=[.B10]*[.D10] -> 472.50000027 | G10: of:=[.C10]*[$curvi.$J12] -> 22.5499773656812 | H10: of:=[.D10]*[$curvi.$J12] -> 38.0530868045871 | J10: of:=([.E10]-[.G10])/[.C10] -> 0.160906264246449 | K10: of:=([.F10]-[.H10])/[.D10] -> 0.160906264246449 | L10: of:=[.B10]-[.J10] -> 0.0140937358535508 | M10: of:=[.B10]-[.K10] -> 0.0140937358535508 | N10: of:=[.C10]*[.$B10] -> 280.00000016 | O10: of:=[.D10]*[.$B10] -> 472.50000027 | R10: of:=[.C10]*[.L10] -> 22.5499773656812 | S10: of:=[.D10]*[.M10] -> 38.0530868045871 | T10: of:=1/[.L10] -> 70.953508025912 | U10: of:=1/[.M10] -> 70.953508025912 | V10: of:=[.B10]*[.T10] -> 12.41686391163 | W10: of:=[.C10]*[.U10] -> 113525.612841459
A11: of:=[.A10]+1 -> 9 | B11: of:=[$curvi.B13] -> 0.2000000001 | C11: 3000 | D11: 2650 | E11: of:=[.B11]*[.C11] -> 600.0000003 | F11: of:=[.B11]*[.D11] -> 530.000000265 | G11: of:=[.C11]*[$curvi.$J13] -> 46.9717290926303 | H11: of:=[.D11]*[$curvi.$J13] -> 41.4916940318234 | J11: of:=([.E11]-[.G11])/[.C11] -> 0.184342757069123 | K11: of:=([.F11]-[.H11])/[.D11] -> 0.184342757069123 | L11: of:=[.B11]-[.J11] -> 0.0156572430308768 | M11: of:=[.B11]-[.K11] -> 0.0156572430308768 | N11: of:=[.C11]*[.$B11] -> 600.0000003 | O11: of:=[.D11]*[.$B11] -> 530.000000265 | R11: of:=[.C11]*[.L11] -> 46.9717290926303 | S11: of:=[.D11]*[.M11] -> 41.4916940318234 | T11: of:=1/[.L11] -> 63.8682045126306 | U11: of:=1/[.M11] -> 63.8682045126306 | V11: of:=[.B11]*[.T11] -> 12.773640908913 | W11: of:=[.C11]*[.U11] -> 191604.613537892
A12: of:=[.A11]+1 -> 10 | B12: of:=[$curvi.B14] -> 0.2250000001 | C12: 4500 | D12: 2600 | E12: of:=[.B12]*[.C12] -> 1012.50000045 | F12: of:=[.B12]*[.D12] -> 585.00000026 | G12: of:=[.C12]*[$curvi.$J14] -> 76.9760857631668 | H12: of:=[.D12]*[$curvi.$J14] -> 44.4750717742742 | J12: of:=([.E12]-[.G12])/[.C12] -> 0.207894203263741 | K12: of:=([.F12]-[.H12])/[.D12] -> 0.207894203263741 | L12: of:=[.B12]-[.J12] -> 0.0171057968362593 | M12: of:=[.B12]-[.K12] -> 0.0171057968362593 | N12: of:=[.C12]*[.$B12] -> 1012.50000045 | O12: of:=[.D12]*[.$B12] -> 585.00000026 | R12: of:=[.C12]*[.L12] -> 76.9760857631668 | S12: of:=[.D12]*[.M12] -> 44.4750717742742 | T12: of:=1/[.L12] -> 58.4597145384243 | U12: of:=1/[.M12] -> 58.4597145384243 | V12: of:=[.B12]*[.T12] -> 13.1534357769914 | W12: of:=[.C12]*[.U12] -> 263068.715422909
A13: of:=[.A12]+1 -> 11 | B13: of:=[$curvi.B15] -> 0.2500000001 | C13: 6000 | D13: 2583 | E13: of:=[.B13]*[.C13] -> 1500.0000006 | F13: of:=[.B13]*[.D13] -> 645.7500002583 | G13: of:=[.C13]*[$curvi.$J15] -> 110.631296641955 | H13: of:=[.D13]*[$curvi.$J15] -> 47.6267732043618 | J13: of:=([.E13]-[.G13])/[.C13] -> 0.231561450659674 | K13: of:=([.F13]-[.H13])/[.D13] -> 0.231561450659674 | L13: of:=[.B13]-[.J13] -> 0.0184385494403259 | M13: of:=[.B13]-[.K13] -> 0.0184385494403259 | N13: of:=[.C13]*[.$B13] -> 1500.0000006 | O13: of:=[.D13]*[.$B13] -> 645.7500002583 | R13: of:=[.C13]*[.L13] -> 110.631296641955 | S13: of:=[.D13]*[.M13] -> 47.6267732043617 | T13: of:=1/[.L13] -> 54.2342011900869 | U13: of:=1/[.M13] -> 54.2342011900869 | V13: of:=[.B13]*[.T13] -> 13.5585503029452 | W13: of:=[.C13]*[.U13] -> 325405.207140522
A14: of:=[.A13]+1 -> 12 | B14: of:=[$curvi.B16] -> 0.2750000001 | C14: 7350 | D14: 2578 | E14: of:=[.B14]*[.C14] -> 2021.250000735 | F14: of:=[.B14]*[.D14] -> 708.9500002578 | G14: of:=[.C14]*[$curvi.$J16] -> 144.461638219341 | H14: of:=[.D14]*[$curvi.$J16] -> 50.6696739223756 | J14: of:=([.E14]-[.G14])/[.C14] -> 0.255345355444307 | K14: of:=([.F14]-[.H14])/[.D14] -> 0.255345355444307 | L14: of:=[.B14]-[.J14] -> 0.0196546446556926 | M14: of:=[.B14]-[.K14] -> 0.0196546446556926 | N14: of:=[.C14]*[.$B14] -> 2021.250000735 | O14: of:=[.D14]*[.$B14] -> 708.9500002578 | R14: of:=[.C14]*[.L14] -> 144.461638219341 | S14: of:=[.D14]*[.M14] -> 50.6696739223756 | T14: of:=1/[.L14] -> 50.8785591150522 | U14: of:=1/[.M14] -> 50.8785591150522 | V14: of:=[.B14]*[.T14] -> 13.9916037617272 | W14: of:=[.C14]*[.U14] -> 373957.409495633
A15: of:=[.A14]+1 -> 13 | B15: of:=[$curvi.B17] -> 0.3000000001 | C15: 8500 | D15: 2574 | E15: of:=[.B15]*[.C15] -> 2550.00000085 | F15: of:=[.B15]*[.D15] -> 772.2000002574 | G15: of:=[.C15]*[$curvi.$J17] -> 176.402351586595 | H15: of:=[.D15]*[$curvi.$J17] -> 53.4187827039878 | J15: of:=([.E15]-[.G15])/[.C15] -> 0.279246782266283 | K15: of:=([.F15]-[.H15])/[.D15] -> 0.279246782266283 | L15: of:=[.B15]-[.J15] -> 0.0207532178337171 | M15: of:=[.B15]-[.K15] -> 0.0207532178337171 | N15: of:=[.C15]*[.$B15] -> 2550.00000085 | O15: of:=[.D15]*[.$B15] -> 772.2000002574 | R15: of:=[.C15]*[.L15] -> 176.402351586595 | S15: of:=[.D15]*[.M15] -> 53.4187827039878 | T15: of:=1/[.L15] -> 48.1852986853601 | U15: of:=1/[.M15] -> 48.1852986853601 | V15: of:=[.B15]*[.T15] -> 14.4555896104266 | W15: of:=[.C15]*[.U15] -> 409575.038825561
A16: of:=[.A15]+1 -> 14 | B16: of:=[$curvi.B18] -> 0.3250000001 | C16: 10500 | D16: 2570 | E16: of:=[.B16]*[.C16] -> 3412.50000105 | F16: of:=[.B16]*[.D16] -> 835.250000257 | G16: of:=[.C16]*[$curvi.$J18] -> 228.20065547702 | H16: of:=[.D16]*[$curvi.$J18] -> 55.8548271024707 | J16: of:=([.E16]-[.G16])/[.C16] -> 0.303266604340284 | K16: of:=([.F16]-[.H16])/[.D16] -> 0.303266604340284 | L16: of:=[.B16]-[.J16] -> 0.0217333957597162 | M16: of:=[.B16]-[.K16] -> 0.0217333957597162 | N16: of:=[.C16]*[.$B16] -> 3412.50000105 | O16: of:=[.D16]*[.$B16] -> 835.250000257 | R16: of:=[.C16]*[.L16] -> 228.20065547702 | S16: of:=[.D16]*[.M16] -> 55.8548271024707 | T16: of:=1/[.L16] -> 46.0121377743254 | U16: of:=1/[.M16] -> 46.0121377743254 | V16: of:=[.B16]*[.T16] -> 14.9539447812569 | W16: of:=[.C16]*[.U16] -> 483127.446630416
A17: of:=[.A16]+1 -> 15 | B17: of:=[$curvi.B19] -> 0.3500000001 | C17: 12500 | D17: 2560 | E17: of:=[.B17]*[.C17] -> 4375.00000125 | F17: of:=[.B17]*[.D17] -> 896.000000256 | G17: of:=[.C17]*[$curvi.$J19] -> 282.428706832801 | H17: of:=[.D17]*[$curvi.$J19] -> 57.8413991593577 | J17: of:=([.E17]-[.G17])/[.C17] -> 0.327405703553376 | K17: of:=([.F17]-[.H17])/[.D17] -> 0.327405703553376 | L17: of:=[.B17]-[.J17] -> 0.0225942965466241 | M17: of:=[.B17]-[.K17] -> 0.0225942965466241 | N17: of:=[.C17]*[.$B17] -> 4375.00000125 | O17: of:=[.D17]*[.$B17] -> 896.000000256 | R17: of:=[.C17]*[.L17] -> 282.428706832801 | S17: of:=[.D17]*[.M17] -> 57.8413991593577 | T17: of:=1/[.L17] -> 44.2589570308802 | U17: of:=1/[.M17] -> 44.2589570308802 | V17: of:=[.B17]*[.T17] -> 15.490634965234 | W17: of:=[.C17]*[.U17] -> 553236.962886002
A18: of:=[.A17]+1 -> 16 | B18: of:=[$curvi.B20] -> 0.3750000001 | C18: 15000 | D18: 2555 | E18: of:=[.B18]*[.C18] -> 5625.0000015 | F18: of:=[.B18]*[.D18] -> 958.1250002555 | G18: of:=[.C18]*[$curvi.$J20] -> 350.025442905909 | H18: of:=[.D18]*[$curvi.$J20] -> 59.6210004416398 | J18: of:=([.E18]-[.G18])/[.C18] -> 0.351664970572939 | K18: of:=([.F18]-[.H18])/[.D18] -> 0.351664970572939 | L18: of:=[.B18]-[.J18] -> 0.0233350295270606 | M18: of:=[.B18]-[.K18] -> 0.0233350295270606 | N18: of:=[.C18]*[.$B18] -> 5625.0000015 | O18: of:=[.D18]*[.$B18] -> 958.1250002555 | R18: of:=[.C18]*[.L18] -> 350.025442905909 | S18: of:=[.D18]*[.M18] -> 59.6210004416399 | T18: of:=1/[.L18] -> 42.8540276257351 | U18: of:=1/[.M18] -> 42.8540276257351 | V18: of:=[.B18]*[.T18] -> 16.0702603639361 | W18: of:=[.C18]*[.U18] -> 642810.414386026
A19: of:=[.A18]+1 -> 17 | B19: of:=[$curvi.B21] -> 0.4000000001 | C19: 12975 | D19: 2548 | E19: of:=[.B19]*[.C19] -> 5190.0000012975 | F19: of:=[.B19]*[.D19] -> 1019.2000002548 | G19: of:=[.C19]*[$curvi.$J21] -> 310.812169490614 | H19: of:=[.D19]*[$curvi.$J21] -> 61.0365632263649 | J19: of:=([.E19]-[.G19])/[.C19] -> 0.376045304956215 | K19: of:=([.F19]-[.H19])/[.D19] -> 0.376045304956215 | L19: of:=[.B19]-[.J19] -> 0.0239546951437853 | M19: of:=[.B19]-[.K19] -> 0.0239546951437853 | N19: of:=[.C19]*[.$B19] -> 5190.0000012975 | O19: of:=[.D19]*[.$B19] -> 1019.2000002548 | R19: of:=[.C19]*[.L19] -> 310.812169490614 | S19: of:=[.D19]*[.M19] -> 61.0365632263649 | T19: of:=1/[.L19] -> 41.7454696875755 | U19: of:=1/[.M19] -> 41.7454696875755 | V19: of:=[.B19]*[.T19] -> 16.6981878792047 | W19: of:=[.C19]*[.U19] -> 541647.469196292
A20: of:=[.A19]+1 -> 18 | B20: of:=[$curvi.B22] -> 0.4250000001 | C20: 4800 | D20: 2545 | E20: of:=[.B20]*[.C20] -> 2040.00000048 | F20: of:=[.B20]*[.D20] -> 1081.6250002545 | G20: of:=[.C20]*[$curvi.$J22] -> 117.371447224828 | H20: of:=[.D20]*[$curvi.$J22] -> 62.2313194139976 | J20: of:=([.E20]-[.G20])/[.C20] -> 0.400547615261494 | K20: of:=([.F20]-[.H20])/[.D20] -> 0.400547615261494 | L20: of:=[.B20]-[.J20] -> 0.0244523848385059 | M20: of:=[.B20]-[.K20] -> 0.0244523848385059 | N20: of:=[.C20]*[.$B20] -> 2040.00000048 | O20: of:=[.D20]*[.$B20] -> 1081.6250002545 | R20: of:=[.C20]*[.L20] -> 117.371447224828 | S20: of:=[.D20]*[.M20] -> 62.2313194139974 | T20: of:=1/[.L20] -> 40.895806548295 | U20: of:=1/[.M20] -> 40.895806548295 | V20: of:=[.B20]*[.T20] -> 17.380717787115 | W20: of:=[.C20]*[.U20] -> 196299.871431816
A21: of:=[.A20]+1 -> 19 | B21: of:=[$curvi.B23] -> 0.4500000001 | C21: 2500 | D21: 2538 | E21: of:=[.B21]*[.C21] -> 1125.00000025 | F21: of:=[.B21]*[.D21] -> 1142.1000002538 | G21: of:=[.C21]*[$curvi.$J23] -> 62.0679523475368 | H21: of:=[.D21]*[$curvi.$J23] -> 63.0113852232193 | J21: of:=([.E21]-[.G21])/[.C21] -> 0.425172819160986 | K21: of:=([.F21]-[.H21])/[.D21] -> 0.425172819160985 | L21: of:=[.B21]-[.J21] -> 0.0248271809390146 | M21: of:=[.B21]-[.K21] -> 0.0248271809390147 | N21: of:=[.C21]*[.$B21] -> 1125.00000025 | O21: of:=[.D21]*[.$B21] -> 1142.1000002538 | R21: of:=[.C21]*[.L21] -> 62.0679523475366 | S21: of:=[.D21]*[.M21] -> 63.0113852232193 | T21: of:=1/[.L21] -> 40.2784352543447 | U21: of:=1/[.M21] -> 40.2784352543445 | V21: of:=[.B21]*[.T21] -> 18.1252958684829 | W21: of:=[.C21]*[.U21] -> 100696.088135861
A22: of:=[.A21]+1 -> 20 | B22: of:=[$curvi.B24] -> 0.4750000001 | C22: 2250 | D22: 2535 | E22: of:=[.B22]*[.C22] -> 1068.750000225 | F22: of:=[.B22]*[.D22] -> 1204.1250002535 | G22: of:=[.C22]*[$curvi.$J24] -> 56.4258522253992 | H22: of:=[.D22]*[$curvi.$J24] -> 63.5731268406164 | J22: of:=([.E22]-[.G22])/[.C22] -> 0.449921843555378 | K22: of:=([.F22]-[.H22])/[.D22] -> 0.449921843555378 | L22: of:=[.B22]-[.J22] -> 0.0250781565446218 | M22: of:=[.B22]-[.K22] -> 0.0250781565446219 | N22: of:=[.C22]*[.$B22] -> 1068.750000225 | O22: of:=[.D22]*[.$B22] -> 1204.1250002535 | R22: of:=[.C22]*[.L22] -> 56.4258522253991 | S22: of:=[.D22]*[.M22] -> 63.5731268406164 | T22: of:=1/[.L22] -> 39.8753392507416 | U22: of:=1/[.M22] -> 39.8753392507414 | V22: of:=[.B22]*[.T22] -> 18.9407861480898 | W22: of:=[.C22]*[.U22] -> 89719.5133141684
A23: of:=[.A22]+1 -> 21 | B23: of:=[$curvi.B25] -> 0.5000000001 | C23: 1700 | D23: 2535 | E23: of:=[.B23]*[.C23] -> 850.00000017 | F23: of:=[.B23]*[.D23] -> 1267.5000002535 | G23: of:=[.C23]*[$curvi.$J25] -> 42.8474381967556 | H23: of:=[.D23]*[$curvi.$J25] -> 63.8930916639855 | J23: of:=([.E23]-[.G23])/[.C23] -> 0.474795624690144 | K23: of:=([.F23]-[.H23])/[.D23] -> 0.474795624690144 | L23: of:=[.B23]-[.J23] -> 0.0252043754098562 | M23: of:=[.B23]-[.K23] -> 0.0252043754098562 | N23: of:=[.C23]*[.$B23] -> 850.00000017 | O23: of:=[.D23]*[.$B23] -> 1267.5000002535 | R23: of:=[.C23]*[.L23] -> 42.8474381967556 | S23: of:=[.D23]*[.M23] -> 63.8930916639855 | T23: of:=1/[.L23] -> 39.6756509034121 | U23: of:=1/[.M23] -> 39.6756509034121 | V23: of:=[.B23]*[.T23] -> 19.8378254556736 | W23: of:=[.C23]*[.U23] -> 67448.6065358006
A24: of:=[.A23]+1 -> 22 | B24: of:=[$curvi.B26] -> 0.5250000001 | C24: 1100 | D24: 2530 | E24: of:=[.B24]*[.C24] -> 577.50000011 | F24: of:=[.B24]*[.D24] -> 1328.250000253 | G24: of:=[.C24]*[$curvi.$J26] -> 27.7253810090436 | H24: of:=[.D24]*[$curvi.$J26] -> 63.7683763208003 | J24: of:=([.E24]-[.G24])/[.C24] -> 0.499795108273597 | K24: of:=([.F24]-[.H24])/[.D24] -> 0.499795108273597 | L24: of:=[.B24]-[.J24] -> 0.0252048918264033 | M24: of:=[.B24]-[.K24] -> 0.0252048918264033 | N24: of:=[.C24]*[.$B24] -> 577.50000011 | O24: of:=[.D24]*[.$B24] -> 1328.250000253 | R24: of:=[.C24]*[.L24] -> 27.7253810090436 | S24: of:=[.D24]*[.M24] -> 63.7683763208003 | T24: of:=1/[.L24] -> 39.6748379992035 | U24: of:=1/[.M24] -> 39.6748379992035 | V24: of:=[.B24]*[.T24] -> 20.8292899535494 | W24: of:=[.C24]*[.U24] -> 43642.3217991239
A25: of:=[.A24]+1 -> 23 | B25: of:=[$curvi.B27] -> 0.5500000001 | C25: 900 | D25: 2520 | E25: of:=[.B25]*[.C25] -> 495.00000009 | F25: of:=[.B25]*[.D25] -> 1386.000000252 | G25: of:=[.C25]*[$curvi.$J27] -> 22.5708754529234 | H25: of:=[.D25]*[$curvi.$J27] -> 63.1984512681856 | J25: of:=([.E25]-[.G25])/[.C25] -> 0.524921249596752 | K25: of:=([.F25]-[.H25])/[.D25] -> 0.524921249596752 | L25: of:=[.B25]-[.J25] -> 0.0250787505032483 | M25: of:=[.B25]-[.K25] -> 0.0250787505032483 | N25: of:=[.C25]*[.$B25] -> 495.00000009 | O25: of:=[.D25]*[.$B25] -> 1386.000000252 | R25: of:=[.C25]*[.L25] -> 22.5708754529234 | S25: of:=[.D25]*[.M25] -> 63.1984512681856 | T25: of:=1/[.L25] -> 39.8743948535425 | U25: of:=1/[.M25] -> 39.8743948535425 | V25: of:=[.B25]*[.T25] -> 21.9309171734359 | W25: of:=[.C25]*[.U25] -> 35886.9553681883
A26: of:=[.A25]+1 -> 24 | B26: of:=[$curvi.B28] -> 0.5750000001 | C26: 800 | D26: 2515 | E26: of:=[.B26]*[.C26] -> 460.00000008 | F26: of:=[.B26]*[.D26] -> 1446.1250002515 | G26: of:=[.C26]*[$curvi.$J28] -> 19.8599891559947 | H26: of:=[.D26]*[$curvi.$J28] -> 62.4348409091585 | J26: of:=([.E26]-[.G26])/[.C26] -> 0.550175013655007 | K26: of:=([.F26]-[.H26])/[.D26] -> 0.550175013655007 | L26: of:=[.B26]-[.J26] -> 0.0248249864449934 | M26: of:=[.B26]-[.K26] -> 0.0248249864449934 | N26: of:=[.C26]*[.$B26] -> 460.00000008 | O26: of:=[.D26]*[.$B26] -> 1446.1250002515 | R26: of:=[.C26]*[.L26] -> 19.8599891559947 | S26: of:=[.D26]*[.M26] -> 62.4348409091585 | T26: of:=1/[.L26] -> 40.2819958115899 | U26: of:=1/[.M26] -> 40.2819958115899 | V26: of:=[.B26]*[.T26] -> 23.1621475956924 | W26: of:=[.C26]*[.U26] -> 32225.5966492719
A27: of:=[.A26]+1 -> 25 | B27: of:=[$curvi.B29] -> 0.6000000001 | C27: 500 | D27: 2510 | E27: of:=[.B27]*[.C27] -> 300.00000005 | F27: of:=[.B27]*[.D27] -> 1506.000000251 | G27: of:=[.C27]*[$curvi.$J29] -> 12.2213124141578 | H27: of:=[.D27]*[$curvi.$J29] -> 61.3509883190722 | J27: of:=([.E27]-[.G27])/[.C27] -> 0.575557375271685 | K27: of:=([.F27]-[.H27])/[.D27] -> 0.575557375271685 | L27: of:=[.B27]-[.J27] -> 0.0244426248283156 | M27: of:=[.B27]-[.K27] -> 0.0244426248283156 | N27: of:=[.C27]*[.$B27] -> 300.00000005 | O27: of:=[.D27]*[.$B27] -> 1506.000000251 | R27: of:=[.C27]*[.L27] -> 12.2213124141578 | S27: of:=[.D27]*[.M27] -> 61.3509883190722 | T27: of:=1/[.L27] -> 40.9121363611304 | U27: of:=1/[.M27] -> 40.9121363611304 | V27: of:=[.B27]*[.T27] -> 24.5472818207695 | W27: of:=[.C27]*[.U27] -> 20456.0681805652
A28: of:=[.A27]+1 -> 26 | B28: of:=[$curvi.B30] -> 0.6250000001 | C28: 400 | D28: 2500 | E28: of:=[.B28]*[.C28] -> 250.00000004 | F28: of:=[.B28]*[.D28] -> 1562.50000025 | G28: of:=[.C28]*[$curvi.$J30] -> 9.57227235061304 | H28: of:=[.D28]*[$curvi.$J30] -> 59.8267021913315 | J28: of:=([.E28]-[.G28])/[.C28] -> 0.601069319223468 | K28: of:=([.F28]-[.H28])/[.D28] -> 0.601069319223468 | L28: of:=[.B28]-[.J28] -> 0.0239306808765326 | M28: of:=[.B28]-[.K28] -> 0.0239306808765327 | N28: of:=[.C28]*[.$B28] -> 250.00000004 | O28: of:=[.D28]*[.$B28] -> 1562.50000025 | R28: of:=[.C28]*[.L28] -> 9.57227235061304 | S28: of:=[.D28]*[.M28] -> 59.8267021913318 | T28: of:=1/[.L28] -> 41.7873609680968 | U28: of:=1/[.M28] -> 41.7873609680967 | V28: of:=[.B28]*[.T28] -> 26.1171006092393 | W28: of:=[.C28]*[.U28] -> 16714.9443872387
A29: of:=[.A28]+1 -> 27 | B29: of:=[$curvi.B31] -> 0.6500000001 | C29: 300 | D29: 2450 | E29: of:=[.B29]*[.C29] -> 195.00000003 | F29: of:=[.B29]*[.D29] -> 1592.500000245 | G29: of:=[.C29]*[$curvi.$J31] -> 6.98644791967269 | H29: of:=[.D29]*[$curvi.$J31] -> 57.0559913439936 | J29: of:=([.E29]-[.G29])/[.C29] -> 0.626711840367758 | K29: of:=([.F29]-[.H29])/[.D29] -> 0.626711840367758 | L29: of:=[.B29]-[.J29] -> 0.0232881597322423 | M29: of:=[.B29]-[.K29] -> 0.0232881597322423 | N29: of:=[.C29]*[.$B29] -> 195.00000003 | O29: of:=[.D29]*[.$B29] -> 1592.500000245 | R29: of:=[.C29]*[.L29] -> 6.98644791967269 | S29: of:=[.D29]*[.M29] -> 57.0559913439936 | T29: of:=1/[.L29] -> 42.9402757236978 | U29: of:=1/[.M29] -> 42.9402757236978 | V29: of:=[.B29]*[.T29] -> 27.9111792246976 | W29: of:=[.C29]*[.U29] -> 12882.0827171093
A30: of:=[.A29]+1 -> 28 | B30: of:=[$curvi.B32] -> 0.6750000001 | C30: 200 | D30: 2400 | E30: of:=[.B30]*[.C30] -> 135.00000002 | F30: of:=[.B30]*[.D30] -> 1620.00000024 | G30: of:=[.C30]*[$curvi.$J32] -> 4.50281126560059 | H30: of:=[.D30]*[$curvi.$J32] -> 54.0337351872071 | J30: of:=([.E30]-[.G30])/[.C30] -> 0.652485943771997 | K30: of:=([.F30]-[.H30])/[.D30] -> 0.652485943771997 | L30: of:=[.B30]-[.J30] -> 0.022514056328003 | M30: of:=[.B30]-[.K30] -> 0.022514056328003 | N30: of:=[.C30]*[.$B30] -> 135.00000002 | O30: of:=[.D30]*[.$B30] -> 1620.00000024 | R30: of:=[.C30]*[.L30] -> 4.50281126560059 | S30: of:=[.D30]*[.M30] -> 54.0337351872071 | T30: of:=1/[.L30] -> 44.416696193311 | U30: of:=1/[.M30] -> 44.416696193311 | V30: of:=[.B30]*[.T30] -> 29.9812699349267 | W30: of:=[.C30]*[.U30] -> 8883.33923866221
A31: of:=[.A30]+1 -> 29 | B31: of:=[$curvi.B33] -> 0.7000000001 | C31: 150 | D31: 2300 | E31: of:=[.B31]*[.C31] -> 105.000000015 | F31: of:=[.B31]*[.D31] -> 1610.00000023 | G31: of:=[.C31]*[$curvi.$J33] -> 3.24110328825237 | H31: of:=[.D31]*[$curvi.$J33] -> 49.6969170865363 | J31: of:=([.E31]-[.G31])/[.C31] -> 0.678392644844985 | K31: of:=([.F31]-[.H31])/[.D31] -> 0.678392644844985 | L31: of:=[.B31]-[.J31] -> 0.0216073552550158 | M31: of:=[.B31]-[.K31] -> 0.0216073552550158 | N31: of:=[.C31]*[.$B31] -> 105.000000015 | O31: of:=[.D31]*[.$B31] -> 1610.00000023 | R31: of:=[.C31]*[.L31] -> 3.24110328825237 | S31: of:=[.D31]*[.M31] -> 49.6969170865363 | T31: of:=1/[.L31] -> 46.2805367985916 | U31: of:=1/[.M31] -> 46.2805367985916 | V31: of:=[.B31]*[.T31] -> 32.3963757636422 | W31: of:=[.C31]*[.U31] -> 6942.08051978874
A32: of:=[.A31]+1 -> 30 | B32: of:=[$curvi.B34] -> 0.7250000001 | C32: 135 | D32: 2150 | E32: of:=[.B32]*[.C32] -> 97.8750000135001 | F32: of:=[.B32]*[.D32] -> 1558.750000215 | G32: of:=[.C32]*[$curvi.$J34] -> 2.77654913501983 | H32: of:=[.D32]*[$curvi.$J34] -> 44.2191158540195 | J32: of:=([.E32]-[.G32])/[.C32] -> 0.704432969470224 | K32: of:=([.F32]-[.H32])/[.D32] -> 0.704432969470224 | L32: of:=[.B32]-[.J32] -> 0.0205670306297765 | M32: of:=[.B32]-[.K32] -> 0.0205670306297765 | N32: of:=[.C32]*[.$B32] -> 97.8750000135001 | O32: of:=[.D32]*[.$B32] -> 1558.750000215 | R32: of:=[.C32]*[.L32] -> 2.77654913501983 | S32: of:=[.D32]*[.M32] -> 44.2191158540195 | T32: of:=1/[.L32] -> 48.6215058459738 | U32: of:=1/[.M32] -> 48.6215058459738 | V32: of:=[.B32]*[.T32] -> 35.2505917431932 | W32: of:=[.C32]*[.U32] -> 6563.90328920646
A33: of:=[.A32]+1 -> 31 | B33: of:=[$curvi.B35] -> 0.7500000001 | C33: 120 | D33: 1850 | E33: of:=[.B33]*[.C33] -> 90.0000000120001 | F33: of:=[.B33]*[.D33] -> 1387.500000185 | G33: of:=[.C33]*[$curvi.$J35] -> 2.32704551503902 | H33: of:=[.D33]*[$curvi.$J35] -> 35.8752850235182 | J33: of:=([.E33]-[.G33])/[.C33] -> 0.730607954141342 | K33: of:=([.F33]-[.H33])/[.D33] -> 0.730607954141342 | L33: of:=[.B33]-[.J33] -> 0.0193920459586584 | M33: of:=[.B33]-[.K33] -> 0.0193920459586585 | N33: of:=[.C33]*[.$B33] -> 90.0000000120001 | O33: of:=[.D33]*[.$B33] -> 1387.500000185 | R33: of:=[.C33]*[.L33] -> 2.32704551503901 | S33: of:=[.D33]*[.M33] -> 35.8752850235182 | T33: of:=1/[.L33] -> 51.5675345516344 | U33: of:=1/[.M33] -> 51.5675345516342 | V33: of:=[.B33]*[.T33] -> 38.6756509188826 | W33: of:=[.C33]*[.U33] -> 6188.1041461961
A34: of:=[.A33]+1 -> 32 | B34: of:=[$curvi.B36] -> 0.7750000001 | C34: 110 | D34: 1670 | E34: of:=[.B34]*[.C34] -> 85.2500000110001 | F34: of:=[.B34]*[.D34] -> 1294.250000167 | G34: of:=[.C34]*[$curvi.$J36] -> 1.98894894004273 | H34: of:=[.D34]*[$curvi.$J36] -> 30.1958611806487 | J34: of:=([.E34]-[.G34])/[.C34] -> 0.756918646099612 | K34: of:=([.F34]-[.H34])/[.D34] -> 0.756918646099612 | L34: of:=[.B34]-[.J34] -> 0.0180813540003885 | M34: of:=[.B34]-[.K34] -> 0.0180813540003885 | N34: of:=[.C34]*[.$B34] -> 85.2500000110001 | O34: of:=[.D34]*[.$B34] -> 1294.250000167 | R34: of:=[.C34]*[.L34] -> 1.98894894004273 | S34: of:=[.D34]*[.M34] -> 30.1958611806487 | T34: of:=1/[.L34] -> 55.305592710508 | U34: of:=1/[.M34] -> 55.305592710508 | V34: of:=[.B34]*[.T34] -> 42.8618343561743 | W34: of:=[.C34]*[.U34] -> 6083.61519815589
A35: of:=[.A34]+1 -> 33 | B35: of:=[$curvi.B37] -> 0.8000000001 | C35: 100 | D35: 1505 | E35: of:=[.B35]*[.C35] -> 80.0000000100001 | F35: of:=[.B35]*[.D35] -> 1204.0000001505 | G35: of:=[.C35]*[$curvi.$J37] -> 1.66338966263789 | H35: of:=[.D35]*[$curvi.$J37] -> 25.0340144227003 | J35: of:=([.E35]-[.G35])/[.C35] -> 0.783366103473622 | K35: of:=([.F35]-[.H35])/[.D35] -> 0.783366103473622 | L35: of:=[.B35]-[.J35] -> 0.0166338966263789 | M35: of:=[.B35]-[.K35] -> 0.0166338966263789 | N35: of:=[.C35]*[.$B35] -> 80.0000000100001 | O35: of:=[.D35]*[.$B35] -> 1204.0000001505 | R35: of:=[.C35]*[.L35] -> 1.66338966263789 | S35: of:=[.D35]*[.M35] -> 25.0340144227003 | T35: of:=1/[.L35] -> 60.1182045591259 | U35: of:=1/[.M35] -> 60.1182045591259 | V35: of:=[.B35]*[.T35] -> 48.0945636533124 | W35: of:=[.C35]*[.U35] -> 6011.82045591257
A36: of:=[.A35]+1 -> 34 | B36: of:=[$curvi.B38] -> 0.825000000100001 | C36: 90 | D36: 1350 | E36: of:=[.B36]*[.C36] -> 74.250000009 | F36: of:=[.B36]*[.D36] -> 1113.750000135 | G36: of:=[.C36]*[$curvi.$J38] -> 1.35437442109883 | H36: of:=[.D36]*[$curvi.$J38] -> 20.3156163164825 | J36: of:=([.E36]-[.G36])/[.C36] -> 0.809951395421125 | K36: of:=([.F36]-[.H36])/[.D36] -> 0.809951395421125 | L36: of:=[.B36]-[.J36] -> 0.015048604678876 | M36: of:=[.B36]-[.K36] -> 0.0150486046788759 | N36: of:=[.C36]*[.$B36] -> 74.250000009 | O36: of:=[.D36]*[.$B36] -> 1113.750000135 | R36: of:=[.C36]*[.L36] -> 1.35437442109884 | S36: of:=[.D36]*[.M36] -> 20.3156163164825 | T36: of:=1/[.L36] -> 66.4513435856095 | U36: of:=1/[.M36] -> 66.45134358561 | V36: of:=[.B36]*[.T36] -> 54.8223584647729 | W36: of:=[.C36]*[.U36] -> 5980.62092270489
A37: of:=[.A36]+1 -> 35 | B37: of:=[$curvi.B39] -> 0.850000000100001 | C37: 80 | D37: 980 | E37: of:=[.B37]*[.C37] -> 68.000000008 | F37: of:=[.B37]*[.D37] -> 833.000000098001 | G37: of:=[.C37]*[$curvi.$J39] -> 1.06595182615073 | H37: of:=[.D37]*[$curvi.$J39] -> 13.0579098703464 | J37: of:=([.E37]-[.G37])/[.C37] -> 0.836675602273117 | K37: of:=([.F37]-[.H37])/[.D37] -> 0.836675602273116 | L37: of:=[.B37]-[.J37] -> 0.013324397826884 | M37: of:=[.B37]-[.K37] -> 0.0133243978268841 | N37: of:=[.C37]*[.$B37] -> 68.000000008 | O37: of:=[.D37]*[.$B37] -> 833.000000098001 | R37: of:=[.C37]*[.L37] -> 1.06595182615072 | S37: of:=[.D37]*[.M37] -> 13.0579098703464 | T37: of:=1/[.L37] -> 75.0502959302482 | U37: of:=1/[.M37] -> 75.0502959302476 | V37: of:=[.B37]*[.T37] -> 63.7927515482161 | W37: of:=[.C37]*[.U37] -> 6004.02367441981
A38: of:=[.A37]+1 -> 36 | B38: of:=[$curvi.B40] -> 0.875000000100001 | C38: 70 | D38: 755 | E38: of:=[.B38]*[.C38] -> 61.250000007 | F38: of:=[.B38]*[.D38] -> 660.6250000755 | G38: of:=[.C38]*[$curvi.$J40] -> 0.802212909387819 | H38: of:=[.D38]*[$curvi.$J40] -> 8.65243923696862 | J38: of:=([.E38]-[.G38])/[.C38] -> 0.863539815680175 | K38: of:=([.F38]-[.H38])/[.D38] -> 0.863539815680175 | L38: of:=[.B38]-[.J38] -> 0.011460184419826 | M38: of:=[.B38]-[.K38] -> 0.0114601844198259 | N38: of:=[.C38]*[.$B38] -> 61.250000007 | O38: of:=[.D38]*[.$B38] -> 660.6250000755 | R38: of:=[.C38]*[.L38] -> 0.802212909387819 | S38: of:=[.D38]*[.M38] -> 8.65243923696854 | T38: of:=1/[.L38] -> 87.2586306962051 | U38: of:=1/[.M38] -> 87.2586306962058 | V38: of:=[.B38]*[.T38] -> 76.3513018679054 | W38: of:=[.C38]*[.U38] -> 6108.10414873442
A39: of:=[.A38]+1 -> 37 | B39: of:=[$curvi.B41] -> 0.900000000100001 | C39: 60 | D39: 575 | E39: of:=[.B39]*[.C39] -> 54.000000006 | F39: of:=[.B39]*[.D39] -> 517.5000000575 | G39: of:=[.C39]*[$curvi.$J41] -> 0.567291680333804 | H39: of:=[.D39]*[$curvi.$J41] -> 5.43654526986562 | J39: of:=([.E39]-[.G39])/[.C39] -> 0.890545138761104 | K39: of:=([.F39]-[.H39])/[.D39] -> 0.890545138761104 | L39: of:=[.B39]-[.J39] -> 0.00945486133889673 | M39: of:=[.B39]-[.K39] -> 0.00945486133889684 | N39: of:=[.C39]*[.$B39] -> 54.000000006 | O39: of:=[.D39]*[.$B39] -> 517.5000000575 | R39: of:=[.C39]*[.L39] -> 0.567291680333804 | S39: of:=[.D39]*[.M39] -> 5.43654526986568 | T39: of:=1/[.L39] -> 105.765697047937 | U39: of:=1/[.M39] -> 105.765697047935 | V39: of:=[.B39]*[.T39] -> 95.1891273537196 | W39: of:=[.C39]*[.U39] -> 6345.94182287613
A40: of:=[.A39]+1 -> 38 | B40: of:=[$curvi.B42] -> 0.925000000100001 | C40: 50 | D40: 276 | E40: of:=[.B40]*[.C40] -> 46.250000005 | F40: of:=[.B40]*[.D40] -> 255.3000000276 | G40: of:=[.C40]*[$curvi.$J42] -> 0.365365692303465 | H40: of:=[.D40]*[$curvi.$J42] -> 2.01681862151513 | J40: of:=([.E40]-[.G40])/[.C40] -> 0.917692686253931 | K40: of:=([.F40]-[.H40])/[.D40] -> 0.917692686253931 | L40: of:=[.B40]-[.J40] -> 0.0073073138460692 | M40: of:=[.B40]-[.K40] -> 0.00730731384606942 | N40: of:=[.C40]*[.$B40] -> 46.250000005 | O40: of:=[.D40]*[.$B40] -> 255.3000000276 | R40: of:=[.C40]*[.L40] -> 0.36536569230346 | S40: of:=[.D40]*[.M40] -> 2.01681862151516 | T40: of:=1/[.L40] -> 136.849192612403 | U40: of:=1/[.M40] -> 136.849192612398 | V40: of:=[.B40]*[.T40] -> 126.585503180157 | W40: of:=[.C40]*[.U40] -> 6842.45963061992
A41: of:=[.A40]+1 -> 39 | B41: of:=[$curvi.B43] -> 0.950000000100001 | C41: 40 | D41: 158 | E41: of:=[.B41]*[.C41] -> 38.000000004 | F41: of:=[.B41]*[.D41] -> 150.1000000158 | G41: of:=[.C41]*[$curvi.$J43] -> 0.200656617228332 | H41: of:=[.D41]*[$curvi.$J43] -> 0.792593638051911 | J41: of:=([.E41]-[.G41])/[.C41] -> 0.944983584669292 | K41: of:=([.F41]-[.H41])/[.D41] -> 0.944983584669292 | L41: of:=[.B41]-[.J41] -> 0.00501641543070819 | M41: of:=[.B41]-[.K41] -> 0.00501641543070819 | N41: of:=[.C41]*[.$B41] -> 38.000000004 | O41: of:=[.D41]*[.$B41] -> 150.1000000158 | R41: of:=[.C41]*[.L41] -> 0.200656617228327 | S41: of:=[.D41]*[.M41] -> 0.792593638051894 | T41: of:=1/[.L41] -> 199.345531448305 | U41: of:=1/[.M41] -> 199.345531448305 | V41: of:=[.B41]*[.T41] -> 189.378254895824 | W41: of:=[.C41]*[.U41] -> 7973.82125793219
A42: of:=[.A41]+1 -> 40 | B42: of:=[$curvi.B44] -> 0.975000000100001 | C42: 30 | D42: 95 | E42: of:=[.B42]*[.C42] -> 29.250000003 | F42: of:=[.B42]*[.D42] -> 92.6250000095001 | G42: of:=[.C42]*[$curvi.$J44] -> 0.0774308296124071 | H42: of:=[.D42]*[$curvi.$J44] -> 0.245197627105956 | J42: of:=([.E42]-[.G42])/[.C42] -> 0.972418972446254 | K42: of:=([.F42]-[.H42])/[.D42] -> 0.972418972446254 | L42: of:=[.B42]-[.J42] -> 0.0025810276537469 | M42: of:=[.B42]-[.K42] -> 0.0025810276537469 | N42: of:=[.C42]*[.$B42] -> 29.250000003 | O42: of:=[.D42]*[.$B42] -> 92.6250000095001 | R42: of:=[.C42]*[.L42] -> 0.0774308296124071 | S42: of:=[.D42]*[.M42] -> 0.245197627105956 | T42: of:=1/[.L42] -> 387.442574878379 | U42: of:=1/[.M42] -> 387.442574878379 | V42: of:=[.B42]*[.T42] -> 377.756510545163 | W42: of:=[.C42]*[.U42] -> 11623.2772463514
A43: of:=[.A42]+1 -> 41 | B43: of:=[$curvi.B45] -> 1.0000000001 | C43: 10 | D43: 30 | E43: of:=[.B43]*[.C43] -> 10.000000001 | F43: of:=[.B43]*[.D43] -> 30.000000003 | G43: of:=[.C43]*[$curvi.$J45] -> -0.000000000106170627844904 | H43: of:=[.D43]*[$curvi.$J45] -> -0.000000000318511883534711 | J43: of:=([.E43]-[.G43])/[.C43] -> 1.00000000011062 | K43: of:=([.F43]-[.H43])/[.D43] -> 1.00000000011062 | L43: of:=[.B43]-[.J43] -> -0.0000000000106170627844904 | M43: of:=[.B43]-[.K43] -> -0.0000000000106170627844904 | N43: of:=[.C43]*[.$B43] -> 10.000000001 | O43: of:=[.D43]*[.$B43] -> 30.000000003 | R43: of:=[.C43]*[.L43] -> -0.000000000106170627844904 | S43: of:=[.D43]*[.M43] -> -0.000000000318511883534711 | T43: of:=1/[.L43] -> -94188008519.7215 | U43: of:=1/[.M43] -> -94188008519.7215 | V43: of:=[.B43]*[.T43] -> -94188008529.1406 | W43: of:=[.C43]*[.U43] -> -941880085197.218
I44: averages | J44: of:=SUM([.L3:.L43])/[.C48] -> 0.00000672037482932693 | K44: of:=SUM([.M3:.M43])/[.D48] -> 0.00000672037482932694 | L44: of:=SUM([.L3:.L43])/[.C48] -> 0.00000672037482932693 | M44: of:=SUM([.M3:.M43])/[.D48] -> 0.00000672037482932694 | N44: of:=SUM([.N3:.N43])/[.C48] -> 0.3510212501 | O44: of:=SUM([.O3:.O43])/[.D48] -> 0.3510210001 | R44: of:=SUM([.R3:.R43]) -> 2164.91613661216 | S44: of:=SUM([.S3:.S43]) -> 1580.09919513455 | T44: of:=SUM([.T3:.T43]) -> 10001122124.4692 | U44: of:=SUM([.U3:.U43]) -> 10001122124.4692 | V44: of:=SUM([.V3:.V43]) -> -94188006877.1717 | W44: of:=SUM([.W3:.W43]) -> 100015952337.073
J46: NPE computated with current metrics | M46: % of the true NPE | P46: diagrams
C47: pop B | D47: pop A | G47: pop B | H47: pop A | K47: pop B | L47: pop A | M47: pop B | N47: pop A | Q47: of:=[.M47] -> pop  B | R47: of:=[.N47] -> pop  A
B48: N | C48: of:=SUM([.C3:.C43]) -> 100000 | D48: of:=SUM([.D3:.D43]) -> 100000 | F48: NPE | G48: of:=SUM([.G3:.G43]) -> 2164.91613661216 | H48: of:=SUM([.H3:.H43]) -> 1580.09919513455 | J48: OR | K48: of:=[.E52]*(([.E54]/(1-[.E54]))/([.E53]/(1-[.E53]))) -> 31873.9322965102 | L48: of:=[.F52]*(([.F54]/(1-[.F54]))/([.F53]/(1-[.F53]))) -> 32725.2246309229 | M48: of:=[.K48]/[.G$48] -> 14.7229408832387 | N48: of:=[.L48]/[.$H$48] -> 20.7108672238367 | P48: of:=[.J48] -> OR | Q48: of:=[.M48] -> 14.7229408832387 | R48: of:=[.N48] -> 20.7108672238367
B49: taill cible | C49: 100000 | D49: 100000 | F49: average AB | G49: of:=[.G48]/[.C48] -> 0.0216491613661216 | H49: of:=[.H48]/[.D48] -> 0.0158009919513455 | J49: RR | K49: of:=[.E52]*([.E54]/[.E53]) -> 32937.2088733879 | L49: of:=[.F52]*([.F54]/[.F53]) -> 33522.0008148655 | M49: of:=[.K49]/[.G$48] -> 15.2140807287486 | N49: of:=[.L49]/[.$H$48] -> 21.2151242897196 | P49: of:=[.J49] -> RR | Q49: of:=[.M49] -> 15.2140807287486 | R49: of:=[.N49] -> 21.2151242897196
B50: écart | C50: of:=[.C48]-[.D48] -> 0 | D50: of:=[.D49]-[.D48] -> 0 | J50: average AB | K50: of:=[.C48]*[.G49] -> 2164.91613661216 | L50: of:=[.D48]*[.H49] -> 1580.09919513455 | M50: of:=[.K50]/[.G$48] -> 1 | N50: of:=[.L50]/[.$H$48] -> 1 | P50: of:=[.J50] -> average AB | Q50: of:=[.M50] -> 1 | R50: of:=[.N50] -> 1
E51: pop B | F51: pop A
D52: total events | E52: of:=SUM([.E3:.E43]) -> 35102.12501 | F52: of:=SUM([.F3:.F43]) -> 35102.10001
D53: average Rc | E53: of:=[.E52]/[.C48] -> 0.3510212501 | F53: of:=[.F52]/[.D48] -> 0.3510210001
D54: average Rt | E54: of:=([.E52]-[.G48])/[.C48] -> 0.329372088733879 | F54: of:=([.F52]-[.H48])/[.D48] -> 0.335220008148655
J55: pop A NPE computated with current metrics and trial 1 summary data | M55: % of the true NPE
K56: pop B | L56: pop A | M56: pop B | N56: pop A | Q56: of:=[.M56] -> pop  B | R56: of:=[.N56] -> pop  A
J57: OR | K57: of:=[.E52]*(([.E63]/(1-[.E63]))/([.E62]/(1-[.E62]))) -> 32725.247938093 | L57: of:=[.F52]*(([.E63]/(1-[.E63]))/([.E62]/(1-[.E62]))) -> 32725.2246309229 | M57: of:=[.K57]/[.G$48] -> 15.1161735019003 | N57: of:=[.L57]/[.$H$48] -> 20.7108672238367 | P57: of:=[.J57] -> OR | Q57: of:=[.M57] -> 15.1161735019003 | R57: of:=[.N57] -> 20.7108672238367
J58: RR | K58: of:=[.E52]*([.E63]/[.E62]) -> 33522.024689506 | L58: of:=[.F52]*([.E63]/[.E62]) -> 33522.0008148655 | M58: of:=[.K58]/[.G$48] -> 15.4842139714308 | N58: of:=[.L58]/[.$H$48] -> 21.2151242897196 | P58: of:=[.J58] -> RR | Q58: of:=[.M58] -> 15.4842139714308 | R58: of:=[.N58] -> 21.2151242897196
J59: average AB | K59: of:=[.C48]*([.E62]-[.E63]) -> 1580.09919513455 | L59: of:=[.D48]*([.E62]-[.E63]) -> 1580.09919513455 | M59: of:=[.K59]/[.G$48] -> 0.729866237501108 | N59: of:=[.L59]/[.$H$48] -> 0.999999999999998 | P59: of:=[.J59] -> average AB | Q59: of:=[.M59] -> 0.729866237501108 | R59: of:=[.N59] -> 0.999999999999998
D62: trial 1 Rc | E62: of:=[.F53] -> 0.3510210001 | J62: pop A NPE computated with current metrics and trial 2 summary data | M62: % of the true NPE
D63: trial 1 Rt | E63: of:=[.F54] -> 0.335220008148655 | K63: pop B | L63: pop A | M63: pop B | N63: pop A | Q63: of:=[.M63] -> pop  B | R63: of:=[.N63] -> pop  A
J64: OR | K64: of:=[.E52]*(([.D75]/(1-[.D75]))/([.D74]/(1-[.D74]))) -> 32064.9114740624 | L64: of:=[.F52]*(([.D75]/(1-[.D75]))/([.D74]/(1-[.D74]))) -> 32064.888637189 | M64: of:=[.K64]/[.G$48] -> 14.8111563916006 | N64: of:=[.L64]/[.$H$48] -> 20.2929592875709 | P64: of:=[.J64] -> OR | Q64: of:=[.M64] -> 14.8111563916006 | R64: of:=[.N64] -> 20.2929592875709
J65: RR | K65: of:=[.E52]*([.D75]/[.D74]) -> 32615.6367028247 | L65: of:=[.F52]*([.D75]/[.D74]) -> 32615.6134737205 | M65: of:=[.K65]/[.G$48] -> 15.065542794588 | N65: of:=[.L65]/[.$H$48] -> 20.6414974288644 | P65: of:=[.J65] -> RR | Q65: of:=[.M65] -> 15.065542794588 | R65: of:=[.N65] -> 20.6414974288644
D66: trial 2 Rc | E66: of:=[.D74] -> 0.195149387639399 | J66: average AB | K66: of:=[.C48]*([.D74]-[.D75]) -> 1382.35696664963 | L66: of:=[.D48]*([.D74]-[.D75]) -> 1382.35696664963 | M66: of:=[.K66]/[.G$48] -> 0.63852679707624 | N66: of:=[.L66]/[.$H$48] -> 0.874854547680417 | P66: of:=[.J66] -> average AB | Q66: of:=[.M66] -> 0.63852679707624 | R66: of:=[.N66] -> 0.874854547680417
D67: trial 2 Rt | E67: of:=[.D75] -> 0.181325817972903
C69: trial 2 summary data | J69: comparing the five NNTs (trial 2) | M69: % of the ref NNT
C70: N | D70: of:=SUM([.D4:.D20]) -> 52983 | K70: pop B | L70: pop A | M70: pop B | N70: pop A
C71: NPE | D71: of:=SUM([.H4:.H20]) -> 732.414191639973 | I71: 1 | J71: NNT ave | K71: of:=1/([.E53]-[.E54]) -> 46.1911657033 | L71: of:=1/([.F53]-[.F54]) -> 63.2871659626944 | M71: of:=[.K71]/[.K74] -> 1 | N71: of:=[.L71]/[.L74] -> 1
C72: trial 2 AB | D72: of:=[.D71]/[.D70] -> 0.0138235696664963 | I72: 2 | J72: NNT ave sec | K72: of:=1/(SUM([.L3:.L43])) -> 1.48801223949015 | L72: of:=1/(SUM([.M3:.M43])) -> 1.48801223949015 | M72: of:=[.K72]/[.K74] -> 0.0322142170874862 | N72: of:=[.L72]/[.L74] -> 0.0235120694196875
C73: total events | D73: of:=SUM([.F4:.F20]) -> 10339.6000052983 | I73: 3 | J73: NNT transp trial 2 | K73: of:=1/([.E53]*(1-([.D75]/[.D74]))) -> 40.2173618558456 | L73: of:=1/([.F53]*(1-([.D75]/[.D74]))) -> 40.2173904989765 | M73: of:=[.K73]/[.K74] -> 0.870672156536903 | N73: of:=[.L73]/[.L74] -> 0.635474663578447
C74: trial 2 Rc | D74: of:=[.D73]/[.D70] -> 0.195149387639399 | I74: 4 | J74: NNT ref | K74: of:=[.C48]/[.G48] -> 46.1911657032999 | L74: of:=[.D48]/[.H48] -> 63.2871659626943 | M74: of:=[.K74]/[.K74] -> 1 | N74: of:=[.L74]/[.L74] -> 1
C75: trial 2 Rt | D75: of:=([.D73]-[.D71])/[.D70] -> 0.181325817972903 | I75: 5 | J75: NNT 5 | K75: of:=(1/[.V44])/[.C48] -> -1.06170629696419E-016 | L75: of:=(1/[.W44])/[.D48] -> 9.99840502072917E-017 | M75: of:=[.K75]/[.K74] -> -2.29850509464052E-018 | N75: of:=[.L75]/[.L74] -> 1.57984717258834E-018
J78: comparing NNT pop with NNT trials | M78: % of the ref NNT
K79: pop B | L79: pop A | M79: pop B | N79: pop A
I80: 1 | J80: NNT trial 1 | K80: of:=1/([.E62]-[.E63]) -> 63.2871659626944 | L80: of:=1/([.E62]-[.E63]) -> 63.2871659626944 | M80: of:=[.K80]/[.K84] -> 1.37011406833089 | N80: of:=[.L80]/[.L84] -> 1
I81: 2 | J81: NNT trial 2 | K81: of:=1/([.E66]-[.E67]) -> 72.3402148739964 | L81: of:=1/([.E66]-[.E67]) -> 72.3402148739964 | M81: of:=[.K81]/[.K84] -> 1.56610498506706 | N81: of:=[.L81]/[.L84] -> 1.14304715298262
I82: 3 | J82: NNT transp trial 1 | K82: of:=1/([.E53]*(1-[.E63]/[.E62])) -> 63.2871208890942 | L82: of:=1/([.F53]*(1-[.E63]/[.E62])) -> 63.2871659626944 | M82: of:=[.K82]/[.$K$84] -> 1.37011309252524 | N82: of:=[.L82]/[.$L$84] -> 1
I83: 3 | J83: NNT transp trial 2 | K83: of:=1/([.E53]*(1-([.E67]/[.E66]))) -> 40.2173618558456 | L83: of:=1/([.F53]*(1-([.E67]/[.E66]))) -> 40.2173904989765 | M83: of:=[.K83]/[.K84] -> 0.870672156536903 | N83: of:=[.L83]/[.L84] -> 0.635474663578447
I84: 4 | J84: NNT ref | K84: of:=[.K74] -> 46.1911657032999 | L84: of:=[.L74] -> 63.2871659626943 | M84: of:=[.K84]/[.K84] -> 1 | N84: of:=[.L84]/[.L84] -> 1
K88: NPE
K89: pop B trial 1 | L89: pop B trial 2 | M89: pop A trial 1 | N89: pop A trial 2
J90: of:=[.J66] -> average AB | K90: of:=[.M59] -> 0.729866237501108 | L90: of:=[.M66] -> 0.63852679707624 | M90: of:=[.N59] -> 0.999999999999998 | N90: of:=[.N66] -> 0.874854547680417

Sheet: TEST 1
B1: Abs
A2: Rc | B2: po A | C2: po B | D2: # events A | E2: # events B | F2: NPEs A | G2: NPEs B
A3: of:=[$curvi.B5] -> 0.0000000001 | B3: 0 | C3: 2439.0243902439 | D3: of:=[.A3]*[.B3] -> 0 | E3: of:=[.A3]*[.C3] -> 0.00000024390243902439 | F3: of:=[.B3]*[$curvi.$J5] -> 0 | G3: of:=[.C3]*[$curvi.$J5] -> 0.0000000234095865295801
A4: of:=[$curvi.B6] -> 0.0250000001 | B4: 0 | C4: 2439.0243902439 | D4: of:=[.A4]*[.B4] -> 0 | E4: of:=[.A4]*[.C4] -> 60.97561 | F4: of:=[.B4]*[$curvi.$J6] -> 0 | G4: of:=[.C4]*[$curvi.$J6] -> 5.71981132726158 | H4: of:=[.B48] -> 0
A5: of:=[$curvi.B7] -> 0.0500000001 | B5: 0 | C5: 2439.0243902439 | D5: of:=[.A5]*[.B5] -> 0 | E5: of:=[.A5]*[.C5] -> 121.951219756098 | F5: of:=[.B5]*[$curvi.$J7] -> 0 | G5: of:=[.C5]*[$curvi.$J7] -> 11.1731732939788 | H5: of:=[.D51] -> 0.5000000001
A6: of:=[$curvi.B8] -> 0.0750000001 | B6: 0 | C6: 2439.0243902439 | D6: of:=[.A6]*[.B6] -> 0 | E6: of:=[.A6]*[.C6] -> 182.926829512195 | F6: of:=[.B6]*[$curvi.$J8] -> 0 | G6: of:=[.C6]*[$curvi.$J8] -> 16.3581539950139 | H6: of:=[.H5]-[.E51] -> 0
A7: of:=[$curvi.B9] -> 0.1000000001 | B7: 0 | C7: 2439.0243902439 | D7: of:=[.A7]*[.B7] -> 0 | E7: of:=[.A7]*[.C7] -> 243.902439268293 | F7: of:=[.B7]*[$curvi.$J9] -> 0 | G7: of:=[.C7]*[$curvi.$J9] -> 21.2728027796094
A8: of:=[$curvi.B10] -> 0.1250000001 | B8: 0 | C8: 2439.0243902439 | D8: of:=[.A8]*[.B8] -> 0 | E8: of:=[.A8]*[.C8] -> 304.87804902439 | F8: of:=[.B8]*[$curvi.$J10] -> 0 | G8: of:=[.C8]*[$curvi.$J10] -> 25.9151500474517
A9: of:=[$curvi.B11] -> 0.1500000001 | B9: 0 | C9: 2439.0243902439 | D9: of:=[.A9]*[.B9] -> 0 | E9: of:=[.A9]*[.C9] -> 365.853658780488 | F9: of:=[.B9]*[$curvi.$J11] -> 0 | G9: of:=[.C9]*[$curvi.$J11] -> 30.2832070180046
A10: of:=[$curvi.B12] -> 0.1750000001 | B10: 0 | C10: 2439.0243902439 | D10: of:=[.A10]*[.B10] -> 0 | E10: of:=[.A10]*[.C10] -> 426.829268536585 | F10: of:=[.B10]*[$curvi.$J12] -> 0 | G10: of:=[.C10]*[$curvi.$J12] -> 34.3749654964653
A11: of:=[$curvi.B13] -> 0.2000000001 | B11: 0 | C11: 2439.0243902439 | D11: of:=[.A11]*[.B11] -> 0 | E11: of:=[.A11]*[.C11] -> 487.804878292683 | F11: of:=[.B11]*[$curvi.$J13] -> 0 | G11: of:=[.C11]*[$curvi.$J13] -> 38.1883976362848
A12: of:=[$curvi.B14] -> 0.2250000001 | B12: 0 | C12: 2439.0243902439 | D12: of:=[.A12]*[.B12] -> 0 | E12: of:=[.A12]*[.C12] -> 548.78048804878 | F12: of:=[.B12]*[$curvi.$J14] -> 0 | G12: of:=[.C12]*[$curvi.$J14] -> 41.7214556981934
A13: of:=[$curvi.B15] -> 0.2500000001 | B13: 0 | C13: 2439.0243902439 | D13: of:=[.A13]*[.B13] -> 0 | E13: of:=[.A13]*[.C13] -> 609.756097804878 | F13: of:=[.B13]*[$curvi.$J15] -> 0 | G13: of:=[.C13]*[$curvi.$J15] -> 44.9720718056729
A14: of:=[$curvi.B16] -> 0.2750000001 | B14: 0 | C14: 2439.0243902439 | D14: of:=[.A14]*[.B14] -> 0 | E14: of:=[.A14]*[.C14] -> 670.731707560976 | F14: of:=[.B14]*[$curvi.$J16] -> 0 | G14: of:=[.C14]*[$curvi.$J16] -> 47.9381576968112
A15: of:=[$curvi.B17] -> 0.3000000001 | B15: 0 | C15: 2439.0243902439 | D15: of:=[.A15]*[.B15] -> 0 | E15: of:=[.A15]*[.C15] -> 731.707317317073 | F15: of:=[.B15]*[$curvi.$J17] -> 0 | G15: of:=[.C15]*[$curvi.$J17] -> 50.6176044724807
A16: of:=[$curvi.B18] -> 0.3250000001 | B16: 0 | C16: 2439.0243902439 | D16: of:=[.A16]*[.B16] -> 0 | E16: of:=[.A16]*[.C16] -> 792.682927073171 | F16: of:=[.B16]*[$curvi.$J18] -> 0 | G16: of:=[.C16]*[$curvi.$J18] -> 53.0082823407713
A17: of:=[$curvi.B19] -> 0.3500000001 | B17: 0 | C17: 2439.0243902439 | D17: of:=[.A17]*[.B17] -> 0 | E17: of:=[.A17]*[.C17] -> 853.658536829269 | F17: of:=[.B17]*[$curvi.$J19] -> 0 | G17: of:=[.C17]*[$curvi.$J19] -> 55.1080403576197
A18: of:=[$curvi.B20] -> 0.3750000001 | B18: 0 | C18: 2439.0243902439 | D18: of:=[.A18]*[.B18] -> 0 | E18: of:=[.A18]*[.C18] -> 914.634146585366 | F18: of:=[.B18]*[$curvi.$J20] -> 0 | G18: of:=[.C18]*[$curvi.$J20] -> 56.9147061635624
A19: of:=[$curvi.B21] -> 0.4000000001 | B19: 0 | C19: 2439.0243902439 | D19: of:=[.A19]*[.B19] -> 0 | E19: of:=[.A19]*[.C19] -> 975.609756341464 | F19: of:=[.B19]*[$curvi.$J21] -> 0 | G19: of:=[.C19]*[$curvi.$J21] -> 58.4260857165495
A20: of:=[$curvi.B22] -> 0.4250000001 | B20: 0 | C20: 2439.0243902439 | D20: of:=[.A20]*[.B20] -> 0 | E20: of:=[.A20]*[.C20] -> 1036.58536609756 | F20: of:=[.B20]*[$curvi.$J22] -> 0 | G20: of:=[.C20]*[$curvi.$J22] -> 59.6399630207462
A21: of:=[$curvi.B23] -> 0.4500000001 | B21: 0 | C21: 2439.0243902439 | D21: of:=[.A21]*[.B21] -> 0 | E21: of:=[.A21]*[.C21] -> 1097.56097585366 | F21: of:=[.B21]*[$curvi.$J23] -> 0 | G21: of:=[.C21]*[$curvi.$J23] -> 60.5540998512554
A22: of:=[$curvi.B24] -> 0.4750000001 | B22: 0 | C22: 2439.0243902439 | D22: of:=[.A22]*[.B22] -> 0 | E22: of:=[.A22]*[.C22] -> 1158.53658560976 | F22: of:=[.B22]*[$curvi.$J24] -> 0 | G22: of:=[.C22]*[$curvi.$J24] -> 61.1662354746875
A23: of:=[$curvi.B25] -> 0.5000000001 | B23: 100000 | C23: 2439.0243902439 | D23: of:=[.A23]*[.B23] -> 50000.00001 | E23: of:=[.A23]*[.C23] -> 1219.51219536585 | F23: of:=[.B23]*[$curvi.$J25] -> 2520.43754098562 | G23: of:=[.C23]*[$curvi.$J25] -> 61.4740863655029
A24: of:=[$curvi.B26] -> 0.5250000001 | B24: 0 | C24: 2439.0243902439 | D24: of:=[.A24]*[.B24] -> 0 | E24: of:=[.A24]*[.C24] -> 1280.48780512195 | F24: of:=[.B24]*[$curvi.$J26] -> 0 | G24: of:=[.C24]*[$curvi.$J26] -> 61.4753459180568
A25: of:=[$curvi.B27] -> 0.5500000001 | B25: 0 | C25: 2439.0243902439 | D25: of:=[.A25]*[.B25] -> 0 | E25: of:=[.A25]*[.C25] -> 1341.46341487805 | F25: of:=[.B25]*[$curvi.$J27] -> 0 | G25: of:=[.C25]*[$curvi.$J27] -> 61.1676841542641
A26: of:=[$curvi.B28] -> 0.5750000001 | B26: 0 | C26: 2439.0243902439 | D26: of:=[.A26]*[.B26] -> 0 | E26: of:=[.A26]*[.C26] -> 1402.43902463415 | F26: of:=[.B26]*[$curvi.$J28] -> 0 | G26: of:=[.C26]*[$curvi.$J28] -> 60.5487474268132
A27: of:=[$curvi.B29] -> 0.6000000001 | B27: 0 | C27: 2439.0243902439 | D27: of:=[.A27]*[.B27] -> 0 | E27: of:=[.A27]*[.C27] -> 1463.41463439024 | F27: of:=[.B27]*[$curvi.$J29] -> 0 | G27: of:=[.C27]*[$curvi.$J29] -> 59.6161581178429
A28: of:=[$curvi.B30] -> 0.6250000001 | B28: 0 | C28: 2439.0243902439 | D28: of:=[.A28]*[.B28] -> 0 | E28: of:=[.A28]*[.C28] -> 1524.39024414634 | F28: of:=[.B28]*[$curvi.$J30] -> 0 | G28: of:=[.C28]*[$curvi.$J30] -> 58.3675143330064
A29: of:=[$curvi.B31] -> 0.6500000001 | B29: 0 | C29: 2439.0243902439 | D29: of:=[.A29]*[.B29] -> 0 | E29: of:=[.A29]*[.C29] -> 1585.36585390244 | F29: of:=[.B29]*[$curvi.$J31] -> 0 | G29: of:=[.C29]*[$curvi.$J31] -> 56.8003895908349
A30: of:=[$curvi.B32] -> 0.6750000001 | B30: 0 | C30: 2439.0243902439 | D30: of:=[.A30]*[.B30] -> 0 | E30: of:=[.A30]*[.C30] -> 1646.34146365854 | F30: of:=[.B30]*[$curvi.$J32] -> 0 | G30: of:=[.C30]*[$curvi.$J32] -> 54.9123325073243
A31: of:=[$curvi.B33] -> 0.7000000001 | B31: 0 | C31: 2439.0243902439 | D31: of:=[.A31]*[.B31] -> 0 | E31: of:=[.A31]*[.C31] -> 1707.31707341464 | F31: of:=[.B31]*[$curvi.$J33] -> 0 | G31: of:=[.C31]*[$curvi.$J33] -> 52.7008664756483
A32: of:=[$curvi.B34] -> 0.7250000001 | B32: 0 | C32: 2439.0243902439 | D32: of:=[.A32]*[.B32] -> 0 | E32: of:=[.A32]*[.C32] -> 1768.29268317073 | F32: of:=[.B32]*[$curvi.$J34] -> 0 | G32: of:=[.C32]*[$curvi.$J34] -> 50.1634893409183
A33: of:=[$curvi.B35] -> 0.7500000001 | B33: 0 | C33: 2439.0243902439 | D33: of:=[.A33]*[.B33] -> 0 | E33: of:=[.A33]*[.C33] -> 1829.26829292683 | F33: of:=[.B33]*[$curvi.$J35] -> 0 | G33: of:=[.C33]*[$curvi.$J35] -> 47.2976730698988 | J33: of:=100000/41 -> 2439.0243902439
A34: of:=[$curvi.B36] -> 0.7750000001 | B34: 0 | C34: 2439.0243902439 | D34: of:=[.A34]*[.B34] -> 0 | E34: of:=[.A34]*[.C34] -> 1890.24390268293 | F34: of:=[.B34]*[$curvi.$J36] -> 0 | G34: of:=[.C34]*[$curvi.$J36] -> 44.1008634155816
A35: of:=[$curvi.B37] -> 0.8000000001 | B35: 0 | C35: 2439.0243902439 | D35: of:=[.A35]*[.B35] -> 0 | E35: of:=[.A35]*[.C35] -> 1951.21951243903 | F35: of:=[.B35]*[$curvi.$J37] -> 0 | G35: of:=[.C35]*[$curvi.$J37] -> 40.570479576534
A36: of:=[$curvi.B38] -> 0.825000000100001 | B36: 0 | C36: 2439.0243902439 | D36: of:=[.A36]*[.B36] -> 0 | E36: of:=[.A36]*[.C36] -> 2012.19512219512 | F36: of:=[.B36]*[$curvi.$J38] -> 0 | G36: of:=[.C36]*[$curvi.$J38] -> 36.7039138509169
A37: of:=[$curvi.B39] -> 0.850000000100001 | B37: 0 | C37: 2439.0243902439 | D37: of:=[.A37]*[.B37] -> 0 | E37: of:=[.A37]*[.C37] -> 2073.17073195122 | F37: of:=[.B37]*[$curvi.$J39] -> 0 | G37: of:=[.C37]*[$curvi.$J39] -> 32.4985312850832
A38: of:=[$curvi.B40] -> 0.875000000100001 | B38: 0 | C38: 2439.0243902439 | D38: of:=[.A38]*[.B38] -> 0 | E38: of:=[.A38]*[.C38] -> 2134.14634170732 | F38: of:=[.B38]*[$curvi.$J40] -> 0 | G38: of:=[.C38]*[$curvi.$J40] -> 27.9516693166488
A39: of:=[$curvi.B41] -> 0.900000000100001 | B39: 0 | C39: 2439.0243902439 | D39: of:=[.A39]*[.B39] -> 0 | E39: of:=[.A39]*[.C39] -> 2195.12195146342 | F39: of:=[.B39]*[$curvi.$J41] -> 0 | G39: of:=[.C39]*[$curvi.$J41] -> 23.0606374119432
A40: of:=[$curvi.B42] -> 0.925000000100001 | B40: 0 | C40: 2439.0243902439 | D40: of:=[.A40]*[.B40] -> 0 | E40: of:=[.A40]*[.C40] -> 2256.09756121951 | F40: of:=[.B40]*[$curvi.$J42] -> 0 | G40: of:=[.C40]*[$curvi.$J42] -> 17.82271669773
A41: of:=[$curvi.B43] -> 0.950000000100001 | B41: 0 | C41: 2439.0243902439 | D41: of:=[.A41]*[.B41] -> 0 | E41: of:=[.A41]*[.C41] -> 2317.07317097561 | F41: of:=[.B41]*[$curvi.$J43] -> 0 | G41: of:=[.C41]*[$curvi.$J43] -> 12.2351595870934
A42: of:=[$curvi.B44] -> 0.975000000100001 | B42: 0 | C42: 2439.0243902439 | D42: of:=[.A42]*[.B42] -> 0 | E42: of:=[.A42]*[.C42] -> 2378.04878073171 | F42: of:=[.B42]*[$curvi.$J44] -> 0 | G42: of:=[.C42]*[$curvi.$J44] -> 6.29518939938269
A43: of:=[$curvi.B45] -> 1.0000000001 | B43: 0 | C43: 2439.0243902439 | D43: of:=[.A43]*[.B43] -> 0 | E43: of:=[.A43]*[.C43] -> 2439.02439048781 | F43: of:=[.B43]*[$curvi.$J45] -> -0 | G43: of:=[.C43]*[$curvi.$J45] -> -0.0000000258952750841229
A46: N | B46: of:=SUM([.B3:.B43]) -> 100000 | C46: of:=SUM([.C3:.C43]) -> 100000 | E46: NPE | F46: of:=SUM([.F3:.F43]) -> 2520.43754098562 | G46: of:=SUM([.G3:.G43]) -> 1639.11581203096
A47: taill cible | B47: 100000 | C47: 100000
A48: écart | B48: of:=[.B47]-[.B46] -> 0 | C48: of:=[.C47]-[.C46] -> 0
C50: total events | D50: of:=SUM([.D3:.D43]) -> 50000.00001 | E50: of:=SUM([.E3:.E43]) -> 50000.00001
C51: average Rc | D51: of:=[.D50]/[.B46] -> 0.5000000001 | E51: of:=[.E50]/[.C46] -> 0.500000000100001

Sheet: TEST 2
B1: Abs
A2: Rc | B2: po A | C2: po B | D2: # events A | E2: # events B | F2: NPEs A | G2: NPEs B
A3: of:=[$curvi.B5] -> 0.0000000001 | B3: 20 | C3: 6620 | D3: of:=[.A3]*[.B3] -> 0.000000002 | E3: of:=[.A3]*[.C3] -> 0.000000662 | F3: of:=[.B3]*[$curvi.$J5] -> 0.000000000191958609542557 | G3: of:=[.C3]*[$curvi.$J5] -> 0.0000000635382997585864
A4: of:=[$curvi.B6] -> 0.0250000001 | B4: 50 | C4: 5000 | D4: of:=[.A4]*[.B4] -> 1.250000005 | E4: of:=[.A4]*[.C4] -> 125.0000005 | F4: of:=[.B4]*[$curvi.$J6] -> 0.117256132208862 | G4: of:=[.C4]*[$curvi.$J6] -> 11.7256132208862 | H4: of:=[.B48] -> 0
A5: of:=[$curvi.B7] -> 0.0500000001 | B5: 100 | C5: 4000 | D5: of:=[.A5]*[.B5] -> 5.00000001 | E5: of:=[.A5]*[.C5] -> 200.0000004 | F5: of:=[.B5]*[$curvi.$J7] -> 0.458100105053129 | G5: of:=[.C5]*[$curvi.$J7] -> 18.3240042021252 | H5: of:=[.D51] -> 0.3327512501
A6: of:=[$curvi.B8] -> 0.0750000001 | B6: 250 | C6: 3500 | D6: of:=[.A6]*[.B6] -> 18.750000025 | E6: of:=[.A6]*[.C6] -> 262.50000035 | F6: of:=[.B6]*[$curvi.$J8] -> 1.67671078448892 | G6: of:=[.C6]*[$curvi.$J8] -> 23.4739509828449 | H6: of:=[.H5]-[.E51] -> -0.0554187500000002
A7: of:=[$curvi.B9] -> 0.1000000001 | B7: 560 | C7: 3250 | D7: of:=[.A7]*[.B7] -> 56.000000056 | E7: of:=[.A7]*[.C7] -> 325.000000325 | F7: of:=[.B7]*[$curvi.$J9] -> 4.88423551819832 | G7: of:=[.C7]*[$curvi.$J9] -> 28.3460097038295
A8: of:=[$curvi.B10] -> 0.1250000001 | B8: 1500 | C8: 3100 | D8: of:=[.A8]*[.B8] -> 187.50000015 | E8: of:=[.A8]*[.C8] -> 387.50000031 | F8: of:=[.B8]*[$curvi.$J10] -> 15.9378172791828 | G8: of:=[.C8]*[$curvi.$J10] -> 32.9381557103111
A9: of:=[$curvi.B11] -> 0.1500000001 | B9: 2500 | C9: 2850 | D9: of:=[.A9]*[.B9] -> 375.00000025 | E9: of:=[.A9]*[.C9] -> 427.500000285 | F9: of:=[.B9]*[$curvi.$J11] -> 31.0402871934547 | G9: of:=[.C9]*[$curvi.$J11] -> 35.3859274005383
A10: of:=[$curvi.B12] -> 0.1750000001 | B10: 3000 | C10: 2700 | D10: of:=[.A10]*[.B10] -> 525.0000003 | E10: of:=[.A10]*[.C10] -> 472.50000027 | F10: of:=[.B10]*[$curvi.$J12] -> 42.2812075606524 | G10: of:=[.C10]*[$curvi.$J12] -> 38.0530868045871
A11: of:=[$curvi.B13] -> 0.2000000001 | B11: 4500 | C11: 2650 | D11: of:=[.A11]*[.B11] -> 900.00000045 | E11: of:=[.A11]*[.C11] -> 530.000000265 | F11: of:=[.B11]*[$curvi.$J13] -> 70.4575936389454 | G11: of:=[.C11]*[$curvi.$J13] -> 41.4916940318234
A12: of:=[$curvi.B14] -> 0.2250000001 | B12: 5500 | C12: 2600 | D12: of:=[.A12]*[.B12] -> 1237.50000055 | E12: of:=[.A12]*[.C12] -> 585.00000026 | F12: of:=[.B12]*[$curvi.$J14] -> 94.0818825994261 | G12: of:=[.C12]*[$curvi.$J14] -> 44.4750717742742
A13: of:=[$curvi.B15] -> 0.2500000001 | B13: 6500 | C13: 2550 | D13: of:=[.A13]*[.B13] -> 1625.00000065 | E13: of:=[.A13]*[.C13] -> 637.500000255 | F13: of:=[.B13]*[$curvi.$J15] -> 119.850571362118 | G13: of:=[.C13]*[$curvi.$J15] -> 47.018301072831
A14: of:=[$curvi.B16] -> 0.2750000001 | B14: 7650 | C14: 2530 | D14: of:=[.A14]*[.B14] -> 2103.750000765 | E14: of:=[.A14]*[.C14] -> 695.750000253 | F14: of:=[.B14]*[$curvi.$J16] -> 150.358031616048 | G14: of:=[.C14]*[$curvi.$J16] -> 49.7262509789023
A15: of:=[$curvi.B17] -> 0.3000000001 | B15: 9000 | C15: 2520 | D15: of:=[.A15]*[.B15] -> 2700.0000009 | E15: of:=[.A15]*[.C15] -> 756.000000252 | F15: of:=[.B15]*[$curvi.$J17] -> 186.778960503454 | G15: of:=[.C15]*[$curvi.$J17] -> 52.2981089409671
A16: of:=[$curvi.B18] -> 0.3250000001 | B16: 10500 | C16: 2520 | D16: of:=[.A16]*[.B16] -> 3412.50000105 | E16: of:=[.A16]*[.C16] -> 819.000000252 | F16: of:=[.B16]*[$curvi.$J18] -> 228.20065547702 | G16: of:=[.C16]*[$curvi.$J18] -> 54.7681573144849
A17: of:=[$curvi.B19] -> 0.3500000001 | B17: 11000 | C17: 2520 | D17: of:=[.A17]*[.B17] -> 3850.0000011 | E17: of:=[.A17]*[.C17] -> 882.000000252 | F17: of:=[.B17]*[$curvi.$J19] -> 248.537262012865 | G17: of:=[.C17]*[$curvi.$J19] -> 56.9376272974927
A18: of:=[$curvi.B20] -> 0.3750000001 | B18: 15000 | C18: 2520 | D18: of:=[.A18]*[.B18] -> 5625.0000015 | E18: of:=[.A18]*[.C18] -> 945.000000252 | F18: of:=[.B18]*[$curvi.$J20] -> 350.025442905909 | G18: of:=[.C18]*[$curvi.$J20] -> 58.8042744081926
A19: of:=[$curvi.B21] -> 0.4000000001 | B19: 7175 | C19: 2520 | D19: of:=[.A19]*[.B19] -> 2870.0000007175 | E19: of:=[.A19]*[.C19] -> 1008.000000252 | F19: of:=[.B19]*[$curvi.$J21] -> 171.874937656659 | G19: of:=[.C19]*[$curvi.$J21] -> 60.3658317623389
A20: of:=[$curvi.B22] -> 0.4250000001 | B20: 3500 | C20: 2520 | D20: of:=[.A20]*[.B20] -> 1487.50000035 | E20: of:=[.A20]*[.C20] -> 1071.000000252 | F20: of:=[.B20]*[$curvi.$J22] -> 85.5833469347707 | G20: of:=[.C20]*[$curvi.$J22] -> 61.6200097930349
A21: of:=[$curvi.B23] -> 0.4500000001 | B21: 2500 | C21: 2520 | D21: of:=[.A21]*[.B21] -> 1125.00000025 | E21: of:=[.A21]*[.C21] -> 1134.000000252 | F21: of:=[.B21]*[$curvi.$J23] -> 62.0679523475368 | G21: of:=[.C21]*[$curvi.$J23] -> 62.5644959663171
A22: of:=[$curvi.B24] -> 0.4750000001 | B22: 2250 | C22: 2520 | D22: of:=[.A22]*[.B22] -> 1068.750000225 | E22: of:=[.A22]*[.C22] -> 1197.000000252 | F22: of:=[.B22]*[$curvi.$J24] -> 56.4258522253992 | G22: of:=[.C22]*[$curvi.$J24] -> 63.1969544924471
A23: of:=[$curvi.B25] -> 0.5000000001 | B23: 1700 | C23: 2520 | D23: of:=[.A23]*[.B23] -> 850.00000017 | E23: of:=[.A23]*[.C23] -> 1260.000000252 | F23: of:=[.B23]*[$curvi.$J25] -> 42.8474381967556 | G23: of:=[.C23]*[$curvi.$J25] -> 63.5150260328376
A24: of:=[$curvi.B26] -> 0.5250000001 | B24: 1100 | C24: 2520 | D24: of:=[.A24]*[.B24] -> 577.50000011 | E24: of:=[.A24]*[.C24] -> 1323.000000252 | F24: of:=[.B24]*[$curvi.$J26] -> 27.7253810090436 | G24: of:=[.C24]*[$curvi.$J26] -> 63.5163274025363
A25: of:=[$curvi.B27] -> 0.5500000001 | B25: 900 | C25: 2520 | D25: of:=[.A25]*[.B25] -> 495.00000009 | E25: of:=[.A25]*[.C25] -> 1386.000000252 | F25: of:=[.B25]*[$curvi.$J27] -> 22.5708754529234 | G25: of:=[.C25]*[$curvi.$J27] -> 63.1984512681856
A26: of:=[$curvi.B28] -> 0.5750000001 | B26: 800 | C26: 2520 | D26: of:=[.A26]*[.B26] -> 460.00000008 | E26: of:=[.A26]*[.C26] -> 1449.000000252 | F26: of:=[.B26]*[$curvi.$J28] -> 19.8599891559947 | G26: of:=[.C26]*[$curvi.$J28] -> 62.5589658413834
A27: of:=[$curvi.B29] -> 0.6000000001 | B27: 500 | C27: 2520 | D27: of:=[.A27]*[.B27] -> 300.00000005 | E27: of:=[.A27]*[.C27] -> 1512.000000252 | F27: of:=[.B27]*[$curvi.$J29] -> 12.2213124141578 | G27: of:=[.C27]*[$curvi.$J29] -> 61.5954145673553
A28: of:=[$curvi.B30] -> 0.6250000001 | B28: 400 | C28: 2520 | D28: of:=[.A28]*[.B28] -> 250.00000004 | E28: of:=[.A28]*[.C28] -> 1575.000000252 | F28: of:=[.B28]*[$curvi.$J30] -> 9.57227235061304 | G28: of:=[.C28]*[$curvi.$J30] -> 60.3053158088622
A29: of:=[$curvi.B31] -> 0.6500000001 | B29: 300 | C29: 2520 | D29: of:=[.A29]*[.B29] -> 195.00000003 | E29: of:=[.A29]*[.C29] -> 1638.000000252 | F29: of:=[.B29]*[$curvi.$J31] -> 6.98644791967269 | G29: of:=[.C29]*[$curvi.$J31] -> 58.6861625252506
A30: of:=[$curvi.B32] -> 0.6750000001 | B30: 200 | C30: 2520 | D30: of:=[.A30]*[.B30] -> 135.00000002 | E30: of:=[.A30]*[.C30] -> 1701.000000252 | F30: of:=[.B30]*[$curvi.$J32] -> 4.50281126560059 | G30: of:=[.C30]*[$curvi.$J32] -> 56.7354219465675
A31: of:=[$curvi.B33] -> 0.7000000001 | B31: 150 | C31: 2520 | D31: of:=[.A31]*[.B31] -> 105.000000015 | E31: of:=[.A31]*[.C31] -> 1764.000000252 | F31: of:=[.B31]*[$curvi.$J33] -> 3.24110328825237 | G31: of:=[.C31]*[$curvi.$J33] -> 54.4505352426398
A32: of:=[$curvi.B34] -> 0.7250000001 | B32: 135 | C32: 2450 | D32: of:=[.A32]*[.B32] -> 97.8750000135001 | E32: of:=[.A32]*[.C32] -> 1776.250000245 | F32: of:=[.B32]*[$curvi.$J34] -> 2.77654913501983 | G32: of:=[.C32]*[$curvi.$J34] -> 50.3892250429524
A33: of:=[$curvi.B35] -> 0.7500000001 | B33: 120 | C33: 2400 | D33: of:=[.A33]*[.B33] -> 90.0000000120001 | E33: of:=[.A33]*[.C33] -> 1800.00000024 | F33: of:=[.B33]*[$curvi.$J35] -> 2.32704551503902 | G33: of:=[.C33]*[$curvi.$J35] -> 46.5409103007804
A34: of:=[$curvi.B36] -> 0.7750000001 | B34: 110 | C34: 2250 | D34: of:=[.A34]*[.B34] -> 85.2500000110001 | E34: of:=[.A34]*[.C34] -> 1743.750000225 | F34: of:=[.B34]*[$curvi.$J36] -> 1.98894894004273 | G34: of:=[.C34]*[$curvi.$J36] -> 40.683046500874
A35: of:=[$curvi.B37] -> 0.8000000001 | B35: 100 | C35: 2100 | D35: of:=[.A35]*[.B35] -> 80.0000000100001 | E35: of:=[.A35]*[.C35] -> 1680.00000021 | F35: of:=[.B35]*[$curvi.$J37] -> 1.66338966263789 | G35: of:=[.C35]*[$curvi.$J37] -> 34.9311829153957
A36: of:=[$curvi.B38] -> 0.825000000100001 | B36: 90 | C36: 1800 | D36: of:=[.A36]*[.B36] -> 74.250000009 | E36: of:=[.A36]*[.C36] -> 1485.00000018 | F36: of:=[.B36]*[$curvi.$J38] -> 1.35437442109883 | G36: of:=[.C36]*[$curvi.$J38] -> 27.0874884219767
A37: of:=[$curvi.B39] -> 0.850000000100001 | B37: 80 | C37: 1550 | D37: of:=[.A37]*[.B37] -> 68.000000008 | E37: of:=[.A37]*[.C37] -> 1317.500000155 | F37: of:=[.B37]*[$curvi.$J39] -> 1.06595182615073 | G37: of:=[.C37]*[$curvi.$J39] -> 20.6528166316704
A38: of:=[$curvi.B40] -> 0.875000000100001 | B38: 70 | C38: 1300 | D38: of:=[.A38]*[.B38] -> 61.250000007 | E38: of:=[.A38]*[.C38] -> 1137.50000013 | F38: of:=[.B38]*[$curvi.$J40] -> 0.802212909387819 | G38: of:=[.C38]*[$curvi.$J40] -> 14.8982397457738
A39: of:=[$curvi.B41] -> 0.900000000100001 | B39: 60 | C39: 950 | D39: of:=[.A39]*[.B39] -> 54.000000006 | E39: of:=[.A39]*[.C39] -> 855.000000095001 | F39: of:=[.B39]*[$curvi.$J41] -> 0.567291680333804 | G39: of:=[.C39]*[$curvi.$J41] -> 8.98211827195189
A40: of:=[$curvi.B42] -> 0.925000000100001 | B40: 50 | C40: 500 | D40: of:=[.A40]*[.B40] -> 46.250000005 | E40: of:=[.A40]*[.C40] -> 462.50000005 | F40: of:=[.B40]*[$curvi.$J42] -> 0.365365692303465 | G40: of:=[.C40]*[$curvi.$J42] -> 3.65365692303465
A41: of:=[$curvi.B43] -> 0.950000000100001 | B41: 40 | C41: 300 | D41: of:=[.A41]*[.B41] -> 38.000000004 | E41: of:=[.A41]*[.C41] -> 285.00000003 | F41: of:=[.B41]*[$curvi.$J43] -> 0.200656617228332 | G41: of:=[.C41]*[$curvi.$J43] -> 1.50492462921249
A42: of:=[$curvi.B44] -> 0.975000000100001 | B42: 30 | C42: 150 | D42: of:=[.A42]*[.B42] -> 29.250000003 | E42: of:=[.A42]*[.C42] -> 146.250000015 | F42: of:=[.B42]*[$curvi.$J44] -> 0.0774308296124071 | G42: of:=[.C42]*[$curvi.$J44] -> 0.387154148062036
A43: of:=[$curvi.B45] -> 1.0000000001 | B43: 10 | C43: 60 | D43: of:=[.A43]*[.B43] -> 10.000000001 | E43: of:=[.A43]*[.C43] -> 60.000000006 | F43: of:=[.B43]*[$curvi.$J45] -> -0.000000000106170627844904 | G43: of:=[.C43]*[$curvi.$J45] -> -0.000000000637023767069422
A46: N | B46: of:=SUM([.B3:.B43]) -> 100000 | C46: of:=SUM([.C3:.C43]) -> 100000 | E46: NPE | F46: of:=SUM([.F3:.F43]) -> 2083.35495213534 | G46: of:=SUM([.G3:.G43]) -> 1635.78591008843
A47: taill cible | B47: 100000 | C47: 100000
A48: écart | B48: of:=[.B47]-[.B46] -> 0 | C48: of:=[.C47]-[.C46] -> 0
C50: total events | D50: of:=SUM([.D3:.D43]) -> 33275.12501 | E50: of:=SUM([.E3:.E43]) -> 38817.00001
C51: average Rc | D51: of:=[.D50]/[.B46] -> 0.3327512501 | E51: of:=[.E50]/[.C46] -> 0.3881700001