Sheet: curvi
I1: max BA (1) | J1: max BA (2)
I2: of:=MAX([.I5:.I45]) -> 0.500219333987637 | J2: of:=MAX([.J5:.J45]) -> 0.251613220637903
A4: Rc | B4: Rt total (1) | C4: Rt total (2) | D4: NNT total (1) | E4: RR total (1) | F4: OR total (1) | G4: Rt+ | H4: Rt- | I4: BA (1) | J4: BA (2) | K4: pas | M4: dose | N4: gamma | O4: ED50 | P4: S | Q4: Emax
A5: 0.0000000001 | B5: of:=[.G5] -> 0.0000000000110981173424306 | C5: of:=[.G5]+[.H5] -> 0.0000000000460981173424306 | D5: of:=1/([.A5]-[.B5]) -> 11248355716.5126 | E5: of:=[.B5]/[.A5] -> 0.110981173424306 | F5: of:=([.B5]/(1-[.B5]))/([.A5]/(1-[.A5])) -> 0.110981173414439 | G5: of:=([.A5]*[.$L$5])/(1-[.A5]+([.A5]*[.$L$5])) -> 0.0000000000110981173424306 | H5: of:=[.$K$7]*[.A5] -> 0.000000000035 | I5: of:=[.A5]-[.B5] -> 0.0000000000889018826575695 | J5: of:=[.A5]-[.C5] -> 0.0000000000539018826575694 | K5: 0.025 | L5: of:=([.P5]*[.Q5]*(POWER([.M5];[.N5])))/((POWER([.O5];[.N5]))+(POWER([.M5];[.N5]))) -> 0.110981173414439 | M5: 3.5 | N5: 3 | O5: 30 | P5: 2 | Q5: 35
A6: of:=[.A5]+[.$K$5] -> 0.0250000001 | B6: of:=[.G6] -> 0.00283759625912667 | C6: of:=[.G6]+[.H6] -> 0.0115875962941267 | D6: of:=1/([.A6]-[.B6]) -> 45.1214591693224 | E6: of:=[.B6]/[.A6] -> 0.113503849911052 | F6: of:=([.B6]/(1-[.B6]))/([.A6]/(1-[.A6])) -> 0.110981173414439 | G6: of:=([.A6]*[.$L$5])/(1-[.A6]+([.A6]*[.$L$5])) -> 0.00283759625912667 | H6: of:=[.$K$7]*[.A6] -> 0.008750000035 | I6: of:=[.A6]-[.B6] -> 0.0221624038408733 | J6: of:=[.A6]-[.C6] -> 0.0134124038058733 | K6: coeff iatro
A7: of:=[.A6]+[.$K$5] -> 0.0500000001 | B7: of:=[.G7] -> 0.00580719391849511 | C7: of:=[.G7]+[.H7] -> 0.0233071939534951 | D7: of:=1/([.A7]-[.B7]) -> 22.6281172526788 | E7: of:=[.B7]/[.A7] -> 0.116143878137614 | F7: of:=([.B7]/(1-[.B7]))/([.A7]/(1-[.A7])) -> 0.110981173414439 | G7: of:=([.A7]*[.$L$5])/(1-[.A7]+([.A7]*[.$L$5])) -> 0.00580719391849511 | H7: of:=[.$K$7]*[.A7] -> 0.017500000035 | I7: of:=[.A7]-[.B7] -> 0.0441928061815049 | J7: of:=[.A7]-[.C7] -> 0.0266928061465049 | K7: 0.35
A8: of:=[.A7]+[.$K$5] -> 0.0750000001 | B8: of:=[.G8] -> 0.00891822313818951 | C8: of:=[.G8]+[.H8] -> 0.0351682231731895 | D8: of:=1/([.A8]-[.B8]) -> 15.1327649766124 | E8: of:=[.B8]/[.A8] -> 0.118909641683981 | F8: of:=([.B8]/(1-[.B8]))/([.A8]/(1-[.A8])) -> 0.110981173414439 | G8: of:=([.A8]*[.$L$5])/(1-[.A8]+([.A8]*[.$L$5])) -> 0.00891822313818951 | H8: of:=[.$K$7]*[.A8] -> 0.026250000035 | I8: of:=[.A8]-[.B8] -> 0.0660817769618105 | J8: of:=[.A8]-[.C8] -> 0.0398317769268105
A9: of:=[.A8]+[.$K$5] -> 0.1000000001 | B9: of:=[.G9] -> 0.0121810342293417 | C9: of:=[.G9]+[.H9] -> 0.0471810342643417 | D9: of:=1/([.A9]-[.B9]) -> 11.3870618958645 | E9: of:=[.B9]/[.A9] -> 0.121810342171607 | F9: of:=([.B9]/(1-[.B9]))/([.A9]/(1-[.A9])) -> 0.110981173414439 | G9: of:=([.A9]*[.$L$5])/(1-[.A9]+([.A9]*[.$L$5])) -> 0.0121810342293417 | H9: of:=[.$K$7]*[.A9] -> 0.035000000035 | I9: of:=[.A9]-[.B9] -> 0.0878189658706583 | J9: of:=[.A9]-[.C9] -> 0.0528189658356583
A10: of:=[.A9]+[.$K$5] -> 0.1250000001 | B10: of:=[.G10] -> 0.0156070127044135 | C10: of:=[.G10]+[.H10] -> 0.0593570127394135 | D10: of:=1/([.A10]-[.B10]) -> 9.14135379065756 | E10: of:=[.B10]/[.A10] -> 0.124856101535423 | F10: of:=([.B10]/(1-[.B10]))/([.A10]/(1-[.A10])) -> 0.110981173414439 | G10: of:=([.A10]*[.$L$5])/(1-[.A10]+([.A10]*[.$L$5])) -> 0.0156070127044135 | H10: of:=[.$K$7]*[.A10] -> 0.043750000035 | I10: of:=[.A10]-[.B10] -> 0.109392987395587 | J10: of:=[.A10]-[.C10] -> 0.0656429873605865
A11: of:=[.A10]+[.$K$5] -> 0.1500000001 | B11: of:=[.G11] -> 0.0192087120177012 | C11: of:=[.G11]+[.H11] -> 0.0717087120527012 | D11: of:=1/([.A11]-[.B11]) -> 7.64576918434171 | E11: of:=[.B11]/[.A11] -> 0.128058080032636 | F11: of:=([.B11]/(1-[.B11]))/([.A11]/(1-[.A11])) -> 0.110981173414439 | G11: of:=([.A11]*[.$L$5])/(1-[.A11]+([.A11]*[.$L$5])) -> 0.0192087120177012 | H11: of:=[.$K$7]*[.A11] -> 0.052500000035 | I11: of:=[.A11]-[.B11] -> 0.130791288082299 | J11: of:=[.A11]-[.C11] -> 0.0782912880472988
A12: of:=[.A11]+[.$K$5] -> 0.1750000001 | B12: of:=[.G12] -> 0.0230000072684969 | C12: of:=[.G12]+[.H12] -> 0.0842500073034969 | D12: of:=1/([.A12]-[.B12]) -> 6.57894767869188 | E12: of:=[.B12]/[.A12] -> 0.131428612887738 | F12: of:=([.B12]/(1-[.B12]))/([.A12]/(1-[.A12])) -> 0.110981173414439 | G12: of:=([.A12]*[.$L$5])/(1-[.A12]+([.A12]*[.$L$5])) -> 0.0230000072684969 | H12: of:=[.$K$7]*[.A12] -> 0.061250000035 | I12: of:=[.A12]-[.B12] -> 0.151999992831503 | J12: of:=[.A12]-[.C12] -> 0.0907499927965031
A13: of:=[.A12]+[.$K$5] -> 0.2000000001 | B13: of:=[.G13] -> 0.0269962738335171 | C13: of:=[.G13]+[.H13] -> 0.0969962738685171 | D13: of:=1/([.A13]-[.B13]) -> 5.78022231994974 | E13: of:=[.B13]/[.A13] -> 0.134981369100095 | F13: of:=([.B13]/(1-[.B13]))/([.A13]/(1-[.A13])) -> 0.110981173414439 | G13: of:=([.A13]*[.$L$5])/(1-[.A13]+([.A13]*[.$L$5])) -> 0.0269962738335171 | H13: of:=[.$K$7]*[.A13] -> 0.070000000035 | I13: of:=[.A13]-[.B13] -> 0.173003726266483 | J13: of:=[.A13]-[.C13] -> 0.103003726231483
A14: of:=[.A13]+[.$K$5] -> 0.2250000001 | B14: of:=[.G14] -> 0.0312145957768431 | C14: of:=[.G14]+[.H14] -> 0.109964595811843 | D14: of:=1/([.A14]-[.B14]) -> 5.16034736203557 | E14: of:=[.B14]/[.A14] -> 0.138731536724311 | F14: of:=([.B14]/(1-[.B14]))/([.A14]/(1-[.A14])) -> 0.110981173414439 | G14: of:=([.A14]*[.$L$5])/(1-[.A14]+([.A14]*[.$L$5])) -> 0.0312145957768431 | H14: of:=[.$K$7]*[.A14] -> 0.078750000035 | I14: of:=[.A14]-[.B14] -> 0.193785404323157 | J14: of:=[.A14]-[.C14] -> 0.115035404288157
A15: of:=[.A14]+[.$K$5] -> 0.2500000001 | B15: of:=[.G15] -> 0.0356740099939952 | C15: of:=[.G15]+[.H15] -> 0.123174010028995 | D15: of:=1/([.A15]-[.B15]) -> 4.66578971362924 | E15: of:=[.B15]/[.A15] -> 0.142696039918902 | F15: of:=([.B15]/(1-[.B15]))/([.A15]/(1-[.A15])) -> 0.110981173414439 | G15: of:=([.A15]*[.$L$5])/(1-[.A15]+([.A15]*[.$L$5])) -> 0.0356740099939952 | H15: of:=[.$K$7]*[.A15] -> 0.087500000035 | I15: of:=[.A15]-[.B15] -> 0.214325990106005 | J15: of:=[.A15]-[.C15] -> 0.126825990071005
A16: of:=[.A15]+[.$K$5] -> 0.2750000001 | B16: of:=[.G16] -> 0.0403957934485915 | C16: of:=[.G16]+[.H16] -> 0.136645793483592 | D16: of:=1/([.A16]-[.B16]) -> 4.26249816349572 | E16: of:=[.B16]/[.A16] -> 0.146893794305099 | F16: of:=([.B16]/(1-[.B16]))/([.A16]/(1-[.A16])) -> 0.110981173414439 | G16: of:=([.A16]*[.$L$5])/(1-[.A16]+([.A16]*[.$L$5])) -> 0.0403957934485915 | H16: of:=[.$K$7]*[.A16] -> 0.096250000035 | I16: of:=[.A16]-[.B16] -> 0.234604206651408 | J16: of:=[.A16]-[.C16] -> 0.138354206616408
A17: of:=[.A16]+[.$K$5] -> 0.3000000001 | B17: of:=[.G17] -> 0.0454038026442642 | C17: of:=[.G17]+[.H17] -> 0.150403802679264 | D17: of:=1/([.A17]-[.B17]) -> 3.92778843515077 | E17: of:=[.B17]/[.A17] -> 0.151346008763765 | F17: of:=([.B17]/(1-[.B17]))/([.A17]/(1-[.A17])) -> 0.110981173414439 | G17: of:=([.A17]*[.$L$5])/(1-[.A17]+([.A17]*[.$L$5])) -> 0.0454038026442642 | H17: of:=[.$K$7]*[.A17] -> 0.105000000035 | I17: of:=[.A17]-[.B17] -> 0.254596197455736 | J17: of:=[.A17]-[.C17] -> 0.149596197420736
A18: of:=[.A17]+[.$K$5] -> 0.3250000001 | B18: of:=[.G18] -> 0.0507248767606454 | C18: of:=[.G18]+[.H18] -> 0.164474876795645 | D18: of:=1/([.A18]-[.B18]) -> 3.64597411469476 | E18: of:=[.B18]/[.A18] -> 0.156076543830885 | F18: of:=([.B18]/(1-[.B18]))/([.A18]/(1-[.A18])) -> 0.110981173414439 | G18: of:=([.A18]*[.$L$5])/(1-[.A18]+([.A18]*[.$L$5])) -> 0.0507248767606454 | H18: of:=[.$K$7]*[.A18] -> 0.113750000035 | I18: of:=[.A18]-[.B18] -> 0.274275123339355 | J18: of:=[.A18]-[.C18] -> 0.160525123304355
A19: of:=[.A18]+[.$K$5] -> 0.3500000001 | B19: of:=[.G19] -> 0.0563893188322312 | C19: of:=[.G19]+[.H19] -> 0.178889318867231 | D19: of:=1/([.A19]-[.B19]) -> 3.40587064367735 | E19: of:=[.B19]/[.A19] -> 0.161112339474628 | F19: of:=([.B19]/(1-[.B19]))/([.A19]/(1-[.A19])) -> 0.110981173414439 | G19: of:=([.A19]*[.$L$5])/(1-[.A19]+([.A19]*[.$L$5])) -> 0.0563893188322312 | H19: of:=[.$K$7]*[.A19] -> 0.122500000035 | I19: of:=[.A19]-[.B19] -> 0.293610681267769 | J19: of:=[.A19]-[.C19] -> 0.171110681232769
A20: of:=[.A19]+[.$K$5] -> 0.3750000001 | B20: of:=[.G20] -> 0.0624314731841214 | C20: of:=[.G20]+[.H20] -> 0.193681473219121 | D20: of:=1/([.A20]-[.B20]) -> 3.19929843822417 | E20: of:=[.B20]/[.A20] -> 0.166483928446595 | F20: of:=([.B20]/(1-[.B20]))/([.A20]/(1-[.A20])) -> 0.110981173414439 | G20: of:=([.A20]*[.$L$5])/(1-[.A20]+([.A20]*[.$L$5])) -> 0.0624314731841214 | H20: of:=[.$K$7]*[.A20] -> 0.131250000035 | I20: of:=[.A20]-[.B20] -> 0.312568526915879 | J20: of:=[.A20]-[.C20] -> 0.181318526880879
A21: of:=[.A20]+[.$K$5] -> 0.4000000001 | B21: of:=[.G21] -> 0.0688904223643244 | C21: of:=[.G21]+[.H21] -> 0.208890422399324 | D21: of:=1/([.A21]-[.B21]) -> 3.0201482144932 | E21: of:=[.B21]/[.A21] -> 0.172226055867754 | F21: of:=([.B21]/(1-[.B21]))/([.A21]/(1-[.A21])) -> 0.110981173414439 | G21: of:=([.A21]*[.$L$5])/(1-[.A21]+([.A21]*[.$L$5])) -> 0.0688904223643244 | H21: of:=[.$K$7]*[.A21] -> 0.140000000035 | I21: of:=[.A21]-[.B21] -> 0.331109577735676 | J21: of:=[.A21]-[.C21] -> 0.191109577700676
A22: of:=[.A21]+[.$K$5] -> 0.4250000001 | B22: of:=[.G22] -> 0.0758108334537872 | C22: of:=[.G22]+[.H22] -> 0.224560833488787 | D22: of:=1/([.A22]-[.B22]) -> 2.86377727466318 | E22: of:=[.B22]/[.A22] -> 0.178378431613998 | F22: of:=([.B22]/(1-[.B22]))/([.A22]/(1-[.A22])) -> 0.110981173414439 | G22: of:=([.A22]*[.$L$5])/(1-[.A22]+([.A22]*[.$L$5])) -> 0.0758108334537872 | H22: of:=[.$K$7]*[.A22] -> 0.148750000035 | I22: of:=[.A22]-[.B22] -> 0.349189166646213 | J22: of:=[.A22]-[.C22] -> 0.200439166611213
A23: of:=[.A22]+[.$K$5] -> 0.4500000001 | B23: of:=[.G23] -> 0.0832439924911451 | C23: of:=[.G23]+[.H23] -> 0.240743992526145 | D23: of:=1/([.A23]-[.B23]) -> 2.72660836974346 | E23: of:=[.B23]/[.A23] -> 0.184986649939214 | F23: of:=([.B23]/(1-[.B23]))/([.A23]/(1-[.A23])) -> 0.110981173414439 | G23: of:=([.A23]*[.$L$5])/(1-[.A23]+([.A23]*[.$L$5])) -> 0.0832439924911451 | H23: of:=[.$K$7]*[.A23] -> 0.157500000035 | I23: of:=[.A23]-[.B23] -> 0.366756007608855 | J23: of:=[.A23]-[.C23] -> 0.209256007573855
A24: of:=[.A23]+[.$K$5] -> 0.4750000001 | B24: of:=[.G24] -> 0.0912490776712775 | C24: of:=[.G24]+[.H24] -> 0.257499077706278 | D24: of:=1/([.A24]-[.B24]) -> 2.60585692842403 | E24: of:=[.B24]/[.A24] -> 0.192103321372773 | F24: of:=([.B24]/(1-[.B24]))/([.A24]/(1-[.A24])) -> 0.110981173414439 | G24: of:=([.A24]*[.$L$5])/(1-[.A24]+([.A24]*[.$L$5])) -> 0.0912490776712775 | H24: of:=[.$K$7]*[.A24] -> 0.166250000035 | I24: of:=[.A24]-[.B24] -> 0.383750922428723 | J24: of:=[.A24]-[.C24] -> 0.217500922393722
A25: of:=[.A24]+[.$K$5] -> 0.5000000001 | B25: of:=[.G25] -> 0.0998947381919287 | C25: of:=[.G25]+[.H25] -> 0.274894738226929 | D25: of:=1/([.A25]-[.B25]) -> 2.49934228615509 | E25: of:=[.B25]/[.A25] -> 0.199789476343899 | F25: of:=([.B25]/(1-[.B25]))/([.A25]/(1-[.A25])) -> 0.110981173414439 | G25: of:=([.A25]*[.$L$5])/(1-[.A25]+([.A25]*[.$L$5])) -> 0.0998947381919287 | H25: of:=[.$K$7]*[.A25] -> 0.175000000035 | I25: of:=[.A25]-[.B25] -> 0.400105261908072 | J25: of:=[.A25]-[.C25] -> 0.225105261873071
A26: of:=[.A25]+[.$K$5] -> 0.5250000001 | B26: of:=[.G26] -> 0.109261067920182 | C26: of:=[.G26]+[.H26] -> 0.293011067955182 | D26: of:=1/([.A26]-[.B26]) -> 2.40535567539167 | E26: of:=[.B26]/[.A26] -> 0.208116319808325 | F26: of:=([.B26]/(1-[.B26]))/([.A26]/(1-[.A26])) -> 0.110981173414439 | G26: of:=([.A26]*[.$L$5])/(1-[.A26]+([.A26]*[.$L$5])) -> 0.109261067920182 | H26: of:=[.$K$7]*[.A26] -> 0.183750000035 | I26: of:=[.A26]-[.B26] -> 0.415738932179818 | J26: of:=[.A26]-[.C26] -> 0.231988932144818
A27: of:=[.A26]+[.$K$5] -> 0.5500000001 | B27: of:=[.G27] -> 0.119442094075727 | C27: of:=[.G27]+[.H27] -> 0.311942094110727 | D27: of:=1/([.A27]-[.B27]) -> 2.32256796590706 | E27: of:=[.B27]/[.A27] -> 0.217167443734564 | F27: of:=([.B27]/(1-[.B27]))/([.A27]/(1-[.A27])) -> 0.110981173414439 | G27: of:=([.A27]*[.$L$5])/(1-[.A27]+([.A27]*[.$L$5])) -> 0.119442094075727 | H27: of:=[.$K$7]*[.A27] -> 0.192500000035 | I27: of:=[.A27]-[.B27] -> 0.430557906024273 | J27: of:=[.A27]-[.C27] -> 0.238057905989273
A28: of:=[.A27]+[.$K$5] -> 0.5750000001 | B28: of:=[.G28] -> 0.130548944848898 | C28: of:=[.G28]+[.H28] -> 0.331798944883898 | D28: of:=1/([.A28]-[.B28]) -> 2.24996653328909 | E28: of:=[.B28]/[.A28] -> 0.22704164317599 | F28: of:=([.B28]/(1-[.B28]))/([.A28]/(1-[.A28])) -> 0.110981173414439 | G28: of:=([.A28]*[.$L$5])/(1-[.A28]+([.A28]*[.$L$5])) -> 0.130548944848898 | H28: of:=[.$K$7]*[.A28] -> 0.201250000035 | I28: of:=[.A28]-[.B28] -> 0.444451055251102 | J28: of:=[.A28]-[.C28] -> 0.243201055216102
A29: of:=[.A28]+[.$K$5] -> 0.6000000001 | B29: of:=[.G29] -> 0.142713922335986 | C29: of:=[.G29]+[.H29] -> 0.352713922370986 | D29: of:=1/([.A29]-[.B29]) -> 2.18681488159379 | E29: of:=[.B29]/[.A29] -> 0.237856537187 | F29: of:=([.B29]/(1-[.B29]))/([.A29]/(1-[.A29])) -> 0.110981173414439 | G29: of:=([.A29]*[.$L$5])/(1-[.A29]+([.A29]*[.$L$5])) -> 0.142713922335986 | H29: of:=[.$K$7]*[.A29] -> 0.210000000035 | I29: of:=[.A29]-[.B29] -> 0.457286077764014 | J29: of:=[.A29]-[.C29] -> 0.247286077729014
A30: of:=[.A29]+[.$K$5] -> 0.6250000001 | B30: of:=[.G30] -> 0.156095797757091 | C30: of:=[.G30]+[.H30] -> 0.374845797792091 | D30: of:=1/([.A30]-[.B30]) -> 2.13263177212624 | E30: of:=[.B30]/[.A30] -> 0.249753276371385 | F30: of:=([.B30]/(1-[.B30]))/([.A30]/(1-[.A30])) -> 0.110981173414439 | G30: of:=([.A30]*[.$L$5])/(1-[.A30]+([.A30]*[.$L$5])) -> 0.156095797757091 | H30: of:=[.$K$7]*[.A30] -> 0.218750000035 | I30: of:=[.A30]-[.B30] -> 0.468904202342909 | J30: of:=[.A30]-[.C30] -> 0.250154202307909
A31: of:=[.A30]+[.$K$5] -> 0.6500000001 | B31: of:=[.G31] -> 0.170886779427097 | C31: of:=[.G31]+[.H31] -> 0.398386779462097 | D31: of:=1/([.A31]-[.B31]) -> 2.08718932572039 | E31: of:=[.B31]/[.A31] -> 0.262902737539702 | F31: of:=([.B31]/(1-[.B31]))/([.A31]/(1-[.A31])) -> 0.110981173414439 | G31: of:=([.A31]*[.$L$5])/(1-[.A31]+([.A31]*[.$L$5])) -> 0.170886779427097 | H31: of:=[.$K$7]*[.A31] -> 0.227500000035 | I31: of:=[.A31]-[.B31] -> 0.479113220672903 | J31: of:=[.A31]-[.C31] -> 0.251613220637903
A32: of:=[.A31]+[.$K$5] -> 0.6750000001 | B32: of:=[.G32] -> 0.187321804232621 | C32: of:=[.G32]+[.H32] -> 0.423571804267621 | D32: of:=1/([.A32]-[.B32]) -> 2.05053252016201 | E32: of:=[.B32]/[.A32] -> 0.277513784007214 | F32: of:=([.B32]/(1-[.B32]))/([.A32]/(1-[.A32])) -> 0.110981173414439 | G32: of:=([.A32]*[.$L$5])/(1-[.A32]+([.A32]*[.$L$5])) -> 0.187321804232621 | H32: of:=[.$K$7]*[.A32] -> 0.236250000035 | I32: of:=[.A32]-[.B32] -> 0.48767819586738 | J32: of:=[.A32]-[.C32] -> 0.251428195832379
A33: of:=[.A32]+[.$K$5] -> 0.7000000001 | B33: of:=[.G33] -> 0.205691109723022 | C33: of:=[.G33]+[.H33] -> 0.450691109758022 | D33: of:=1/([.A33]-[.B33]) -> 2.02302653152235 | E33: of:=[.B33]/[.A33] -> 0.293844442419482 | F33: of:=([.B33]/(1-[.B33]))/([.A33]/(1-[.A33])) -> 0.110981173414439 | G33: of:=([.A33]*[.$L$5])/(1-[.A33]+([.A33]*[.$L$5])) -> 0.205691109723022 | H33: of:=[.$K$7]*[.A33] -> 0.245000000035 | I33: of:=[.A33]-[.B33] -> 0.494308890376979 | J33: of:=[.A33]-[.C33] -> 0.249308890341978
A34: of:=[.A33]+[.$K$5] -> 0.7250000001 | B34: of:=[.G34] -> 0.226357522674336 | C34: of:=[.G34]+[.H34] -> 0.480107522709336 | D34: of:=1/([.A34]-[.B34]) -> 2.00544487337438 | E34: of:=[.B34]/[.A34] -> 0.312217272611192 | F34: of:=([.B34]/(1-[.B34]))/([.A34]/(1-[.A34])) -> 0.110981173414439 | G34: of:=([.A34]*[.$L$5])/(1-[.A34]+([.A34]*[.$L$5])) -> 0.226357522674336 | H34: of:=[.$K$7]*[.A34] -> 0.253750000035 | I34: of:=[.A34]-[.B34] -> 0.498642477425665 | J34: of:=[.A34]-[.C34] -> 0.244892477390664
A35: of:=[.A34]+[.$K$5] -> 0.7500000001 | B35: of:=[.G35] -> 0.249780666112363 | C35: of:=[.G35]+[.H35] -> 0.512280666147363 | D35: of:=1/([.A35]-[.B35]) -> 1.99912304873989 | E35: of:=[.B35]/[.A35] -> 0.333040888105412 | F35: of:=([.B35]/(1-[.B35]))/([.A35]/(1-[.A35])) -> 0.110981173414439 | G35: of:=([.A35]*[.$L$5])/(1-[.A35]+([.A35]*[.$L$5])) -> 0.249780666112363 | H35: of:=[.$K$7]*[.A35] -> 0.262500000035 | I35: of:=[.A35]-[.B35] -> 0.500219333987637 | J35: of:=[.A35]-[.C35] -> 0.237719333952637
A36: of:=[.A35]+[.$K$5] -> 0.7750000001 | B36: of:=[.G36] -> 0.276551545650382 | C36: of:=[.G36]+[.H36] -> 0.547801545685382 | D36: of:=1/([.A36]-[.B36]) -> 2.00622550049672 | E36: of:=[.B36]/[.A36] -> 0.356840704018965 | F36: of:=([.B36]/(1-[.B36]))/([.A36]/(1-[.A36])) -> 0.110981173414439 | G36: of:=([.A36]*[.$L$5])/(1-[.A36]+([.A36]*[.$L$5])) -> 0.276551545650382 | H36: of:=[.$K$7]*[.A36] -> 0.271250000035 | I36: of:=[.A36]-[.B36] -> 0.498448454449618 | J36: of:=[.A36]-[.C36] -> 0.227198454414618
A37: of:=[.A36]+[.$K$5] -> 0.8000000001 | B37: of:=[.G37] -> 0.307443106832225 | C37: of:=[.G37]+[.H37] -> 0.587443106867225 | D37: of:=1/([.A37]-[.B37]) -> 2.03022232287866 | E37: of:=[.B37]/[.A37] -> 0.384303883492243 | F37: of:=([.B37]/(1-[.B37]))/([.A37]/(1-[.A37])) -> 0.110981173414439 | G37: of:=([.A37]*[.$L$5])/(1-[.A37]+([.A37]*[.$L$5])) -> 0.307443106832225 | H37: of:=[.$K$7]*[.A37] -> 0.280000000035 | I37: of:=[.A37]-[.B37] -> 0.492556893267776 | J37: of:=[.A37]-[.C37] -> 0.212556893232775
A38: of:=[.A37]+[.$K$5] -> 0.825000000100001 | B38: of:=[.G38] -> 0.343486085009607 | C38: of:=[.G38]+[.H38] -> 0.632236085044608 | D38: of:=1/([.A38]-[.B38]) -> 2.07678318042434 | E38: of:=[.B38]/[.A38] -> 0.416346769658149 | F38: of:=([.B38]/(1-[.B38]))/([.A38]/(1-[.A38])) -> 0.110981173414439 | G38: of:=([.A38]*[.$L$5])/(1-[.A38]+([.A38]*[.$L$5])) -> 0.343486085009607 | H38: of:=[.$K$7]*[.A38] -> 0.288750000035 | I38: of:=[.A38]-[.B38] -> 0.481513915090393 | J38: of:=[.A38]-[.C38] -> 0.192763915055392
A39: of:=[.A38]+[.$K$5] -> 0.850000000100001 | B39: of:=[.G39] -> 0.386086252632225 | C39: of:=[.G39]+[.H39] -> 0.683586252667225 | D39: of:=1/([.A39]-[.B39]) -> 2.15557311129147 | E39: of:=[.B39]/[.A39] -> 0.454219120690356 | F39: of:=([.B39]/(1-[.B39]))/([.A39]/(1-[.A39])) -> 0.110981173414439 | G39: of:=([.A39]*[.$L$5])/(1-[.A39]+([.A39]*[.$L$5])) -> 0.386086252632225 | H39: of:=[.$K$7]*[.A39] -> 0.297500000035 | I39: of:=[.A39]-[.B39] -> 0.463913747467776 | J39: of:=[.A39]-[.C39] -> 0.166413747432775
A40: of:=[.A39]+[.$K$5] -> 0.875000000100001 | B40: of:=[.G40] -> 0.437212061211459 | C40: of:=[.G40]+[.H40] -> 0.74346206124646 | D40: of:=1/([.A40]-[.B40]) -> 2.28421094134938 | E40: of:=[.B40]/[.A40] -> 0.499670927041705 | F40: of:=([.B40]/(1-[.B40]))/([.A40]/(1-[.A40])) -> 0.110981173414439 | G40: of:=([.A40]*[.$L$5])/(1-[.A40]+([.A40]*[.$L$5])) -> 0.437212061211459 | H40: of:=[.$K$7]*[.A40] -> 0.306250000035 | I40: of:=[.A40]-[.B40] -> 0.437787938888541 | J40: of:=[.A40]-[.C40] -> 0.131537938853541
A41: of:=[.A40]+[.$K$5] -> 0.900000000100001 | B41: of:=[.G41] -> 0.499707469411726 | C41: of:=[.G41]+[.H41] -> 0.814707469446726 | D41: of:=1/([.A41]-[.B41]) -> 2.49817301931808 | E41: of:=[.B41]/[.A41] -> 0.555230521506892 | F41: of:=([.B41]/(1-[.B41]))/([.A41]/(1-[.A41])) -> 0.110981173414439 | G41: of:=([.A41]*[.$L$5])/(1-[.A41]+([.A41]*[.$L$5])) -> 0.499707469411726 | H41: of:=[.$K$7]*[.A41] -> 0.315000000035 | I41: of:=[.A41]-[.B41] -> 0.400292530688274 | J41: of:=[.A41]-[.C41] -> 0.0852925306532745
A42: of:=[.A41]+[.$K$5] -> 0.925000000100001 | B42: of:=[.G42] -> 0.577839585260946 | C42: of:=[.G42]+[.H42] -> 0.901589585295947 | D42: of:=1/([.A42]-[.B42]) -> 2.88051274643051 | E42: of:=[.B42]/[.A42] -> 0.624691443457813 | F42: of:=([.B42]/(1-[.B42]))/([.A42]/(1-[.A42])) -> 0.110981173414439 | G42: of:=([.A42]*[.$L$5])/(1-[.A42]+([.A42]*[.$L$5])) -> 0.577839585260946 | H42: of:=[.$K$7]*[.A42] -> 0.323750000035 | I42: of:=[.A42]-[.B42] -> 0.347160414839054 | J42: of:=[.A42]-[.C42] -> 0.0234104148040536
A43: of:=[.A42]+[.$K$5] -> 0.950000000100001 | B43: of:=[.G43] -> 0.678316157436062 | C43: of:=[.G43]+[.H43] -> 1.01081615747106 | D43: of:=1/([.A43]-[.B43]) -> 3.68074888147455 | E43: of:=[.B43]/[.A43] -> 0.714017007752273 | F43: of:=([.B43]/(1-[.B43]))/([.A43]/(1-[.A43])) -> 0.110981173414439 | G43: of:=([.A43]*[.$L$5])/(1-[.A43]+([.A43]*[.$L$5])) -> 0.678316157436062 | H43: of:=[.$K$7]*[.A43] -> 0.332500000035 | I43: of:=[.A43]-[.B43] -> 0.271683842663939 | J43: of:=[.A43]-[.C43] -> -0.0608161573710593
A44: of:=[.A43]+[.$K$5] -> 0.975000000100001 | B44: of:=[.G44] -> 0.812321674421561 | C44: of:=[.G44]+[.H44] -> 1.15357167445656 | D44: of:=1/([.A44]-[.B44]) -> 6.14710039477949 | E44: of:=[.B44]/[.A44] -> 0.833150435218714 | F44: of:=([.B44]/(1-[.B44]))/([.A44]/(1-[.A44])) -> 0.110981173414439 | G44: of:=([.A44]*[.$L$5])/(1-[.A44]+([.A44]*[.$L$5])) -> 0.812321674421561 | H44: of:=[.$K$7]*[.A44] -> 0.341250000035 | I44: of:=[.A44]-[.B44] -> 0.162678325678439 | J44: of:=[.A44]-[.C44] -> -0.178571674356559
A45: of:=[.A44]+[.$K$5] -> 1.0000000001 | B45: of:=[.G45] -> 1.00000000090106 | C45: of:=[.G45]+[.H45] -> 1.35000000093606 | D45: of:=1/([.A45]-[.B45]) -> -1248347158.7794 | E45: of:=[.B45]/[.A45] -> 1.00000000080106 | F45: of:=([.B45]/(1-[.B45]))/([.A45]/(1-[.A45])) -> 0.110981162544518 | G45: of:=([.A45]*[.$L$5])/(1-[.A45]+([.A45]*[.$L$5])) -> 1.00000000090106 | H45: of:=[.$K$7]*[.A45] -> 0.350000000035 | I45: of:=[.A45]-[.B45] -> -0.000000000801059218957789 | J45: of:=[.A45]-[.C45] -> -0.350000000836059

Sheet: linéaire
F1: max BA (1) | G1: max BA (2)
F2: of:=MAX([.F5:.F45]) -> 0.2 | G2: of:=MAX([.G5:.G45]) -> 0
A4: Rc | B4: Rt total (1) | C4: Rt total (2) | D4: Rt+ | E4: Rt- | F4: BA (1) | G4: BA (2) | H4: NNT (1) | J4: pas | K4: RR
A5: 0 | B5: of:=[.D5] -> 0 | C5: of:=[.D5]+[.E5] -> 0 | D5: of:=[.A5]*[.$K$5] -> 0 | E5: of:=[.$J$7]*[.A5] -> 0 | F5: of:=[.A5]-[.B5] -> 0 | G5: of:=[.A5]-[.C5] -> 0 | H5: of:=1/[.F5] ->  | J5: 0.025 | K5: 0.8
A6: of:=[.A5]+[.$J$5] -> 0.025 | B6: of:=[.D6] -> 0.02 | C6: of:=[.D6]+[.E6] -> 0.02875 | D6: of:=[.A6]*[.$K$5] -> 0.02 | E6: of:=[.$J$7]*[.A6] -> 0.00875 | F6: of:=[.A6]-[.B6] -> 0.005 | G6: of:=[.A6]-[.C6] -> -0.00375 | H6: of:=1/[.F6] -> 200 | J6: coeff iatro
A7: of:=[.A6]+[.$J$5] -> 0.05 | B7: of:=[.D7] -> 0.04 | C7: of:=[.D7]+[.E7] -> 0.0575 | D7: of:=[.A7]*[.$K$5] -> 0.04 | E7: of:=[.$J$7]*[.A7] -> 0.0175 | F7: of:=[.A7]-[.B7] -> 0.01 | G7: of:=[.A7]-[.C7] -> -0.0075 | H7: of:=1/[.F7] -> 100 | J7: 0.35
A8: of:=[.A7]+[.$J$5] -> 0.075 | B8: of:=[.D8] -> 0.06 | C8: of:=[.D8]+[.E8] -> 0.08625 | D8: of:=[.A8]*[.$K$5] -> 0.06 | E8: of:=[.$J$7]*[.A8] -> 0.02625 | F8: of:=[.A8]-[.B8] -> 0.015 | G8: of:=[.A8]-[.C8] -> -0.01125 | H8: of:=1/[.F8] -> 66.6666666666667
A9: of:=[.A8]+[.$J$5] -> 0.1 | B9: of:=[.D9] -> 0.08 | C9: of:=[.D9]+[.E9] -> 0.115 | D9: of:=[.A9]*[.$K$5] -> 0.08 | E9: of:=[.$J$7]*[.A9] -> 0.035 | F9: of:=[.A9]-[.B9] -> 0.02 | G9: of:=[.A9]-[.C9] -> -0.015 | H9: of:=1/[.F9] -> 50
A10: of:=[.A9]+[.$J$5] -> 0.125 | B10: of:=[.D10] -> 0.1 | C10: of:=[.D10]+[.E10] -> 0.14375 | D10: of:=[.A10]*[.$K$5] -> 0.1 | E10: of:=[.$J$7]*[.A10] -> 0.04375 | F10: of:=[.A10]-[.B10] -> 0.025 | G10: of:=[.A10]-[.C10] -> -0.01875 | H10: of:=1/[.F10] -> 40
A11: of:=[.A10]+[.$J$5] -> 0.15 | B11: of:=[.D11] -> 0.12 | C11: of:=[.D11]+[.E11] -> 0.1725 | D11: of:=[.A11]*[.$K$5] -> 0.12 | E11: of:=[.$J$7]*[.A11] -> 0.0525 | F11: of:=[.A11]-[.B11] -> 0.03 | G11: of:=[.A11]-[.C11] -> -0.0225 | H11: of:=1/[.F11] -> 33.3333333333333
A12: of:=[.A11]+[.$J$5] -> 0.175 | B12: of:=[.D12] -> 0.14 | C12: of:=[.D12]+[.E12] -> 0.20125 | D12: of:=[.A12]*[.$K$5] -> 0.14 | E12: of:=[.$J$7]*[.A12] -> 0.06125 | F12: of:=[.A12]-[.B12] -> 0.035 | G12: of:=[.A12]-[.C12] -> -0.02625 | H12: of:=1/[.F12] -> 28.5714285714286
A13: of:=[.A12]+[.$J$5] -> 0.2 | B13: of:=[.D13] -> 0.16 | C13: of:=[.D13]+[.E13] -> 0.23 | D13: of:=[.A13]*[.$K$5] -> 0.16 | E13: of:=[.$J$7]*[.A13] -> 0.07 | F13: of:=[.A13]-[.B13] -> 0.04 | G13: of:=[.A13]-[.C13] -> -0.03 | H13: of:=1/[.F13] -> 25
A14: of:=[.A13]+[.$J$5] -> 0.225 | B14: of:=[.D14] -> 0.18 | C14: of:=[.D14]+[.E14] -> 0.25875 | D14: of:=[.A14]*[.$K$5] -> 0.18 | E14: of:=[.$J$7]*[.A14] -> 0.07875 | F14: of:=[.A14]-[.B14] -> 0.045 | G14: of:=[.A14]-[.C14] -> -0.03375 | H14: of:=1/[.F14] -> 22.2222222222222
A15: of:=[.A14]+[.$J$5] -> 0.25 | B15: of:=[.D15] -> 0.2 | C15: of:=[.D15]+[.E15] -> 0.2875 | D15: of:=[.A15]*[.$K$5] -> 0.2 | E15: of:=[.$J$7]*[.A15] -> 0.0875 | F15: of:=[.A15]-[.B15] -> 0.05 | G15: of:=[.A15]-[.C15] -> -0.0375 | H15: of:=1/[.F15] -> 20
A16: of:=[.A15]+[.$J$5] -> 0.275 | B16: of:=[.D16] -> 0.22 | C16: of:=[.D16]+[.E16] -> 0.31625 | D16: of:=[.A16]*[.$K$5] -> 0.22 | E16: of:=[.$J$7]*[.A16] -> 0.09625 | F16: of:=[.A16]-[.B16] -> 0.055 | G16: of:=[.A16]-[.C16] -> -0.04125 | H16: of:=1/[.F16] -> 18.1818181818182
A17: of:=[.A16]+[.$J$5] -> 0.3 | B17: of:=[.D17] -> 0.24 | C17: of:=[.D17]+[.E17] -> 0.345 | D17: of:=[.A17]*[.$K$5] -> 0.24 | E17: of:=[.$J$7]*[.A17] -> 0.105 | F17: of:=[.A17]-[.B17] -> 0.0600000000000001 | G17: of:=[.A17]-[.C17] -> -0.045 | H17: of:=1/[.F17] -> 16.6666666666667
A18: of:=[.A17]+[.$J$5] -> 0.325 | B18: of:=[.D18] -> 0.26 | C18: of:=[.D18]+[.E18] -> 0.37375 | D18: of:=[.A18]*[.$K$5] -> 0.26 | E18: of:=[.$J$7]*[.A18] -> 0.11375 | F18: of:=[.A18]-[.B18] -> 0.065 | G18: of:=[.A18]-[.C18] -> -0.04875 | H18: of:=1/[.F18] -> 15.3846153846154
A19: of:=[.A18]+[.$J$5] -> 0.35 | B19: of:=[.D19] -> 0.28 | C19: of:=[.D19]+[.E19] -> 0.4025 | D19: of:=[.A19]*[.$K$5] -> 0.28 | E19: of:=[.$J$7]*[.A19] -> 0.1225 | F19: of:=[.A19]-[.B19] -> 0.07 | G19: of:=[.A19]-[.C19] -> -0.0525 | H19: of:=1/[.F19] -> 14.2857142857143
A20: of:=[.A19]+[.$J$5] -> 0.375 | B20: of:=[.D20] -> 0.3 | C20: of:=[.D20]+[.E20] -> 0.43125 | D20: of:=[.A20]*[.$K$5] -> 0.3 | E20: of:=[.$J$7]*[.A20] -> 0.13125 | F20: of:=[.A20]-[.B20] -> 0.075 | G20: of:=[.A20]-[.C20] -> -0.05625 | H20: of:=1/[.F20] -> 13.3333333333333
A21: of:=[.A20]+[.$J$5] -> 0.4 | B21: of:=[.D21] -> 0.32 | C21: of:=[.D21]+[.E21] -> 0.46 | D21: of:=[.A21]*[.$K$5] -> 0.32 | E21: of:=[.$J$7]*[.A21] -> 0.14 | F21: of:=[.A21]-[.B21] -> 0.08 | G21: of:=[.A21]-[.C21] -> -0.06 | H21: of:=1/[.F21] -> 12.5
A22: of:=[.A21]+[.$J$5] -> 0.425 | B22: of:=[.D22] -> 0.34 | C22: of:=[.D22]+[.E22] -> 0.48875 | D22: of:=[.A22]*[.$K$5] -> 0.34 | E22: of:=[.$J$7]*[.A22] -> 0.14875 | F22: of:=[.A22]-[.B22] -> 0.085 | G22: of:=[.A22]-[.C22] -> -0.06375 | H22: of:=1/[.F22] -> 11.7647058823529
A23: of:=[.A22]+[.$J$5] -> 0.45 | B23: of:=[.D23] -> 0.36 | C23: of:=[.D23]+[.E23] -> 0.5175 | D23: of:=[.A23]*[.$K$5] -> 0.36 | E23: of:=[.$J$7]*[.A23] -> 0.1575 | F23: of:=[.A23]-[.B23] -> 0.09 | G23: of:=[.A23]-[.C23] -> -0.0675000000000001 | H23: of:=1/[.F23] -> 11.1111111111111
A24: of:=[.A23]+[.$J$5] -> 0.475 | B24: of:=[.D24] -> 0.38 | C24: of:=[.D24]+[.E24] -> 0.54625 | D24: of:=[.A24]*[.$K$5] -> 0.38 | E24: of:=[.$J$7]*[.A24] -> 0.16625 | F24: of:=[.A24]-[.B24] -> 0.095 | G24: of:=[.A24]-[.C24] -> -0.07125 | H24: of:=1/[.F24] -> 10.5263157894737
A25: of:=[.A24]+[.$J$5] -> 0.5 | B25: of:=[.D25] -> 0.4 | C25: of:=[.D25]+[.E25] -> 0.575 | D25: of:=[.A25]*[.$K$5] -> 0.4 | E25: of:=[.$J$7]*[.A25] -> 0.175 | F25: of:=[.A25]-[.B25] -> 0.1 | G25: of:=[.A25]-[.C25] -> -0.0750000000000001 | H25: of:=1/[.F25] -> 10
A26: of:=[.A25]+[.$J$5] -> 0.525 | B26: of:=[.D26] -> 0.42 | C26: of:=[.D26]+[.E26] -> 0.60375 | D26: of:=[.A26]*[.$K$5] -> 0.42 | E26: of:=[.$J$7]*[.A26] -> 0.18375 | F26: of:=[.A26]-[.B26] -> 0.105 | G26: of:=[.A26]-[.C26] -> -0.07875 | H26: of:=1/[.F26] -> 9.52380952380953
A27: of:=[.A26]+[.$J$5] -> 0.55 | B27: of:=[.D27] -> 0.44 | C27: of:=[.D27]+[.E27] -> 0.6325 | D27: of:=[.A27]*[.$K$5] -> 0.44 | E27: of:=[.$J$7]*[.A27] -> 0.1925 | F27: of:=[.A27]-[.B27] -> 0.11 | G27: of:=[.A27]-[.C27] -> -0.0825 | H27: of:=1/[.F27] -> 9.09090909090909
A28: of:=[.A27]+[.$J$5] -> 0.575 | B28: of:=[.D28] -> 0.46 | C28: of:=[.D28]+[.E28] -> 0.66125 | D28: of:=[.A28]*[.$K$5] -> 0.46 | E28: of:=[.$J$7]*[.A28] -> 0.20125 | F28: of:=[.A28]-[.B28] -> 0.115 | G28: of:=[.A28]-[.C28] -> -0.0862499999999999 | H28: of:=1/[.F28] -> 8.69565217391305
A29: of:=[.A28]+[.$J$5] -> 0.6 | B29: of:=[.D29] -> 0.48 | C29: of:=[.D29]+[.E29] -> 0.69 | D29: of:=[.A29]*[.$K$5] -> 0.48 | E29: of:=[.$J$7]*[.A29] -> 0.21 | F29: of:=[.A29]-[.B29] -> 0.12 | G29: of:=[.A29]-[.C29] -> -0.09 | H29: of:=1/[.F29] -> 8.33333333333333
A30: of:=[.A29]+[.$J$5] -> 0.625 | B30: of:=[.D30] -> 0.5 | C30: of:=[.D30]+[.E30] -> 0.71875 | D30: of:=[.A30]*[.$K$5] -> 0.5 | E30: of:=[.$J$7]*[.A30] -> 0.21875 | F30: of:=[.A30]-[.B30] -> 0.125 | G30: of:=[.A30]-[.C30] -> -0.0937500000000001 | H30: of:=1/[.F30] -> 8
A31: of:=[.A30]+[.$J$5] -> 0.65 | B31: of:=[.D31] -> 0.52 | C31: of:=[.D31]+[.E31] -> 0.7475 | D31: of:=[.A31]*[.$K$5] -> 0.52 | E31: of:=[.$J$7]*[.A31] -> 0.2275 | F31: of:=[.A31]-[.B31] -> 0.13 | G31: of:=[.A31]-[.C31] -> -0.0975 | H31: of:=1/[.F31] -> 7.69230769230769
A32: of:=[.A31]+[.$J$5] -> 0.675 | B32: of:=[.D32] -> 0.54 | C32: of:=[.D32]+[.E32] -> 0.77625 | D32: of:=[.A32]*[.$K$5] -> 0.54 | E32: of:=[.$J$7]*[.A32] -> 0.23625 | F32: of:=[.A32]-[.B32] -> 0.135 | G32: of:=[.A32]-[.C32] -> -0.10125 | H32: of:=1/[.F32] -> 7.40740740740741
A33: of:=[.A32]+[.$J$5] -> 0.7 | B33: of:=[.D33] -> 0.56 | C33: of:=[.D33]+[.E33] -> 0.805 | D33: of:=[.A33]*[.$K$5] -> 0.56 | E33: of:=[.$J$7]*[.A33] -> 0.245 | F33: of:=[.A33]-[.B33] -> 0.14 | G33: of:=[.A33]-[.C33] -> -0.105 | H33: of:=1/[.F33] -> 7.14285714285714
A34: of:=[.A33]+[.$J$5] -> 0.725 | B34: of:=[.D34] -> 0.58 | C34: of:=[.D34]+[.E34] -> 0.83375 | D34: of:=[.A34]*[.$K$5] -> 0.58 | E34: of:=[.$J$7]*[.A34] -> 0.25375 | F34: of:=[.A34]-[.B34] -> 0.145 | G34: of:=[.A34]-[.C34] -> -0.10875 | H34: of:=1/[.F34] -> 6.89655172413793
A35: of:=[.A34]+[.$J$5] -> 0.75 | B35: of:=[.D35] -> 0.6 | C35: of:=[.D35]+[.E35] -> 0.8625 | D35: of:=[.A35]*[.$K$5] -> 0.6 | E35: of:=[.$J$7]*[.A35] -> 0.2625 | F35: of:=[.A35]-[.B35] -> 0.15 | G35: of:=[.A35]-[.C35] -> -0.1125 | H35: of:=1/[.F35] -> 6.66666666666667
A36: of:=[.A35]+[.$J$5] -> 0.775 | B36: of:=[.D36] -> 0.62 | C36: of:=[.D36]+[.E36] -> 0.89125 | D36: of:=[.A36]*[.$K$5] -> 0.62 | E36: of:=[.$J$7]*[.A36] -> 0.27125 | F36: of:=[.A36]-[.B36] -> 0.155 | G36: of:=[.A36]-[.C36] -> -0.11625 | H36: of:=1/[.F36] -> 6.45161290322581
A37: of:=[.A36]+[.$J$5] -> 0.8 | B37: of:=[.D37] -> 0.64 | C37: of:=[.D37]+[.E37] -> 0.92 | D37: of:=[.A37]*[.$K$5] -> 0.64 | E37: of:=[.$J$7]*[.A37] -> 0.28 | F37: of:=[.A37]-[.B37] -> 0.16 | G37: of:=[.A37]-[.C37] -> -0.12 | H37: of:=1/[.F37] -> 6.25
A38: of:=[.A37]+[.$J$5] -> 0.825 | B38: of:=[.D38] -> 0.66 | C38: of:=[.D38]+[.E38] -> 0.94875 | D38: of:=[.A38]*[.$K$5] -> 0.66 | E38: of:=[.$J$7]*[.A38] -> 0.28875 | F38: of:=[.A38]-[.B38] -> 0.165 | G38: of:=[.A38]-[.C38] -> -0.12375 | H38: of:=1/[.F38] -> 6.06060606060606
A39: of:=[.A38]+[.$J$5] -> 0.85 | B39: of:=[.D39] -> 0.68 | C39: of:=[.D39]+[.E39] -> 0.9775 | D39: of:=[.A39]*[.$K$5] -> 0.68 | E39: of:=[.$J$7]*[.A39] -> 0.2975 | F39: of:=[.A39]-[.B39] -> 0.17 | G39: of:=[.A39]-[.C39] -> -0.1275 | H39: of:=1/[.F39] -> 5.88235294117647
A40: of:=[.A39]+[.$J$5] -> 0.875 | B40: of:=[.D40] -> 0.7 | C40: of:=[.D40]+[.E40] -> 1.00625 | D40: of:=[.A40]*[.$K$5] -> 0.7 | E40: of:=[.$J$7]*[.A40] -> 0.30625 | F40: of:=[.A40]-[.B40] -> 0.175 | G40: of:=[.A40]-[.C40] -> -0.13125 | H40: of:=1/[.F40] -> 5.71428571428571
A41: of:=[.A40]+[.$J$5] -> 0.9 | B41: of:=[.D41] -> 0.72 | C41: of:=[.D41]+[.E41] -> 1.035 | D41: of:=[.A41]*[.$K$5] -> 0.72 | E41: of:=[.$J$7]*[.A41] -> 0.315 | F41: of:=[.A41]-[.B41] -> 0.18 | G41: of:=[.A41]-[.C41] -> -0.135 | H41: of:=1/[.F41] -> 5.55555555555555
A42: of:=[.A41]+[.$J$5] -> 0.925 | B42: of:=[.D42] -> 0.74 | C42: of:=[.D42]+[.E42] -> 1.06375 | D42: of:=[.A42]*[.$K$5] -> 0.74 | E42: of:=[.$J$7]*[.A42] -> 0.32375 | F42: of:=[.A42]-[.B42] -> 0.185 | G42: of:=[.A42]-[.C42] -> -0.13875 | H42: of:=1/[.F42] -> 5.4054054054054
A43: of:=[.A42]+[.$J$5] -> 0.950000000000001 | B43: of:=[.D43] -> 0.76 | C43: of:=[.D43]+[.E43] -> 1.0925 | D43: of:=[.A43]*[.$K$5] -> 0.76 | E43: of:=[.$J$7]*[.A43] -> 0.3325 | F43: of:=[.A43]-[.B43] -> 0.190000000000001 | G43: of:=[.A43]-[.C43] -> -0.142499999999999 | H43: of:=1/[.F43] -> 5.26315789473684
A44: of:=[.A43]+[.$J$5] -> 0.975000000000001 | B44: of:=[.D44] -> 0.78 | C44: of:=[.D44]+[.E44] -> 1.12125 | D44: of:=[.A44]*[.$K$5] -> 0.78 | E44: of:=[.$J$7]*[.A44] -> 0.34125 | F44: of:=[.A44]-[.B44] -> 0.195000000000001 | G44: of:=[.A44]-[.C44] -> -0.146249999999999 | H44: of:=1/[.F44] -> 5.12820512820513
A45: of:=[.A44]+[.$J$5] -> 1 | B45: of:=[.D45] -> 0.8 | C45: of:=[.D45]+[.E45] -> 1.15 | D45: of:=[.A45]*[.$K$5] -> 0.8 | E45: of:=[.$J$7]*[.A45] -> 0.35 | F45: of:=[.A45]-[.B45] -> 0.2 | G45: of:=[.A45]-[.C45] -> -0.15 | H45: of:=1/[.F45] -> 5

Sheet: curvi metrics
A1: of:=[$curvi.A4] -> Rc | B1: of:=[$curvi.I4] -> BA (1) | C1: of:=[$curvi.D4] -> NNT total (1) | D1: of:=[$curvi.E4] -> RR total (1) | E1: of:=[$curvi.F4] -> OR total (1)
A2: Rc | B2: AB | C2: NNT | D2: RR | E2: OR
A3: of:=[$curvi.A6] -> 0.0250000001 | B3: of:=[$curvi.I6] -> 0.0221624038408733 | C3: of:=[$curvi.D6] -> 45.1214591693224 | D3: of:=[$curvi.E6] -> 0.113503849911052 | E3: of:=[$curvi.F6] -> 0.110981173414439
A4: of:=[$curvi.A7] -> 0.0500000001 | B4: of:=[$curvi.I7] -> 0.0441928061815049 | C4: of:=[$curvi.D7] -> 22.6281172526788 | D4: of:=[$curvi.E7] -> 0.116143878137614 | E4: of:=[$curvi.F7] -> 0.110981173414439
A5: of:=[$curvi.A8] -> 0.0750000001 | B5: of:=[$curvi.I8] -> 0.0660817769618105 | C5: of:=[$curvi.D8] -> 15.1327649766124 | D5: of:=[$curvi.E8] -> 0.118909641683981 | E5: of:=[$curvi.F8] -> 0.110981173414439
A6: of:=[$curvi.A9] -> 0.1000000001 | B6: of:=[$curvi.I9] -> 0.0878189658706583 | C6: of:=[$curvi.D9] -> 11.3870618958645 | D6: of:=[$curvi.E9] -> 0.121810342171607 | E6: of:=[$curvi.F9] -> 0.110981173414439
A7: of:=[$curvi.A10] -> 0.1250000001 | B7: of:=[$curvi.I10] -> 0.109392987395587 | C7: of:=[$curvi.D10] -> 9.14135379065756 | D7: of:=[$curvi.E10] -> 0.124856101535423 | E7: of:=[$curvi.F10] -> 0.110981173414439
A8: of:=[$curvi.A11] -> 0.1500000001 | B8: of:=[$curvi.I11] -> 0.130791288082299 | C8: of:=[$curvi.D11] -> 7.64576918434171 | D8: of:=[$curvi.E11] -> 0.128058080032636 | E8: of:=[$curvi.F11] -> 0.110981173414439
A9: of:=[$curvi.A12] -> 0.1750000001 | B9: of:=[$curvi.I12] -> 0.151999992831503 | C9: of:=[$curvi.D12] -> 6.57894767869188 | D9: of:=[$curvi.E12] -> 0.131428612887738 | E9: of:=[$curvi.F12] -> 0.110981173414439
A10: of:=[$curvi.A13] -> 0.2000000001 | B10: of:=[$curvi.I13] -> 0.173003726266483 | C10: of:=[$curvi.D13] -> 5.78022231994974 | D10: of:=[$curvi.E13] -> 0.134981369100095 | E10: of:=[$curvi.F13] -> 0.110981173414439
A11: of:=[$curvi.A14] -> 0.2250000001 | B11: of:=[$curvi.I14] -> 0.193785404323157 | C11: of:=[$curvi.D14] -> 5.16034736203557 | D11: of:=[$curvi.E14] -> 0.138731536724311 | E11: of:=[$curvi.F14] -> 0.110981173414439
A12: of:=[$curvi.A15] -> 0.2500000001 | B12: of:=[$curvi.I15] -> 0.214325990106005 | C12: of:=[$curvi.D15] -> 4.66578971362924 | D12: of:=[$curvi.E15] -> 0.142696039918902 | E12: of:=[$curvi.F15] -> 0.110981173414439
A13: of:=[$curvi.A16] -> 0.2750000001 | B13: of:=[$curvi.I16] -> 0.234604206651408 | C13: of:=[$curvi.D16] -> 4.26249816349572 | D13: of:=[$curvi.E16] -> 0.146893794305099 | E13: of:=[$curvi.F16] -> 0.110981173414439
A14: of:=[$curvi.A17] -> 0.3000000001 | B14: of:=[$curvi.I17] -> 0.254596197455736 | C14: of:=[$curvi.D17] -> 3.92778843515077 | D14: of:=[$curvi.E17] -> 0.151346008763765 | E14: of:=[$curvi.F17] -> 0.110981173414439
A15: of:=[$curvi.A18] -> 0.3250000001 | B15: of:=[$curvi.I18] -> 0.274275123339355 | C15: of:=[$curvi.D18] -> 3.64597411469476 | D15: of:=[$curvi.E18] -> 0.156076543830885 | E15: of:=[$curvi.F18] -> 0.110981173414439
A16: of:=[$curvi.A19] -> 0.3500000001 | B16: of:=[$curvi.I19] -> 0.293610681267769 | C16: of:=[$curvi.D19] -> 3.40587064367735 | D16: of:=[$curvi.E19] -> 0.161112339474628 | E16: of:=[$curvi.F19] -> 0.110981173414439
A17: of:=[$curvi.A20] -> 0.3750000001 | B17: of:=[$curvi.I20] -> 0.312568526915879 | C17: of:=[$curvi.D20] -> 3.19929843822417 | D17: of:=[$curvi.E20] -> 0.166483928446595 | E17: of:=[$curvi.F20] -> 0.110981173414439
A18: of:=[$curvi.A21] -> 0.4000000001 | B18: of:=[$curvi.I21] -> 0.331109577735676 | C18: of:=[$curvi.D21] -> 3.0201482144932 | D18: of:=[$curvi.E21] -> 0.172226055867754 | E18: of:=[$curvi.F21] -> 0.110981173414439
A19: of:=[$curvi.A22] -> 0.4250000001 | B19: of:=[$curvi.I22] -> 0.349189166646213 | C19: of:=[$curvi.D22] -> 2.86377727466318 | D19: of:=[$curvi.E22] -> 0.178378431613998 | E19: of:=[$curvi.F22] -> 0.110981173414439
A20: of:=[$curvi.A23] -> 0.4500000001 | B20: of:=[$curvi.I23] -> 0.366756007608855 | C20: of:=[$curvi.D23] -> 2.72660836974346 | D20: of:=[$curvi.E23] -> 0.184986649939214 | E20: of:=[$curvi.F23] -> 0.110981173414439
A21: of:=[$curvi.A24] -> 0.4750000001 | B21: of:=[$curvi.I24] -> 0.383750922428723 | C21: of:=[$curvi.D24] -> 2.60585692842403 | D21: of:=[$curvi.E24] -> 0.192103321372773 | E21: of:=[$curvi.F24] -> 0.110981173414439
A22: of:=[$curvi.A25] -> 0.5000000001 | B22: of:=[$curvi.I25] -> 0.400105261908072 | C22: of:=[$curvi.D25] -> 2.49934228615509 | D22: of:=[$curvi.E25] -> 0.199789476343899 | E22: of:=[$curvi.F25] -> 0.110981173414439
A23: of:=[$curvi.A26] -> 0.5250000001 | B23: of:=[$curvi.I26] -> 0.415738932179818 | C23: of:=[$curvi.D26] -> 2.40535567539167 | D23: of:=[$curvi.E26] -> 0.208116319808325 | E23: of:=[$curvi.F26] -> 0.110981173414439
A24: of:=[$curvi.A27] -> 0.5500000001 | B24: of:=[$curvi.I27] -> 0.430557906024273 | C24: of:=[$curvi.D27] -> 2.32256796590706 | D24: of:=[$curvi.E27] -> 0.217167443734564 | E24: of:=[$curvi.F27] -> 0.110981173414439
A25: of:=[$curvi.A28] -> 0.5750000001 | B25: of:=[$curvi.I28] -> 0.444451055251102 | C25: of:=[$curvi.D28] -> 2.24996653328909 | D25: of:=[$curvi.E28] -> 0.22704164317599 | E25: of:=[$curvi.F28] -> 0.110981173414439
A26: of:=[$curvi.A29] -> 0.6000000001 | B26: of:=[$curvi.I29] -> 0.457286077764014 | C26: of:=[$curvi.D29] -> 2.18681488159379 | D26: of:=[$curvi.E29] -> 0.237856537187 | E26: of:=[$curvi.F29] -> 0.110981173414439
A27: of:=[$curvi.A30] -> 0.6250000001 | B27: of:=[$curvi.I30] -> 0.468904202342909 | C27: of:=[$curvi.D30] -> 2.13263177212624 | D27: of:=[$curvi.E30] -> 0.249753276371385 | E27: of:=[$curvi.F30] -> 0.110981173414439
A28: of:=[$curvi.A31] -> 0.6500000001 | B28: of:=[$curvi.I31] -> 0.479113220672903 | C28: of:=[$curvi.D31] -> 2.08718932572039 | D28: of:=[$curvi.E31] -> 0.262902737539702 | E28: of:=[$curvi.F31] -> 0.110981173414439
A29: of:=[$curvi.A32] -> 0.6750000001 | B29: of:=[$curvi.I32] -> 0.48767819586738 | C29: of:=[$curvi.D32] -> 2.05053252016201 | D29: of:=[$curvi.E32] -> 0.277513784007214 | E29: of:=[$curvi.F32] -> 0.110981173414439
A30: of:=[$curvi.A33] -> 0.7000000001 | B30: of:=[$curvi.I33] -> 0.494308890376979 | C30: of:=[$curvi.D33] -> 2.02302653152235 | D30: of:=[$curvi.E33] -> 0.293844442419482 | E30: of:=[$curvi.F33] -> 0.110981173414439
A31: of:=[$curvi.A34] -> 0.7250000001 | B31: of:=[$curvi.I34] -> 0.498642477425665 | C31: of:=[$curvi.D34] -> 2.00544487337438 | D31: of:=[$curvi.E34] -> 0.312217272611192 | E31: of:=[$curvi.F34] -> 0.110981173414439
A32: of:=[$curvi.A35] -> 0.7500000001 | B32: of:=[$curvi.I35] -> 0.500219333987637 | C32: of:=[$curvi.D35] -> 1.99912304873989 | D32: of:=[$curvi.E35] -> 0.333040888105412 | E32: of:=[$curvi.F35] -> 0.110981173414439
A33: of:=[$curvi.A36] -> 0.7750000001 | B33: of:=[$curvi.I36] -> 0.498448454449618 | C33: of:=[$curvi.D36] -> 2.00622550049672 | D33: of:=[$curvi.E36] -> 0.356840704018965 | E33: of:=[$curvi.F36] -> 0.110981173414439
A34: of:=[$curvi.A37] -> 0.8000000001 | B34: of:=[$curvi.I37] -> 0.492556893267776 | C34: of:=[$curvi.D37] -> 2.03022232287866 | D34: of:=[$curvi.E37] -> 0.384303883492243 | E34: of:=[$curvi.F37] -> 0.110981173414439
A35: of:=[$curvi.A38] -> 0.825000000100001 | B35: of:=[$curvi.I38] -> 0.481513915090393 | C35: of:=[$curvi.D38] -> 2.07678318042434 | D35: of:=[$curvi.E38] -> 0.416346769658149 | E35: of:=[$curvi.F38] -> 0.110981173414439
A36: of:=[$curvi.A39] -> 0.850000000100001 | B36: of:=[$curvi.I39] -> 0.463913747467776 | C36: of:=[$curvi.D39] -> 2.15557311129147 | D36: of:=[$curvi.E39] -> 0.454219120690356 | E36: of:=[$curvi.F39] -> 0.110981173414439
A37: of:=[$curvi.A40] -> 0.875000000100001 | B37: of:=[$curvi.I40] -> 0.437787938888541 | C37: of:=[$curvi.D40] -> 2.28421094134938 | D37: of:=[$curvi.E40] -> 0.499670927041705 | E37: of:=[$curvi.F40] -> 0.110981173414439
A38: of:=[$curvi.A41] -> 0.900000000100001 | B38: of:=[$curvi.I41] -> 0.400292530688274 | C38: of:=[$curvi.D41] -> 2.49817301931808 | D38: of:=[$curvi.E41] -> 0.555230521506892 | E38: of:=[$curvi.F41] -> 0.110981173414439
A39: of:=[$curvi.A42] -> 0.925000000100001 | B39: of:=[$curvi.I42] -> 0.347160414839054 | C39: of:=[$curvi.D42] -> 2.88051274643051 | D39: of:=[$curvi.E42] -> 0.624691443457813 | E39: of:=[$curvi.F42] -> 0.110981173414439
A40: of:=[$curvi.A43] -> 0.950000000100001 | B40: of:=[$curvi.I43] -> 0.271683842663939 | C40: of:=[$curvi.D43] -> 3.68074888147455 | D40: of:=[$curvi.E43] -> 0.714017007752273 | E40: of:=[$curvi.F43] -> 0.110981173414439
A41: of:=[$curvi.A44] -> 0.975000000100001 | B41: of:=[$curvi.I44] -> 0.162678325678439 | C41: of:=[$curvi.D44] -> 6.14710039477949 | D41: of:=[$curvi.E44] -> 0.833150435218714 | E41: of:=[$curvi.F44] -> 0.110981173414439
A44: figure
A45: of:=[.A2] -> Rc | B45: of:=[.B2] -> AB | C45: NNT/ | D45: of:=[.D2] -> RR | E45: of:=[.E2] -> OR
A46: of:=[.A3] -> 0.0250000001 | B46: of:=[.B3] -> 0.0221624038408733 | C46: of:=[.C3]/[.$F$46] -> 0.902429183386448 | D46: of:=[.D3] -> 0.113503849911052 | E46: of:=[.E3] -> 0.110981173414439 | F46: 50
A47: of:=[.A4] -> 0.0500000001 | B47: of:=[.B4] -> 0.0441928061815049 | C47: of:=[.C4]/[.$F$46] -> 0.452562345053575 | D47: of:=[.D4] -> 0.116143878137614 | E47: of:=[.E4] -> 0.110981173414439
A48: of:=[.A5] -> 0.0750000001 | B48: of:=[.B5] -> 0.0660817769618105 | C48: of:=[.C5]/[.$F$46] -> 0.302655299532249 | D48: of:=[.D5] -> 0.118909641683981 | E48: of:=[.E5] -> 0.110981173414439
A49: of:=[.A6] -> 0.1000000001 | B49: of:=[.B6] -> 0.0878189658706583 | C49: of:=[.C6]/[.$F$46] -> 0.22774123791729 | D49: of:=[.D6] -> 0.121810342171607 | E49: of:=[.E6] -> 0.110981173414439
A50: of:=[.A7] -> 0.1250000001 | B50: of:=[.B7] -> 0.109392987395587 | C50: of:=[.C7]/[.$F$46] -> 0.182827075813151 | D50: of:=[.D7] -> 0.124856101535423 | E50: of:=[.E7] -> 0.110981173414439
A51: of:=[.A8] -> 0.1500000001 | B51: of:=[.B8] -> 0.130791288082299 | C51: of:=[.C8]/[.$F$46] -> 0.152915383686834 | D51: of:=[.D8] -> 0.128058080032636 | E51: of:=[.E8] -> 0.110981173414439
A52: of:=[.A9] -> 0.1750000001 | B52: of:=[.B9] -> 0.151999992831503 | C52: of:=[.C9]/[.$F$46] -> 0.131578953573838 | D52: of:=[.D9] -> 0.131428612887738 | E52: of:=[.E9] -> 0.110981173414439
A53: of:=[.A10] -> 0.2000000001 | B53: of:=[.B10] -> 0.173003726266483 | C53: of:=[.C10]/[.$F$46] -> 0.115604446398995 | D53: of:=[.D10] -> 0.134981369100095 | E53: of:=[.E10] -> 0.110981173414439
A54: of:=[.A11] -> 0.2250000001 | B54: of:=[.B11] -> 0.193785404323157 | C54: of:=[.C11]/[.$F$46] -> 0.103206947240711 | D54: of:=[.D11] -> 0.138731536724311 | E54: of:=[.E11] -> 0.110981173414439
A55: of:=[.A12] -> 0.2500000001 | B55: of:=[.B12] -> 0.214325990106005 | C55: of:=[.C12]/[.$F$46] -> 0.0933157942725848 | D55: of:=[.D12] -> 0.142696039918902 | E55: of:=[.E12] -> 0.110981173414439
A56: of:=[.A13] -> 0.2750000001 | B56: of:=[.B13] -> 0.234604206651408 | C56: of:=[.C13]/[.$F$46] -> 0.0852499632699145 | D56: of:=[.D13] -> 0.146893794305099 | E56: of:=[.E13] -> 0.110981173414439
A57: of:=[.A14] -> 0.3000000001 | B57: of:=[.B14] -> 0.254596197455736 | C57: of:=[.C14]/[.$F$46] -> 0.0785557687030153 | D57: of:=[.D14] -> 0.151346008763765 | E57: of:=[.E14] -> 0.110981173414439
A58: of:=[.A15] -> 0.3250000001 | B58: of:=[.B15] -> 0.274275123339355 | C58: of:=[.C15]/[.$F$46] -> 0.0729194822938952 | D58: of:=[.D15] -> 0.156076543830885 | E58: of:=[.E15] -> 0.110981173414439
A59: of:=[.A16] -> 0.3500000001 | B59: of:=[.B16] -> 0.293610681267769 | C59: of:=[.C16]/[.$F$46] -> 0.0681174128735469 | D59: of:=[.D16] -> 0.161112339474628 | E59: of:=[.E16] -> 0.110981173414439
A60: of:=[.A17] -> 0.3750000001 | B60: of:=[.B17] -> 0.312568526915879 | C60: of:=[.C17]/[.$F$46] -> 0.0639859687644834 | D60: of:=[.D17] -> 0.166483928446595 | E60: of:=[.E17] -> 0.110981173414439
A61: of:=[.A18] -> 0.4000000001 | B61: of:=[.B18] -> 0.331109577735676 | C61: of:=[.C18]/[.$F$46] -> 0.0604029642898641 | D61: of:=[.D18] -> 0.172226055867754 | E61: of:=[.E18] -> 0.110981173414439
A62: of:=[.A19] -> 0.4250000001 | B62: of:=[.B19] -> 0.349189166646213 | C62: of:=[.C19]/[.$F$46] -> 0.0572755454932637 | D62: of:=[.D19] -> 0.178378431613998 | E62: of:=[.E19] -> 0.110981173414439
A63: of:=[.A20] -> 0.4500000001 | B63: of:=[.B20] -> 0.366756007608855 | C63: of:=[.C20]/[.$F$46] -> 0.0545321673948692 | D63: of:=[.D20] -> 0.184986649939214 | E63: of:=[.E20] -> 0.110981173414439
A64: of:=[.A21] -> 0.4750000001 | B64: of:=[.B21] -> 0.383750922428723 | C64: of:=[.C21]/[.$F$46] -> 0.0521171385684806 | D64: of:=[.D21] -> 0.192103321372773 | E64: of:=[.E21] -> 0.110981173414439
A65: of:=[.A22] -> 0.5000000001 | B65: of:=[.B22] -> 0.400105261908072 | C65: of:=[.C22]/[.$F$46] -> 0.0499868457231018 | D65: of:=[.D22] -> 0.199789476343899 | E65: of:=[.E22] -> 0.110981173414439
A66: of:=[.A23] -> 0.5250000001 | B66: of:=[.B23] -> 0.415738932179818 | C66: of:=[.C23]/[.$F$46] -> 0.0481071135078335 | D66: of:=[.D23] -> 0.208116319808325 | E66: of:=[.E23] -> 0.110981173414439
A67: of:=[.A24] -> 0.5500000001 | B67: of:=[.B24] -> 0.430557906024273 | C67: of:=[.C24]/[.$F$46] -> 0.0464513593181412 | D67: of:=[.D24] -> 0.217167443734564 | E67: of:=[.E24] -> 0.110981173414439
A68: of:=[.A25] -> 0.5750000001 | B68: of:=[.B25] -> 0.444451055251102 | C68: of:=[.C25]/[.$F$46] -> 0.0449993306657818 | D68: of:=[.D25] -> 0.22704164317599 | E68: of:=[.E25] -> 0.110981173414439
A69: of:=[.A26] -> 0.6000000001 | B69: of:=[.B26] -> 0.457286077764014 | C69: of:=[.C26]/[.$F$46] -> 0.0437362976318757 | D69: of:=[.D26] -> 0.237856537187 | E69: of:=[.E26] -> 0.110981173414439
A70: of:=[.A27] -> 0.6250000001 | B70: of:=[.B27] -> 0.468904202342909 | C70: of:=[.C27]/[.$F$46] -> 0.0426526354425248 | D70: of:=[.D27] -> 0.249753276371385 | E70: of:=[.E27] -> 0.110981173414439
A71: of:=[.A28] -> 0.6500000001 | B71: of:=[.B28] -> 0.479113220672903 | C71: of:=[.C28]/[.$F$46] -> 0.0417437865144077 | D71: of:=[.D28] -> 0.262902737539702 | E71: of:=[.E28] -> 0.110981173414439
A72: of:=[.A29] -> 0.6750000001 | B72: of:=[.B29] -> 0.48767819586738 | C72: of:=[.C29]/[.$F$46] -> 0.0410106504032402 | D72: of:=[.D29] -> 0.277513784007214 | E72: of:=[.E29] -> 0.110981173414439
A73: of:=[.A30] -> 0.7000000001 | B73: of:=[.B30] -> 0.494308890376979 | C73: of:=[.C30]/[.$F$46] -> 0.040460530630447 | D73: of:=[.D30] -> 0.293844442419482 | E73: of:=[.E30] -> 0.110981173414439
A74: of:=[.A31] -> 0.7250000001 | B74: of:=[.B31] -> 0.498642477425665 | C74: of:=[.C31]/[.$F$46] -> 0.0401088974674876 | D74: of:=[.D31] -> 0.312217272611192 | E74: of:=[.E31] -> 0.110981173414439
A75: of:=[.A32] -> 0.7500000001 | B75: of:=[.B32] -> 0.500219333987637 | C75: of:=[.C32]/[.$F$46] -> 0.0399824609747977 | D75: of:=[.D32] -> 0.333040888105412 | E75: of:=[.E32] -> 0.110981173414439
A76: of:=[.A33] -> 0.7750000001 | B76: of:=[.B33] -> 0.498448454449618 | C76: of:=[.C33]/[.$F$46] -> 0.0401245100099343 | D76: of:=[.D33] -> 0.356840704018965 | E76: of:=[.E33] -> 0.110981173414439
A77: of:=[.A34] -> 0.8000000001 | B77: of:=[.B34] -> 0.492556893267776 | C77: of:=[.C34]/[.$F$46] -> 0.0406044464575732 | D77: of:=[.D34] -> 0.384303883492243 | E77: of:=[.E34] -> 0.110981173414439
A78: of:=[.A35] -> 0.825000000100001 | B78: of:=[.B35] -> 0.481513915090393 | C78: of:=[.C35]/[.$F$46] -> 0.0415356636084867 | D78: of:=[.D35] -> 0.416346769658149 | E78: of:=[.E35] -> 0.110981173414439
A79: of:=[.A36] -> 0.850000000100001 | B79: of:=[.B36] -> 0.463913747467776 | C79: of:=[.C36]/[.$F$46] -> 0.0431114622258295 | D79: of:=[.D36] -> 0.454219120690356 | E79: of:=[.E36] -> 0.110981173414439
A80: of:=[.A37] -> 0.875000000100001 | B80: of:=[.B37] -> 0.437787938888541 | C80: of:=[.C37]/[.$F$46] -> 0.0456842188269876 | D80: of:=[.D37] -> 0.499670927041705 | E80: of:=[.E37] -> 0.110981173414439
A81: of:=[.A38] -> 0.900000000100001 | B81: of:=[.B38] -> 0.400292530688274 | C81: of:=[.C38]/[.$F$46] -> 0.0499634603863615 | D81: of:=[.D38] -> 0.555230521506892 | E81: of:=[.E38] -> 0.110981173414439
A82: of:=[.A39] -> 0.925000000100001 | B82: of:=[.B39] -> 0.347160414839054 | C82: of:=[.C39]/[.$F$46] -> 0.0576102549286102 | D82: of:=[.D39] -> 0.624691443457813 | E82: of:=[.E39] -> 0.110981173414439
A83: of:=[.A40] -> 0.950000000100001 | B83: of:=[.B40] -> 0.271683842663939 | C83: of:=[.C40]/[.$F$46] -> 0.073614977629491 | D83: of:=[.D40] -> 0.714017007752273 | E83: of:=[.E40] -> 0.110981173414439
A84: of:=[.A41] -> 0.975000000100001 | B84: of:=[.B41] -> 0.162678325678439 | C84: of:=[.C41]/[.$F$46] -> 0.12294200789559 | D84: of:=[.D41] -> 0.833150435218714 | E84: of:=[.E41] -> 0.110981173414439

Sheet: NPE vs pop 2
B1: Two populations, with different Rc distributions, different Rc, same size
B2: Rc | C2: pop C | D2: pop A | E2: # events C | F2: # events A | G2: NPEs C | H2: NPEs A | J2: Rt pop C | K2: Rt pop A | L2: ABi pop C | M2: ABi pop A | N2: ni*Rci pop C | O2: ni*Rci pop A | P2: ni*Rti pop C | Q2: ni*Rti pop A | R2: ni*Abi pop C | S2: ni*Abi pop A | T2: NNTi pop C | U2: NNTi pop A | V2: ni NNTi pop C | W2: ni NNTi pop A
A3: 1 | B3: of:=[$curvi.A5] -> 0.0000000001 | C3: 13950 | D3: 8290 | E3: of:=[.B3]*[.C3] -> 0.000001395 | F3: of:=[.B3]*[.D3] -> 0.000000829 | G3: of:=[.C3]*[$curvi.$I5] -> 0.00000124018126307309 | H3: of:=[.D3]*[$curvi.$I5] -> 0.000000736996607231251 | J3: of:=([.E3]-[.G3])/[.C3] -> 0.0000000000110981173424306 | K3: of:=([.F3]-[.H3])/[.D3] -> 0.0000000000110981173424306 | L3: of:=[.B3]-[.J3] -> 0.0000000000889018826575695 | M3: of:=[.B3]-[.K3] -> 0.0000000000889018826575695 | N3: of:=[.C3]*[.$B3] -> 0.000001395 | O3: of:=[.D3]*[.$B3] -> 0.000000829 | R3: of:=[.C3]*[.L3] -> 0.00000124018126307309 | S3: of:=[.D3]*[.M3] -> 0.000000736996607231251 | T3: of:=1/[.L3] -> 11248355716.5126 | U3: of:=1/[.M3] -> 11248355716.5126 | V3: of:=[.B3]*[.T3] -> 1.12483557165126 | W3: of:=[.C3]*[.U3] -> 156914562245350
A4: of:=[.A3]+1 -> 2 | B4: of:=[$curvi.A6] -> 0.0250000001 | C4: 9810 | D4: 6540 | E4: of:=[.B4]*[.C4] -> 245.250000981 | F4: of:=[.B4]*[.D4] -> 163.500000654 | G4: of:=[.C4]*[$curvi.$I6] -> 217.413181678967 | H4: of:=[.D4]*[$curvi.$I6] -> 144.942121119312 | I4: of:=[.C50] -> 0 | J4: of:=([.E4]-[.G4])/[.C4] -> 0.00283759625912667 | K4: of:=([.F4]-[.H4])/[.D4] -> 0.00283759625912667 | L4: of:=[.B4]-[.J4] -> 0.0221624038408733 | M4: of:=[.B4]-[.K4] -> 0.0221624038408733 | N4: of:=[.C4]*[.$B4] -> 245.250000981 | O4: of:=[.D4]*[.$B4] -> 163.500000654 | R4: of:=[.C4]*[.L4] -> 217.413181678967 | S4: of:=[.D4]*[.M4] -> 144.942121119312 | T4: of:=1/[.L4] -> 45.1214591693224 | U4: of:=1/[.M4] -> 45.1214591693224 | V4: of:=[.B4]*[.T4] -> 1.12803648374521 | W4: of:=[.C4]*[.U4] -> 442641.514451053
A5: of:=[.A4]+1 -> 3 | B5: of:=[$curvi.A7] -> 0.0500000001 | C5: 7000 | D5: 5080 | E5: of:=[.B5]*[.C5] -> 350.0000007 | F5: of:=[.B5]*[.D5] -> 254.000000508 | G5: of:=[.C5]*[$curvi.$I7] -> 309.349643270534 | H5: of:=[.D5]*[$curvi.$I7] -> 224.499455402045 | I5: of:=[.E53] -> 0.2163737501 | J5: of:=([.E5]-[.G5])/[.C5] -> 0.00580719391849511 | K5: of:=([.F5]-[.H5])/[.D5] -> 0.00580719391849511 | L5: of:=[.B5]-[.J5] -> 0.0441928061815049 | M5: of:=[.B5]-[.K5] -> 0.0441928061815049 | N5: of:=[.C5]*[.$B5] -> 350.0000007 | O5: of:=[.D5]*[.$B5] -> 254.000000508 | R5: of:=[.C5]*[.L5] -> 309.349643270534 | S5: of:=[.D5]*[.M5] -> 224.499455402045 | T5: of:=1/[.L5] -> 22.6281172526788 | U5: of:=1/[.M5] -> 22.6281172526788 | V5: of:=[.B5]*[.T5] -> 1.13140586489675 | W5: of:=[.C5]*[.U5] -> 158396.820768751
A6: of:=[.A5]+1 -> 4 | B6: of:=[$curvi.A8] -> 0.0750000001 | C6: 6250 | D6: 3700 | E6: of:=[.B6]*[.C6] -> 468.750000625 | F6: of:=[.B6]*[.D6] -> 277.50000037 | G6: of:=[.C6]*[$curvi.$I8] -> 413.011106011316 | H6: of:=[.D6]*[$curvi.$I8] -> 244.502574758699 | I6: of:=[.I5]-[.F53] -> -0.13464725 | J6: of:=([.E6]-[.G6])/[.C6] -> 0.00891822313818951 | K6: of:=([.F6]-[.H6])/[.D6] -> 0.0089182231381895 | L6: of:=[.B6]-[.J6] -> 0.0660817769618105 | M6: of:=[.B6]-[.K6] -> 0.0660817769618105 | N6: of:=[.C6]*[.$B6] -> 468.750000625 | O6: of:=[.D6]*[.$B6] -> 277.50000037 | R6: of:=[.C6]*[.L6] -> 413.011106011316 | S6: of:=[.D6]*[.M6] -> 244.502574758699 | T6: of:=1/[.L6] -> 15.1327649766124 | U6: of:=1/[.M6] -> 15.1327649766124 | V6: of:=[.B6]*[.T6] -> 1.13495737475921 | W6: of:=[.C6]*[.U6] -> 94579.7811038277
A7: of:=[.A6]+1 -> 5 | B7: of:=[$curvi.A9] -> 0.1000000001 | C7: 5300 | D7: 3250 | E7: of:=[.B7]*[.C7] -> 530.00000053 | F7: of:=[.B7]*[.D7] -> 325.000000325 | G7: of:=[.C7]*[$curvi.$I9] -> 465.440519114489 | H7: of:=[.D7]*[$curvi.$I9] -> 285.411639079639 | J7: of:=([.E7]-[.G7])/[.C7] -> 0.0121810342293417 | K7: of:=([.F7]-[.H7])/[.D7] -> 0.0121810342293417 | L7: of:=[.B7]-[.J7] -> 0.0878189658706583 | M7: of:=[.B7]-[.K7] -> 0.0878189658706583 | N7: of:=[.C7]*[.$B7] -> 530.00000053 | O7: of:=[.D7]*[.$B7] -> 325.000000325 | R7: of:=[.C7]*[.L7] -> 465.440519114489 | S7: of:=[.D7]*[.M7] -> 285.411639079639 | T7: of:=1/[.L7] -> 11.3870618958645 | U7: of:=1/[.M7] -> 11.3870618958645 | V7: of:=[.B7]*[.T7] -> 1.13870619072516 | W7: of:=[.C7]*[.U7] -> 60351.428048082
A8: of:=[.A7]+1 -> 6 | B8: of:=[$curvi.A10] -> 0.1250000001 | C8: 4500 | D8: 3100 | E8: of:=[.B8]*[.C8] -> 562.50000045 | F8: of:=[.B8]*[.D8] -> 387.50000031 | G8: of:=[.C8]*[$curvi.$I10] -> 492.26844328014 | H8: of:=[.D8]*[$curvi.$I10] -> 339.118260926318 | J8: of:=([.E8]-[.G8])/[.C8] -> 0.0156070127044134 | K8: of:=([.F8]-[.H8])/[.D8] -> 0.0156070127044134 | L8: of:=[.B8]-[.J8] -> 0.109392987395587 | M8: of:=[.B8]-[.K8] -> 0.109392987395587 | N8: of:=[.C8]*[.$B8] -> 562.50000045 | O8: of:=[.D8]*[.$B8] -> 387.50000031 | R8: of:=[.C8]*[.L8] -> 492.26844328014 | S8: of:=[.D8]*[.M8] -> 339.118260926318 | T8: of:=1/[.L8] -> 9.14135379065756 | U8: of:=1/[.M8] -> 9.14135379065756 | V8: of:=[.B8]*[.T8] -> 1.14266922474633 | W8: of:=[.C8]*[.U8] -> 41136.092057959
A9: of:=[.A8]+1 -> 7 | B9: of:=[$curvi.A11] -> 0.1500000001 | C9: 3850 | D9: 2850 | E9: of:=[.B9]*[.C9] -> 577.500000385 | F9: of:=[.B9]*[.D9] -> 427.500000285 | G9: of:=[.C9]*[$curvi.$I11] -> 503.546459116851 | H9: of:=[.D9]*[$curvi.$I11] -> 372.755171034552 | J9: of:=([.E9]-[.G9])/[.C9] -> 0.0192087120177012 | K9: of:=([.F9]-[.H9])/[.D9] -> 0.0192087120177011 | L9: of:=[.B9]-[.J9] -> 0.130791288082299 | M9: of:=[.B9]-[.K9] -> 0.130791288082299 | N9: of:=[.C9]*[.$B9] -> 577.500000385 | O9: of:=[.D9]*[.$B9] -> 427.500000285 | R9: of:=[.C9]*[.L9] -> 503.546459116851 | S9: of:=[.D9]*[.M9] -> 372.755171034552 | T9: of:=1/[.L9] -> 7.64576918434171 | U9: of:=1/[.M9] -> 7.64576918434171 | V9: of:=[.B9]*[.T9] -> 1.14686537841583 | W9: of:=[.C9]*[.U9] -> 29436.2113597156
A10: of:=[.A9]+1 -> 8 | B10: of:=[$curvi.A12] -> 0.1750000001 | C10: 3700 | D10: 2700 | E10: of:=[.B10]*[.C10] -> 647.50000037 | F10: of:=[.B10]*[.D10] -> 472.50000027 | G10: of:=[.C10]*[$curvi.$I12] -> 562.399973476561 | H10: of:=[.D10]*[$curvi.$I12] -> 410.399980645058 | J10: of:=([.E10]-[.G10])/[.C10] -> 0.0230000072684969 | K10: of:=([.F10]-[.H10])/[.D10] -> 0.0230000072684969 | L10: of:=[.B10]-[.J10] -> 0.151999992831503 | M10: of:=[.B10]-[.K10] -> 0.151999992831503 | N10: of:=[.C10]*[.$B10] -> 647.50000037 | O10: of:=[.D10]*[.$B10] -> 472.50000027 | R10: of:=[.C10]*[.L10] -> 562.399973476561 | S10: of:=[.D10]*[.M10] -> 410.399980645058 | T10: of:=1/[.L10] -> 6.57894767869188 | U10: of:=1/[.M10] -> 6.57894767869188 | V10: of:=[.B10]*[.T10] -> 1.15131584442897 | W10: of:=[.C10]*[.U10] -> 24342.10641116
A11: of:=[.A10]+1 -> 9 | B11: of:=[$curvi.A13] -> 0.2000000001 | C11: 3500 | D11: 2650 | E11: of:=[.B11]*[.C11] -> 700.00000035 | F11: of:=[.B11]*[.D11] -> 530.000000265 | G11: of:=[.C11]*[$curvi.$I13] -> 605.51304193269 | H11: of:=[.D11]*[$curvi.$I13] -> 458.45987460618 | J11: of:=([.E11]-[.G11])/[.C11] -> 0.0269962738335171 | K11: of:=([.F11]-[.H11])/[.D11] -> 0.0269962738335171 | L11: of:=[.B11]-[.J11] -> 0.173003726266483 | M11: of:=[.B11]-[.K11] -> 0.173003726266483 | N11: of:=[.C11]*[.$B11] -> 700.00000035 | O11: of:=[.D11]*[.$B11] -> 530.000000265 | R11: of:=[.C11]*[.L11] -> 605.51304193269 | S11: of:=[.D11]*[.M11] -> 458.45987460618 | T11: of:=1/[.L11] -> 5.78022231994974 | U11: of:=1/[.M11] -> 5.78022231994974 | V11: of:=[.B11]*[.T11] -> 1.15604446456797 | W11: of:=[.C11]*[.U11] -> 20230.7781198241
A12: of:=[.A11]+1 -> 10 | B12: of:=[$curvi.A14] -> 0.2250000001 | C12: 3350 | D12: 2600 | E12: of:=[.B12]*[.C12] -> 753.750000335 | F12: of:=[.B12]*[.D12] -> 585.00000026 | G12: of:=[.C12]*[$curvi.$I14] -> 649.181104482576 | H12: of:=[.D12]*[$curvi.$I14] -> 503.842051240208 | J12: of:=([.E12]-[.G12])/[.C12] -> 0.0312145957768431 | K12: of:=([.F12]-[.H12])/[.D12] -> 0.0312145957768431 | L12: of:=[.B12]-[.J12] -> 0.193785404323157 | M12: of:=[.B12]-[.K12] -> 0.193785404323157 | N12: of:=[.C12]*[.$B12] -> 753.750000335 | O12: of:=[.D12]*[.$B12] -> 585.00000026 | R12: of:=[.C12]*[.L12] -> 649.181104482576 | S12: of:=[.D12]*[.M12] -> 503.842051240208 | T12: of:=1/[.L12] -> 5.16034736203558 | U12: of:=1/[.M12] -> 5.16034736203557 | V12: of:=[.B12]*[.T12] -> 1.16107815697404 | W12: of:=[.C12]*[.U12] -> 17287.1636628192
A13: of:=[.A12]+1 -> 11 | B13: of:=[$curvi.A15] -> 0.2500000001 | C13: 3250 | D13: 2583 | E13: of:=[.B13]*[.C13] -> 812.500000325 | F13: of:=[.B13]*[.D13] -> 645.7500002583 | G13: of:=[.C13]*[$curvi.$I15] -> 696.559467844516 | H13: of:=[.D13]*[$curvi.$I15] -> 553.604032443811 | J13: of:=([.E13]-[.G13])/[.C13] -> 0.0356740099939952 | K13: of:=([.F13]-[.H13])/[.D13] -> 0.0356740099939952 | L13: of:=[.B13]-[.J13] -> 0.214325990106005 | M13: of:=[.B13]-[.K13] -> 0.214325990106005 | N13: of:=[.C13]*[.$B13] -> 812.500000325 | O13: of:=[.D13]*[.$B13] -> 645.7500002583 | R13: of:=[.C13]*[.L13] -> 696.559467844516 | S13: of:=[.D13]*[.M13] -> 553.604032443811 | T13: of:=1/[.L13] -> 4.66578971362924 | U13: of:=1/[.M13] -> 4.66578971362924 | V13: of:=[.B13]*[.T13] -> 1.16644742887389 | W13: of:=[.C13]*[.U13] -> 15163.816569295
A14: of:=[.A13]+1 -> 12 | B14: of:=[$curvi.A16] -> 0.2750000001 | C14: 3150 | D14: 2578 | E14: of:=[.B14]*[.C14] -> 866.250000315 | F14: of:=[.B14]*[.D14] -> 708.9500002578 | G14: of:=[.C14]*[$curvi.$I16] -> 739.003250951937 | H14: of:=[.D14]*[$curvi.$I16] -> 604.809644747331 | J14: of:=([.E14]-[.G14])/[.C14] -> 0.0403957934485915 | K14: of:=([.F14]-[.H14])/[.D14] -> 0.0403957934485915 | L14: of:=[.B14]-[.J14] -> 0.234604206651408 | M14: of:=[.B14]-[.K14] -> 0.234604206651408 | N14: of:=[.C14]*[.$B14] -> 866.250000315 | O14: of:=[.D14]*[.$B14] -> 708.9500002578 | R14: of:=[.C14]*[.L14] -> 739.003250951937 | S14: of:=[.D14]*[.M14] -> 604.809644747331 | T14: of:=1/[.L14] -> 4.26249816349572 | U14: of:=1/[.M14] -> 4.26249816349572 | V14: of:=[.B14]*[.T14] -> 1.17218699538757 | W14: of:=[.C14]*[.U14] -> 13426.8692150115
A15: of:=[.A14]+1 -> 13 | B15: of:=[$curvi.A17] -> 0.3000000001 | C15: 3050 | D15: 2574 | E15: of:=[.B15]*[.C15] -> 915.000000305 | F15: of:=[.B15]*[.D15] -> 772.2000002574 | G15: of:=[.C15]*[$curvi.$I17] -> 776.518402239994 | H15: of:=[.D15]*[$curvi.$I17] -> 655.330612251064 | J15: of:=([.E15]-[.G15])/[.C15] -> 0.0454038026442642 | K15: of:=([.F15]-[.H15])/[.D15] -> 0.0454038026442642 | L15: of:=[.B15]-[.J15] -> 0.254596197455736 | M15: of:=[.B15]-[.K15] -> 0.254596197455736 | N15: of:=[.C15]*[.$B15] -> 915.000000305 | O15: of:=[.D15]*[.$B15] -> 772.2000002574 | R15: of:=[.C15]*[.L15] -> 776.518402239994 | S15: of:=[.D15]*[.M15] -> 655.330612251064 | T15: of:=1/[.L15] -> 3.92778843515077 | U15: of:=1/[.M15] -> 3.92778843515077 | V15: of:=[.B15]*[.T15] -> 1.17833653093801 | W15: of:=[.C15]*[.U15] -> 11979.7547272098
A16: of:=[.A15]+1 -> 14 | B16: of:=[$curvi.A18] -> 0.3250000001 | C16: 2950 | D16: 2570 | E16: of:=[.B16]*[.C16] -> 958.750000295 | F16: of:=[.B16]*[.D16] -> 835.250000257 | G16: of:=[.C16]*[$curvi.$I18] -> 809.111613851096 | H16: of:=[.D16]*[$curvi.$I18] -> 704.887066982142 | J16: of:=([.E16]-[.G16])/[.C16] -> 0.0507248767606453 | K16: of:=([.F16]-[.H16])/[.D16] -> 0.0507248767606454 | L16: of:=[.B16]-[.J16] -> 0.274275123339355 | M16: of:=[.B16]-[.K16] -> 0.274275123339355 | N16: of:=[.C16]*[.$B16] -> 958.750000295 | O16: of:=[.D16]*[.$B16] -> 835.250000257 | R16: of:=[.C16]*[.L16] -> 809.111613851096 | S16: of:=[.D16]*[.M16] -> 704.887066982142 | T16: of:=1/[.L16] -> 3.64597411469476 | U16: of:=1/[.M16] -> 3.64597411469476 | V16: of:=[.B16]*[.T16] -> 1.18494158764039 | W16: of:=[.C16]*[.U16] -> 10755.6236383495
A17: of:=[.A16]+1 -> 15 | B17: of:=[$curvi.A19] -> 0.3500000001 | C17: 2850 | D17: 2560 | E17: of:=[.B17]*[.C17] -> 997.500000285 | F17: of:=[.B17]*[.D17] -> 896.000000256 | G17: of:=[.C17]*[$curvi.$I19] -> 836.790441613142 | H17: of:=[.D17]*[$curvi.$I19] -> 751.643344045488 | J17: of:=([.E17]-[.G17])/[.C17] -> 0.0563893188322312 | K17: of:=([.F17]-[.H17])/[.D17] -> 0.0563893188322312 | L17: of:=[.B17]-[.J17] -> 0.293610681267769 | M17: of:=[.B17]-[.K17] -> 0.293610681267769 | N17: of:=[.C17]*[.$B17] -> 997.500000285 | O17: of:=[.D17]*[.$B17] -> 896.000000256 | R17: of:=[.C17]*[.L17] -> 836.790441613142 | S17: of:=[.D17]*[.M17] -> 751.643344045488 | T17: of:=1/[.L17] -> 3.40587064367735 | U17: of:=1/[.M17] -> 3.40587064367735 | V17: of:=[.B17]*[.T17] -> 1.19205472562766 | W17: of:=[.C17]*[.U17] -> 9706.73133448044
A18: of:=[.A17]+1 -> 16 | B18: of:=[$curvi.A20] -> 0.3750000001 | C18: 2750 | D18: 2555 | E18: of:=[.B18]*[.C18] -> 1031.250000275 | F18: of:=[.B18]*[.D18] -> 958.1250002555 | G18: of:=[.C18]*[$curvi.$I20] -> 859.563449018667 | H18: of:=[.D18]*[$curvi.$I20] -> 798.61258627007 | J18: of:=([.E18]-[.G18])/[.C18] -> 0.0624314731841214 | K18: of:=([.F18]-[.H18])/[.D18] -> 0.0624314731841214 | L18: of:=[.B18]-[.J18] -> 0.312568526915879 | M18: of:=[.B18]-[.K18] -> 0.312568526915879 | N18: of:=[.C18]*[.$B18] -> 1031.250000275 | O18: of:=[.D18]*[.$B18] -> 958.1250002555 | R18: of:=[.C18]*[.L18] -> 859.563449018667 | S18: of:=[.D18]*[.M18] -> 798.61258627007 | T18: of:=1/[.L18] -> 3.19929843822417 | U18: of:=1/[.M18] -> 3.19929843822417 | V18: of:=[.B18]*[.T18] -> 1.19973691465399 | W18: of:=[.C18]*[.U18] -> 8798.07070511646
A19: of:=[.A18]+1 -> 17 | B19: of:=[$curvi.A21] -> 0.4000000001 | C19: 2600 | D19: 2548 | E19: of:=[.B19]*[.C19] -> 1040.00000026 | F19: of:=[.B19]*[.D19] -> 1019.2000002548 | G19: of:=[.C19]*[$curvi.$I21] -> 860.884902112757 | H19: of:=[.D19]*[$curvi.$I21] -> 843.667204070502 | J19: of:=([.E19]-[.G19])/[.C19] -> 0.0688904223643244 | K19: of:=([.F19]-[.H19])/[.D19] -> 0.0688904223643244 | L19: of:=[.B19]-[.J19] -> 0.331109577735676 | M19: of:=[.B19]-[.K19] -> 0.331109577735676 | N19: of:=[.C19]*[.$B19] -> 1040.00000026 | O19: of:=[.D19]*[.$B19] -> 1019.2000002548 | R19: of:=[.C19]*[.L19] -> 860.884902112757 | S19: of:=[.D19]*[.M19] -> 843.667204070502 | T19: of:=1/[.L19] -> 3.0201482144932 | U19: of:=1/[.M19] -> 3.0201482144932 | V19: of:=[.B19]*[.T19] -> 1.2080592860993 | W19: of:=[.C19]*[.U19] -> 7852.38535768233
A20: of:=[.A19]+1 -> 18 | B20: of:=[$curvi.A22] -> 0.4250000001 | C20: 2500 | D20: 2545 | E20: of:=[.B20]*[.C20] -> 1062.50000025 | F20: of:=[.B20]*[.D20] -> 1081.6250002545 | G20: of:=[.C20]*[$curvi.$I22] -> 872.972916615533 | H20: of:=[.D20]*[$curvi.$I22] -> 888.686429114612 | J20: of:=([.E20]-[.G20])/[.C20] -> 0.0758108334537872 | K20: of:=([.F20]-[.H20])/[.D20] -> 0.0758108334537872 | L20: of:=[.B20]-[.J20] -> 0.349189166646213 | M20: of:=[.B20]-[.K20] -> 0.349189166646213 | N20: of:=[.C20]*[.$B20] -> 1062.50000025 | O20: of:=[.D20]*[.$B20] -> 1081.6250002545 | R20: of:=[.C20]*[.L20] -> 872.972916615533 | S20: of:=[.D20]*[.M20] -> 888.686429114612 | T20: of:=1/[.L20] -> 2.86377727466318 | U20: of:=1/[.M20] -> 2.86377727466318 | V20: of:=[.B20]*[.T20] -> 1.21710534201823 | W20: of:=[.C20]*[.U20] -> 7159.44318665796
A21: of:=[.A20]+1 -> 19 | B21: of:=[$curvi.A23] -> 0.4500000001 | C21: 2350 | D21: 2538 | E21: of:=[.B21]*[.C21] -> 1057.500000235 | F21: of:=[.B21]*[.D21] -> 1142.1000002538 | G21: of:=[.C21]*[$curvi.$I23] -> 861.87661788081 | H21: of:=[.D21]*[$curvi.$I23] -> 930.826747311274 | J21: of:=([.E21]-[.G21])/[.C21] -> 0.0832439924911451 | K21: of:=([.F21]-[.H21])/[.D21] -> 0.0832439924911451 | L21: of:=[.B21]-[.J21] -> 0.366756007608855 | M21: of:=[.B21]-[.K21] -> 0.366756007608855 | N21: of:=[.C21]*[.$B21] -> 1057.500000235 | O21: of:=[.D21]*[.$B21] -> 1142.1000002538 | R21: of:=[.C21]*[.L21] -> 861.87661788081 | S21: of:=[.D21]*[.M21] -> 930.826747311274 | T21: of:=1/[.L21] -> 2.72660836974346 | U21: of:=1/[.M21] -> 2.72660836974346 | V21: of:=[.B21]*[.T21] -> 1.22697376665722 | W21: of:=[.C21]*[.U21] -> 6407.52966889713
A22: of:=[.A21]+1 -> 20 | B22: of:=[$curvi.A24] -> 0.4750000001 | C22: 2100 | D22: 2535 | E22: of:=[.B22]*[.C22] -> 997.50000021 | F22: of:=[.B22]*[.D22] -> 1204.1250002535 | G22: of:=[.C22]*[$curvi.$I24] -> 805.876937100318 | H22: of:=[.D22]*[$curvi.$I24] -> 972.808588356812 | J22: of:=([.E22]-[.G22])/[.C22] -> 0.0912490776712775 | K22: of:=([.F22]-[.H22])/[.D22] -> 0.0912490776712775 | L22: of:=[.B22]-[.J22] -> 0.383750922428723 | M22: of:=[.B22]-[.K22] -> 0.383750922428723 | N22: of:=[.C22]*[.$B22] -> 997.50000021 | O22: of:=[.D22]*[.$B22] -> 1204.1250002535 | R22: of:=[.C22]*[.L22] -> 805.876937100318 | S22: of:=[.D22]*[.M22] -> 972.808588356812 | T22: of:=1/[.L22] -> 2.60585692842403 | U22: of:=1/[.M22] -> 2.60585692842403 | V22: of:=[.B22]*[.T22] -> 1.237782041262 | W22: of:=[.C22]*[.U22] -> 5472.29954969047
A23: of:=[.A22]+1 -> 21 | B23: of:=[$curvi.A25] -> 0.5000000001 | C23: 1850 | D23: 2535 | E23: of:=[.B23]*[.C23] -> 925.000000185 | F23: of:=[.B23]*[.D23] -> 1267.5000002535 | G23: of:=[.C23]*[$curvi.$I25] -> 740.194734529932 | H23: of:=[.D23]*[$curvi.$I25] -> 1014.26683893696 | J23: of:=([.E23]-[.G23])/[.C23] -> 0.0998947381919287 | K23: of:=([.F23]-[.H23])/[.D23] -> 0.0998947381919287 | L23: of:=[.B23]-[.J23] -> 0.400105261908072 | M23: of:=[.B23]-[.K23] -> 0.400105261908072 | N23: of:=[.C23]*[.$B23] -> 925.000000185 | O23: of:=[.D23]*[.$B23] -> 1267.5000002535 | R23: of:=[.C23]*[.L23] -> 740.194734529932 | S23: of:=[.D23]*[.M23] -> 1014.26683893696 | T23: of:=1/[.L23] -> 2.49934228615509 | U23: of:=1/[.M23] -> 2.49934228615509 | V23: of:=[.B23]*[.T23] -> 1.24967114332748 | W23: of:=[.C23]*[.U23] -> 4623.78322938691
A24: of:=[.A23]+1 -> 22 | B24: of:=[$curvi.A26] -> 0.5250000001 | C24: 1550 | D24: 2530 | E24: of:=[.B24]*[.C24] -> 813.750000155 | F24: of:=[.B24]*[.D24] -> 1328.250000253 | G24: of:=[.C24]*[$curvi.$I26] -> 644.395344878718 | H24: of:=[.D24]*[$curvi.$I26] -> 1051.81949841494 | J24: of:=([.E24]-[.G24])/[.C24] -> 0.109261067920182 | K24: of:=([.F24]-[.H24])/[.D24] -> 0.109261067920182 | L24: of:=[.B24]-[.J24] -> 0.415738932179818 | M24: of:=[.B24]-[.K24] -> 0.415738932179818 | N24: of:=[.C24]*[.$B24] -> 813.750000155 | O24: of:=[.D24]*[.$B24] -> 1328.250000253 | R24: of:=[.C24]*[.L24] -> 644.395344878718 | S24: of:=[.D24]*[.M24] -> 1051.81949841494 | T24: of:=1/[.L24] -> 2.40535567539167 | U24: of:=1/[.M24] -> 2.40535567539167 | V24: of:=[.B24]*[.T24] -> 1.26281172982117 | W24: of:=[.C24]*[.U24] -> 3728.3012968571
A25: of:=[.A24]+1 -> 23 | B25: of:=[$curvi.A27] -> 0.5500000001 | C25: 1250 | D25: 2520 | E25: of:=[.B25]*[.C25] -> 687.500000125 | F25: of:=[.B25]*[.D25] -> 1386.000000252 | G25: of:=[.C25]*[$curvi.$I27] -> 538.197382530341 | H25: of:=[.D25]*[$curvi.$I27] -> 1085.00592318117 | J25: of:=([.E25]-[.G25])/[.C25] -> 0.119442094075727 | K25: of:=([.F25]-[.H25])/[.D25] -> 0.119442094075727 | L25: of:=[.B25]-[.J25] -> 0.430557906024273 | M25: of:=[.B25]-[.K25] -> 0.430557906024273 | N25: of:=[.C25]*[.$B25] -> 687.500000125 | O25: of:=[.D25]*[.$B25] -> 1386.000000252 | R25: of:=[.C25]*[.L25] -> 538.197382530341 | S25: of:=[.D25]*[.M25] -> 1085.00592318117 | T25: of:=1/[.L25] -> 2.32256796590706 | U25: of:=1/[.M25] -> 2.32256796590706 | V25: of:=[.B25]*[.T25] -> 1.27741238148114 | W25: of:=[.C25]*[.U25] -> 2903.20995738383
A26: of:=[.A25]+1 -> 24 | B26: of:=[$curvi.A28] -> 0.5750000001 | C26: 1100 | D26: 2515 | E26: of:=[.B26]*[.C26] -> 632.50000011 | F26: of:=[.B26]*[.D26] -> 1446.1250002515 | G26: of:=[.C26]*[$curvi.$I28] -> 488.896160776212 | H26: of:=[.D26]*[$curvi.$I28] -> 1117.79440395652 | J26: of:=([.E26]-[.G26])/[.C26] -> 0.130548944848898 | K26: of:=([.F26]-[.H26])/[.D26] -> 0.130548944848898 | L26: of:=[.B26]-[.J26] -> 0.444451055251102 | M26: of:=[.B26]-[.K26] -> 0.444451055251102 | N26: of:=[.C26]*[.$B26] -> 632.50000011 | O26: of:=[.D26]*[.$B26] -> 1446.1250002515 | R26: of:=[.C26]*[.L26] -> 488.896160776212 | S26: of:=[.D26]*[.M26] -> 1117.79440395652 | T26: of:=1/[.L26] -> 2.24996653328909 | U26: of:=1/[.M26] -> 2.24996653328909 | V26: of:=[.B26]*[.T26] -> 1.29373075686622 | W26: of:=[.C26]*[.U26] -> 2474.963186618
A27: of:=[.A26]+1 -> 25 | B27: of:=[$curvi.A29] -> 0.6000000001 | C27: 800 | D27: 2510 | E27: of:=[.B27]*[.C27] -> 480.00000008 | F27: of:=[.B27]*[.D27] -> 1506.000000251 | G27: of:=[.C27]*[$curvi.$I29] -> 365.828862211212 | H27: of:=[.D27]*[$curvi.$I29] -> 1147.78805518768 | J27: of:=([.E27]-[.G27])/[.C27] -> 0.142713922335986 | K27: of:=([.F27]-[.H27])/[.D27] -> 0.142713922335986 | L27: of:=[.B27]-[.J27] -> 0.457286077764014 | M27: of:=[.B27]-[.K27] -> 0.457286077764014 | N27: of:=[.C27]*[.$B27] -> 480.00000008 | O27: of:=[.D27]*[.$B27] -> 1506.000000251 | R27: of:=[.C27]*[.L27] -> 365.828862211212 | S27: of:=[.D27]*[.M27] -> 1147.78805518768 | T27: of:=1/[.L27] -> 2.18681488159379 | U27: of:=1/[.M27] -> 2.18681488159379 | V27: of:=[.B27]*[.T27] -> 1.31208892917495 | W27: of:=[.C27]*[.U27] -> 1749.45190527503
A28: of:=[.A27]+1 -> 26 | B28: of:=[$curvi.A30] -> 0.6250000001 | C28: 600 | D28: 2500 | E28: of:=[.B28]*[.C28] -> 375.00000006 | F28: of:=[.B28]*[.D28] -> 1562.50000025 | G28: of:=[.C28]*[$curvi.$I30] -> 281.342521405745 | H28: of:=[.D28]*[$curvi.$I30] -> 1172.26050585727 | J28: of:=([.E28]-[.G28])/[.C28] -> 0.156095797757091 | K28: of:=([.F28]-[.H28])/[.D28] -> 0.156095797757091 | L28: of:=[.B28]-[.J28] -> 0.468904202342909 | M28: of:=[.B28]-[.K28] -> 0.468904202342909 | N28: of:=[.C28]*[.$B28] -> 375.00000006 | O28: of:=[.D28]*[.$B28] -> 1562.50000025 | R28: of:=[.C28]*[.L28] -> 281.342521405745 | S28: of:=[.D28]*[.M28] -> 1172.26050585727 | T28: of:=1/[.L28] -> 2.13263177212624 | U28: of:=1/[.M28] -> 2.13263177212624 | V28: of:=[.B28]*[.T28] -> 1.33289485779217 | W28: of:=[.C28]*[.U28] -> 1279.57906327574
A29: of:=[.A28]+1 -> 27 | B29: of:=[$curvi.A31] -> 0.6500000001 | C29: 500 | D29: 2450 | E29: of:=[.B29]*[.C29] -> 325.00000005 | F29: of:=[.B29]*[.D29] -> 1592.500000245 | G29: of:=[.C29]*[$curvi.$I31] -> 239.556610336452 | H29: of:=[.D29]*[$curvi.$I31] -> 1173.82739064861 | J29: of:=([.E29]-[.G29])/[.C29] -> 0.170886779427097 | K29: of:=([.F29]-[.H29])/[.D29] -> 0.170886779427097 | L29: of:=[.B29]-[.J29] -> 0.479113220672904 | M29: of:=[.B29]-[.K29] -> 0.479113220672903 | N29: of:=[.C29]*[.$B29] -> 325.00000005 | O29: of:=[.D29]*[.$B29] -> 1592.500000245 | R29: of:=[.C29]*[.L29] -> 239.556610336452 | S29: of:=[.D29]*[.M29] -> 1173.82739064861 | T29: of:=1/[.L29] -> 2.08718932572039 | U29: of:=1/[.M29] -> 2.08718932572039 | V29: of:=[.B29]*[.T29] -> 1.35667306192697 | W29: of:=[.C29]*[.U29] -> 1043.59466286019
A30: of:=[.A29]+1 -> 28 | B30: of:=[$curvi.A32] -> 0.6750000001 | C30: 450 | D30: 2400 | E30: of:=[.B30]*[.C30] -> 303.750000045 | F30: of:=[.B30]*[.D30] -> 1620.00000024 | G30: of:=[.C30]*[$curvi.$I32] -> 219.455188140321 | H30: of:=[.D30]*[$curvi.$I32] -> 1170.42767008171 | J30: of:=([.E30]-[.G30])/[.C30] -> 0.187321804232621 | K30: of:=([.F30]-[.H30])/[.D30] -> 0.187321804232621 | L30: of:=[.B30]-[.J30] -> 0.48767819586738 | M30: of:=[.B30]-[.K30] -> 0.48767819586738 | N30: of:=[.C30]*[.$B30] -> 303.750000045 | O30: of:=[.D30]*[.$B30] -> 1620.00000024 | R30: of:=[.C30]*[.L30] -> 219.455188140321 | S30: of:=[.D30]*[.M30] -> 1170.42767008171 | T30: of:=1/[.L30] -> 2.05053252016201 | U30: of:=1/[.M30] -> 2.05053252016201 | V30: of:=[.B30]*[.T30] -> 1.38410945131441 | W30: of:=[.C30]*[.U30] -> 922.739634072904
A31: of:=[.A30]+1 -> 29 | B31: of:=[$curvi.A33] -> 0.7000000001 | C31: 450 | D31: 2300 | E31: of:=[.B31]*[.C31] -> 315.000000045 | F31: of:=[.B31]*[.D31] -> 1610.00000023 | G31: of:=[.C31]*[$curvi.$I33] -> 222.43900066964 | H31: of:=[.D31]*[$curvi.$I33] -> 1136.91044786705 | J31: of:=([.E31]-[.G31])/[.C31] -> 0.205691109723022 | K31: of:=([.F31]-[.H31])/[.D31] -> 0.205691109723022 | L31: of:=[.B31]-[.J31] -> 0.494308890376978 | M31: of:=[.B31]-[.K31] -> 0.494308890376979 | N31: of:=[.C31]*[.$B31] -> 315.000000045 | O31: of:=[.D31]*[.$B31] -> 1610.00000023 | R31: of:=[.C31]*[.L31] -> 222.43900066964 | S31: of:=[.D31]*[.M31] -> 1136.91044786705 | T31: of:=1/[.L31] -> 2.02302653152235 | U31: of:=1/[.M31] -> 2.02302653152235 | V31: of:=[.B31]*[.T31] -> 1.41611857226795 | W31: of:=[.C31]*[.U31] -> 910.361939185057
A32: of:=[.A31]+1 -> 30 | B32: of:=[$curvi.A34] -> 0.7250000001 | C32: 400 | D32: 2150 | E32: of:=[.B32]*[.C32] -> 290.00000004 | F32: of:=[.B32]*[.D32] -> 1558.750000215 | G32: of:=[.C32]*[$curvi.$I34] -> 199.456990970266 | H32: of:=[.D32]*[$curvi.$I34] -> 1072.08132646518 | J32: of:=([.E32]-[.G32])/[.C32] -> 0.226357522674336 | K32: of:=([.F32]-[.H32])/[.D32] -> 0.226357522674336 | L32: of:=[.B32]-[.J32] -> 0.498642477425665 | M32: of:=[.B32]-[.K32] -> 0.498642477425665 | N32: of:=[.C32]*[.$B32] -> 290.00000004 | O32: of:=[.D32]*[.$B32] -> 1558.750000215 | R32: of:=[.C32]*[.L32] -> 199.456990970266 | S32: of:=[.D32]*[.M32] -> 1072.08132646518 | T32: of:=1/[.L32] -> 2.00544487337438 | U32: of:=1/[.M32] -> 2.00544487337438 | V32: of:=[.B32]*[.T32] -> 1.45394753339697 | W32: of:=[.C32]*[.U32] -> 802.177949349753
A33: of:=[.A32]+1 -> 31 | B33: of:=[$curvi.A35] -> 0.7500000001 | C33: 360 | D33: 1850 | E33: of:=[.B33]*[.C33] -> 270.000000036 | F33: of:=[.B33]*[.D33] -> 1387.500000185 | G33: of:=[.C33]*[$curvi.$I35] -> 180.078960235549 | H33: of:=[.D33]*[$curvi.$I35] -> 925.405767877129 | J33: of:=([.E33]-[.G33])/[.C33] -> 0.249780666112363 | K33: of:=([.F33]-[.H33])/[.D33] -> 0.249780666112363 | L33: of:=[.B33]-[.J33] -> 0.500219333987637 | M33: of:=[.B33]-[.K33] -> 0.500219333987637 | N33: of:=[.C33]*[.$B33] -> 270.000000036 | O33: of:=[.D33]*[.$B33] -> 1387.500000185 | R33: of:=[.C33]*[.L33] -> 180.078960235549 | S33: of:=[.D33]*[.M33] -> 925.405767877129 | T33: of:=1/[.L33] -> 1.99912304873989 | U33: of:=1/[.M33] -> 1.99912304873989 | V33: of:=[.B33]*[.T33] -> 1.49934228675483 | W33: of:=[.C33]*[.U33] -> 719.684297546359
A34: of:=[.A33]+1 -> 32 | B34: of:=[$curvi.A36] -> 0.7750000001 | C34: 350 | D34: 1670 | E34: of:=[.B34]*[.C34] -> 271.250000035 | F34: of:=[.B34]*[.D34] -> 1294.250000167 | G34: of:=[.C34]*[$curvi.$I36] -> 174.456959057366 | H34: of:=[.D34]*[$curvi.$I36] -> 832.408918930863 | J34: of:=([.E34]-[.G34])/[.C34] -> 0.276551545650382 | K34: of:=([.F34]-[.H34])/[.D34] -> 0.276551545650382 | L34: of:=[.B34]-[.J34] -> 0.498448454449618 | M34: of:=[.B34]-[.K34] -> 0.498448454449618 | N34: of:=[.C34]*[.$B34] -> 271.250000035 | O34: of:=[.D34]*[.$B34] -> 1294.250000167 | R34: of:=[.C34]*[.L34] -> 174.456959057366 | S34: of:=[.D34]*[.M34] -> 832.408918930863 | T34: of:=1/[.L34] -> 2.00622550049672 | U34: of:=1/[.M34] -> 2.00622550049672 | V34: of:=[.B34]*[.T34] -> 1.55482476308558 | W34: of:=[.C34]*[.U34] -> 702.178925173851
A35: of:=[.A34]+1 -> 33 | B35: of:=[$curvi.A37] -> 0.8000000001 | C35: 300 | D35: 1505 | E35: of:=[.B35]*[.C35] -> 240.00000003 | F35: of:=[.B35]*[.D35] -> 1204.0000001505 | G35: of:=[.C35]*[$curvi.$I37] -> 147.767067980333 | H35: of:=[.D35]*[$curvi.$I37] -> 741.298124368002 | J35: of:=([.E35]-[.G35])/[.C35] -> 0.307443106832225 | K35: of:=([.F35]-[.H35])/[.D35] -> 0.307443106832225 | L35: of:=[.B35]-[.J35] -> 0.492556893267776 | M35: of:=[.B35]-[.K35] -> 0.492556893267776 | N35: of:=[.C35]*[.$B35] -> 240.00000003 | O35: of:=[.D35]*[.$B35] -> 1204.0000001505 | R35: of:=[.C35]*[.L35] -> 147.767067980333 | S35: of:=[.D35]*[.M35] -> 741.298124368002 | T35: of:=1/[.L35] -> 2.03022232287866 | U35: of:=1/[.M35] -> 2.03022232287866 | V35: of:=[.B35]*[.T35] -> 1.62417785850595 | W35: of:=[.C35]*[.U35] -> 609.066696863598
A36: of:=[.A35]+1 -> 34 | B36: of:=[$curvi.A38] -> 0.825000000100001 | C36: 260 | D36: 1350 | E36: of:=[.B36]*[.C36] -> 214.500000026 | F36: of:=[.B36]*[.D36] -> 1113.750000135 | G36: of:=[.C36]*[$curvi.$I38] -> 125.193617923502 | H36: of:=[.D36]*[$curvi.$I38] -> 650.043785372031 | J36: of:=([.E36]-[.G36])/[.C36] -> 0.343486085009607 | K36: of:=([.F36]-[.H36])/[.D36] -> 0.343486085009607 | L36: of:=[.B36]-[.J36] -> 0.481513915090393 | M36: of:=[.B36]-[.K36] -> 0.481513915090393 | N36: of:=[.C36]*[.$B36] -> 214.500000026 | O36: of:=[.D36]*[.$B36] -> 1113.750000135 | R36: of:=[.C36]*[.L36] -> 125.193617923502 | S36: of:=[.D36]*[.M36] -> 650.043785372031 | T36: of:=1/[.L36] -> 2.07678318042434 | U36: of:=1/[.M36] -> 2.07678318042434 | V36: of:=[.B36]*[.T36] -> 1.71334612405776 | W36: of:=[.C36]*[.U36] -> 539.963626910327
A37: of:=[.A36]+1 -> 35 | B37: of:=[$curvi.A39] -> 0.850000000100001 | C37: 245 | D37: 980 | E37: of:=[.B37]*[.C37] -> 208.2500000245 | F37: of:=[.B37]*[.D37] -> 833.000000098001 | G37: of:=[.C37]*[$curvi.$I39] -> 113.658868129605 | H37: of:=[.D37]*[$curvi.$I39] -> 454.63547251842 | J37: of:=([.E37]-[.G37])/[.C37] -> 0.386086252632225 | K37: of:=([.F37]-[.H37])/[.D37] -> 0.386086252632225 | L37: of:=[.B37]-[.J37] -> 0.463913747467776 | M37: of:=[.B37]-[.K37] -> 0.463913747467776 | N37: of:=[.C37]*[.$B37] -> 208.2500000245 | O37: of:=[.D37]*[.$B37] -> 833.000000098001 | R37: of:=[.C37]*[.L37] -> 113.658868129605 | S37: of:=[.D37]*[.M37] -> 454.63547251842 | T37: of:=1/[.L37] -> 2.15557311129147 | U37: of:=1/[.M37] -> 2.15557311129147 | V37: of:=[.B37]*[.T37] -> 1.83223714481331 | W37: of:=[.C37]*[.U37] -> 528.115412266411
A38: of:=[.A37]+1 -> 36 | B38: of:=[$curvi.A40] -> 0.875000000100001 | C38: 200 | D38: 755 | E38: of:=[.B38]*[.C38] -> 175.00000002 | F38: of:=[.B38]*[.D38] -> 660.6250000755 | G38: of:=[.C38]*[$curvi.$I40] -> 87.5575877777082 | H38: of:=[.D38]*[$curvi.$I40] -> 330.529893860849 | J38: of:=([.E38]-[.G38])/[.C38] -> 0.437212061211459 | K38: of:=([.F38]-[.H38])/[.D38] -> 0.437212061211459 | L38: of:=[.B38]-[.J38] -> 0.437787938888541 | M38: of:=[.B38]-[.K38] -> 0.437787938888541 | N38: of:=[.C38]*[.$B38] -> 175.00000002 | O38: of:=[.D38]*[.$B38] -> 660.6250000755 | R38: of:=[.C38]*[.L38] -> 87.5575877777083 | S38: of:=[.D38]*[.M38] -> 330.529893860849 | T38: of:=1/[.L38] -> 2.28421094134938 | U38: of:=1/[.M38] -> 2.28421094134938 | V38: of:=[.B38]*[.T38] -> 1.99868457390913 | W38: of:=[.C38]*[.U38] -> 456.842188269876
A39: of:=[.A38]+1 -> 37 | B39: of:=[$curvi.A41] -> 0.900000000100001 | C39: 190 | D39: 575 | E39: of:=[.B39]*[.C39] -> 171.000000019 | F39: of:=[.B39]*[.D39] -> 517.5000000575 | G39: of:=[.C39]*[$curvi.$I41] -> 76.0555808307722 | H39: of:=[.D39]*[$curvi.$I41] -> 230.168205145758 | J39: of:=([.E39]-[.G39])/[.C39] -> 0.499707469411726 | K39: of:=([.F39]-[.H39])/[.D39] -> 0.499707469411726 | L39: of:=[.B39]-[.J39] -> 0.400292530688274 | M39: of:=[.B39]-[.K39] -> 0.400292530688275 | N39: of:=[.C39]*[.$B39] -> 171.000000019 | O39: of:=[.D39]*[.$B39] -> 517.5000000575 | R39: of:=[.C39]*[.L39] -> 76.0555808307722 | S39: of:=[.D39]*[.M39] -> 230.168205145758 | T39: of:=1/[.L39] -> 2.49817301931808 | U39: of:=1/[.M39] -> 2.49817301931807 | V39: of:=[.B39]*[.T39] -> 2.24835571763609 | W39: of:=[.C39]*[.U39] -> 474.652873670434
A40: of:=[.A39]+1 -> 38 | B40: of:=[$curvi.A42] -> 0.925000000100001 | C40: 150 | D40: 276 | E40: of:=[.B40]*[.C40] -> 138.750000015 | F40: of:=[.B40]*[.D40] -> 255.3000000276 | G40: of:=[.C40]*[$curvi.$I42] -> 52.0740622258581 | H40: of:=[.D40]*[$curvi.$I42] -> 95.816274495579 | J40: of:=([.E40]-[.G40])/[.C40] -> 0.577839585260946 | K40: of:=([.F40]-[.H40])/[.D40] -> 0.577839585260946 | L40: of:=[.B40]-[.J40] -> 0.347160414839054 | M40: of:=[.B40]-[.K40] -> 0.347160414839054 | N40: of:=[.C40]*[.$B40] -> 138.750000015 | O40: of:=[.D40]*[.$B40] -> 255.3000000276 | R40: of:=[.C40]*[.L40] -> 52.0740622258581 | S40: of:=[.D40]*[.M40] -> 95.816274495579 | T40: of:=1/[.L40] -> 2.88051274643051 | U40: of:=1/[.M40] -> 2.88051274643051 | V40: of:=[.B40]*[.T40] -> 2.66447429073628 | W40: of:=[.C40]*[.U40] -> 432.076911964577
A41: of:=[.A40]+1 -> 39 | B41: of:=[$curvi.A43] -> 0.950000000100001 | C41: 110 | D41: 158 | E41: of:=[.B41]*[.C41] -> 104.500000011 | F41: of:=[.B41]*[.D41] -> 150.1000000158 | G41: of:=[.C41]*[$curvi.$I43] -> 29.8852226930332 | H41: of:=[.D41]*[$curvi.$I43] -> 42.9260471409023 | J41: of:=([.E41]-[.G41])/[.C41] -> 0.678316157436062 | K41: of:=([.F41]-[.H41])/[.D41] -> 0.678316157436062 | L41: of:=[.B41]-[.J41] -> 0.271683842663939 | M41: of:=[.B41]-[.K41] -> 0.271683842663939 | N41: of:=[.C41]*[.$B41] -> 104.500000011 | O41: of:=[.D41]*[.$B41] -> 150.1000000158 | R41: of:=[.C41]*[.L41] -> 29.8852226930332 | S41: of:=[.D41]*[.M41] -> 42.9260471409023 | T41: of:=1/[.L41] -> 3.68074888147455 | U41: of:=1/[.M41] -> 3.68074888147455 | V41: of:=[.B41]*[.T41] -> 3.4967114377689 | W41: of:=[.C41]*[.U41] -> 404.882376962201
A42: of:=[.A41]+1 -> 40 | B42: of:=[$curvi.A44] -> 0.975000000100001 | C42: 95 | D42: 95 | E42: of:=[.B42]*[.C42] -> 92.6250000095001 | F42: of:=[.B42]*[.D42] -> 92.6250000095001 | G42: of:=[.C42]*[$curvi.$I44] -> 15.4544409394517 | H42: of:=[.D42]*[$curvi.$I44] -> 15.4544409394517 | J42: of:=([.E42]-[.G42])/[.C42] -> 0.812321674421561 | K42: of:=([.F42]-[.H42])/[.D42] -> 0.812321674421561 | L42: of:=[.B42]-[.J42] -> 0.162678325678439 | M42: of:=[.B42]-[.K42] -> 0.162678325678439 | N42: of:=[.C42]*[.$B42] -> 92.6250000095001 | O42: of:=[.D42]*[.$B42] -> 92.6250000095001 | R42: of:=[.C42]*[.L42] -> 15.4544409394517 | S42: of:=[.D42]*[.M42] -> 15.4544409394517 | T42: of:=1/[.L42] -> 6.14710039477948 | U42: of:=1/[.M42] -> 6.14710039477948 | V42: of:=[.B42]*[.T42] -> 5.99342288552471 | W42: of:=[.C42]*[.U42] -> 583.974537504051
A43: of:=[.A42]+1 -> 41 | B43: of:=[$curvi.A45] -> 1.0000000001 | C43: 30 | D43: 30 | E43: of:=[.B43]*[.C43] -> 30.000000003 | F43: of:=[.B43]*[.D43] -> 30.000000003 | G43: of:=[.C43]*[$curvi.$I45] -> -0.0000000240317765687337 | H43: of:=[.D43]*[$curvi.$I45] -> -0.0000000240317765687337 | J43: of:=([.E43]-[.G43])/[.C43] -> 1.00000000090106 | K43: of:=([.F43]-[.H43])/[.D43] -> 1.00000000090106 | L43: of:=[.B43]-[.J43] -> -0.000000000801059218957789 | M43: of:=[.B43]-[.K43] -> -0.000000000801059218957789 | N43: of:=[.C43]*[.$B43] -> 30.000000003 | O43: of:=[.D43]*[.$B43] -> 30.000000003 | R43: of:=[.C43]*[.L43] -> -0.0000000240317765687337 | S43: of:=[.D43]*[.M43] -> -0.0000000240317765687337 | T43: of:=1/[.L43] -> -1248347158.7794 | U43: of:=1/[.M43] -> -1248347158.7794 | V43: of:=[.B43]*[.T43] -> -1248347158.90423 | W43: of:=[.C43]*[.U43] -> -37450414763.3819
I44: averagess | J44: of:=SUM([.L3:.L43])/[.C48] -> 0.000126270573680319 | K44: of:=SUM([.M3:.M43])/[.D48] -> 0.000126270573680319 | L44: of:=SUM([.L3:.L43])/[.C48] -> 0.000126270573680319 | M44: of:=SUM([.M3:.M43])/[.D48] -> 0.000126270573680319 | N44: of:=SUM([.N3:.N43])/[.C48] -> 0.2163737501 | O44: of:=SUM([.O3:.O43])/[.D48] -> 0.3510210001 | R44: of:=SUM([.R3:.R43]) -> 17279.2266370511 | S44: of:=SUM([.S3:.S43]) -> 26149.6763763642 | T44: of:=SUM([.T3:.T43]) -> 10000008770.3544 | U44: of:=SUM([.U3:.U43]) -> 10000008770.3544 | V44: of:=SUM([.V3:.V43]) -> -1248347097.53966 | W44: of:=SUM([.W3:.W43]) -> 156877112841601
J46: NPE computated with current metrics | M46: deviation from the true NPE | P46: diagrams
C47: pop C | D47: pop A | G47: pop C | H47: pop A | K47: pop C | L47: pop A | M47: pop C | N47: pop A | Q47: of:=[.M47] -> pop C | R47: of:=[.N47] -> pop A
B48: N | C48: of:=SUM([.C3:.C43]) -> 100000 | D48: of:=SUM([.D3:.D43]) -> 100000 | F48: NPE | G48: of:=SUM([.G3:.G43]) -> 17279.2266370511 | H48: of:=SUM([.H3:.H43]) -> 26149.6763763642 | J48: OR | K48: of:=[.E52]*(([.E54]/(1-[.E54]))/([.E53]/(1-[.E53]))) -> 3570.77932714955 | L48: of:=[.F52]*(([.F54]/(1-[.F54]))/([.F53]/(1-[.F53]))) -> 6381.20768098172 | M48: of:=[.K48]/[.$G$48] -> 0.206651570822787 | N48: of:=[.L48]/[.$H$48] -> 0.244026258265647 | P48: of:=[.J48] -> OR | Q48: of:=[.M48] -> 0.206651570822787 | R48: of:=[.N48] -> 0.244026258265647
B49: taill cible | C49: 100000 | D49: 100000 | F49: average AB | G49: of:=[.G48]/[.C48] -> 0.172792266370511 | H49: of:=[.H48]/[.D48] -> 0.261496763763642 | J49: RR | K49: of:=[.E52]*([.E54]/[.E53]) -> 4358.14837294896 | L49: of:=[.F52]*([.F54]/[.F53]) -> 8952.42363363587 | M49: of:=[.K49]/[.$G$48] -> 0.252218948480251 | N49: of:=[.L49]/[.$H$48] -> 0.342353132971377 | P49: of:=[.J49] -> RR | Q49: of:=[.M49] -> 0.252218948480251 | R49: of:=[.N49] -> 0.342353132971377
B50: écart | C50: of:=[.C48]-[.D48] -> 0 | D50: of:=[.D49]-[.D48] -> 0 | J50: average AB | K50: of:=[.C48]*[.G49] -> 17279.2266370511 | L50: of:=[.D48]*[.H49] -> 26149.6763763642 | M50: of:=[.K50]/[.$G$48] -> 1 | N50: of:=[.L50]/[.$H$48] -> 1 | P50: of:=[.J50] -> average AB | Q50: of:=[.M50] -> 1 | R50: of:=[.N50] -> 1
E51: pop C | F51: pop A
D52: total events | E52: of:=SUM([.E3:.E43]) -> 21637.37501 | F52: of:=SUM([.F3:.F43]) -> 35102.10001
D53: average Rc | E53: of:=[.E52]/[.C48] -> 0.2163737501 | F53: of:=[.F52]/[.D48] -> 0.3510210001
D54: average Rt | E54: of:=([.E52]-[.G48])/[.C48] -> 0.0435814837294896 | F54: of:=[.F53]-[.H49] -> 0.0895242363363586
J55: pop NPE computated with current metrics and trial 1 summary data | M55: deviation from the true NPE
K56: pop C | L56: pop A | M56: pop C | N56: pop A | Q56: of:=[.M56] -> pop C | R56: of:=[.N56] -> pop A
J57: OR | K57: of:=[.E52]*(([.E63]/(1-[.E63]))/([.E62]/(1-[.E62]))) -> 3933.45650461822 | L57: of:=[.F52]*(([.E63]/(1-[.E63]))/([.E62]/(1-[.E62]))) -> 6381.20768098172 | M57: of:=[.K57]/[.$G$48] -> 0.227640772775322 | N57: of:=[.L57]/[.$H$48] -> 0.244026258265647 | P57: of:=[.J57] -> OR | Q57: of:=[.M57] -> 0.227640772775322 | R57: of:=[.N57] -> 0.244026258265647
J58: RR | K58: of:=[.E52]*([.E63]/[.E62]) -> 5518.38628897366 | L58: of:=[.F52]*([.E63]/[.E62]) -> 8952.42363363587 | M58: of:=[.K58]/[.$G$48] -> 0.319365351522205 | N58: of:=[.L58]/[.$H$48] -> 0.342353132971377 | P58: of:=[.J58] -> RR | Q58: of:=[.M58] -> 0.319365351522205 | R58: of:=[.N58] -> 0.342353132971377
J59: average AB | K59: of:=[.C48]*([.E62]-[.E63]) -> 26149.6763763642 | L59: of:=[.D48]*([.E62]-[.E63]) -> 26149.6763763642 | M59: of:=[.K59]/[.$G$48] -> 1.5133591870537 | N59: of:=[.L59]/[.$H$48] -> 1 | P59: of:=[.J59] -> average AB | Q59: of:=[.M59] -> 1.5133591870537 | R59: of:=[.N59] -> 1
D62: trial 1 Rc | E62: of:=[.F53] -> 0.3510210001 | J62: pop NPE computated with current metrics and trial 2 summary data | M62: deviation from the true NPE
D63: trial 1 Rt | E63: of:=[.F54] -> 0.0895242363363586 | K63: pop C | L63: pop A | M63: pop C | N63: pop A | Q63: of:=[.M63] -> pop C | R63: of:=[.N63] -> pop A
J64: OR | K64: of:=[.E52]*(([.D74]/(1-[.D74]))/([.D73]/(1-[.D73]))) -> 2697.23502561322 | L64: of:=[.F52]*(([.D74]/(1-[.D74]))/([.D73]/(1-[.D73]))) -> 4375.697771832 | M64: of:=[.K64]/[.$G$48] -> 0.156096975997159 | N64: of:=[.L64]/[.$H$48] -> 0.1673327695859 | P64: of:=[.J64] -> OR | Q64: of:=[.M64] -> 0.156096975997159 | R64: of:=[.N64] -> 0.1673327695859
J65: RR | K65: of:=[.E52]*([.D74]/[.D73]) -> 3252.90539333334 | L65: of:=[.F52]*([.D74]/[.D73]) -> 5277.15632728479 | M65: of:=[.K65]/[.$G$48] -> 0.188255265218773 | N65: of:=[.L65]/[.$H$48] -> 0.20180579871553 | P65: of:=[.J65] -> RR | Q65: of:=[.M65] -> 0.188255265218773 | R65: of:=[.N65] -> 0.20180579871553
D66: trial 2 Rc | E66: of:=[.D73] -> 0.195149387639399 | J66: average AB | K66: of:=[.C48]*([.D73]-[.D74]) -> 16581.1147891532 | L66: of:=[.D48]*([.D73]-[.D74]) -> 16581.1147891532 | M66: of:=[.K66]/[.$G$48] -> 0.959598200627744 | N66: of:=[.L66]/[.$H$48] -> 0.634084894608497 | P66: of:=[.J66] -> average AB | Q66: of:=[.M66] -> 0.959598200627744 | R66: of:=[.N66] -> 0.634084894608497
D67: trial 2 Rt | E67: of:=[.D74] -> 0.0293382397478677
C68: trial 2 summary data
C69: N | D69: of:=SUM([.D4:.D20]) -> 52983 | J69: comparing the five NNTs (trial 2) | M69: % of the ref NNT
C70: NPE | D70: of:=SUM([.H4:.H20]) -> 8785.17204873703 | K70: pop C | L70: pop A | M70: pop C | N70: pop A
C71: trial 2 AB | D71: of:=[.D70]/[.D69] -> 0.165811147891532 | I71: 1 | J71: NNT ave | K71: of:=1/([.E53]-[.E54]) -> 5.78729604631579 | L71: of:=1/([.F53]-[.F54]) -> 3.82413910446658 | M71: of:=[.K71]/[.K74] -> 1 | N71: of:=[.L71]/[.L74] -> 1
C72: total events | D72: of:=SUM([.F4:.F20]) -> 10339.6000052983 | I72: 2 | J72: NNT ave sec | K72: of:=1/(SUM([.L3:.L43])) -> 0.0791950151847504 | L72: of:=1/(SUM([.M3:.M43])) -> 0.0791950151847504 | M72: of:=[.K72]/[.K74] -> 0.01368428615902 | N72: of:=[.L72]/[.L74] -> 0.0207092401770247
C73: trial 2 Rc | D73: of:=[.D72]/[.D69] -> 0.195149387639399 | I73: 3 | J73: NNT transp trial 2 | K73: of:=1/([.E53]*(1-([.D75]/[.D74]))) -> 4.62163270515872 | L73: of:=1/([.F53]*(1-([.D75]/[.D74]))) -> 2.8488324052268 | M73: of:=[.K73]/[.K74] -> 0.798582389456448 | N73: of:=[.L73]/[.L74] -> 0.744960454471799
C74: trial 2 Rt | D74: of:=([.D72]-[.D70])/[.D69] -> 0.0293382397478677 | I74: 4 | J74: NNT ref | K74: of:=[.C48]/[.G48] -> 5.78729604631579 | L74: of:=[.D48]/[.H48] -> 3.82413910446658 | M74: of:=[.K74]/[.K74] -> 1 | N74: of:=[.L74]/[.L74] -> 1
I75: 5 | J75: NNT 5 | K75: of:=(1/[.V44])/[.C48] -> -8.01059258255079E-015 | L75: of:=(1/[.W44])/[.D48] -> 6.37441613940016E-020 | M75: of:=[.K75]/[.K74] -> -1.38416844730975E-015 | N75: of:=[.L75]/[.L74] -> 1.66688919133587E-020
J78: comparing NNT pop with NNT trials | M78: % of the ref NNT
K79: pop C | L79: pop A | M79: pop C | N79: pop A
I80: 1 | J80: NNT trial 1 | K80: of:=1/([.E62]-[.E63]) -> 3.82413910446658 | L80: of:=1/([.E62]-[.E63]) -> 3.82413910446658 | M80: of:=[.K80]/[.K84] -> 0.660781662776874 | N80: of:=[.L80]/[.L84] -> 1
I81: 2 | J81: NNT trial 2 | K81: of:=1/([.E66]-[.E67]) -> 6.03095758467439 | L81: of:=1/([.E66]-[.E67]) -> 6.03095758467439 | M81: of:=[.K81]/[.K84] -> 1.04210282944031 | N81: of:=[.L81]/[.L84] -> 1.57707589078814
I82: 3 | J82: NNT transp trial 1 | K82: of:=1/([.E53]*(1-[.E63]/[.E62])) -> 6.20386314121278 | L82: of:=1/([.F53]*(1-[.E63]/[.E62])) -> 3.82413910446658 | M82: of:=[.K82]/[.$K$84] -> 1.07197957242263 | N82: of:=[.L82]/[.$L$84] -> 1
I83: 4 | J83: NNT transp trial 2 | K83: of:=1/([.E53]*(1-([.E67]/[.E66]))) -> 5.43937367164205 | L83: of:=1/([.F53]*(1-([.E67]/[.E66]))) -> 3.35289820037293 | M83: of:=[.K83]/[.K84] -> 0.939881704359116 | N83: of:=[.L83]/[.L84] -> 0.87677202862646
I84: 5 | J84: NNT ref | K84: of:=[.K74] -> 5.78729604631579 | L84: of:=[.L74] -> 3.82413910446658 | M84: of:=[.K84]/[.K84] -> 1 | N84: of:=[.L84]/[.L84] -> 1
K88: NPE
K89: pop C trial 1 | L89: pop C trial 2 | M89: pop A trial 1 | N89: pop A trial 2
J90: of:=[.J66] -> average AB | K90: of:=[.M59] -> 1.5133591870537 | L90: of:=[.M66] -> 0.959598200627744 | M90: of:=[.N59] -> 1 | N90: of:=[.N66] -> 0.634084894608497

Sheet: NPE vs pop 1
B1: Two populations with different Rc distributions, same size (100,000), same average Rc (0,35102)
B2: Rc | C2: pop B | D2: pop A | E2: # events B | F2: # events A | G2: NPEs B | H2: NPEs A | J2: Rt pop B | K2: Rt pop A | L2: ABi pop B | M2: ABi pop A | N2: ni*Rci pop B | O2: ni*Rci pop A | P2: ni*Rti pop B | Q2: ni*Rti pop A | R2: ni*Abi pop B | S2: ni*Abi pop A | T2: NNTi pop B | U2: NNTi pop A | V2: ni NNTi pop B | W2: ni NNTi pop A
A3: 1 | B3: of:=[$curvi.A5] -> 0.0000000001 | C3: 10 | D3: 8290 | E3: of:=[.B3]*[.C3] -> 0.000000001 | F3: of:=[.B3]*[.D3] -> 0.000000829 | G3: of:=[.C3]*[$curvi.$I5] -> 0.000000000889018826575695 | H3: of:=[.D3]*[$curvi.$I5] -> 0.000000736996607231251 | J3: of:=([.E3]-[.G3])/[.C3] -> 0.0000000000110981173424306 | K3: of:=([.F3]-[.H3])/[.D3] -> 0.0000000000110981173424306 | L3: of:=[.B3]-[.J3] -> 0.0000000000889018826575695 | M3: of:=[.B3]-[.K3] -> 0.0000000000889018826575695 | N3: of:=[.C3]*[.$B3] -> 0.000000001 | O3: of:=[.D3]*[.$B3] -> 0.000000829 | R3: of:=[.C3]*[.L3] -> 0.000000000889018826575695 | S3: of:=[.D3]*[.M3] -> 0.000000736996607231251 | T3: of:=1/[.L3] -> 11248355716.5126 | U3: of:=1/[.M3] -> 11248355716.5126 | V3: of:=[.B3]*[.T3] -> 1.12483557165126 | W3: of:=[.C3]*[.U3] -> 112483557165.126
A4: of:=[.A3]+1 -> 2 | B4: of:=[$curvi.A6] -> 0.0250000001 | C4: 20 | D4: 6540 | E4: of:=[.B4]*[.C4] -> 0.500000002 | F4: of:=[.B4]*[.D4] -> 163.500000654 | G4: of:=[.C4]*[$curvi.$I6] -> 0.443248076817467 | H4: of:=[.D4]*[$curvi.$I6] -> 144.942121119312 | I4: of:=[.C50] -> 0 | J4: of:=([.E4]-[.G4])/[.C4] -> 0.00283759625912667 | K4: of:=([.F4]-[.H4])/[.D4] -> 0.00283759625912667 | L4: of:=[.B4]-[.J4] -> 0.0221624038408733 | M4: of:=[.B4]-[.K4] -> 0.0221624038408733 | N4: of:=[.C4]*[.$B4] -> 0.500000002 | O4: of:=[.D4]*[.$B4] -> 163.500000654 | R4: of:=[.C4]*[.L4] -> 0.443248076817467 | S4: of:=[.D4]*[.M4] -> 144.942121119312 | T4: of:=1/[.L4] -> 45.1214591693225 | U4: of:=1/[.M4] -> 45.1214591693225 | V4: of:=[.B4]*[.T4] -> 1.12803648374521 | W4: of:=[.C4]*[.U4] -> 902.429183386448
A5: of:=[.A4]+1 -> 3 | B5: of:=[$curvi.A7] -> 0.0500000001 | C5: 50 | D5: 5080 | E5: of:=[.B5]*[.C5] -> 2.500000005 | F5: of:=[.B5]*[.D5] -> 254.000000508 | G5: of:=[.C5]*[$curvi.$I7] -> 2.20964030907524 | H5: of:=[.D5]*[$curvi.$I7] -> 224.499455402045 | I5: of:=[.E53] -> 0.3510212501 | J5: of:=([.E5]-[.G5])/[.C5] -> 0.00580719391849511 | K5: of:=([.F5]-[.H5])/[.D5] -> 0.00580719391849511 | L5: of:=[.B5]-[.J5] -> 0.0441928061815049 | M5: of:=[.B5]-[.K5] -> 0.0441928061815049 | N5: of:=[.C5]*[.$B5] -> 2.500000005 | O5: of:=[.D5]*[.$B5] -> 254.000000508 | R5: of:=[.C5]*[.L5] -> 2.20964030907524 | S5: of:=[.D5]*[.M5] -> 224.499455402045 | T5: of:=1/[.L5] -> 22.6281172526788 | U5: of:=1/[.M5] -> 22.6281172526788 | V5: of:=[.B5]*[.T5] -> 1.13140586489675 | W5: of:=[.C5]*[.U5] -> 1131.40586263394
A6: of:=[.A5]+1 -> 4 | B6: of:=[$curvi.A8] -> 0.0750000001 | C6: 100 | D6: 3700 | E6: of:=[.B6]*[.C6] -> 7.50000001 | F6: of:=[.B6]*[.D6] -> 277.50000037 | G6: of:=[.C6]*[$curvi.$I8] -> 6.60817769618105 | H6: of:=[.D6]*[$curvi.$I8] -> 244.502574758699 | I6: of:=[.I5]-[.F53] -> 0.000000249999999868411 | J6: of:=([.E6]-[.G6])/[.C6] -> 0.00891822313818951 | K6: of:=([.F6]-[.H6])/[.D6] -> 0.0089182231381895 | L6: of:=[.B6]-[.J6] -> 0.0660817769618105 | M6: of:=[.B6]-[.K6] -> 0.0660817769618105 | N6: of:=[.C6]*[.$B6] -> 7.50000001 | O6: of:=[.D6]*[.$B6] -> 277.50000037 | R6: of:=[.C6]*[.L6] -> 6.60817769618105 | S6: of:=[.D6]*[.M6] -> 244.502574758699 | T6: of:=1/[.L6] -> 15.1327649766124 | U6: of:=1/[.M6] -> 15.1327649766124 | V6: of:=[.B6]*[.T6] -> 1.13495737475921 | W6: of:=[.C6]*[.U6] -> 1513.27649766124
A7: of:=[.A6]+1 -> 5 | B7: of:=[$curvi.A9] -> 0.1000000001 | C7: 200 | D7: 3250 | E7: of:=[.B7]*[.C7] -> 20.00000002 | F7: of:=[.B7]*[.D7] -> 325.000000325 | G7: of:=[.C7]*[$curvi.$I9] -> 17.5637931741317 | H7: of:=[.D7]*[$curvi.$I9] -> 285.411639079639 | J7: of:=([.E7]-[.G7])/[.C7] -> 0.0121810342293417 | K7: of:=([.F7]-[.H7])/[.D7] -> 0.0121810342293417 | L7: of:=[.B7]-[.J7] -> 0.0878189658706583 | M7: of:=[.B7]-[.K7] -> 0.0878189658706583 | N7: of:=[.C7]*[.$B7] -> 20.00000002 | O7: of:=[.D7]*[.$B7] -> 325.000000325 | R7: of:=[.C7]*[.L7] -> 17.5637931741317 | S7: of:=[.D7]*[.M7] -> 285.411639079639 | T7: of:=1/[.L7] -> 11.3870618958645 | U7: of:=1/[.M7] -> 11.3870618958645 | V7: of:=[.B7]*[.T7] -> 1.13870619072516 | W7: of:=[.C7]*[.U7] -> 2277.4123791729
A8: of:=[.A7]+1 -> 6 | B8: of:=[$curvi.A10] -> 0.1250000001 | C8: 400 | D8: 3100 | E8: of:=[.B8]*[.C8] -> 50.00000004 | F8: of:=[.B8]*[.D8] -> 387.50000031 | G8: of:=[.C8]*[$curvi.$I10] -> 43.7571949582346 | H8: of:=[.D8]*[$curvi.$I10] -> 339.118260926318 | J8: of:=([.E8]-[.G8])/[.C8] -> 0.0156070127044135 | K8: of:=([.F8]-[.H8])/[.D8] -> 0.0156070127044134 | L8: of:=[.B8]-[.J8] -> 0.109392987395587 | M8: of:=[.B8]-[.K8] -> 0.109392987395587 | N8: of:=[.C8]*[.$B8] -> 50.00000004 | O8: of:=[.D8]*[.$B8] -> 387.50000031 | R8: of:=[.C8]*[.L8] -> 43.7571949582346 | S8: of:=[.D8]*[.M8] -> 339.118260926318 | T8: of:=1/[.L8] -> 9.14135379065752 | U8: of:=1/[.M8] -> 9.14135379065752 | V8: of:=[.B8]*[.T8] -> 1.14266922474633 | W8: of:=[.C8]*[.U8] -> 3656.54151626302
A9: of:=[.A8]+1 -> 7 | B9: of:=[$curvi.A11] -> 0.1500000001 | C9: 800 | D9: 2850 | E9: of:=[.B9]*[.C9] -> 120.00000008 | F9: of:=[.B9]*[.D9] -> 427.500000285 | G9: of:=[.C9]*[$curvi.$I11] -> 104.633030465839 | H9: of:=[.D9]*[$curvi.$I11] -> 372.755171034552 | J9: of:=([.E9]-[.G9])/[.C9] -> 0.0192087120177012 | K9: of:=([.F9]-[.H9])/[.D9] -> 0.0192087120177011 | L9: of:=[.B9]-[.J9] -> 0.130791288082299 | M9: of:=[.B9]-[.K9] -> 0.130791288082299 | N9: of:=[.C9]*[.$B9] -> 120.00000008 | O9: of:=[.D9]*[.$B9] -> 427.500000285 | R9: of:=[.C9]*[.L9] -> 104.633030465839 | S9: of:=[.D9]*[.M9] -> 372.755171034552 | T9: of:=1/[.L9] -> 7.6457691843417 | U9: of:=1/[.M9] -> 7.6457691843417 | V9: of:=[.B9]*[.T9] -> 1.14686537841583 | W9: of:=[.C9]*[.U9] -> 6116.61534747337
A10: of:=[.A9]+1 -> 8 | B10: of:=[$curvi.A12] -> 0.1750000001 | C10: 1600 | D10: 2700 | E10: of:=[.B10]*[.C10] -> 280.00000016 | F10: of:=[.B10]*[.D10] -> 472.50000027 | G10: of:=[.C10]*[$curvi.$I12] -> 243.199988530405 | H10: of:=[.D10]*[$curvi.$I12] -> 410.399980645058 | J10: of:=([.E10]-[.G10])/[.C10] -> 0.0230000072684969 | K10: of:=([.F10]-[.H10])/[.D10] -> 0.0230000072684969 | L10: of:=[.B10]-[.J10] -> 0.151999992831503 | M10: of:=[.B10]-[.K10] -> 0.151999992831503 | N10: of:=[.C10]*[.$B10] -> 280.00000016 | O10: of:=[.D10]*[.$B10] -> 472.50000027 | R10: of:=[.C10]*[.L10] -> 243.199988530405 | S10: of:=[.D10]*[.M10] -> 410.399980645058 | T10: of:=1/[.L10] -> 6.57894767869189 | U10: of:=1/[.M10] -> 6.57894767869189 | V10: of:=[.B10]*[.T10] -> 1.15131584442897 | W10: of:=[.C10]*[.U10] -> 10526.316285907
A11: of:=[.A10]+1 -> 9 | B11: of:=[$curvi.A13] -> 0.2000000001 | C11: 3000 | D11: 2650 | E11: of:=[.B11]*[.C11] -> 600.0000003 | F11: of:=[.B11]*[.D11] -> 530.000000265 | G11: of:=[.C11]*[$curvi.$I13] -> 519.011178799449 | H11: of:=[.D11]*[$curvi.$I13] -> 458.45987460618 | J11: of:=([.E11]-[.G11])/[.C11] -> 0.0269962738335172 | K11: of:=([.F11]-[.H11])/[.D11] -> 0.0269962738335171 | L11: of:=[.B11]-[.J11] -> 0.173003726266483 | M11: of:=[.B11]-[.K11] -> 0.173003726266483 | N11: of:=[.C11]*[.$B11] -> 600.0000003 | O11: of:=[.D11]*[.$B11] -> 530.000000265 | R11: of:=[.C11]*[.L11] -> 519.011178799449 | S11: of:=[.D11]*[.M11] -> 458.45987460618 | T11: of:=1/[.L11] -> 5.78022231994974 | U11: of:=1/[.M11] -> 5.78022231994974 | V11: of:=[.B11]*[.T11] -> 1.15604446456797 | W11: of:=[.C11]*[.U11] -> 17340.6669598492
A12: of:=[.A11]+1 -> 10 | B12: of:=[$curvi.A14] -> 0.2250000001 | C12: 4500 | D12: 2600 | E12: of:=[.B12]*[.C12] -> 1012.50000045 | F12: of:=[.B12]*[.D12] -> 585.00000026 | G12: of:=[.C12]*[$curvi.$I14] -> 872.034319454206 | H12: of:=[.D12]*[$curvi.$I14] -> 503.842051240208 | J12: of:=([.E12]-[.G12])/[.C12] -> 0.0312145957768431 | K12: of:=([.F12]-[.H12])/[.D12] -> 0.0312145957768431 | L12: of:=[.B12]-[.J12] -> 0.193785404323157 | M12: of:=[.B12]-[.K12] -> 0.193785404323157 | N12: of:=[.C12]*[.$B12] -> 1012.50000045 | O12: of:=[.D12]*[.$B12] -> 585.00000026 | R12: of:=[.C12]*[.L12] -> 872.034319454206 | S12: of:=[.D12]*[.M12] -> 503.842051240208 | T12: of:=1/[.L12] -> 5.16034736203557 | U12: of:=1/[.M12] -> 5.16034736203557 | V12: of:=[.B12]*[.T12] -> 1.16107815697404 | W12: of:=[.C12]*[.U12] -> 23221.5631291601
A13: of:=[.A12]+1 -> 11 | B13: of:=[$curvi.A15] -> 0.2500000001 | C13: 6000 | D13: 2583 | E13: of:=[.B13]*[.C13] -> 1500.0000006 | F13: of:=[.B13]*[.D13] -> 645.7500002583 | G13: of:=[.C13]*[$curvi.$I15] -> 1285.95594063603 | H13: of:=[.D13]*[$curvi.$I15] -> 553.604032443811 | J13: of:=([.E13]-[.G13])/[.C13] -> 0.0356740099939952 | K13: of:=([.F13]-[.H13])/[.D13] -> 0.0356740099939952 | L13: of:=[.B13]-[.J13] -> 0.214325990106005 | M13: of:=[.B13]-[.K13] -> 0.214325990106005 | N13: of:=[.C13]*[.$B13] -> 1500.0000006 | O13: of:=[.D13]*[.$B13] -> 645.7500002583 | R13: of:=[.C13]*[.L13] -> 1285.95594063603 | S13: of:=[.D13]*[.M13] -> 553.604032443811 | T13: of:=1/[.L13] -> 4.66578971362924 | U13: of:=1/[.M13] -> 4.66578971362924 | V13: of:=[.B13]*[.T13] -> 1.16644742887389 | W13: of:=[.C13]*[.U13] -> 27994.7382817754
A14: of:=[.A13]+1 -> 12 | B14: of:=[$curvi.A16] -> 0.2750000001 | C14: 7350 | D14: 2578 | E14: of:=[.B14]*[.C14] -> 2021.250000735 | F14: of:=[.B14]*[.D14] -> 708.9500002578 | G14: of:=[.C14]*[$curvi.$I16] -> 1724.34091888785 | H14: of:=[.D14]*[$curvi.$I16] -> 604.809644747331 | J14: of:=([.E14]-[.G14])/[.C14] -> 0.0403957934485915 | K14: of:=([.F14]-[.H14])/[.D14] -> 0.0403957934485915 | L14: of:=[.B14]-[.J14] -> 0.234604206651408 | M14: of:=[.B14]-[.K14] -> 0.234604206651408 | N14: of:=[.C14]*[.$B14] -> 2021.250000735 | O14: of:=[.D14]*[.$B14] -> 708.9500002578 | R14: of:=[.C14]*[.L14] -> 1724.34091888785 | S14: of:=[.D14]*[.M14] -> 604.809644747331 | T14: of:=1/[.L14] -> 4.26249816349573 | U14: of:=1/[.M14] -> 4.26249816349573 | V14: of:=[.B14]*[.T14] -> 1.17218699538757 | W14: of:=[.C14]*[.U14] -> 31329.3615016936
A15: of:=[.A14]+1 -> 13 | B15: of:=[$curvi.A17] -> 0.3000000001 | C15: 8500 | D15: 2574 | E15: of:=[.B15]*[.C15] -> 2550.00000085 | F15: of:=[.B15]*[.D15] -> 772.2000002574 | G15: of:=[.C15]*[$curvi.$I17] -> 2164.06767837376 | H15: of:=[.D15]*[$curvi.$I17] -> 655.330612251064 | J15: of:=([.E15]-[.G15])/[.C15] -> 0.0454038026442642 | K15: of:=([.F15]-[.H15])/[.D15] -> 0.0454038026442642 | L15: of:=[.B15]-[.J15] -> 0.254596197455736 | M15: of:=[.B15]-[.K15] -> 0.254596197455736 | N15: of:=[.C15]*[.$B15] -> 2550.00000085 | O15: of:=[.D15]*[.$B15] -> 772.2000002574 | R15: of:=[.C15]*[.L15] -> 2164.06767837376 | S15: of:=[.D15]*[.M15] -> 655.330612251064 | T15: of:=1/[.L15] -> 3.92778843515076 | U15: of:=1/[.M15] -> 3.92778843515076 | V15: of:=[.B15]*[.T15] -> 1.17833653093801 | W15: of:=[.C15]*[.U15] -> 33386.2016987815
A16: of:=[.A15]+1 -> 14 | B16: of:=[$curvi.A18] -> 0.3250000001 | C16: 10500 | D16: 2570 | E16: of:=[.B16]*[.C16] -> 3412.50000105 | F16: of:=[.B16]*[.D16] -> 835.250000257 | G16: of:=[.C16]*[$curvi.$I18] -> 2879.88879506322 | H16: of:=[.D16]*[$curvi.$I18] -> 704.887066982142 | J16: of:=([.E16]-[.G16])/[.C16] -> 0.0507248767606453 | K16: of:=([.F16]-[.H16])/[.D16] -> 0.0507248767606454 | L16: of:=[.B16]-[.J16] -> 0.274275123339355 | M16: of:=[.B16]-[.K16] -> 0.274275123339355 | N16: of:=[.C16]*[.$B16] -> 3412.50000105 | O16: of:=[.D16]*[.$B16] -> 835.250000257 | R16: of:=[.C16]*[.L16] -> 2879.88879506322 | S16: of:=[.D16]*[.M16] -> 704.887066982142 | T16: of:=1/[.L16] -> 3.64597411469476 | U16: of:=1/[.M16] -> 3.64597411469476 | V16: of:=[.B16]*[.T16] -> 1.18494158764039 | W16: of:=[.C16]*[.U16] -> 38282.728204295
A17: of:=[.A16]+1 -> 15 | B17: of:=[$curvi.A19] -> 0.3500000001 | C17: 12500 | D17: 2560 | E17: of:=[.B17]*[.C17] -> 4375.00000125 | F17: of:=[.B17]*[.D17] -> 896.000000256 | G17: of:=[.C17]*[$curvi.$I19] -> 3670.13351584711 | H17: of:=[.D17]*[$curvi.$I19] -> 751.643344045488 | J17: of:=([.E17]-[.G17])/[.C17] -> 0.0563893188322312 | K17: of:=([.F17]-[.H17])/[.D17] -> 0.0563893188322312 | L17: of:=[.B17]-[.J17] -> 0.293610681267769 | M17: of:=[.B17]-[.K17] -> 0.293610681267769 | N17: of:=[.C17]*[.$B17] -> 4375.00000125 | O17: of:=[.D17]*[.$B17] -> 896.000000256 | R17: of:=[.C17]*[.L17] -> 3670.13351584711 | S17: of:=[.D17]*[.M17] -> 751.643344045488 | T17: of:=1/[.L17] -> 3.40587064367734 | U17: of:=1/[.M17] -> 3.40587064367734 | V17: of:=[.B17]*[.T17] -> 1.19205472562766 | W17: of:=[.C17]*[.U17] -> 42573.3830459668
A18: of:=[.A17]+1 -> 16 | B18: of:=[$curvi.A20] -> 0.3750000001 | C18: 15000 | D18: 2555 | E18: of:=[.B18]*[.C18] -> 5625.0000015 | F18: of:=[.B18]*[.D18] -> 958.1250002555 | G18: of:=[.C18]*[$curvi.$I20] -> 4688.52790373818 | H18: of:=[.D18]*[$curvi.$I20] -> 798.61258627007 | J18: of:=([.E18]-[.G18])/[.C18] -> 0.0624314731841214 | K18: of:=([.F18]-[.H18])/[.D18] -> 0.0624314731841214 | L18: of:=[.B18]-[.J18] -> 0.312568526915879 | M18: of:=[.B18]-[.K18] -> 0.312568526915879 | N18: of:=[.C18]*[.$B18] -> 5625.0000015 | O18: of:=[.D18]*[.$B18] -> 958.1250002555 | R18: of:=[.C18]*[.L18] -> 4688.52790373818 | S18: of:=[.D18]*[.M18] -> 798.61258627007 | T18: of:=1/[.L18] -> 3.19929843822417 | U18: of:=1/[.M18] -> 3.19929843822417 | V18: of:=[.B18]*[.T18] -> 1.19973691465399 | W18: of:=[.C18]*[.U18] -> 47989.4765733625
A19: of:=[.A18]+1 -> 17 | B19: of:=[$curvi.A21] -> 0.4000000001 | C19: 12975 | D19: 2548 | E19: of:=[.B19]*[.C19] -> 5190.0000012975 | F19: of:=[.B19]*[.D19] -> 1019.2000002548 | G19: of:=[.C19]*[$curvi.$I21] -> 4296.14677112039 | H19: of:=[.D19]*[$curvi.$I21] -> 843.667204070502 | J19: of:=([.E19]-[.G19])/[.C19] -> 0.0688904223643244 | K19: of:=([.F19]-[.H19])/[.D19] -> 0.0688904223643244 | L19: of:=[.B19]-[.J19] -> 0.331109577735676 | M19: of:=[.B19]-[.K19] -> 0.331109577735676 | N19: of:=[.C19]*[.$B19] -> 5190.0000012975 | O19: of:=[.D19]*[.$B19] -> 1019.2000002548 | R19: of:=[.C19]*[.L19] -> 4296.14677112039 | S19: of:=[.D19]*[.M19] -> 843.667204070502 | T19: of:=1/[.L19] -> 3.0201482144932 | U19: of:=1/[.M19] -> 3.0201482144932 | V19: of:=[.B19]*[.T19] -> 1.2080592860993 | W19: of:=[.C19]*[.U19] -> 39186.4230830493
A20: of:=[.A19]+1 -> 18 | B20: of:=[$curvi.A22] -> 0.4250000001 | C20: 4800 | D20: 2545 | E20: of:=[.B20]*[.C20] -> 2040.00000048 | F20: of:=[.B20]*[.D20] -> 1081.6250002545 | G20: of:=[.C20]*[$curvi.$I22] -> 1676.10799990182 | H20: of:=[.D20]*[$curvi.$I22] -> 888.686429114612 | J20: of:=([.E20]-[.G20])/[.C20] -> 0.0758108334537872 | K20: of:=([.F20]-[.H20])/[.D20] -> 0.0758108334537872 | L20: of:=[.B20]-[.J20] -> 0.349189166646213 | M20: of:=[.B20]-[.K20] -> 0.349189166646213 | N20: of:=[.C20]*[.$B20] -> 2040.00000048 | O20: of:=[.D20]*[.$B20] -> 1081.6250002545 | R20: of:=[.C20]*[.L20] -> 1676.10799990182 | S20: of:=[.D20]*[.M20] -> 888.686429114612 | T20: of:=1/[.L20] -> 2.86377727466318 | U20: of:=1/[.M20] -> 2.86377727466318 | V20: of:=[.B20]*[.T20] -> 1.21710534201823 | W20: of:=[.C20]*[.U20] -> 13746.1309183833
A21: of:=[.A20]+1 -> 19 | B21: of:=[$curvi.A23] -> 0.4500000001 | C21: 2500 | D21: 2538 | E21: of:=[.B21]*[.C21] -> 1125.00000025 | F21: of:=[.B21]*[.D21] -> 1142.1000002538 | G21: of:=[.C21]*[$curvi.$I23] -> 916.890019022138 | H21: of:=[.D21]*[$curvi.$I23] -> 930.826747311274 | J21: of:=([.E21]-[.G21])/[.C21] -> 0.0832439924911451 | K21: of:=([.F21]-[.H21])/[.D21] -> 0.0832439924911451 | L21: of:=[.B21]-[.J21] -> 0.366756007608855 | M21: of:=[.B21]-[.K21] -> 0.366756007608855 | N21: of:=[.C21]*[.$B21] -> 1125.00000025 | O21: of:=[.D21]*[.$B21] -> 1142.1000002538 | R21: of:=[.C21]*[.L21] -> 916.890019022138 | S21: of:=[.D21]*[.M21] -> 930.826747311274 | T21: of:=1/[.L21] -> 2.72660836974346 | U21: of:=1/[.M21] -> 2.72660836974346 | V21: of:=[.B21]*[.T21] -> 1.22697376665722 | W21: of:=[.C21]*[.U21] -> 6816.52092435865
A22: of:=[.A21]+1 -> 20 | B22: of:=[$curvi.A24] -> 0.4750000001 | C22: 2250 | D22: 2535 | E22: of:=[.B22]*[.C22] -> 1068.750000225 | F22: of:=[.B22]*[.D22] -> 1204.1250002535 | G22: of:=[.C22]*[$curvi.$I24] -> 863.439575464626 | H22: of:=[.D22]*[$curvi.$I24] -> 972.808588356812 | J22: of:=([.E22]-[.G22])/[.C22] -> 0.0912490776712776 | K22: of:=([.F22]-[.H22])/[.D22] -> 0.0912490776712775 | L22: of:=[.B22]-[.J22] -> 0.383750922428723 | M22: of:=[.B22]-[.K22] -> 0.383750922428723 | N22: of:=[.C22]*[.$B22] -> 1068.750000225 | O22: of:=[.D22]*[.$B22] -> 1204.1250002535 | R22: of:=[.C22]*[.L22] -> 863.439575464626 | S22: of:=[.D22]*[.M22] -> 972.808588356812 | T22: of:=1/[.L22] -> 2.60585692842403 | U22: of:=1/[.M22] -> 2.60585692842403 | V22: of:=[.B22]*[.T22] -> 1.237782041262 | W22: of:=[.C22]*[.U22] -> 5863.17808895407
A23: of:=[.A22]+1 -> 21 | B23: of:=[$curvi.A25] -> 0.5000000001 | C23: 1700 | D23: 2535 | E23: of:=[.B23]*[.C23] -> 850.00000017 | F23: of:=[.B23]*[.D23] -> 1267.5000002535 | G23: of:=[.C23]*[$curvi.$I25] -> 680.178945243722 | H23: of:=[.D23]*[$curvi.$I25] -> 1014.26683893696 | J23: of:=([.E23]-[.G23])/[.C23] -> 0.0998947381919287 | K23: of:=([.F23]-[.H23])/[.D23] -> 0.0998947381919287 | L23: of:=[.B23]-[.J23] -> 0.400105261908072 | M23: of:=[.B23]-[.K23] -> 0.400105261908072 | N23: of:=[.C23]*[.$B23] -> 850.00000017 | O23: of:=[.D23]*[.$B23] -> 1267.5000002535 | R23: of:=[.C23]*[.L23] -> 680.178945243722 | S23: of:=[.D23]*[.M23] -> 1014.26683893696 | T23: of:=1/[.L23] -> 2.49934228615509 | U23: of:=1/[.M23] -> 2.49934228615509 | V23: of:=[.B23]*[.T23] -> 1.24967114332748 | W23: of:=[.C23]*[.U23] -> 4248.88188646365
A24: of:=[.A23]+1 -> 22 | B24: of:=[$curvi.A26] -> 0.5250000001 | C24: 1100 | D24: 2530 | E24: of:=[.B24]*[.C24] -> 577.50000011 | F24: of:=[.B24]*[.D24] -> 1328.250000253 | G24: of:=[.C24]*[$curvi.$I26] -> 457.3128253978 | H24: of:=[.D24]*[$curvi.$I26] -> 1051.81949841494 | J24: of:=([.E24]-[.G24])/[.C24] -> 0.109261067920182 | K24: of:=([.F24]-[.H24])/[.D24] -> 0.109261067920182 | L24: of:=[.B24]-[.J24] -> 0.415738932179818 | M24: of:=[.B24]-[.K24] -> 0.415738932179818 | N24: of:=[.C24]*[.$B24] -> 577.50000011 | O24: of:=[.D24]*[.$B24] -> 1328.250000253 | R24: of:=[.C24]*[.L24] -> 457.3128253978 | S24: of:=[.D24]*[.M24] -> 1051.81949841494 | T24: of:=1/[.L24] -> 2.40535567539167 | U24: of:=1/[.M24] -> 2.40535567539167 | V24: of:=[.B24]*[.T24] -> 1.26281172982117 | W24: of:=[.C24]*[.U24] -> 2645.89124293084
A25: of:=[.A24]+1 -> 23 | B25: of:=[$curvi.A27] -> 0.5500000001 | C25: 900 | D25: 2520 | E25: of:=[.B25]*[.C25] -> 495.00000009 | F25: of:=[.B25]*[.D25] -> 1386.000000252 | G25: of:=[.C25]*[$curvi.$I27] -> 387.502115421846 | H25: of:=[.D25]*[$curvi.$I27] -> 1085.00592318117 | J25: of:=([.E25]-[.G25])/[.C25] -> 0.119442094075727 | K25: of:=([.F25]-[.H25])/[.D25] -> 0.119442094075727 | L25: of:=[.B25]-[.J25] -> 0.430557906024273 | M25: of:=[.B25]-[.K25] -> 0.430557906024273 | N25: of:=[.C25]*[.$B25] -> 495.00000009 | O25: of:=[.D25]*[.$B25] -> 1386.000000252 | R25: of:=[.C25]*[.L25] -> 387.502115421846 | S25: of:=[.D25]*[.M25] -> 1085.00592318117 | T25: of:=1/[.L25] -> 2.32256796590706 | U25: of:=1/[.M25] -> 2.32256796590706 | V25: of:=[.B25]*[.T25] -> 1.27741238148114 | W25: of:=[.C25]*[.U25] -> 2090.31116931636
A26: of:=[.A25]+1 -> 24 | B26: of:=[$curvi.A28] -> 0.5750000001 | C26: 800 | D26: 2515 | E26: of:=[.B26]*[.C26] -> 460.00000008 | F26: of:=[.B26]*[.D26] -> 1446.1250002515 | G26: of:=[.C26]*[$curvi.$I28] -> 355.560844200882 | H26: of:=[.D26]*[$curvi.$I28] -> 1117.79440395652 | J26: of:=([.E26]-[.G26])/[.C26] -> 0.130548944848898 | K26: of:=([.F26]-[.H26])/[.D26] -> 0.130548944848898 | L26: of:=[.B26]-[.J26] -> 0.444451055251102 | M26: of:=[.B26]-[.K26] -> 0.444451055251102 | N26: of:=[.C26]*[.$B26] -> 460.00000008 | O26: of:=[.D26]*[.$B26] -> 1446.1250002515 | R26: of:=[.C26]*[.L26] -> 355.560844200882 | S26: of:=[.D26]*[.M26] -> 1117.79440395652 | T26: of:=1/[.L26] -> 2.24996653328909 | U26: of:=1/[.M26] -> 2.24996653328909 | V26: of:=[.B26]*[.T26] -> 1.29373075686622 | W26: of:=[.C26]*[.U26] -> 1799.97322663127
A27: of:=[.A26]+1 -> 25 | B27: of:=[$curvi.A29] -> 0.6000000001 | C27: 500 | D27: 2510 | E27: of:=[.B27]*[.C27] -> 300.00000005 | F27: of:=[.B27]*[.D27] -> 1506.000000251 | G27: of:=[.C27]*[$curvi.$I29] -> 228.643038882007 | H27: of:=[.D27]*[$curvi.$I29] -> 1147.78805518768 | J27: of:=([.E27]-[.G27])/[.C27] -> 0.142713922335986 | K27: of:=([.F27]-[.H27])/[.D27] -> 0.142713922335986 | L27: of:=[.B27]-[.J27] -> 0.457286077764014 | M27: of:=[.B27]-[.K27] -> 0.457286077764014 | N27: of:=[.C27]*[.$B27] -> 300.00000005 | O27: of:=[.D27]*[.$B27] -> 1506.000000251 | R27: of:=[.C27]*[.L27] -> 228.643038882007 | S27: of:=[.D27]*[.M27] -> 1147.78805518768 | T27: of:=1/[.L27] -> 2.18681488159379 | U27: of:=1/[.M27] -> 2.18681488159379 | V27: of:=[.B27]*[.T27] -> 1.31208892917495 | W27: of:=[.C27]*[.U27] -> 1093.40744079689
A28: of:=[.A27]+1 -> 26 | B28: of:=[$curvi.A30] -> 0.6250000001 | C28: 400 | D28: 2500 | E28: of:=[.B28]*[.C28] -> 250.00000004 | F28: of:=[.B28]*[.D28] -> 1562.50000025 | G28: of:=[.C28]*[$curvi.$I30] -> 187.561680937164 | H28: of:=[.D28]*[$curvi.$I30] -> 1172.26050585727 | J28: of:=([.E28]-[.G28])/[.C28] -> 0.156095797757091 | K28: of:=([.F28]-[.H28])/[.D28] -> 0.156095797757091 | L28: of:=[.B28]-[.J28] -> 0.468904202342909 | M28: of:=[.B28]-[.K28] -> 0.468904202342909 | N28: of:=[.C28]*[.$B28] -> 250.00000004 | O28: of:=[.D28]*[.$B28] -> 1562.50000025 | R28: of:=[.C28]*[.L28] -> 187.561680937164 | S28: of:=[.D28]*[.M28] -> 1172.26050585727 | T28: of:=1/[.L28] -> 2.13263177212624 | U28: of:=1/[.M28] -> 2.13263177212624 | V28: of:=[.B28]*[.T28] -> 1.33289485779217 | W28: of:=[.C28]*[.U28] -> 853.052708850497
A29: of:=[.A28]+1 -> 27 | B29: of:=[$curvi.A31] -> 0.6500000001 | C29: 300 | D29: 2450 | E29: of:=[.B29]*[.C29] -> 195.00000003 | F29: of:=[.B29]*[.D29] -> 1592.500000245 | G29: of:=[.C29]*[$curvi.$I31] -> 143.733966201871 | H29: of:=[.D29]*[$curvi.$I31] -> 1173.82739064861 | J29: of:=([.E29]-[.G29])/[.C29] -> 0.170886779427097 | K29: of:=([.F29]-[.H29])/[.D29] -> 0.170886779427097 | L29: of:=[.B29]-[.J29] -> 0.479113220672903 | M29: of:=[.B29]-[.K29] -> 0.479113220672903 | N29: of:=[.C29]*[.$B29] -> 195.00000003 | O29: of:=[.D29]*[.$B29] -> 1592.500000245 | R29: of:=[.C29]*[.L29] -> 143.733966201871 | S29: of:=[.D29]*[.M29] -> 1173.82739064861 | T29: of:=1/[.L29] -> 2.08718932572039 | U29: of:=1/[.M29] -> 2.08718932572039 | V29: of:=[.B29]*[.T29] -> 1.35667306192697 | W29: of:=[.C29]*[.U29] -> 626.156797716116
A30: of:=[.A29]+1 -> 28 | B30: of:=[$curvi.A32] -> 0.6750000001 | C30: 200 | D30: 2400 | E30: of:=[.B30]*[.C30] -> 135.00000002 | F30: of:=[.B30]*[.D30] -> 1620.00000024 | G30: of:=[.C30]*[$curvi.$I32] -> 97.5356391734759 | H30: of:=[.D30]*[$curvi.$I32] -> 1170.42767008171 | J30: of:=([.E30]-[.G30])/[.C30] -> 0.187321804232621 | K30: of:=([.F30]-[.H30])/[.D30] -> 0.187321804232621 | L30: of:=[.B30]-[.J30] -> 0.48767819586738 | M30: of:=[.B30]-[.K30] -> 0.48767819586738 | N30: of:=[.C30]*[.$B30] -> 135.00000002 | O30: of:=[.D30]*[.$B30] -> 1620.00000024 | R30: of:=[.C30]*[.L30] -> 97.5356391734759 | S30: of:=[.D30]*[.M30] -> 1170.42767008171 | T30: of:=1/[.L30] -> 2.05053252016201 | U30: of:=1/[.M30] -> 2.05053252016201 | V30: of:=[.B30]*[.T30] -> 1.38410945131441 | W30: of:=[.C30]*[.U30] -> 410.106504032402
A31: of:=[.A30]+1 -> 29 | B31: of:=[$curvi.A33] -> 0.7000000001 | C31: 150 | D31: 2300 | E31: of:=[.B31]*[.C31] -> 105.000000015 | F31: of:=[.B31]*[.D31] -> 1610.00000023 | G31: of:=[.C31]*[$curvi.$I33] -> 74.1463335565468 | H31: of:=[.D31]*[$curvi.$I33] -> 1136.91044786705 | J31: of:=([.E31]-[.G31])/[.C31] -> 0.205691109723022 | K31: of:=([.F31]-[.H31])/[.D31] -> 0.205691109723022 | L31: of:=[.B31]-[.J31] -> 0.494308890376979 | M31: of:=[.B31]-[.K31] -> 0.494308890376979 | N31: of:=[.C31]*[.$B31] -> 105.000000015 | O31: of:=[.D31]*[.$B31] -> 1610.00000023 | R31: of:=[.C31]*[.L31] -> 74.1463335565468 | S31: of:=[.D31]*[.M31] -> 1136.91044786705 | T31: of:=1/[.L31] -> 2.02302653152235 | U31: of:=1/[.M31] -> 2.02302653152235 | V31: of:=[.B31]*[.T31] -> 1.41611857226795 | W31: of:=[.C31]*[.U31] -> 303.453979728352
A32: of:=[.A31]+1 -> 30 | B32: of:=[$curvi.A34] -> 0.7250000001 | C32: 135 | D32: 2150 | E32: of:=[.B32]*[.C32] -> 97.8750000135001 | F32: of:=[.B32]*[.D32] -> 1558.750000215 | G32: of:=[.C32]*[$curvi.$I34] -> 67.3167344524647 | H32: of:=[.D32]*[$curvi.$I34] -> 1072.08132646518 | J32: of:=([.E32]-[.G32])/[.C32] -> 0.226357522674336 | K32: of:=([.F32]-[.H32])/[.D32] -> 0.226357522674336 | L32: of:=[.B32]-[.J32] -> 0.498642477425665 | M32: of:=[.B32]-[.K32] -> 0.498642477425665 | N32: of:=[.C32]*[.$B32] -> 97.8750000135001 | O32: of:=[.D32]*[.$B32] -> 1558.750000215 | R32: of:=[.C32]*[.L32] -> 67.3167344524647 | S32: of:=[.D32]*[.M32] -> 1072.08132646518 | T32: of:=1/[.L32] -> 2.00544487337438 | U32: of:=1/[.M32] -> 2.00544487337438 | V32: of:=[.B32]*[.T32] -> 1.45394753339697 | W32: of:=[.C32]*[.U32] -> 270.735057905541
A33: of:=[.A32]+1 -> 31 | B33: of:=[$curvi.A35] -> 0.7500000001 | C33: 120 | D33: 1850 | E33: of:=[.B33]*[.C33] -> 90.0000000120001 | F33: of:=[.B33]*[.D33] -> 1387.500000185 | G33: of:=[.C33]*[$curvi.$I35] -> 60.0263200785165 | H33: of:=[.D33]*[$curvi.$I35] -> 925.405767877129 | J33: of:=([.E33]-[.G33])/[.C33] -> 0.249780666112363 | K33: of:=([.F33]-[.H33])/[.D33] -> 0.249780666112363 | L33: of:=[.B33]-[.J33] -> 0.500219333987637 | M33: of:=[.B33]-[.K33] -> 0.500219333987637 | N33: of:=[.C33]*[.$B33] -> 90.0000000120001 | O33: of:=[.D33]*[.$B33] -> 1387.500000185 | R33: of:=[.C33]*[.L33] -> 60.0263200785165 | S33: of:=[.D33]*[.M33] -> 925.405767877129 | T33: of:=1/[.L33] -> 1.99912304873989 | U33: of:=1/[.M33] -> 1.99912304873989 | V33: of:=[.B33]*[.T33] -> 1.49934228675483 | W33: of:=[.C33]*[.U33] -> 239.894765848786
A34: of:=[.A33]+1 -> 32 | B34: of:=[$curvi.A36] -> 0.7750000001 | C34: 110 | D34: 1670 | E34: of:=[.B34]*[.C34] -> 85.2500000110001 | F34: of:=[.B34]*[.D34] -> 1294.250000167 | G34: of:=[.C34]*[$curvi.$I36] -> 54.829329989458 | H34: of:=[.D34]*[$curvi.$I36] -> 832.408918930863 | J34: of:=([.E34]-[.G34])/[.C34] -> 0.276551545650382 | K34: of:=([.F34]-[.H34])/[.D34] -> 0.276551545650382 | L34: of:=[.B34]-[.J34] -> 0.498448454449618 | M34: of:=[.B34]-[.K34] -> 0.498448454449618 | N34: of:=[.C34]*[.$B34] -> 85.2500000110001 | O34: of:=[.D34]*[.$B34] -> 1294.250000167 | R34: of:=[.C34]*[.L34] -> 54.829329989458 | S34: of:=[.D34]*[.M34] -> 832.408918930863 | T34: of:=1/[.L34] -> 2.00622550049672 | U34: of:=1/[.M34] -> 2.00622550049672 | V34: of:=[.B34]*[.T34] -> 1.55482476308558 | W34: of:=[.C34]*[.U34] -> 220.684805054639
A35: of:=[.A34]+1 -> 33 | B35: of:=[$curvi.A37] -> 0.8000000001 | C35: 100 | D35: 1505 | E35: of:=[.B35]*[.C35] -> 80.0000000100001 | F35: of:=[.B35]*[.D35] -> 1204.0000001505 | G35: of:=[.C35]*[$curvi.$I37] -> 49.2556893267776 | H35: of:=[.D35]*[$curvi.$I37] -> 741.298124368002 | J35: of:=([.E35]-[.G35])/[.C35] -> 0.307443106832225 | K35: of:=([.F35]-[.H35])/[.D35] -> 0.307443106832225 | L35: of:=[.B35]-[.J35] -> 0.492556893267776 | M35: of:=[.B35]-[.K35] -> 0.492556893267776 | N35: of:=[.C35]*[.$B35] -> 80.0000000100001 | O35: of:=[.D35]*[.$B35] -> 1204.0000001505 | R35: of:=[.C35]*[.L35] -> 49.2556893267776 | S35: of:=[.D35]*[.M35] -> 741.298124368002 | T35: of:=1/[.L35] -> 2.03022232287866 | U35: of:=1/[.M35] -> 2.03022232287866 | V35: of:=[.B35]*[.T35] -> 1.62417785850595 | W35: of:=[.C35]*[.U35] -> 203.022232287866
A36: of:=[.A35]+1 -> 34 | B36: of:=[$curvi.A38] -> 0.825000000100001 | C36: 90 | D36: 1350 | E36: of:=[.B36]*[.C36] -> 74.250000009 | F36: of:=[.B36]*[.D36] -> 1113.750000135 | G36: of:=[.C36]*[$curvi.$I38] -> 43.3362523581354 | H36: of:=[.D36]*[$curvi.$I38] -> 650.043785372031 | J36: of:=([.E36]-[.G36])/[.C36] -> 0.343486085009607 | K36: of:=([.F36]-[.H36])/[.D36] -> 0.343486085009607 | L36: of:=[.B36]-[.J36] -> 0.481513915090393 | M36: of:=[.B36]-[.K36] -> 0.481513915090393 | N36: of:=[.C36]*[.$B36] -> 74.250000009 | O36: of:=[.D36]*[.$B36] -> 1113.750000135 | R36: of:=[.C36]*[.L36] -> 43.3362523581354 | S36: of:=[.D36]*[.M36] -> 650.043785372031 | T36: of:=1/[.L36] -> 2.07678318042434 | U36: of:=1/[.M36] -> 2.07678318042434 | V36: of:=[.B36]*[.T36] -> 1.71334612405776 | W36: of:=[.C36]*[.U36] -> 186.91048623819
A37: of:=[.A36]+1 -> 35 | B37: of:=[$curvi.A39] -> 0.850000000100001 | C37: 80 | D37: 980 | E37: of:=[.B37]*[.C37] -> 68.000000008 | F37: of:=[.B37]*[.D37] -> 833.000000098001 | G37: of:=[.C37]*[$curvi.$I39] -> 37.1130997974221 | H37: of:=[.D37]*[$curvi.$I39] -> 454.63547251842 | J37: of:=([.E37]-[.G37])/[.C37] -> 0.386086252632225 | K37: of:=([.F37]-[.H37])/[.D37] -> 0.386086252632225 | L37: of:=[.B37]-[.J37] -> 0.463913747467776 | M37: of:=[.B37]-[.K37] -> 0.463913747467776 | N37: of:=[.C37]*[.$B37] -> 68.000000008 | O37: of:=[.D37]*[.$B37] -> 833.000000098001 | R37: of:=[.C37]*[.L37] -> 37.1130997974221 | S37: of:=[.D37]*[.M37] -> 454.63547251842 | T37: of:=1/[.L37] -> 2.15557311129147 | U37: of:=1/[.M37] -> 2.15557311129147 | V37: of:=[.B37]*[.T37] -> 1.83223714481331 | W37: of:=[.C37]*[.U37] -> 172.445848903318
A38: of:=[.A37]+1 -> 36 | B38: of:=[$curvi.A40] -> 0.875000000100001 | C38: 70 | D38: 755 | E38: of:=[.B38]*[.C38] -> 61.250000007 | F38: of:=[.B38]*[.D38] -> 660.6250000755 | G38: of:=[.C38]*[$curvi.$I40] -> 30.6451557221979 | H38: of:=[.D38]*[$curvi.$I40] -> 330.529893860849 | J38: of:=([.E38]-[.G38])/[.C38] -> 0.437212061211459 | K38: of:=([.F38]-[.H38])/[.D38] -> 0.437212061211459 | L38: of:=[.B38]-[.J38] -> 0.437787938888541 | M38: of:=[.B38]-[.K38] -> 0.437787938888541 | N38: of:=[.C38]*[.$B38] -> 61.250000007 | O38: of:=[.D38]*[.$B38] -> 660.6250000755 | R38: of:=[.C38]*[.L38] -> 30.6451557221979 | S38: of:=[.D38]*[.M38] -> 330.529893860849 | T38: of:=1/[.L38] -> 2.28421094134938 | U38: of:=1/[.M38] -> 2.28421094134938 | V38: of:=[.B38]*[.T38] -> 1.99868457390913 | W38: of:=[.C38]*[.U38] -> 159.894765894457
A39: of:=[.A38]+1 -> 37 | B39: of:=[$curvi.A41] -> 0.900000000100001 | C39: 60 | D39: 575 | E39: of:=[.B39]*[.C39] -> 54.000000006 | F39: of:=[.B39]*[.D39] -> 517.5000000575 | G39: of:=[.C39]*[$curvi.$I41] -> 24.0175518412965 | H39: of:=[.D39]*[$curvi.$I41] -> 230.168205145758 | J39: of:=([.E39]-[.G39])/[.C39] -> 0.499707469411726 | K39: of:=([.F39]-[.H39])/[.D39] -> 0.499707469411726 | L39: of:=[.B39]-[.J39] -> 0.400292530688274 | M39: of:=[.B39]-[.K39] -> 0.400292530688275 | N39: of:=[.C39]*[.$B39] -> 54.000000006 | O39: of:=[.D39]*[.$B39] -> 517.5000000575 | R39: of:=[.C39]*[.L39] -> 24.0175518412965 | S39: of:=[.D39]*[.M39] -> 230.168205145758 | T39: of:=1/[.L39] -> 2.49817301931808 | U39: of:=1/[.M39] -> 2.49817301931807 | V39: of:=[.B39]*[.T39] -> 2.24835571763609 | W39: of:=[.C39]*[.U39] -> 149.890381159084
A40: of:=[.A39]+1 -> 38 | B40: of:=[$curvi.A42] -> 0.925000000100001 | C40: 50 | D40: 276 | E40: of:=[.B40]*[.C40] -> 46.250000005 | F40: of:=[.B40]*[.D40] -> 255.3000000276 | G40: of:=[.C40]*[$curvi.$I42] -> 17.3580207419527 | H40: of:=[.D40]*[$curvi.$I42] -> 95.816274495579 | J40: of:=([.E40]-[.G40])/[.C40] -> 0.577839585260946 | K40: of:=([.F40]-[.H40])/[.D40] -> 0.577839585260946 | L40: of:=[.B40]-[.J40] -> 0.347160414839054 | M40: of:=[.B40]-[.K40] -> 0.347160414839054 | N40: of:=[.C40]*[.$B40] -> 46.250000005 | O40: of:=[.D40]*[.$B40] -> 255.3000000276 | R40: of:=[.C40]*[.L40] -> 17.3580207419527 | S40: of:=[.D40]*[.M40] -> 95.816274495579 | T40: of:=1/[.L40] -> 2.88051274643051 | U40: of:=1/[.M40] -> 2.88051274643051 | V40: of:=[.B40]*[.T40] -> 2.66447429073628 | W40: of:=[.C40]*[.U40] -> 144.025637321526
A41: of:=[.A40]+1 -> 39 | B41: of:=[$curvi.A43] -> 0.950000000100001 | C41: 40 | D41: 158 | E41: of:=[.B41]*[.C41] -> 38.000000004 | F41: of:=[.B41]*[.D41] -> 150.1000000158 | G41: of:=[.C41]*[$curvi.$I43] -> 10.8673537065575 | H41: of:=[.D41]*[$curvi.$I43] -> 42.9260471409023 | J41: of:=([.E41]-[.G41])/[.C41] -> 0.678316157436062 | K41: of:=([.F41]-[.H41])/[.D41] -> 0.678316157436062 | L41: of:=[.B41]-[.J41] -> 0.271683842663939 | M41: of:=[.B41]-[.K41] -> 0.271683842663939 | N41: of:=[.C41]*[.$B41] -> 38.000000004 | O41: of:=[.D41]*[.$B41] -> 150.1000000158 | R41: of:=[.C41]*[.L41] -> 10.8673537065575 | S41: of:=[.D41]*[.M41] -> 42.9260471409023 | T41: of:=1/[.L41] -> 3.68074888147455 | U41: of:=1/[.M41] -> 3.68074888147455 | V41: of:=[.B41]*[.T41] -> 3.4967114377689 | W41: of:=[.C41]*[.U41] -> 147.229955258982
A42: of:=[.A41]+1 -> 40 | B42: of:=[$curvi.A44] -> 0.975000000100001 | C42: 30 | D42: 95 | E42: of:=[.B42]*[.C42] -> 29.250000003 | F42: of:=[.B42]*[.D42] -> 92.6250000095001 | G42: of:=[.C42]*[$curvi.$I44] -> 4.88034977035318 | H42: of:=[.D42]*[$curvi.$I44] -> 15.4544409394517 | J42: of:=([.E42]-[.G42])/[.C42] -> 0.812321674421561 | K42: of:=([.F42]-[.H42])/[.D42] -> 0.812321674421561 | L42: of:=[.B42]-[.J42] -> 0.162678325678439 | M42: of:=[.B42]-[.K42] -> 0.162678325678439 | N42: of:=[.C42]*[.$B42] -> 29.250000003 | O42: of:=[.D42]*[.$B42] -> 92.6250000095001 | R42: of:=[.C42]*[.L42] -> 4.88034977035318 | S42: of:=[.D42]*[.M42] -> 15.4544409394517 | T42: of:=1/[.L42] -> 6.1471003947795 | U42: of:=1/[.M42] -> 6.1471003947795 | V42: of:=[.B42]*[.T42] -> 5.99342288552471 | W42: of:=[.C42]*[.U42] -> 184.413011843384
A43: of:=[.A42]+1 -> 41 | B43: of:=[$curvi.A45] -> 1.0000000001 | C43: 10 | D43: 30 | E43: of:=[.B43]*[.C43] -> 10.000000001 | F43: of:=[.B43]*[.D43] -> 30.000000003 | G43: of:=[.C43]*[$curvi.$I45] -> -0.00000000801059218957789 | H43: of:=[.D43]*[$curvi.$I45] -> -0.0000000240317765687337 | J43: of:=([.E43]-[.G43])/[.C43] -> 1.00000000090106 | K43: of:=([.F43]-[.H43])/[.D43] -> 1.00000000090106 | L43: of:=[.B43]-[.J43] -> -0.000000000801059218957789 | M43: of:=[.B43]-[.K43] -> -0.000000000801059218957789 | N43: of:=[.C43]*[.$B43] -> 10.000000001 | O43: of:=[.D43]*[.$B43] -> 30.000000003 | R43: of:=[.C43]*[.L43] -> -0.00000000801059218957789 | S43: of:=[.D43]*[.M43] -> -0.0000000240317765687337 | T43: of:=1/[.L43] -> -1248347158.7794 | U43: of:=1/[.M43] -> -1248347158.7794 | V43: of:=[.B43]*[.T43] -> -1248347158.90423 | W43: of:=[.C43]*[.U43] -> -12483471587.794
I44: averages | J44: of:=SUM([.L3:.L43])/[.C48] -> 0.000126270573680319 | K44: of:=SUM([.M3:.M43])/[.D48] -> 0.000126270573680319 | L44: of:=SUM([.L3:.L43])/[.C48] -> 0.000126270573680319 | M44: of:=SUM([.M3:.M43])/[.D48] -> 0.000126270573680319 | N44: of:=SUM([.N3:.N43])/[.C48] -> 0.3510212501 | O44: of:=SUM([.O3:.O43])/[.D48] -> 0.3510210001 | R44: of:=SUM([.R3:.R43]) -> 28986.7809363128 | S44: of:=SUM([.S3:.S43]) -> 26149.6763763642 | T44: of:=SUM([.T3:.T43]) -> 10000008770.3544 | U44: of:=SUM([.U3:.U43]) -> 10000008770.3544 | V44: of:=SUM([.V3:.V43]) -> -1248347097.53966 | W44: of:=SUM([.W3:.W43]) -> 100000455582.083
J46: NPE computated with current metrics | M46: % of the true NPE | P46: diagrams
C47: pop B | D47: pop A | G47: pop B | H47: pop A | K47: pop B | L47: pop A | M47: pop B | N47: pop A | Q47: of:=[.M47] -> pop B | R47: of:=[.N47] -> pop A
B48: N | C48: of:=SUM([.C3:.C43]) -> 100000 | D48: of:=SUM([.D3:.D43]) -> 100000 | F48: NPE | G48: of:=SUM([.G3:.G43]) -> 28986.7809363128 | H48: of:=SUM([.H3:.H43]) -> 26149.6763763642 | J48: OR | K48: of:=[.E52]*(([.E54]/(1-[.E54]))/([.E53]/(1-[.E53]))) -> 4227.23853327517 | L48: of:=[.F52]*(([.F54]/(1-[.F54]))/([.F53]/(1-[.F53]))) -> 6381.20768098172 | M48: of:=[.K48]/[.G$48] -> 0.145833321146038 | N48: of:=[.L48]/[.$H$48] -> 0.244026258265647 | P48: of:=[.J48] -> OR | Q48: of:=[.M48] -> 0.145833321146038 | R48: of:=[.N48] -> 0.244026258265647
B49: taill cible | C49: 100000 | D49: 100000 | F49: average AB | G49: of:=[.G48]/[.C48] -> 0.289867809363128 | H49: of:=[.H48]/[.D48] -> 0.261496763763642 | J49: RR | K49: of:=[.E52]*([.E54]/[.E53]) -> 6115.34407368722 | L49: of:=[.F52]*([.F54]/[.F53]) -> 8952.42363363586 | M49: of:=[.K49]/[.G$48] -> 0.210970100030194 | N49: of:=[.L49]/[.$H$48] -> 0.342353132971376 | P49: of:=[.J49] -> RR | Q49: of:=[.M49] -> 0.210970100030194 | R49: of:=[.N49] -> 0.342353132971376
B50: écart | C50: of:=[.C48]-[.D48] -> 0 | D50: of:=[.D49]-[.D48] -> 0 | J50: average AB | K50: of:=[.C48]*[.G49] -> 28986.7809363128 | L50: of:=[.D48]*[.H49] -> 26149.6763763642 | M50: of:=[.K50]/[.G$48] -> 1 | N50: of:=[.L50]/[.$H$48] -> 1 | P50: of:=[.J50] -> average AB | Q50: of:=[.M50] -> 1 | R50: of:=[.N50] -> 1
E51: pop B | F51: pop A
D52: total events | E52: of:=SUM([.E3:.E43]) -> 35102.12501 | F52: of:=SUM([.F3:.F43]) -> 35102.10001
D53: average Rc | E53: of:=[.E52]/[.C48] -> 0.3510212501 | F53: of:=[.F52]/[.D48] -> 0.3510210001
D54: average Rt | E54: of:=([.E52]-[.G48])/[.C48] -> 0.0611534407368722 | F54: of:=([.F52]-[.H48])/[.D48] -> 0.0895242363363586
J55: pop A NPE computated with current metrics and trial 1 summary data | M55: % of the true NPE
K56: pop B | L56: pop A | M56: pop B | N56: pop A | Q56: of:=[.M56] -> pop B | R56: of:=[.N56] -> pop A
J57: OR | K57: of:=[.E52]*(([.E63]/(1-[.E63]))/([.E62]/(1-[.E62]))) -> 6381.21222572952 | L57: of:=[.F52]*(([.E63]/(1-[.E63]))/([.E62]/(1-[.E62]))) -> 6381.20768098172 | M57: of:=[.K57]/[.G$48] -> 0.220142148234734 | N57: of:=[.L57]/[.$H$48] -> 0.244026258265647 | P57: of:=[.J57] -> OR | Q57: of:=[.M57] -> 0.220142148234734 | R57: of:=[.N57] -> 0.244026258265647
J58: RR | K58: of:=[.E52]*([.E63]/[.E62]) -> 8952.4300096245 | L58: of:=[.F52]*([.E63]/[.E62]) -> 8952.42363363586 | M58: of:=[.K58]/[.G$48] -> 0.308845263959941 | N58: of:=[.L58]/[.$H$48] -> 0.342353132971376 | P58: of:=[.J58] -> RR | Q58: of:=[.M58] -> 0.308845263959941 | R58: of:=[.N58] -> 0.342353132971376
J59: average AB | K59: of:=[.C48]*([.E62]-[.E63]) -> 26149.6763763642 | L59: of:=[.D48]*([.E62]-[.E63]) -> 26149.6763763642 | M59: of:=[.K59]/[.G$48] -> 0.902124193570094 | N59: of:=[.L59]/[.$H$48] -> 1 | P59: of:=[.J59] -> average AB | Q59: of:=[.M59] -> 0.902124193570094 | R59: of:=[.N59] -> 1
D62: trial 1 Rc | E62: of:=[.F53] -> 0.3510210001 | J62: pop A NPE computated with current metrics and trial 2 summary data | M62: % of the true NPE
D63: trial 1 Rt | E63: of:=[.F54] -> 0.0895242363363586 | K63: pop B | L63: pop A | M63: pop B | N63: pop A | Q63: of:=[.M63] -> pop B | R63: of:=[.N63] -> pop A
J64: OR | K64: of:=[.E52]*(([.D75]/(1-[.D75]))/([.D74]/(1-[.D74]))) -> 4375.7008882394 | L64: of:=[.F52]*(([.D75]/(1-[.D75]))/([.D74]/(1-[.D74]))) -> 4375.697771832 | M64: of:=[.K64]/[.G$48] -> 0.150955047331861 | N64: of:=[.L64]/[.$H$48] -> 0.1673327695859 | P64: of:=[.J64] -> OR | Q64: of:=[.M64] -> 0.150955047331861 | R64: of:=[.N64] -> 0.1673327695859
J65: RR | K65: of:=[.E52]*([.D75]/[.D74]) -> 5277.16008571827 | L65: of:=[.F52]*([.D75]/[.D74]) -> 5277.15632728479 | M65: of:=[.K65]/[.G$48] -> 0.182054023084274 | N65: of:=[.L65]/[.$H$48] -> 0.20180579871553 | P65: of:=[.J65] -> RR | Q65: of:=[.M65] -> 0.182054023084274 | R65: of:=[.N65] -> 0.20180579871553
D66: trial 2 Rc | E66: of:=[.D74] -> 0.195149387639399 | J66: average AB | K66: of:=[.C48]*([.D74]-[.D75]) -> 16581.1147891532 | L66: of:=[.D48]*([.D74]-[.D75]) -> 16581.1147891532 | M66: of:=[.K66]/[.G$48] -> 0.572023324203669 | N66: of:=[.L66]/[.$H$48] -> 0.634084894608497 | P66: of:=[.J66] -> average AB | Q66: of:=[.M66] -> 0.572023324203669 | R66: of:=[.N66] -> 0.634084894608497
D67: trial 2 Rt | E67: of:=[.D75] -> 0.0293382397478677
C69: trial 2 summary data | J69: comparing the five NNTs (trial 2) | M69: % of the ref NNT
C70: N | D70: of:=SUM([.D4:.D20]) -> 52983 | K70: pop B | L70: pop A | M70: pop B | N70: pop A
C71: NPE | D71: of:=SUM([.H4:.H20]) -> 8785.17204873703 | I71: 1 | J71: NNT ave | K71: of:=1/([.E53]-[.E54]) -> 3.44984840571677 | L71: of:=1/([.F53]-[.F54]) -> 3.82413910446658 | M71: of:=[.K71]/[.K74] -> 1 | N71: of:=[.L71]/[.L74] -> 1
C72: trial 2 AB | D72: of:=[.D71]/[.D70] -> 0.165811147891532 | I72: 2 | J72: NNT ave sec | K72: of:=1/(SUM([.L3:.L43])) -> 0.0791950151847504 | L72: of:=1/(SUM([.M3:.M43])) -> 0.0791950151847504 | M72: of:=[.K72]/[.K74] -> 0.0229560855640832 | N72: of:=[.L72]/[.L74] -> 0.0207092401770247
C73: total events | D73: of:=SUM([.F4:.F20]) -> 10339.6000052983 | I73: 3 | J73: NNT transp trial 2 | K73: of:=1/([.E53]*(1-([.D75]/[.D74]))) -> 3.35289581241337 | L73: of:=1/([.F53]*(1-([.D75]/[.D74]))) -> 3.35289820037293 | M73: of:=[.K73]/[.K74] -> 0.97189656416707 | N73: of:=[.L73]/[.L74] -> 0.87677202862646
C74: trial 2 Rc | D74: of:=[.D73]/[.D70] -> 0.195149387639399 | I74: 4 | J74: NNT ref | K74: of:=[.C48]/[.G48] -> 3.44984840571677 | L74: of:=[.D48]/[.H48] -> 3.82413910446658 | M74: of:=[.K74]/[.K74] -> 1 | N74: of:=[.L74]/[.L74] -> 1
C75: trial 2 Rt | D75: of:=([.D73]-[.D71])/[.D70] -> 0.0293382397478677 | I75: 5 | J75: NNT 5 | K75: of:=(1/[.V44])/[.C48] -> -8.01059258255079E-015 | L75: of:=(1/[.W44])/[.D48] -> 9.99995444199926E-017 | M75: of:=[.K75]/[.K74] -> -2.32201292360452E-015 | N75: of:=[.L75]/[.L74] -> 2.61495572436666E-017
J78: comparing NNT pop with NNT trials | M78: % of the ref NNT
K79: pop B | L79: pop A | M79: pop B | N79: pop A
I80: 1 | J80: NNT trial 1 | K80: of:=1/([.E62]-[.E63]) -> 3.82413910446658 | L80: of:=1/([.E62]-[.E63]) -> 3.82413910446658 | M80: of:=[.K80]/[.$K$84] -> 1.1084948249116 | N80: of:=[.L80]/[.$L$84] -> 1
I81: 2 | J81: NNT trial 2 | K81: of:=1/([.E66]-[.E67]) -> 6.03095758467439 | L81: of:=1/([.E66]-[.E67]) -> 6.03095758467439 | M81: of:=[.K81]/[.$K$84] -> 1.74818046343151 | N81: of:=[.L81]/[.$L$84] -> 1.57707589078814
I82: 3 | J82: NNT transp trial 1 | K82: of:=1/([.E53]*(1-[.E63]/[.E62])) -> 3.82413638088566 | L82: of:=1/([.F53]*(1-[.E63]/[.E62])) -> 3.82413910446657 | M82: of:=[.K82]/[.$K$84] -> 1.10849403543317 | N82: of:=[.L82]/[.$L$84] -> 1
I83: 4 | J83: NNT transp trial 2 | K83: of:=1/([.E53]*(1-([.E67]/[.E66]))) -> 3.35289581241337 | L83: of:=1/([.F53]*(1-([.E67]/[.E66]))) -> 3.35289820037293 | M83: of:=[.K83]/[.$K$84] -> 0.97189656416707 | N83: of:=[.L83]/[.$L$84] -> 0.87677202862646
I84: 5 | J84: NNT ref | K84: of:=[.K74] -> 3.44984840571677 | L84: of:=[.L74] -> 3.82413910446658 | M84: of:=[.K84]/[.$K$84] -> 1 | N84: of:=[.L84]/[.$L$84] -> 1
K88: NPE
K89: pop B trial 1 | L89: pop B trial 2 | M89: pop B trial 1 | N89: pop B trial 2
J90: of:=[.J66] -> average AB | K90: of:=[.M59] -> 0.902124193570094 | L90: of:=[.M66] -> 0.572023324203669 | M90: of:=[.N59] -> 1 | N90: of:=[.N66] -> 0.634084894608497

Sheet: SUMMARY TABLES
B1: population data
B2: pop A | C2: pop B | D2: pop C
A3: size | B3: of:=[$'NPE vs pop 1'.D49] -> 100000 | C3: of:=[$'NPE vs pop 1'.C49] -> 100000 | D3: of:=[$'NPE vs pop 2'.C48] -> 100000
A4: average Rc | B4: of:=[$'NPE vs pop 1'.F53] -> 0.3510210001 | C4: of:=[$'NPE vs pop 1'.E53] -> 0.3510212501 | D4: of:=[$'NPE vs pop 2'.E53] -> 0.2163737501
A5: total events | B5: of:=[$'NPE vs pop 1'.F52] -> 35102.10001 | C5: of:=[$'NPE vs pop 1'.E52] -> 35102.12501 | D5: of:=[$'NPE vs pop 2'.E52] -> 21637.37501
B9: real benefit from drugs 1 and 2
B10: pop A | C10: pop B | D10: pop C
A11: drug 1
A12: NPE | B12: of:=[$'NPE vs pop 1'.H48] -> 26149.6763763642 | C12: of:=[$'NPE vs pop 1'.G48] -> 28986.7809363128 | D12: of:=[$'NPE vs pop 2'.G48] -> 17279.2266370511
A13: average AB | B13: of:=[$'NPE vs pop 1'.H49] -> 0.261496763763642 | C13: of:=[$'NPE vs pop 1'.G49] -> 0.289867809363128 | D13: of:=[$'NPE vs pop 2'.G49] -> 0.172792266370511
A14: average Rt | B14: of:=[$'NPE vs pop 1'.F54] -> 0.0895242363363586 | C14: of:=[$'NPE vs pop 1'.E54] -> 0.0611534407368722 | D14: of:=[$'NPE vs pop 2'.E54] -> 0.0435814837294896
A15: drug 2
A16: NPE | B16: of:=['efficacy%20metrics%20drug%202%20bis.fods'#$'NPE vs pop 2'.$H$48] -> 1580.09919513455 | C16: of:=['efficacy%20metrics%20drug%202%20bis.fods'#$'NPE vs pop 1'.$G$48] -> 2164.91613661216 | D16: of:=['efficacy%20metrics%20drug%202%20bis.fods'#$'NPE vs pop 2'.$G$48] -> 1264.7659063041
A17: average AB | B17: of:=['efficacy%20metrics%20drug%202%20bis.fods'#$'NPE vs pop 1'.$H$49] -> 0.0158009919513455 | C17: of:=['efficacy%20metrics%20drug%202%20bis.fods'#$'NPE vs pop 1'.$G$49] -> 0.0216491613661216 | D17: of:=['efficacy%20metrics%20drug%202%20bis.fods'#$'NPE vs pop 2'.$G$49] -> 0.012647659063041
A18: average Rt | B18: of:=['efficacy%20metrics%20drug%202%20bis.fods'#$'NPE vs pop 2'.$F$54] -> 0.335220008148655 | C18: of:=['efficacy%20metrics%20drug%202%20bis.fods'#$'NPE vs pop 1'.$E$54] -> 0.329372088733879 | D18: of:=['efficacy%20metrics%20drug%202%20bis.fods'#$'NPE vs pop 2'.$E$54] -> 0.203726091036959
B22: trial summary findings
A24: drug 1 | B24: trial 1 | C24: trial 2
A25: Rc | B25: of:=[$'NPE vs pop 1'.E62] -> 0.3510210001 | C25: of:=[$'NPE vs pop 1'.D74] -> 0.195149387639399
A26: Rt | B26: of:=[$'NPE vs pop 1'.E63] -> 0.0895242363363586 | C26: of:=[$'NPE vs pop 1'.D75] -> 0.0293382397478677
A27: OR | B27: of:=([.B26]*(1-[.B26]))/([.B25]*(1-[.B25])) -> 0.357804066102289 | C27: of:=([.C26]*(1-[.C26]))/([.C25]*(1-[.C25])) -> 0.181309058320888
A28: RR | B28: of:=[.B26]/[.B25] -> 0.255039545528201 | C28: of:=[.C26]/[.C25] -> 0.150337339526165
A29: AB | B29: of:=[.B25]-[.B26] -> 0.261496763763642 | C29: of:=[.C25]-[.C26] -> 0.165811147891532
A30: NNT | B30: of:=1/[.B29] -> 3.82413910446658 | C30: of:=1/[.C29] -> 6.03095758467439
A31: drug 2
A32: Rc | B32: of:=['efficacy%20metrics%20drug%202%20bis.fods'#$'NPE vs pop 1'.$E$62] -> 0.3510210001 | C32: of:=['efficacy%20metrics%20drug%202%20bis.fods'#$'NPE vs pop 1'.$D$74] -> 0.195149387639399
A33: Rt | B33: of:=['efficacy%20metrics%20drug%202%20bis.fods'#$'NPE vs pop 1'.$E$63] -> 0.335220008148655 | C33: of:=['efficacy%20metrics%20drug%202%20bis.fods'#$'NPE vs pop 1'.$D$75] -> 0.181325817972903
A34: OR | B34: of:=([.B33]*(1-[.B33]))/([.B32]*(1-[.B32])) -> 0.978237098845742 | C34: of:=([.C33]*(1-[.C33]))/([.C32]*(1-[.C32])) -> 0.945122860969809
A35: RR | B35: of:=[.B33]/[.B32] -> 0.95498562209428 | C35: of:=[.C33]/[.C32] -> 0.92916416580287
A36: AB | B36: of:=[.B32]-[.B33] -> 0.015800991951345 | C36: of:=[.C32]-[.C33] -> 0.013823569666496
A37: NNT | B37: of:=1/[.B36] -> 63.2871659626964 | C37: of:=1/[.C36] -> 72.3402148739979
D41: transposabilty predictions in % of true values
C42: targeted population metrics | E42: pop A | F42: pop B | G42: pop C
A43: drug 1 | D43: source
B44: trial 1
C45: NPE
D46: trial OR | E46: of:=[$'NPE vs pop 1'.N57] -> 0.244026258265647 | F46: of:=[$'NPE vs pop 1'.M57] -> 0.220142148234734 | G46: of:=[$'NPE vs pop 2'.M57] -> 0.227640772775322
D47: trial RR | E47: of:=[$'NPE vs pop 1'.N58] -> 0.342353132971376 | F47: of:=[$'NPE vs pop 1'.M58] -> 0.308845263959941 | G47: of:=[$'NPE vs pop 2'.M58] -> 0.319365351522205
D48: trial AB | E48: of:=[$'NPE vs pop 1'.N57] -> 0.244026258265647 | F48: of:=[$'NPE vs pop 1'.M59] -> 0.902124193570094 | G48: of:=[$'NPE vs pop 2'.M59] -> 1.5133591870537
C49: NNT
D50: trial RR | E50: of:=[$'NPE vs pop 1'.N82] -> 1 | F50: of:=[$'NPE vs pop 1'.M82] -> 1.10849403543317 | G50: of:=[$'NPE vs pop 2'.M82] -> 1.07197957242263
B54: trial 2
C55: NPE
D56: trial OR | E56: of:=[$'NPE vs pop 1'.N64] -> 0.1673327695859 | F56: of:=[$'NPE vs pop 1'.M64] -> 0.150955047331861 | G56: of:=[$'NPE vs pop 2'.M64] -> 0.156096975997159
D57: trial RR | E57: of:=[$'NPE vs pop 1'.N65] -> 0.20180579871553 | F57: of:=[$'NPE vs pop 1'.M65] -> 0.182054023084274 | G57: of:=[$'NPE vs pop 2'.M65] -> 0.188255265218773
D58: trial AB | E58: of:=[$'NPE vs pop 1'.N66] -> 0.634084894608497 | F58: of:=[$'NPE vs pop 1'.M66] -> 0.572023324203669 | G58: of:=[$'NPE vs pop 2'.M66] -> 0.959598200627744
C59: NNT
D60: trial RR | E60: of:=[$'NPE vs pop 1'.N83] -> 0.87677202862646 | F60: of:=[$'NPE vs pop 1'.M83] -> 0.97189656416707 | G60: of:=[$'NPE vs pop 2'.M83] -> 0.939881704359116
D63: transposabilty predictions in % of true values
C64: targeted population metrics | E64: pop A | F64: pop B | G64: pop C
A65: drug 2 | D65: source
B66: trial 1
C67: NPE
D68: trial OR | E68: of:=['efficacy%20metrics%20drug%202%20bis.fods'#$'NPE vs pop 1'.N57] -> 20.7108672238367 | F68: of:=['efficacy%20metrics%20drug%202%20bis.fods'#$'NPE vs pop 1'.M57] -> 15.1161735019003 | G68: of:=['efficacy%20metrics%20drug%202%20bis.fods'#$'NPE vs pop 2'.M57] -> 15.9493856482097
D69: trial RR | E69: of:=['efficacy%20metrics%20drug%202%20bis.fods'#$'NPE vs pop 1'.N58] -> 21.2151242897196 | F69: of:=['efficacy%20metrics%20drug%202%20bis.fods'#$'NPE vs pop 1'.M58] -> 15.4842139714308 | G69: of:=['efficacy%20metrics%20drug%202%20bis.fods'#$'NPE vs pop 2'.M58] -> 16.33771271934
D70: trial AB | E70: of:=['efficacy%20metrics%20drug%202%20bis.fods'#$'NPE vs pop 1'.N59] -> 0.999999999999998 | F70: of:=['efficacy%20metrics%20drug%202%20bis.fods'#$'NPE vs pop 1'.M59] -> 0.729866237501108 | G70: of:=['efficacy%20metrics%20drug%202%20bis.fods'#$'NPE vs pop 2'.M59] -> 1.24932146514917
C71: NNT
D72: trial RR | E72: of:=['efficacy%20metrics%20drug%202%20bis.fods'#$'NPE vs pop 1'.$N$82] -> 1 | F72: of:=['efficacy%20metrics%20drug%202%20bis.fods'#$'NPE vs pop 1'.$M$82] -> 1.37011309252524 | G72: of:=['efficacy%20metrics%20drug%202%20bis.fods'#$'NPE vs pop 2'.$M$82] -> 1.29853698948972
B76: trial 2
C77: NPE
D78: trial OR | E78: of:=['efficacy%20metrics%20drug%202%20bis.fods'#$'NPE vs pop 1'.N64] -> 20.2929592875709 | F78: of:=['efficacy%20metrics%20drug%202%20bis.fods'#$'NPE vs pop 1'.M64] -> 14.8111563916006 | G78: of:=['efficacy%20metrics%20drug%202%20bis.fods'#$'NPE vs pop 2'.M64] -> 15.6275558199889
D79: trial RR | E79: of:=['efficacy%20metrics%20drug%202%20bis.fods'#$'NPE vs pop 1'.N65] -> 20.6414974288644 | F79: of:=['efficacy%20metrics%20drug%202%20bis.fods'#$'NPE vs pop 1'.M65] -> 15.065542794588 | G79: of:=['efficacy%20metrics%20drug%202%20bis.fods'#$'NPE vs pop 2'.M65] -> 15.8959641472946
D80: trial AB | E80: of:=['efficacy%20metrics%20drug%202%20bis.fods'#$'NPE vs pop 1'.N66] -> 0.874854547680417 | F80: of:=['efficacy%20metrics%20drug%202%20bis.fods'#$'NPE vs pop 1'.M66] -> 0.63852679707624 | G80: of:=['efficacy%20metrics%20drug%202%20bis.fods'#$'NPE vs pop 2'.M66] -> 1.09297456530051
C81: NNT
D82: trial RR | E82: of:=['efficacy%20metrics%20drug%202%20bis.fods'#$'NPE vs pop 1'.$N$83] -> 0.635474663578447 | F82: of:=['efficacy%20metrics%20drug%202%20bis.fods'#$'NPE vs pop 1'.$M$83] -> 0.870672156536903 | G82: of:=['efficacy%20metrics%20drug%202%20bis.fods'#$'NPE vs pop 2'.$M$83] -> 0.825187356540146

Sheet: SUMMARY FIGURES
B1: of:=[$'NPE vs pop 1'.B2] -> Rc | C1: of:=[$'NPE vs pop 1'.D2] -> pop A | D1: of:=[$'NPE vs pop 1'.C2] -> pop B | E1: of:=[$'NPE vs pop 2'.C2] -> pop C
A2: of:=[$'NPE vs pop 1'.A3] -> 1 | B2: of:=[$'NPE vs pop 1'.B3] -> 0.0000000001 | C2: of:=[$'NPE vs pop 1'.D3] -> 8290 | D2: of:=[$'NPE vs pop 1'.C3] -> 10 | E2: of:=[$'NPE vs pop 2'.C3] -> 13950
A3: of:=[$'NPE vs pop 1'.A4] -> 2 | B3: of:=[$'NPE vs pop 1'.B4] -> 0.0250000001 | C3: of:=[$'NPE vs pop 1'.D4] -> 6540 | D3: of:=[$'NPE vs pop 1'.C4] -> 20 | E3: of:=[$'NPE vs pop 2'.C4] -> 9810
A4: of:=[$'NPE vs pop 1'.A5] -> 3 | B4: of:=[$'NPE vs pop 1'.B5] -> 0.0500000001 | C4: of:=[$'NPE vs pop 1'.D5] -> 5080 | D4: of:=[$'NPE vs pop 1'.C5] -> 50 | E4: of:=[$'NPE vs pop 2'.C5] -> 7000
A5: of:=[$'NPE vs pop 1'.A6] -> 4 | B5: of:=[$'NPE vs pop 1'.B6] -> 0.0750000001 | C5: of:=[$'NPE vs pop 1'.D6] -> 3700 | D5: of:=[$'NPE vs pop 1'.C6] -> 100 | E5: of:=[$'NPE vs pop 2'.C6] -> 6250
A6: of:=[$'NPE vs pop 1'.A7] -> 5 | B6: of:=[$'NPE vs pop 1'.B7] -> 0.1000000001 | C6: of:=[$'NPE vs pop 1'.D7] -> 3250 | D6: of:=[$'NPE vs pop 1'.C7] -> 200 | E6: of:=[$'NPE vs pop 2'.C7] -> 5300
A7: of:=[$'NPE vs pop 1'.A8] -> 6 | B7: of:=[$'NPE vs pop 1'.B8] -> 0.1250000001 | C7: of:=[$'NPE vs pop 1'.D8] -> 3100 | D7: of:=[$'NPE vs pop 1'.C8] -> 400 | E7: of:=[$'NPE vs pop 2'.C8] -> 4500
A8: of:=[$'NPE vs pop 1'.A9] -> 7 | B8: of:=[$'NPE vs pop 1'.B9] -> 0.1500000001 | C8: of:=[$'NPE vs pop 1'.D9] -> 2850 | D8: of:=[$'NPE vs pop 1'.C9] -> 800 | E8: of:=[$'NPE vs pop 2'.C9] -> 3850
A9: of:=[$'NPE vs pop 1'.A10] -> 8 | B9: of:=[$'NPE vs pop 1'.B10] -> 0.1750000001 | C9: of:=[$'NPE vs pop 1'.D10] -> 2700 | D9: of:=[$'NPE vs pop 1'.C10] -> 1600 | E9: of:=[$'NPE vs pop 2'.C10] -> 3700
A10: of:=[$'NPE vs pop 1'.A11] -> 9 | B10: of:=[$'NPE vs pop 1'.B11] -> 0.2000000001 | C10: of:=[$'NPE vs pop 1'.D11] -> 2650 | D10: of:=[$'NPE vs pop 1'.C11] -> 3000 | E10: of:=[$'NPE vs pop 2'.C11] -> 3500
A11: of:=[$'NPE vs pop 1'.A12] -> 10 | B11: of:=[$'NPE vs pop 1'.B12] -> 0.2250000001 | C11: of:=[$'NPE vs pop 1'.D12] -> 2600 | D11: of:=[$'NPE vs pop 1'.C12] -> 4500 | E11: of:=[$'NPE vs pop 2'.C12] -> 3350
A12: of:=[$'NPE vs pop 1'.A13] -> 11 | B12: of:=[$'NPE vs pop 1'.B13] -> 0.2500000001 | C12: of:=[$'NPE vs pop 1'.D13] -> 2583 | D12: of:=[$'NPE vs pop 1'.C13] -> 6000 | E12: of:=[$'NPE vs pop 2'.C13] -> 3250
A13: of:=[$'NPE vs pop 1'.A14] -> 12 | B13: of:=[$'NPE vs pop 1'.B14] -> 0.2750000001 | C13: of:=[$'NPE vs pop 1'.D14] -> 2578 | D13: of:=[$'NPE vs pop 1'.C14] -> 7350 | E13: of:=[$'NPE vs pop 2'.C14] -> 3150
A14: of:=[$'NPE vs pop 1'.A15] -> 13 | B14: of:=[$'NPE vs pop 1'.B15] -> 0.3000000001 | C14: of:=[$'NPE vs pop 1'.D15] -> 2574 | D14: of:=[$'NPE vs pop 1'.C15] -> 8500 | E14: of:=[$'NPE vs pop 2'.C15] -> 3050
A15: of:=[$'NPE vs pop 1'.A16] -> 14 | B15: of:=[$'NPE vs pop 1'.B16] -> 0.3250000001 | C15: of:=[$'NPE vs pop 1'.D16] -> 2570 | D15: of:=[$'NPE vs pop 1'.C16] -> 10500 | E15: of:=[$'NPE vs pop 2'.C16] -> 2950
A16: of:=[$'NPE vs pop 1'.A17] -> 15 | B16: of:=[$'NPE vs pop 1'.B17] -> 0.3500000001 | C16: of:=[$'NPE vs pop 1'.D17] -> 2560 | D16: of:=[$'NPE vs pop 1'.C17] -> 12500 | E16: of:=[$'NPE vs pop 2'.C17] -> 2850
A17: of:=[$'NPE vs pop 1'.A18] -> 16 | B17: of:=[$'NPE vs pop 1'.B18] -> 0.3750000001 | C17: of:=[$'NPE vs pop 1'.D18] -> 2555 | D17: of:=[$'NPE vs pop 1'.C18] -> 15000 | E17: of:=[$'NPE vs pop 2'.C18] -> 2750
A18: of:=[$'NPE vs pop 1'.A19] -> 17 | B18: of:=[$'NPE vs pop 1'.B19] -> 0.4000000001 | C18: of:=[$'NPE vs pop 1'.D19] -> 2548 | D18: of:=[$'NPE vs pop 1'.C19] -> 12975 | E18: of:=[$'NPE vs pop 2'.C19] -> 2600
A19: of:=[$'NPE vs pop 1'.A20] -> 18 | B19: of:=[$'NPE vs pop 1'.B20] -> 0.4250000001 | C19: of:=[$'NPE vs pop 1'.D20] -> 2545 | D19: of:=[$'NPE vs pop 1'.C20] -> 4800 | E19: of:=[$'NPE vs pop 2'.C20] -> 2500
A20: of:=[$'NPE vs pop 1'.A21] -> 19 | B20: of:=[$'NPE vs pop 1'.B21] -> 0.4500000001 | C20: of:=[$'NPE vs pop 1'.D21] -> 2538 | D20: of:=[$'NPE vs pop 1'.C21] -> 2500 | E20: of:=[$'NPE vs pop 2'.C21] -> 2350
A21: of:=[$'NPE vs pop 1'.A22] -> 20 | B21: of:=[$'NPE vs pop 1'.B22] -> 0.4750000001 | C21: of:=[$'NPE vs pop 1'.D22] -> 2535 | D21: of:=[$'NPE vs pop 1'.C22] -> 2250 | E21: of:=[$'NPE vs pop 2'.C22] -> 2100
A22: of:=[$'NPE vs pop 1'.A23] -> 21 | B22: of:=[$'NPE vs pop 1'.B23] -> 0.5000000001 | C22: of:=[$'NPE vs pop 1'.D23] -> 2535 | D22: of:=[$'NPE vs pop 1'.C23] -> 1700 | E22: of:=[$'NPE vs pop 2'.C23] -> 1850
A23: of:=[$'NPE vs pop 1'.A24] -> 22 | B23: of:=[$'NPE vs pop 1'.B24] -> 0.5250000001 | C23: of:=[$'NPE vs pop 1'.D24] -> 2530 | D23: of:=[$'NPE vs pop 1'.C24] -> 1100 | E23: of:=[$'NPE vs pop 2'.C24] -> 1550
A24: of:=[$'NPE vs pop 1'.A25] -> 23 | B24: of:=[$'NPE vs pop 1'.B25] -> 0.5500000001 | C24: of:=[$'NPE vs pop 1'.D25] -> 2520 | D24: of:=[$'NPE vs pop 1'.C25] -> 900 | E24: of:=[$'NPE vs pop 2'.C25] -> 1250
A25: of:=[$'NPE vs pop 1'.A26] -> 24 | B25: of:=[$'NPE vs pop 1'.B26] -> 0.5750000001 | C25: of:=[$'NPE vs pop 1'.D26] -> 2515 | D25: of:=[$'NPE vs pop 1'.C26] -> 800 | E25: of:=[$'NPE vs pop 2'.C26] -> 1100
A26: of:=[$'NPE vs pop 1'.A27] -> 25 | B26: of:=[$'NPE vs pop 1'.B27] -> 0.6000000001 | C26: of:=[$'NPE vs pop 1'.D27] -> 2510 | D26: of:=[$'NPE vs pop 1'.C27] -> 500 | E26: of:=[$'NPE vs pop 2'.C27] -> 800
A27: of:=[$'NPE vs pop 1'.A28] -> 26 | B27: of:=[$'NPE vs pop 1'.B28] -> 0.6250000001 | C27: of:=[$'NPE vs pop 1'.D28] -> 2500 | D27: of:=[$'NPE vs pop 1'.C28] -> 400 | E27: of:=[$'NPE vs pop 2'.C28] -> 600
A28: of:=[$'NPE vs pop 1'.A29] -> 27 | B28: of:=[$'NPE vs pop 1'.B29] -> 0.6500000001 | C28: of:=[$'NPE vs pop 1'.D29] -> 2450 | D28: of:=[$'NPE vs pop 1'.C29] -> 300 | E28: of:=[$'NPE vs pop 2'.C29] -> 500
A29: of:=[$'NPE vs pop 1'.A30] -> 28 | B29: of:=[$'NPE vs pop 1'.B30] -> 0.6750000001 | C29: of:=[$'NPE vs pop 1'.D30] -> 2400 | D29: of:=[$'NPE vs pop 1'.C30] -> 200 | E29: of:=[$'NPE vs pop 2'.C30] -> 450
A30: of:=[$'NPE vs pop 1'.A31] -> 29 | B30: of:=[$'NPE vs pop 1'.B31] -> 0.7000000001 | C30: of:=[$'NPE vs pop 1'.D31] -> 2300 | D30: of:=[$'NPE vs pop 1'.C31] -> 150 | E30: of:=[$'NPE vs pop 2'.C31] -> 450
A31: of:=[$'NPE vs pop 1'.A32] -> 30 | B31: of:=[$'NPE vs pop 1'.B32] -> 0.7250000001 | C31: of:=[$'NPE vs pop 1'.D32] -> 2150 | D31: of:=[$'NPE vs pop 1'.C32] -> 135 | E31: of:=[$'NPE vs pop 2'.C32] -> 400
A32: of:=[$'NPE vs pop 1'.A33] -> 31 | B32: of:=[$'NPE vs pop 1'.B33] -> 0.7500000001 | C32: of:=[$'NPE vs pop 1'.D33] -> 1850 | D32: of:=[$'NPE vs pop 1'.C33] -> 120 | E32: of:=[$'NPE vs pop 2'.C33] -> 360
A33: of:=[$'NPE vs pop 1'.A34] -> 32 | B33: of:=[$'NPE vs pop 1'.B34] -> 0.7750000001 | C33: of:=[$'NPE vs pop 1'.D34] -> 1670 | D33: of:=[$'NPE vs pop 1'.C34] -> 110 | E33: of:=[$'NPE vs pop 2'.C34] -> 350
A34: of:=[$'NPE vs pop 1'.A35] -> 33 | B34: of:=[$'NPE vs pop 1'.B35] -> 0.8000000001 | C34: of:=[$'NPE vs pop 1'.D35] -> 1505 | D34: of:=[$'NPE vs pop 1'.C35] -> 100 | E34: of:=[$'NPE vs pop 2'.C35] -> 300
A35: of:=[$'NPE vs pop 1'.A36] -> 34 | B35: of:=[$'NPE vs pop 1'.B36] -> 0.825000000100001 | C35: of:=[$'NPE vs pop 1'.D36] -> 1350 | D35: of:=[$'NPE vs pop 1'.C36] -> 90 | E35: of:=[$'NPE vs pop 2'.C36] -> 260
A36: of:=[$'NPE vs pop 1'.A37] -> 35 | B36: of:=[$'NPE vs pop 1'.B37] -> 0.850000000100001 | C36: of:=[$'NPE vs pop 1'.D37] -> 980 | D36: of:=[$'NPE vs pop 1'.C37] -> 80 | E36: of:=[$'NPE vs pop 2'.C37] -> 245
A37: of:=[$'NPE vs pop 1'.A38] -> 36 | B37: of:=[$'NPE vs pop 1'.B38] -> 0.875000000100001 | C37: of:=[$'NPE vs pop 1'.D38] -> 755 | D37: of:=[$'NPE vs pop 1'.C38] -> 70 | E37: of:=[$'NPE vs pop 2'.C38] -> 200
A38: of:=[$'NPE vs pop 1'.A39] -> 37 | B38: of:=[$'NPE vs pop 1'.B39] -> 0.900000000100001 | C38: of:=[$'NPE vs pop 1'.D39] -> 575 | D38: of:=[$'NPE vs pop 1'.C39] -> 60 | E38: of:=[$'NPE vs pop 2'.C39] -> 190
A39: of:=[$'NPE vs pop 1'.A40] -> 38 | B39: of:=[$'NPE vs pop 1'.B40] -> 0.925000000100001 | C39: of:=[$'NPE vs pop 1'.D40] -> 276 | D39: of:=[$'NPE vs pop 1'.C40] -> 50 | E39: of:=[$'NPE vs pop 2'.C40] -> 150
A40: of:=[$'NPE vs pop 1'.A41] -> 39 | B40: of:=[$'NPE vs pop 1'.B41] -> 0.950000000100001 | C40: of:=[$'NPE vs pop 1'.D41] -> 158 | D40: of:=[$'NPE vs pop 1'.C41] -> 40 | E40: of:=[$'NPE vs pop 2'.C41] -> 110
A41: of:=[$'NPE vs pop 1'.A42] -> 40 | B41: of:=[$'NPE vs pop 1'.B42] -> 0.975000000100001 | C41: of:=[$'NPE vs pop 1'.D42] -> 95 | D41: of:=[$'NPE vs pop 1'.C42] -> 30 | E41: of:=[$'NPE vs pop 2'.C42] -> 95
A42: of:=[$'NPE vs pop 1'.A43] -> 41 | B42: of:=[$'NPE vs pop 1'.B43] -> 1.0000000001 | C42: of:=[$'NPE vs pop 1'.D43] -> 30 | D42: of:=[$'NPE vs pop 1'.C43] -> 10 | E42: of:=[$'NPE vs pop 2'.C43] -> 30

Sheet: TEST 1
B1: Abs
A2: Rc | B2: po A | C2: po B | D2: # events A | E2: # events B | F2: NPEs A | G2: NPEs B
A3: of:=[$curvi.A5] -> 0.0000000001 | B3: 0 | C3: 2439.0243902439 | D3: of:=[.A3]*[.B3] -> 0 | E3: of:=[.A3]*[.C3] -> 0.00000024390243902439 | F3: of:=[.B3]*[$curvi.$I5] -> 0 | G3: of:=[.C3]*[$curvi.$I5] -> 0.000000216833860140413
A4: of:=[$curvi.A6] -> 0.0250000001 | B4: 0 | C4: 2439.0243902439 | D4: of:=[.A4]*[.B4] -> 0 | E4: of:=[.A4]*[.C4] -> 60.97561 | F4: of:=[.B4]*[$curvi.$I6] -> 0 | G4: of:=[.C4]*[$curvi.$I6] -> 54.0546435143252 | H4: of:=[.B48] -> 0
A5: of:=[$curvi.A7] -> 0.0500000001 | B5: 0 | C5: 2439.0243902439 | D5: of:=[.A5]*[.B5] -> 0 | E5: of:=[.A5]*[.C5] -> 121.951219756098 | F5: of:=[.B5]*[$curvi.$I7] -> 0 | G5: of:=[.C5]*[$curvi.$I7] -> 107.787332150012 | H5: of:=[.D51] -> 0.5000000001
A6: of:=[$curvi.A8] -> 0.0750000001 | B6: 0 | C6: 2439.0243902439 | D6: of:=[.A6]*[.B6] -> 0 | E6: of:=[.A6]*[.C6] -> 182.926829512195 | F6: of:=[.B6]*[$curvi.$I8] -> 0 | G6: of:=[.C6]*[$curvi.$I8] -> 161.175065760513 | H6: of:=[.H5]-[.E51] -> 0
A7: of:=[$curvi.A9] -> 0.1000000001 | B7: 0 | C7: 2439.0243902439 | D7: of:=[.A7]*[.B7] -> 0 | E7: of:=[.A7]*[.C7] -> 243.902439268293 | F7: of:=[.B7]*[$curvi.$I9] -> 0 | G7: of:=[.C7]*[$curvi.$I9] -> 214.192599684532
A8: of:=[$curvi.A10] -> 0.1250000001 | B8: 0 | C8: 2439.0243902439 | D8: of:=[.A8]*[.B8] -> 0 | E8: of:=[.A8]*[.C8] -> 304.87804902439 | F8: of:=[.B8]*[$curvi.$I10] -> 0 | G8: of:=[.C8]*[$curvi.$I10] -> 266.812164379479
A9: of:=[$curvi.A11] -> 0.1500000001 | B9: 0 | C9: 2439.0243902439 | D9: of:=[.A9]*[.B9] -> 0 | E9: of:=[.A9]*[.C9] -> 365.853658780488 | F9: of:=[.B9]*[$curvi.$I11] -> 0 | G9: of:=[.C9]*[$curvi.$I11] -> 319.003141664144
A10: of:=[$curvi.A12] -> 0.1750000001 | B10: 0 | C10: 2439.0243902439 | D10: of:=[.A10]*[.B10] -> 0 | E10: of:=[.A10]*[.C10] -> 426.829268536585 | F10: of:=[.B10]*[$curvi.$I12] -> 0 | G10: of:=[.C10]*[$curvi.$I12] -> 370.731689832934
A11: of:=[$curvi.A13] -> 0.2000000001 | B11: 0 | C11: 2439.0243902439 | D11: of:=[.A11]*[.B11] -> 0 | E11: of:=[.A11]*[.C11] -> 487.804878292683 | F11: of:=[.B11]*[$curvi.$I13] -> 0 | G11: of:=[.C11]*[$curvi.$I13] -> 421.960307967031
A12: of:=[$curvi.A14] -> 0.2250000001 | B12: 0 | C12: 2439.0243902439 | D12: of:=[.A12]*[.B12] -> 0 | E12: of:=[.A12]*[.C12] -> 548.78048804878 | F12: of:=[.B12]*[$curvi.$I14] -> 0 | G12: of:=[.C12]*[$curvi.$I14] -> 472.647327617456
A13: of:=[$curvi.A15] -> 0.2500000001 | B13: 0 | C13: 2439.0243902439 | D13: of:=[.A13]*[.B13] -> 0 | E13: of:=[.A13]*[.C13] -> 609.756097804878 | F13: of:=[.B13]*[$curvi.$I15] -> 0 | G13: of:=[.C13]*[$curvi.$I15] -> 522.746317331719
A14: of:=[$curvi.A16] -> 0.2750000001 | B14: 0 | C14: 2439.0243902439 | D14: of:=[.A14]*[.B14] -> 0 | E14: of:=[.A14]*[.C14] -> 670.731707560976 | F14: of:=[.B14]*[$curvi.$I16] -> 0 | G14: of:=[.C14]*[$curvi.$I16] -> 572.205382076606
A15: of:=[$curvi.A17] -> 0.3000000001 | B15: 0 | C15: 2439.0243902439 | D15: of:=[.A15]*[.B15] -> 0 | E15: of:=[.A15]*[.C15] -> 731.707317317073 | F15: of:=[.B15]*[$curvi.$I17] -> 0 | G15: of:=[.C15]*[$curvi.$I17] -> 620.966335257892
A16: of:=[$curvi.A18] -> 0.3250000001 | B16: 0 | C16: 2439.0243902439 | D16: of:=[.A16]*[.B16] -> 0 | E16: of:=[.A16]*[.C16] -> 792.682927073171 | F16: of:=[.B16]*[$curvi.$I18] -> 0 | G16: of:=[.C16]*[$curvi.$I18] -> 668.963715461841
A17: of:=[$curvi.A19] -> 0.3500000001 | B17: 0 | C17: 2439.0243902439 | D17: of:=[.A17]*[.B17] -> 0 | E17: of:=[.A17]*[.C17] -> 853.658536829269 | F17: of:=[.B17]*[$curvi.$I19] -> 0 | G17: of:=[.C17]*[$curvi.$I19] -> 716.123612848217
A18: of:=[$curvi.A20] -> 0.3750000001 | B18: 0 | C18: 2439.0243902439 | D18: of:=[.A18]*[.B18] -> 0 | E18: of:=[.A18]*[.C18] -> 914.634146585366 | F18: of:=[.B18]*[$curvi.$I20] -> 0 | G18: of:=[.C18]*[$curvi.$I20] -> 762.362260770436
A19: of:=[$curvi.A21] -> 0.4000000001 | B19: 0 | C19: 2439.0243902439 | D19: of:=[.A19]*[.B19] -> 0 | E19: of:=[.A19]*[.C19] -> 975.609756341464 | F19: of:=[.B19]*[$curvi.$I21] -> 0 | G19: of:=[.C19]*[$curvi.$I21] -> 807.584335940673
A20: of:=[$curvi.A22] -> 0.4250000001 | B20: 0 | C20: 2439.0243902439 | D20: of:=[.A20]*[.B20] -> 0 | E20: of:=[.A20]*[.C20] -> 1036.58536609756 | F20: of:=[.B20]*[$curvi.$I22] -> 0 | G20: of:=[.C20]*[$curvi.$I22] -> 851.680894259056
A21: of:=[$curvi.A23] -> 0.4500000001 | B21: 0 | C21: 2439.0243902439 | D21: of:=[.A21]*[.B21] -> 0 | E21: of:=[.A21]*[.C21] -> 1097.56097585366 | F21: of:=[.B21]*[$curvi.$I23] -> 0 | G21: of:=[.C21]*[$curvi.$I23] -> 894.526847826476
A22: of:=[$curvi.A24] -> 0.4750000001 | B22: 0 | C22: 2439.0243902439 | D22: of:=[.A22]*[.B22] -> 0 | E22: of:=[.A22]*[.C22] -> 1158.53658560976 | F22: of:=[.B22]*[$curvi.$I24] -> 0 | G22: of:=[.C22]*[$curvi.$I24] -> 935.97785958225
A23: of:=[$curvi.A25] -> 0.5000000001 | B23: 100000 | C23: 2439.0243902439 | D23: of:=[.A23]*[.B23] -> 50000.00001 | E23: of:=[.A23]*[.C23] -> 1219.51219536585 | F23: of:=[.B23]*[$curvi.$I25] -> 40010.5261908072 | G23: of:=[.C23]*[$curvi.$I25] -> 975.866492458711
A24: of:=[$curvi.A26] -> 0.5250000001 | B24: 0 | C24: 2439.0243902439 | D24: of:=[.A24]*[.B24] -> 0 | E24: of:=[.A24]*[.C24] -> 1280.48780512195 | F24: of:=[.B24]*[$curvi.$I26] -> 0 | G24: of:=[.C24]*[$curvi.$I26] -> 1013.99739556053
A25: of:=[$curvi.A27] -> 0.5500000001 | B25: 0 | C25: 2439.0243902439 | D25: of:=[.A25]*[.B25] -> 0 | E25: of:=[.A25]*[.C25] -> 1341.46341487805 | F25: of:=[.B25]*[$curvi.$I27] -> 0 | G25: of:=[.C25]*[$curvi.$I27] -> 1050.14123420554
A26: of:=[$curvi.A28] -> 0.5750000001 | B26: 0 | C26: 2439.0243902439 | D26: of:=[.A26]*[.B26] -> 0 | E26: of:=[.A26]*[.C26] -> 1402.43902463415 | F26: of:=[.B26]*[$curvi.$I28] -> 0 | G26: of:=[.C26]*[$curvi.$I28] -> 1084.02696402708
A27: of:=[$curvi.A29] -> 0.6000000001 | B27: 0 | C27: 2439.0243902439 | D27: of:=[.A27]*[.B27] -> 0 | E27: of:=[.A27]*[.C27] -> 1463.41463439024 | F27: of:=[.B27]*[$curvi.$I29] -> 0 | G27: of:=[.C27]*[$curvi.$I29] -> 1115.3318969854
A28: of:=[$curvi.A30] -> 0.6250000001 | B28: 0 | C28: 2439.0243902439 | D28: of:=[.A28]*[.B28] -> 0 | E28: of:=[.A28]*[.C28] -> 1524.39024414634 | F28: of:=[.B28]*[$curvi.$I30] -> 0 | G28: of:=[.C28]*[$curvi.$I30] -> 1143.66878620222
A29: of:=[$curvi.A31] -> 0.6500000001 | B29: 0 | C29: 2439.0243902439 | D29: of:=[.A29]*[.B29] -> 0 | E29: of:=[.A29]*[.C29] -> 1585.36585390244 | F29: of:=[.B29]*[$curvi.$I31] -> 0 | G29: of:=[.C29]*[$curvi.$I31] -> 1168.56883090952
A30: of:=[$curvi.A32] -> 0.6750000001 | B30: 0 | C30: 2439.0243902439 | D30: of:=[.A30]*[.B30] -> 0 | E30: of:=[.A30]*[.C30] -> 1646.34146365854 | F30: of:=[.B30]*[$curvi.$I32] -> 0 | G30: of:=[.C30]*[$curvi.$I32] -> 1189.45901431068
A31: of:=[$curvi.A33] -> 0.7000000001 | B31: 0 | C31: 2439.0243902439 | D31: of:=[.A31]*[.B31] -> 0 | E31: of:=[.A31]*[.C31] -> 1707.31707341464 | F31: of:=[.B31]*[$curvi.$I33] -> 0 | G31: of:=[.C31]*[$curvi.$I33] -> 1205.63143994385
A32: of:=[$curvi.A34] -> 0.7250000001 | B32: 0 | C32: 2439.0243902439 | D32: of:=[.A32]*[.B32] -> 0 | E32: of:=[.A32]*[.C32] -> 1768.29268317073 | F32: of:=[.B32]*[$curvi.$I34] -> 0 | G32: of:=[.C32]*[$curvi.$I34] -> 1216.20116445284
A33: of:=[$curvi.A35] -> 0.7500000001 | B33: 0 | C33: 2439.0243902439 | D33: of:=[.A33]*[.B33] -> 0 | E33: of:=[.A33]*[.C33] -> 1829.26829292683 | F33: of:=[.B33]*[$curvi.$I35] -> 0 | G33: of:=[.C33]*[$curvi.$I35] -> 1220.04715606741 | J33: of:=100000/41 -> 2439.0243902439
A34: of:=[$curvi.A36] -> 0.7750000001 | B34: 0 | C34: 2439.0243902439 | D34: of:=[.A34]*[.B34] -> 0 | E34: of:=[.A34]*[.C34] -> 1890.24390268293 | F34: of:=[.B34]*[$curvi.$I36] -> 0 | G34: of:=[.C34]*[$curvi.$I36] -> 1215.727937682
A35: of:=[$curvi.A37] -> 0.8000000001 | B35: 0 | C35: 2439.0243902439 | D35: of:=[.A35]*[.B35] -> 0 | E35: of:=[.A35]*[.C35] -> 1951.21951243903 | F35: of:=[.B35]*[$curvi.$I37] -> 0 | G35: of:=[.C35]*[$curvi.$I37] -> 1201.35827626287
A36: of:=[$curvi.A38] -> 0.825000000100001 | B36: 0 | C36: 2439.0243902439 | D36: of:=[.A36]*[.B36] -> 0 | E36: of:=[.A36]*[.C36] -> 2012.19512219512 | F36: of:=[.B36]*[$curvi.$I38] -> 0 | G36: of:=[.C36]*[$curvi.$I38] -> 1174.4241831473
A37: of:=[$curvi.A39] -> 0.850000000100001 | B37: 0 | C37: 2439.0243902439 | D37: of:=[.A37]*[.B37] -> 0 | E37: of:=[.A37]*[.C37] -> 2073.17073195122 | F37: of:=[.B37]*[$curvi.$I39] -> 0 | G37: of:=[.C37]*[$curvi.$I39] -> 1131.49694504336
A38: of:=[$curvi.A40] -> 0.875000000100001 | B38: 0 | C38: 2439.0243902439 | D38: of:=[.A38]*[.B38] -> 0 | E38: of:=[.A38]*[.C38] -> 2134.14634170732 | F38: of:=[.B38]*[$curvi.$I40] -> 0 | G38: of:=[.C38]*[$curvi.$I40] -> 1067.77546070376
A39: of:=[$curvi.A41] -> 0.900000000100001 | B39: 0 | C39: 2439.0243902439 | D39: of:=[.A39]*[.B39] -> 0 | E39: of:=[.A39]*[.C39] -> 2195.12195146342 | F39: of:=[.B39]*[$curvi.$I41] -> 0 | G39: of:=[.C39]*[$curvi.$I41] -> 976.323245581157
A40: of:=[$curvi.A42] -> 0.925000000100001 | B40: 0 | C40: 2439.0243902439 | D40: of:=[.A40]*[.B40] -> 0 | E40: of:=[.A40]*[.C40] -> 2256.09756121951 | F40: of:=[.B40]*[$curvi.$I42] -> 0 | G40: of:=[.C40]*[$curvi.$I42] -> 846.732719119644
A41: of:=[$curvi.A43] -> 0.950000000100001 | B41: 0 | C41: 2439.0243902439 | D41: of:=[.A41]*[.B41] -> 0 | E41: of:=[.A41]*[.C41] -> 2317.07317097561 | F41: of:=[.B41]*[$curvi.$I43] -> 0 | G41: of:=[.C41]*[$curvi.$I43] -> 662.643518692533
A42: of:=[$curvi.A44] -> 0.975000000100001 | B42: 0 | C42: 2439.0243902439 | D42: of:=[.A42]*[.B42] -> 0 | E42: of:=[.A42]*[.C42] -> 2378.04878073171 | F42: of:=[.B42]*[$curvi.$I44] -> 0 | G42: of:=[.C42]*[$curvi.$I44] -> 396.776404093754
A43: of:=[$curvi.A45] -> 1.0000000001 | B43: 0 | C43: 2439.0243902439 | D43: of:=[.A43]*[.B43] -> 0 | E43: of:=[.A43]*[.C43] -> 2439.02439048781 | F43: of:=[.B43]*[$curvi.$I45] -> -0 | G43: of:=[.C43]*[$curvi.$I45] -> -0.00000195380297306778
A46: N | B46: of:=SUM([.B3:.B43]) -> 100000 | C46: of:=SUM([.C3:.C43]) -> 100000 | E46: NPE | F46: of:=SUM([.F3:.F43]) -> 40010.5261908072 | G46: of:=SUM([.G3:.G43]) -> 30797.7008976388
A47: taill cible | B47: 100000 | C47: 100000
A48: écart | B48: of:=[.B47]-[.B46] -> 0 | C48: of:=[.C47]-[.C46] -> 0
C50: total events | D50: of:=SUM([.D3:.D43]) -> 50000.00001 | E50: of:=SUM([.E3:.E43]) -> 50000.00001
C51: average Rc | D51: of:=[.D50]/[.B46] -> 0.5000000001 | E51: of:=[.E50]/[.C46] -> 0.500000000100001

Sheet: TEST 2
B1: Abs
A2: Rc | B2: po A | C2: po B | D2: # events A | E2: # events B | F2: NPEs A | G2: NPEs B
A3: of:=[$curvi.A5] -> 0.0000000001 | B3: 20 | C3: 6620 | D3: of:=[.A3]*[.B3] -> 0.000000002 | E3: of:=[.A3]*[.C3] -> 0.000000662 | F3: of:=[.B3]*[$curvi.$I5] -> 0.00000000177803765315139 | G3: of:=[.C3]*[$curvi.$I5] -> 0.00000058853046319311
A4: of:=[$curvi.A6] -> 0.0250000001 | B4: 50 | C4: 5000 | D4: of:=[.A4]*[.B4] -> 1.250000005 | E4: of:=[.A4]*[.C4] -> 125.0000005 | F4: of:=[.B4]*[$curvi.$I6] -> 1.10812019204367 | G4: of:=[.C4]*[$curvi.$I6] -> 110.812019204367 | H4: of:=[.B48] -> 0
A5: of:=[$curvi.A7] -> 0.0500000001 | B5: 100 | C5: 4000 | D5: of:=[.A5]*[.B5] -> 5.00000001 | E5: of:=[.A5]*[.C5] -> 200.0000004 | F5: of:=[.B5]*[$curvi.$I7] -> 4.41928061815049 | G5: of:=[.C5]*[$curvi.$I7] -> 176.77122472602 | H5: of:=[.D51] -> 0.3327512501
A6: of:=[$curvi.A8] -> 0.0750000001 | B6: 250 | C6: 3500 | D6: of:=[.A6]*[.B6] -> 18.750000025 | E6: of:=[.A6]*[.C6] -> 262.50000035 | F6: of:=[.B6]*[$curvi.$I8] -> 16.5204442404526 | G6: of:=[.C6]*[$curvi.$I8] -> 231.286219366337 | H6: of:=[.H5]-[.E51] -> -0.0554187500000002
A7: of:=[$curvi.A9] -> 0.1000000001 | B7: 560 | C7: 3250 | D7: of:=[.A7]*[.B7] -> 56.000000056 | E7: of:=[.A7]*[.C7] -> 325.000000325 | F7: of:=[.B7]*[$curvi.$I9] -> 49.1786208875686 | G7: of:=[.C7]*[$curvi.$I9] -> 285.411639079639
A8: of:=[$curvi.A10] -> 0.1250000001 | B8: 1500 | C8: 3100 | D8: of:=[.A8]*[.B8] -> 187.50000015 | E8: of:=[.A8]*[.C8] -> 387.50000031 | F8: of:=[.B8]*[$curvi.$I10] -> 164.08948109338 | G8: of:=[.C8]*[$curvi.$I10] -> 339.118260926318
A9: of:=[$curvi.A11] -> 0.1500000001 | B9: 2500 | C9: 2850 | D9: of:=[.A9]*[.B9] -> 375.00000025 | E9: of:=[.A9]*[.C9] -> 427.500000285 | F9: of:=[.B9]*[$curvi.$I11] -> 326.978220205747 | G9: of:=[.C9]*[$curvi.$I11] -> 372.755171034552
A10: of:=[$curvi.A12] -> 0.1750000001 | B10: 3000 | C10: 2700 | D10: of:=[.A10]*[.B10] -> 525.0000003 | E10: of:=[.A10]*[.C10] -> 472.50000027 | F10: of:=[.B10]*[$curvi.$I12] -> 455.999978494509 | G10: of:=[.C10]*[$curvi.$I12] -> 410.399980645058
A11: of:=[$curvi.A13] -> 0.2000000001 | B11: 4500 | C11: 2650 | D11: of:=[.A11]*[.B11] -> 900.00000045 | E11: of:=[.A11]*[.C11] -> 530.000000265 | F11: of:=[.B11]*[$curvi.$I13] -> 778.516768199173 | G11: of:=[.C11]*[$curvi.$I13] -> 458.45987460618
A12: of:=[$curvi.A14] -> 0.2250000001 | B12: 5500 | C12: 2600 | D12: of:=[.A12]*[.B12] -> 1237.50000055 | E12: of:=[.A12]*[.C12] -> 585.00000026 | F12: of:=[.B12]*[$curvi.$I14] -> 1065.81972377736 | G12: of:=[.C12]*[$curvi.$I14] -> 503.842051240208
A13: of:=[$curvi.A15] -> 0.2500000001 | B13: 6500 | C13: 2550 | D13: of:=[.A13]*[.B13] -> 1625.00000065 | E13: of:=[.A13]*[.C13] -> 637.500000255 | F13: of:=[.B13]*[$curvi.$I15] -> 1393.11893568903 | G13: of:=[.C13]*[$curvi.$I15] -> 546.531274770312
A14: of:=[$curvi.A16] -> 0.2750000001 | B14: 7650 | C14: 2530 | D14: of:=[.A14]*[.B14] -> 2103.750000765 | E14: of:=[.A14]*[.C14] -> 695.750000253 | F14: of:=[.B14]*[$curvi.$I16] -> 1794.72218088328 | G14: of:=[.C14]*[$curvi.$I16] -> 593.548642828064
A15: of:=[$curvi.A17] -> 0.3000000001 | B15: 9000 | C15: 2520 | D15: of:=[.A15]*[.B15] -> 2700.0000009 | E15: of:=[.A15]*[.C15] -> 756.000000252 | F15: of:=[.B15]*[$curvi.$I17] -> 2291.36577710162 | G15: of:=[.C15]*[$curvi.$I17] -> 641.582417588454
A16: of:=[$curvi.A18] -> 0.3250000001 | B16: 10500 | C16: 2520 | D16: of:=[.A16]*[.B16] -> 3412.50000105 | E16: of:=[.A16]*[.C16] -> 819.000000252 | F16: of:=[.B16]*[$curvi.$I18] -> 2879.88879506322 | G16: of:=[.C16]*[$curvi.$I18] -> 691.173310815174
A17: of:=[$curvi.A19] -> 0.3500000001 | B17: 11000 | C17: 2520 | D17: of:=[.A17]*[.B17] -> 3850.0000011 | E17: of:=[.A17]*[.C17] -> 882.000000252 | F17: of:=[.B17]*[$curvi.$I19] -> 3229.71749394546 | G17: of:=[.C17]*[$curvi.$I19] -> 739.898916794778
A18: of:=[$curvi.A20] -> 0.3750000001 | B18: 15000 | C18: 2520 | D18: of:=[.A18]*[.B18] -> 5625.0000015 | E18: of:=[.A18]*[.C18] -> 945.000000252 | F18: of:=[.B18]*[$curvi.$I20] -> 4688.52790373818 | G18: of:=[.C18]*[$curvi.$I20] -> 787.672687828014
A19: of:=[$curvi.A21] -> 0.4000000001 | B19: 7175 | C19: 2520 | D19: of:=[.A19]*[.B19] -> 2870.0000007175 | E19: of:=[.A19]*[.C19] -> 1008.000000252 | F19: of:=[.B19]*[$curvi.$I21] -> 2375.71122025347 | G19: of:=[.C19]*[$curvi.$I21] -> 834.396135893903
A20: of:=[$curvi.A22] -> 0.4250000001 | B20: 3500 | C20: 2520 | D20: of:=[.A20]*[.B20] -> 1487.50000035 | E20: of:=[.A20]*[.C20] -> 1071.000000252 | F20: of:=[.B20]*[$curvi.$I22] -> 1222.16208326175 | G20: of:=[.C20]*[$curvi.$I22] -> 879.956699948457
A21: of:=[$curvi.A23] -> 0.4500000001 | B21: 2500 | C21: 2520 | D21: of:=[.A21]*[.B21] -> 1125.00000025 | E21: of:=[.A21]*[.C21] -> 1134.000000252 | F21: of:=[.B21]*[$curvi.$I23] -> 916.890019022138 | G21: of:=[.C21]*[$curvi.$I23] -> 924.225139174315
A22: of:=[$curvi.A24] -> 0.4750000001 | B22: 2250 | C22: 2520 | D22: of:=[.A22]*[.B22] -> 1068.750000225 | E22: of:=[.A22]*[.C22] -> 1197.000000252 | F22: of:=[.B22]*[$curvi.$I24] -> 863.439575464626 | G22: of:=[.C22]*[$curvi.$I24] -> 967.052324520381
A23: of:=[$curvi.A25] -> 0.5000000001 | B23: 1700 | C23: 2520 | D23: of:=[.A23]*[.B23] -> 850.00000017 | E23: of:=[.A23]*[.C23] -> 1260.000000252 | F23: of:=[.B23]*[$curvi.$I25] -> 680.178945243722 | G23: of:=[.C23]*[$curvi.$I25] -> 1008.26526000834
A24: of:=[$curvi.A26] -> 0.5250000001 | B24: 1100 | C24: 2520 | D24: of:=[.A24]*[.B24] -> 577.50000011 | E24: of:=[.A24]*[.C24] -> 1323.000000252 | F24: of:=[.B24]*[$curvi.$I26] -> 457.3128253978 | G24: of:=[.C24]*[$curvi.$I26] -> 1047.66210909314
A25: of:=[$curvi.A27] -> 0.5500000001 | B25: 900 | C25: 2520 | D25: of:=[.A25]*[.B25] -> 495.00000009 | E25: of:=[.A25]*[.C25] -> 1386.000000252 | F25: of:=[.B25]*[$curvi.$I27] -> 387.502115421846 | G25: of:=[.C25]*[$curvi.$I27] -> 1085.00592318117
A26: of:=[$curvi.A28] -> 0.5750000001 | B26: 800 | C26: 2520 | D26: of:=[.A26]*[.B26] -> 460.00000008 | E26: of:=[.A26]*[.C26] -> 1449.000000252 | F26: of:=[.B26]*[$curvi.$I28] -> 355.560844200882 | G26: of:=[.C26]*[$curvi.$I28] -> 1120.01665923278
A27: of:=[$curvi.A29] -> 0.6000000001 | B27: 500 | C27: 2520 | D27: of:=[.A27]*[.B27] -> 300.00000005 | E27: of:=[.A27]*[.C27] -> 1512.000000252 | F27: of:=[.B27]*[$curvi.$I29] -> 228.643038882007 | G27: of:=[.C27]*[$curvi.$I29] -> 1152.36091596532
A28: of:=[$curvi.A30] -> 0.6250000001 | B28: 400 | C28: 2520 | D28: of:=[.A28]*[.B28] -> 250.00000004 | E28: of:=[.A28]*[.C28] -> 1575.000000252 | F28: of:=[.B28]*[$curvi.$I30] -> 187.561680937164 | G28: of:=[.C28]*[$curvi.$I30] -> 1181.63858990413
A29: of:=[$curvi.A31] -> 0.6500000001 | B29: 300 | C29: 2520 | D29: of:=[.A29]*[.B29] -> 195.00000003 | E29: of:=[.A29]*[.C29] -> 1638.000000252 | F29: of:=[.B29]*[$curvi.$I31] -> 143.733966201871 | G29: of:=[.C29]*[$curvi.$I31] -> 1207.36531609572
A30: of:=[$curvi.A32] -> 0.6750000001 | B30: 200 | C30: 2520 | D30: of:=[.A30]*[.B30] -> 135.00000002 | E30: of:=[.A30]*[.C30] -> 1701.000000252 | F30: of:=[.B30]*[$curvi.$I32] -> 97.5356391734759 | G30: of:=[.C30]*[$curvi.$I32] -> 1228.9490535858
A31: of:=[$curvi.A33] -> 0.7000000001 | B31: 150 | C31: 2520 | D31: of:=[.A31]*[.B31] -> 105.000000015 | E31: of:=[.A31]*[.C31] -> 1764.000000252 | F31: of:=[.B31]*[$curvi.$I33] -> 74.1463335565468 | G31: of:=[.C31]*[$curvi.$I33] -> 1245.65840374999
A32: of:=[$curvi.A34] -> 0.7250000001 | B32: 135 | C32: 2450 | D32: of:=[.A32]*[.B32] -> 97.8750000135001 | E32: of:=[.A32]*[.C32] -> 1776.250000245 | F32: of:=[.B32]*[$curvi.$I34] -> 67.3167344524647 | G32: of:=[.C32]*[$curvi.$I34] -> 1221.67406969288
A33: of:=[$curvi.A35] -> 0.7500000001 | B33: 120 | C33: 2400 | D33: of:=[.A33]*[.B33] -> 90.0000000120001 | E33: of:=[.A33]*[.C33] -> 1800.00000024 | F33: of:=[.B33]*[$curvi.$I35] -> 60.0263200785165 | G33: of:=[.C33]*[$curvi.$I35] -> 1200.52640157033
A34: of:=[$curvi.A36] -> 0.7750000001 | B34: 110 | C34: 2250 | D34: of:=[.A34]*[.B34] -> 85.2500000110001 | E34: of:=[.A34]*[.C34] -> 1743.750000225 | F34: of:=[.B34]*[$curvi.$I36] -> 54.829329989458 | G34: of:=[.C34]*[$curvi.$I36] -> 1121.50902251164
A35: of:=[$curvi.A37] -> 0.8000000001 | B35: 100 | C35: 2100 | D35: of:=[.A35]*[.B35] -> 80.0000000100001 | E35: of:=[.A35]*[.C35] -> 1680.00000021 | F35: of:=[.B35]*[$curvi.$I37] -> 49.2556893267776 | G35: of:=[.C35]*[$curvi.$I37] -> 1034.36947586233
A36: of:=[$curvi.A38] -> 0.825000000100001 | B36: 90 | C36: 1800 | D36: of:=[.A36]*[.B36] -> 74.250000009 | E36: of:=[.A36]*[.C36] -> 1485.00000018 | F36: of:=[.B36]*[$curvi.$I38] -> 43.3362523581354 | G36: of:=[.C36]*[$curvi.$I38] -> 866.725047162708
A37: of:=[$curvi.A39] -> 0.850000000100001 | B37: 80 | C37: 1550 | D37: of:=[.A37]*[.B37] -> 68.000000008 | E37: of:=[.A37]*[.C37] -> 1317.500000155 | F37: of:=[.B37]*[$curvi.$I39] -> 37.1130997974221 | G37: of:=[.C37]*[$curvi.$I39] -> 719.066308575053
A38: of:=[$curvi.A40] -> 0.875000000100001 | B38: 70 | C38: 1300 | D38: of:=[.A38]*[.B38] -> 61.250000007 | E38: of:=[.A38]*[.C38] -> 1137.50000013 | F38: of:=[.B38]*[$curvi.$I40] -> 30.6451557221979 | G38: of:=[.C38]*[$curvi.$I40] -> 569.124320555104
A39: of:=[$curvi.A41] -> 0.900000000100001 | B39: 60 | C39: 950 | D39: of:=[.A39]*[.B39] -> 54.000000006 | E39: of:=[.A39]*[.C39] -> 855.000000095001 | F39: of:=[.B39]*[$curvi.$I41] -> 24.0175518412965 | G39: of:=[.C39]*[$curvi.$I41] -> 380.277904153861
A40: of:=[$curvi.A42] -> 0.925000000100001 | B40: 50 | C40: 500 | D40: of:=[.A40]*[.B40] -> 46.250000005 | E40: of:=[.A40]*[.C40] -> 462.50000005 | F40: of:=[.B40]*[$curvi.$I42] -> 17.3580207419527 | G40: of:=[.C40]*[$curvi.$I42] -> 173.580207419527
A41: of:=[$curvi.A43] -> 0.950000000100001 | B41: 40 | C41: 300 | D41: of:=[.A41]*[.B41] -> 38.000000004 | E41: of:=[.A41]*[.C41] -> 285.00000003 | F41: of:=[.B41]*[$curvi.$I43] -> 10.8673537065575 | G41: of:=[.C41]*[$curvi.$I43] -> 81.5051527991816
A42: of:=[$curvi.A44] -> 0.975000000100001 | B42: 30 | C42: 150 | D42: of:=[.A42]*[.B42] -> 29.250000003 | E42: of:=[.A42]*[.C42] -> 146.250000015 | F42: of:=[.B42]*[$curvi.$I44] -> 4.88034977035318 | G42: of:=[.C42]*[$curvi.$I44] -> 24.4017488517659
A43: of:=[$curvi.A45] -> 1.0000000001 | B43: 10 | C43: 60 | D43: of:=[.A43]*[.B43] -> 10.000000001 | E43: of:=[.A43]*[.C43] -> 60.000000006 | F43: of:=[.B43]*[$curvi.$I45] -> -0.00000000801059218957789 | G43: of:=[.C43]*[$curvi.$I45] -> -0.0000000480635531374674
A46: N | B46: of:=SUM([.B3:.B43]) -> 100000 | C46: of:=SUM([.C3:.C43]) -> 100000 | E46: NPE | F46: of:=SUM([.F3:.F43]) -> 27529.9958689254 | G46: of:=SUM([.G3:.G43]) -> 28164.5758815017
A47: taill cible | B47: 100000 | C47: 100000
A48: écart | B48: of:=[.B47]-[.B46] -> 0 | C48: of:=[.C47]-[.C46] -> 0
C50: total events | D50: of:=SUM([.D3:.D43]) -> 33275.12501 | E50: of:=SUM([.E3:.E43]) -> 38817.00001
C51: average Rc | D51: of:=[.D50]/[.B46] -> 0.3327512501 | E51: of:=[.E50]/[.C46] -> 0.3881700001

Sheet: 'efficacy%20metrics%20drug%202%20bis.fods'#NPE vs pop 2
B1: Two populations, with different Rc distributions, different Rc, same size
B2: Rc | C2: pop C | D2: pop A | E2: # events C | F2: # events A | G2: NPEs C | H2: NPEs A | J2: Rt pop C | K2: Rt pop A | L2: ABi pop C | M2: ABi pop A | N2: ni*Rci pop C | O2: ni*Rci pop A | P2: ni*Rti pop C | Q2: ni*Rti pop A | R2: ni*Abi pop C | S2: ni*Abi pop A | T2: NNTi pop C | U2: NNTi pop A | V2: ni NNTi pop C | W2: ni NNTi pop A
A3: 1 | B3: 0.0000000001 | C3: 13950 | D3: 8290 | E3: 0.000001395 | F3: 0.000000829 | G3: 0.000000133891130155934 | H3: 0.0000000795668436553899 | J3: 0.0000000000904020695228721 | K3: 0.0000000000904020695228722 | L3: 0.00000000000959793047712786 | M3: 0.00000000000959793047712785 | N3: 0.000001395 | O3: 0.000000829 | R3: 0.000000133891130155934 | S3: 0.0000000795668436553899 | T3: 104189127268.949 | U3: 104189127268.949 | V3: 10.4189127268949 | W3: 1453438325401840
A4: 2 | B4: 0.0250000001 | C4: 9810 | D4: 6540 | E4: 245.250000981 | F4: 163.500000654 | G4: 23.0056531393788 | H4: 15.3371020929192 | I4: 0 | J4: 0.0226548774558228 | K4: 0.0226548774558228 | L4: 0.00234512264417725 | M4: 0.00234512264417725 | N4: 245.250000981 | O4: 163.500000654 | R4: 23.0056531393788 | S4: 15.3371020929192 | T4: 426.416930680756 | U4: 426.416930680756 | V4: 10.6604233096606 | W4: 4183150.08997821
A5: 3 | B5: 0.0500000001 | C5: 7000 | D5: 5080 | E5: 350.0000007 | F5: 254.000000508 | G5: 32.067007353719 | H5: 23.2714853366989 | I5: 0.2163737501 | J5: 0.0454189990494687 | K5: 0.0454189990494687 | L5: 0.00458100105053129 | M5: 0.00458100105053129 | N5: 350.0000007 | O5: 254.000000508 | R5: 32.067007353719 | S5: 23.2714853366989 | T5: 218.292899078035 | U5: 218.292899078035 | V5: 10.9146449757311 | W5: 1528050.29354625
A6: 4 | B6: 0.0750000001 | C6: 6250 | D6: 3700 | E6: 468.750000625 | F6: 277.50000037 | G6: 41.9177696122231 | H6: 24.8153196104361 | I6: -0.13464725 | J6: 0.0682931569620443 | K6: 0.0682931569620443 | L6: 0.00670684313795569 | M6: 0.00670684313795569 | N6: 468.750000625 | O6: 277.50000037 | R6: 41.9177696122231 | S6: 24.8153196104361 | T6: 149.101444514298 | U6: 149.101444514298 | V6: 11.1826083534825 | W6: 931884.028214362
A7: 5 | B7: 0.1000000001 | C7: 5300 | D7: 3250 | E7: 530.00000053 | F7: 325.000000325 | G7: 46.2258004400913 | H7: 28.3460097038295 | J7: 0.0912781509603602 | K7: 0.0912781509603602 | L7: 0.00872184913963986 | M7: 0.00872184913963987 | N7: 530.00000053 | O7: 325.000000325 | R7: 46.2258004400913 | S7: 28.3460097038296 | T7: 114.654585740896 | U7: 114.654585740896 | V7: 11.4654585855551 | W7: 607669.304426749
A8: 6 | B8: 0.1250000001 | C8: 4500 | D8: 3100 | E8: 562.50000045 | F8: 387.50000031 | G8: 47.8134518375483 | H8: 32.9381557103111 | J8: 0.114374788580545 | K8: 0.114374788580545 | L8: 0.0106252115194552 | M8: 0.0106252115194552 | N8: 562.50000045 | O8: 387.50000031 | R8: 47.8134518375483 | S8: 32.9381557103111 | T8: 94.115773428977 | U8: 94.1157734289768 | V8: 11.7644716880337 | W8: 423520.980430396
A9: 7 | B9: 0.1500000001 | C9: 3850 | D9: 2850 | E9: 577.500000385 | F9: 427.500000285 | G9: 47.8020422779202 | H9: 35.3859274005383 | J9: 0.137583885222618 | K9: 0.137583885222618 | L9: 0.0124161148773819 | M9: 0.0124161148773819 | N9: 577.500000385 | O9: 427.500000285 | R9: 47.8020422779202 | S9: 35.3859274005383 | T9: 80.5404919232566 | U9: 80.5404919232566 | V9: 12.0810737965425 | W9: 310080.893904538
A10: 8 | B10: 0.1750000001 | C10: 3700 | D10: 2700 | E10: 647.50000037 | F10: 472.50000027 | G10: 52.1468226581379 | H10: 38.0530868045871 | J10: 0.160906264246449 | K10: 0.160906264246449 | L10: 0.0140937358535508 | M10: 0.0140937358535508 | N10: 647.50000037 | O10: 472.50000027 | R10: 52.146822658138 | S10: 38.0530868045871 | T10: 70.9535080259119 | U10: 70.9535080259121 | V10: 12.4168639116299 | W10: 262527.979695875
A11: 9 | B11: 0.2000000001 | C11: 3500 | D11: 2650 | E11: 700.00000035 | F11: 530.000000265 | G11: 54.8003506080687 | H11: 41.4916940318234 | J11: 0.184342757069123 | K11: 0.184342757069123 | L11: 0.0156572430308768 | M11: 0.0156572430308768 | N11: 700.00000035 | O11: 530.000000265 | R11: 54.8003506080688 | S11: 41.4916940318234 | T11: 63.8682045126307 | U11: 63.8682045126308 | V11: 12.773640908913 | W11: 223538.715794208
A12: 10 | B12: 0.2250000001 | C12: 3350 | D12: 2600 | E12: 753.750000335 | F12: 585.00000026 | G12: 57.3044194014686 | H12: 44.4750717742742 | J12: 0.207894203263741 | K12: 0.207894203263741 | L12: 0.0171057968362593 | M12: 0.0171057968362593 | N12: 753.750000335 | O12: 585.00000026 | R12: 57.3044194014686 | S12: 44.4750717742742 | T12: 58.4597145384243 | U12: 58.4597145384243 | V12: 13.1534357769914 | W12: 195840.043703721
A13: 11 | B13: 0.2500000001 | C13: 3250 | D13: 2583 | E13: 812.500000325 | F13: 645.7500002583 | G13: 59.9252856810591 | H13: 47.6267732043618 | J13: 0.231561450659674 | K13: 0.231561450659674 | L13: 0.0184385494403259 | M13: 0.0184385494403259 | N13: 812.500000325 | O13: 645.7500002583 | R13: 59.9252856810591 | S13: 47.6267732043617 | T13: 54.234201190087 | U13: 54.2342011900871 | V13: 13.5585503029452 | W13: 176261.153867783
A14: 12 | B14: 0.2750000001 | C14: 3150 | D14: 2578 | E14: 866.250000315 | F14: 708.9500002578 | G14: 61.9121306654317 | H14: 50.6696739223756 | J14: 0.255345355444307 | K14: 0.255345355444307 | L14: 0.0196546446556926 | M14: 0.0196546446556926 | N14: 866.250000315 | O14: 708.9500002578 | R14: 61.9121306654317 | S14: 50.6696739223756 | T14: 50.8785591150521 | U14: 50.8785591150521 | V14: 13.9916037617272 | W14: 160267.461212414
A15: 13 | B15: 0.3000000001 | C15: 3050 | D15: 2574 | E15: 915.000000305 | F15: 772.2000002574 | G15: 63.2973143928371 | H15: 53.4187827039878 | J15: 0.279246782266283 | K15: 0.279246782266283 | L15: 0.0207532178337171 | M15: 0.0207532178337171 | N15: 915.000000305 | O15: 772.2000002574 | R15: 63.2973143928371 | S15: 53.4187827039878 | T15: 48.1852986853601 | U15: 48.1852986853601 | V15: 14.4555896104266 | W15: 146965.160990348
A16: 14 | B16: 0.3250000001 | C16: 2950 | D16: 2570 | E16: 958.750000295 | F16: 835.250000257 | G16: 64.1135174911629 | H16: 55.8548271024707 | J16: 0.303266604340284 | K16: 0.303266604340284 | L16: 0.0217333957597162 | M16: 0.0217333957597162 | N16: 958.750000295 | O16: 835.250000257 | R16: 64.1135174911629 | S16: 55.8548271024707 | T16: 46.0121377743253 | U16: 46.0121377743253 | V16: 14.9539447812569 | W16: 135735.80643426
A17: 15 | B17: 0.3500000001 | C17: 2850 | D17: 2560 | E17: 997.500000285 | F17: 896.000000256 | G17: 64.3937451578787 | H17: 57.8413991593577 | J17: 0.327405703553376 | K17: 0.327405703553376 | L17: 0.0225942965466241 | M17: 0.0225942965466241 | N17: 997.500000285 | O17: 896.000000256 | R17: 64.3937451578787 | S17: 57.8413991593577 | T17: 44.2589570308802 | U17: 44.2589570308802 | V17: 15.490634965234 | W17: 126138.027538009
A18: 16 | B18: 0.3750000001 | C18: 2750 | D18: 2555 | E18: 1031.250000275 | F18: 958.1250002555 | G18: 64.1713311994166 | H18: 59.6210004416398 | J18: 0.351664970572939 | K18: 0.351664970572939 | L18: 0.0233350295270606 | M18: 0.0233350295270606 | N18: 1031.250000275 | O18: 958.1250002555 | R18: 64.1713311994167 | S18: 59.6210004416399 | T18: 42.8540276257351 | U18: 42.8540276257351 | V18: 16.0702603639361 | W18: 117848.575970772
A19: 17 | B19: 0.4000000001 | C19: 2600 | D19: 2548 | E19: 1040.00000026 | F19: 1019.2000002548 | G19: 62.2822073738418 | H19: 61.0365632263649 | J19: 0.376045304956215 | K19: 0.376045304956215 | L19: 0.0239546951437853 | M19: 0.0239546951437853 | N19: 1040.00000026 | O19: 1019.2000002548 | R19: 62.2822073738418 | S19: 61.0365632263649 | T19: 41.7454696875755 | U19: 41.7454696875755 | V19: 16.6981878792047 | W19: 108538.221187696
A20: 18 | B20: 0.4250000001 | C20: 2500 | D20: 2545 | E20: 1062.50000025 | F20: 1081.6250002545 | G20: 61.1309620962648 | H20: 62.2313194139976 | J20: 0.400547615261494 | K20: 0.400547615261494 | L20: 0.024452384838506 | M20: 0.0244523848385059 | N20: 1062.50000025 | O20: 1081.6250002545 | R20: 61.130962096265 | S20: 62.2313194139974 | T20: 40.8958065482949 | U20: 40.8958065482951 | V20: 17.3807177871149 | W20: 102239.516370738
A21: 19 | B21: 0.4500000001 | C21: 2350 | D21: 2538 | E21: 1057.500000235 | F21: 1142.1000002538 | G21: 58.3438752066846 | H21: 63.0113852232193 | J21: 0.425172819160986 | K21: 0.425172819160985 | L21: 0.0248271809390146 | M21: 0.0248271809390147 | N21: 1057.500000235 | O21: 1142.1000002538 | R21: 58.3438752066844 | S21: 63.0113852232193 | T21: 40.2784352543446 | U21: 40.2784352543445 | V21: 18.1252958684829 | W21: 94654.3228477096
A22: 20 | B22: 0.4750000001 | C22: 2100 | D22: 2535 | E22: 997.50000021 | F22: 1204.1250002535 | G22: 52.6641287437059 | H22: 63.5731268406164 | J22: 0.449921843555378 | K22: 0.449921843555378 | L22: 0.0250781565446219 | M22: 0.0250781565446219 | N22: 997.50000021 | O22: 1204.1250002535 | R22: 52.6641287437059 | S22: 63.5731268406164 | T22: 39.8753392507415 | U22: 39.8753392507415 | V22: 18.9407861480898 | W22: 83738.2124265572
A23: 21 | B23: 0.5000000001 | C23: 1850 | D23: 2535 | E23: 925.000000185 | F23: 1267.5000002535 | G23: 46.628094508234 | H23: 63.8930916639855 | J23: 0.474795624690144 | K23: 0.474795624690144 | L23: 0.0252043754098562 | M23: 0.0252043754098562 | N23: 925.000000185 | O23: 1267.5000002535 | R23: 46.628094508234 | S23: 63.8930916639855 | T23: 39.6756509034121 | U23: 39.6756509034121 | V23: 19.8378254556736 | W23: 73399.9541713125
A24: 22 | B24: 0.5250000001 | C24: 1550 | D24: 2530 | E24: 813.750000155 | F24: 1328.250000253 | G24: 39.0675823309251 | H24: 63.7683763208003 | J24: 0.499795108273597 | K24: 0.499795108273597 | L24: 0.0252048918264033 | M24: 0.0252048918264033 | N24: 813.750000155 | O24: 1328.250000253 | R24: 39.0675823309251 | S24: 63.7683763208003 | T24: 39.6748379992035 | U24: 39.6748379992035 | V24: 20.8292899535494 | W24: 61495.9988987655
A25: 23 | B25: 0.5500000001 | C25: 1250 | D25: 2520 | E25: 687.500000125 | F25: 1386.000000252 | G25: 31.3484381290603 | H25: 63.1984512681856 | J25: 0.524921249596752 | K25: 0.524921249596752 | L25: 0.0250787505032483 | M25: 0.0250787505032483 | N25: 687.500000125 | O25: 1386.000000252 | R25: 31.3484381290603 | S25: 63.1984512681856 | T25: 39.8743948535425 | U25: 39.8743948535425 | V25: 21.9309171734359 | W25: 49842.9935669282
A26: 24 | B26: 0.5750000001 | C26: 1100 | D26: 2515 | E26: 632.50000011 | F26: 1446.1250002515 | G26: 27.3074850894928 | H26: 62.4348409091585 | J26: 0.550175013655007 | K26: 0.550175013655007 | L26: 0.0248249864449934 | M26: 0.0248249864449934 | N26: 632.50000011 | O26: 1446.1250002515 | R26: 27.3074850894928 | S26: 62.4348409091585 | T26: 40.2819958115899 | U26: 40.2819958115899 | V26: 23.1621475956924 | W26: 44310.1953927488
A27: 25 | B27: 0.6000000001 | C27: 800 | D27: 2510 | E27: 480.00000008 | F27: 1506.000000251 | G27: 19.5540998626525 | H27: 61.3509883190722 | J27: 0.575557375271685 | K27: 0.575557375271685 | L27: 0.0244426248283156 | M27: 0.0244426248283156 | N27: 480.00000008 | O27: 1506.000000251 | R27: 19.5540998626525 | S27: 61.3509883190722 | T27: 40.9121363611304 | U27: 40.9121363611304 | V27: 24.5472818207695 | W27: 32729.7090889043
A28: 26 | B28: 0.6250000001 | C28: 600 | D28: 2500 | E28: 375.00000006 | F28: 1562.50000025 | G28: 14.3584085259196 | H28: 59.8267021913315 | J28: 0.601069319223468 | K28: 0.601069319223468 | L28: 0.0239306808765326 | M28: 0.0239306808765327 | N28: 375.00000006 | O28: 1562.50000025 | R28: 14.3584085259196 | S28: 59.8267021913318 | T28: 41.7873609680968 | U28: 41.7873609680966 | V28: 26.1171006092393 | W28: 25072.416580858
A29: 27 | B29: 0.6500000001 | C29: 500 | D29: 2450 | E29: 325.00000005 | F29: 1592.500000245 | G29: 11.6440798661211 | H29: 57.0559913439936 | J29: 0.626711840367758 | K29: 0.626711840367758 | L29: 0.0232881597322424 | M29: 0.0232881597322423 | N29: 325.00000005 | O29: 1592.500000245 | R29: 11.6440798661212 | S29: 57.0559913439936 | T29: 42.9402757236976 | U29: 42.9402757236978 | V29: 27.9111792246975 | W29: 21470.1378618489
A30: 28 | B30: 0.6750000001 | C30: 450 | D30: 2400 | E30: 303.750000045 | F30: 1620.00000024 | G30: 10.1313253476013 | H30: 54.0337351872071 | J30: 0.652485943771997 | K30: 0.652485943771997 | L30: 0.022514056328003 | M30: 0.022514056328003 | N30: 303.750000045 | O30: 1620.00000024 | R30: 10.1313253476013 | S30: 54.0337351872071 | T30: 44.4166961933111 | U30: 44.4166961933111 | V30: 29.9812699349267 | W30: 19987.51328699
A31: 29 | B31: 0.7000000001 | C31: 450 | D31: 2300 | E31: 315.000000045 | F31: 1610.00000023 | G31: 9.7233098647571 | H31: 49.6969170865363 | J31: 0.678392644844985 | K31: 0.678392644844985 | L31: 0.0216073552550157 | M31: 0.0216073552550158 | N31: 315.000000045 | O31: 1610.00000023 | R31: 9.72330986475705 | S31: 49.6969170865363 | T31: 46.2805367985919 | U31: 46.2805367985916 | V31: 32.3963757636424 | W31: 20826.2415593662
A32: 30 | B32: 0.7250000001 | C32: 400 | D32: 2150 | E32: 290.00000004 | F32: 1558.750000215 | G32: 8.2268122519106 | H32: 44.2191158540195 | J32: 0.704432969470224 | K32: 0.704432969470224 | L32: 0.0205670306297765 | M32: 0.0205670306297765 | N32: 290.00000004 | O32: 1558.750000215 | R32: 8.2268122519106 | S32: 44.2191158540195 | T32: 48.6215058459738 | U32: 48.6215058459738 | V32: 35.2505917431932 | W32: 19448.6023383895
A33: 31 | B33: 0.7500000001 | C33: 360 | D33: 1850 | E33: 270.000000036 | F33: 1387.500000185 | G33: 6.98113654511706 | H33: 35.8752850235182 | J33: 0.730607954141342 | K33: 0.730607954141342 | L33: 0.0193920459586584 | M33: 0.0193920459586585 | N33: 270.000000036 | O33: 1387.500000185 | R33: 6.98113654511702 | S33: 35.8752850235182 | T33: 51.5675345516344 | U33: 51.5675345516341 | V33: 38.6756509188826 | W33: 18564.3124385883
A34: 32 | B34: 0.7750000001 | C34: 350 | D34: 1670 | E34: 271.250000035 | F34: 1294.250000167 | G34: 6.32847390013596 | H34: 30.1958611806487 | J34: 0.756918646099612 | K34: 0.756918646099612 | L34: 0.0180813540003886 | M34: 0.0180813540003885 | N34: 271.250000035 | O34: 1294.250000167 | R34: 6.328473900136 | S34: 30.1958611806487 | T34: 55.3055927105077 | U34: 55.3055927105081 | V34: 42.8618343561741 | W34: 19356.9574486778
A35: 33 | B35: 0.8000000001 | C35: 300 | D35: 1505 | E35: 240.00000003 | F35: 1204.0000001505 | G35: 4.99016898791368 | H35: 25.0340144227003 | J35: 0.783366103473622 | K35: 0.783366103473622 | L35: 0.0166338966263789 | M35: 0.0166338966263789 | N35: 240.00000003 | O35: 1204.0000001505 | R35: 4.99016898791368 | S35: 25.0340144227003 | T35: 60.1182045591257 | U35: 60.1182045591257 | V35: 48.0945636533124 | W35: 18035.4613677377
A36: 34 | B36: 0.825000000100001 | C36: 260 | D36: 1350 | E36: 214.500000026 | F36: 1113.750000135 | G36: 3.91263721650774 | H36: 20.3156163164825 | J36: 0.809951395421125 | K36: 0.809951395421125 | L36: 0.0150486046788759 | M36: 0.0150486046788759 | N36: 214.500000026 | O36: 1113.750000135 | R36: 3.91263721650774 | S36: 20.3156163164825 | T36: 66.4513435856099 | U36: 66.4513435856099 | V36: 54.8223584647733 | W36: 17277.3493322586
A37: 35 | B37: 0.850000000100001 | C37: 245 | D37: 980 | E37: 208.2500000245 | F37: 833.000000098001 | G37: 3.26447746758661 | H37: 13.0579098703464 | J37: 0.836675602273116 | K37: 0.836675602273116 | L37: 0.0133243978268841 | M37: 0.0133243978268841 | N37: 208.2500000245 | O37: 833.000000098001 | R37: 3.26447746758661 | S37: 13.0579098703464 | T37: 75.0502959302476 | U37: 75.0502959302476 | V37: 63.7927515482155 | W37: 18387.3225029107
A38: 36 | B38: 0.875000000100001 | C38: 200 | D38: 755 | E38: 175.00000002 | F38: 660.6250000755 | G38: 2.2920368839652 | H38: 8.65243923696862 | J38: 0.863539815680174 | K38: 0.863539815680175 | L38: 0.0114601844198261 | M38: 0.0114601844198259 | N38: 175.00000002 | O38: 660.6250000755 | R38: 2.29203688396522 | S38: 8.65243923696854 | T38: 87.2586306962043 | U38: 87.258630696206 | V38: 76.3513018679047 | W38: 17451.7261392412
A39: 37 | B39: 0.900000000100001 | C39: 190 | D39: 575 | E39: 171.000000019 | F39: 517.5000000575 | G39: 1.79642365439038 | H39: 5.43654526986562 | J39: 0.890545138761104 | K39: 0.890545138761104 | L39: 0.00945486133889661 | M39: 0.00945486133889684 | N39: 171.000000019 | O39: 517.5000000575 | R39: 1.79642365439036 | S39: 5.43654526986568 | T39: 105.765697047938 | U39: 105.765697047935 | V39: 95.1891273537208 | W39: 20095.4824391077
A40: 38 | B40: 0.925000000100001 | C40: 150 | D40: 276 | E40: 138.750000015 | F40: 255.3000000276 | G40: 1.0960970769104 | H40: 2.01681862151513 | J40: 0.917692686253931 | K40: 0.917692686253931 | L40: 0.0073073138460692 | M40: 0.00730731384606942 | N40: 138.750000015 | O40: 255.3000000276 | R40: 1.09609707691038 | S40: 2.01681862151516 | T40: 136.849192612403 | U40: 136.849192612398 | V40: 126.585503180157 | W40: 20527.3788918598
A41: 39 | B41: 0.950000000100001 | C41: 110 | D41: 158 | E41: 104.500000011 | F41: 150.1000000158 | G41: 0.551805697377913 | H41: 0.792593638051911 | J41: 0.944983584669292 | K41: 0.944983584669292 | L41: 0.0050164154307083 | M41: 0.00501641543070819 | N41: 104.500000011 | O41: 150.1000000158 | R41: 0.551805697377913 | S41: 0.792593638051894 | T41: 199.3455314483 | U41: 199.345531448305 | V41: 189.37825489582 | W41: 21928.0084593135
A42: 40 | B42: 0.975000000100001 | C42: 95 | D42: 95 | E42: 92.6250000095001 | F42: 92.6250000095001 | G42: 0.245197627105956 | H42: 0.245197627105956 | J42: 0.972418972446254 | K42: 0.972418972446254 | L42: 0.0025810276537469 | M42: 0.0025810276537469 | N42: 92.6250000095001 | O42: 92.6250000095001 | R42: 0.245197627105956 | S42: 0.245197627105956 | T42: 387.442574878378 | U42: 387.442574878378 | V42: 377.756510545163 | W42: 36807.0446134459
A43: 41 | B43: 1.0000000001 | C43: 30 | D43: 30 | E43: 30.000000003 | F43: 30.000000003 | G43: -0.000000000318511883534711 | H43: -0.000000000318511883534711 | J43: 1.00000000011062 | K43: 1.00000000011062 | L43: -0.0000000000106170627844904 | M43: -0.0000000000106170627844904 | N43: 30.000000003 | O43: 30.000000003 | R43: -0.000000000318511883534711 | S43: -0.000000000318511883534711 | T43: -94188008519.7218 | U43: -94188008519.7218 | V43: -94188008529.1406 | W43: -2825640255591.65
I44: averagess | J44: 0.00000672037482932693 | K44: 0.00000672037482932694 | L44: 0.00000672037482932693 | M44: 0.00000672037482932693 | N44: 0.2163737501 | O44: 0.3510210001 | R44: 1264.7659063041 | S44: 1580.09919513455 | T44: 10001122124.4691 | U44: 10001122124.4692 | V44: -94188006877.1717 | W44: 1.45061269564191E+015
J46: NPE computated with current metrics | M46: deviation from the true NPE | P46: diagrams
C47: pop C | D47: pop A | G47: pop C | H47: pop A | K47: pop C | L47: pop A | M47: pop C | N47: pop A | Q47: pop C | R47: pop A
B48: N | C48: 100000 | D48: 100000 | F48: NPE | G48: 1264.7659063041 | H48: 1580.09919513455 | J48: OR | K48: 20049.0196814283 | L48: 32725.2246309229 | M48: 15.8519608897552 | N48: 20.7108672238367 | P48: OR | Q48: 15.8519608897552 | R48: 20.7108672238367
B49: taill cible | C49: 100000 | D49: 100000 | F49: average AB | G49: 0.012647659063041 | H49: 0.0158009919513455 | J49: RR | K49: 20372.6091036959 | L49: 33522.0008148655 | M49: 16.1078101505984 | N49: 21.2151242897196 | P49: RR | Q49: 16.1078101505984 | R49: 21.2151242897196
B50: écart | C50: 0 | D50: 0 | J50: average AB | K50: 1264.7659063041 | L50: 1580.09919513455 | M50: 1 | N50: 1 | P50: average AB | Q50: 1 | R50: 1
E51: pop C | F51: pop A
D52: total events | E52: 21637.37501 | F52: 35102.10001
D53: average Rc | E53: 0.2163737501 | F53: 0.3510210001
D54: average Rt | E54: 0.203726091036959 | F54: 0.335220008148655
J55: pop NPE computated with current metrics and trial 1 summary data | M55: deviation from the true NPE
K56: pop C | L56: pop A | M56: pop C | N56: pop A | Q56: pop C | R56: pop A
J57: OR | K57: 20172.2391943515 | L57: 32725.2246309229 | M57: 15.9493856482097 | N57: 20.7108672238367 | P57: OR | Q57: 15.9493856482097 | R57: 20.7108672238367
J58: RR | K58: 20663.3820344121 | L58: 33522.0008148655 | M58: 16.33771271934 | N58: 21.2151242897196 | P58: RR | Q58: 16.33771271934 | R58: 21.2151242897196
J59: average AB | K59: 1580.09919513455 | L59: 1580.09919513455 | M59: 1.24932146514917 | N59: 0.999999999999998 | P59: average AB | Q59: 1.24932146514917 | R59: 0.999999999999998
D62: trial 1 Rc | E62: 0.3510210001 | J62: pop NPE computated with current metrics and trial 2 summary data | M62: deviation from the true NPE
D63: trial 1 Rt | E63: 0.335220008148655 | K63: pop C | L63: pop A | M63: pop C | N63: pop A | Q63: pop C | R63: pop A
J64: OR | K64: 19765.1997999861 | L64: 32064.888637189 | M64: 15.6275558199889 | N64: 20.2929592875709 | P64: OR | Q64: 15.6275558199889 | R64: 20.2929592875709
J65: RR | K65: 20104.6735013305 | L65: 32615.6134737205 | M65: 15.8959641472946 | N65: 20.6414974288644 | P65: RR | Q65: 15.8959641472946 | R65: 20.6414974288644
D66: trial 2 Rc | E66: 0.195149387639399 | J66: average AB | K66: 1382.35696664963 | L66: 1382.35696664963 | M66: 1.09297456530051 | N66: 0.874854547680417 | P66: average AB | Q66: 1.09297456530051 | R66: 0.874854547680417
D67: trial 2 Rt | E67: 0.181325817972903
C68: trial 2 summary data
C69: N | D69: 52983 | J69: comparing the five NNTs (trial 2) | M69: % of the ref NNT
C70: NPE | D70: 732.414191639973 | K70: pop C | L70: pop A | M70: pop C | N70: pop A
C71: trial 2 AB | D71: 0.0138235696664963 | I71: 1 | J71: NNT ave | K71: 79.0660149056519 | L71: 63.2871659626944 | M71: 1 | N71: 1
C72: total events | D72: 10339.6000052983 | I72: 2 | J72: NNT ave sec | K72: 1.48801223949015 | L72: 1.48801223949015 | M72: 0.0188198714867035 | N72: 0.0235120694196875
C73: trial 2 Rc | D73: 0.195149387639399 | I73: 3 | J73: NNT transp trial 2 | K73: 4.62163270515872 | L73: 2.8488324052268 | M73: 0.0584528347694472 | N73: 0.0450143779057209
C74: trial 2 Rt | D74: 0.181325817972903 | I74: 4 | J74: NNT ref | K74: 79.0660149056519 | L74: 63.2871659626943 | M74: 1 | N74: 1
I75: 5 | J75: NNT 5 | K75: -1.06170629696419E-016 | L75: 6.89363882588583E-021 | M75: -1.34280992690869E-018 | N75: 1.08926331603305E-022
J78: comparing NNT pop with NNT trials | M78: % of the ref NNT
K79: pop C | L79: pop A | M79: pop C | N79: pop A
I80: 1 | J80: NNT trial 1 | K80: 63.2871659626944 | L80: 63.2871659626944 | M80: 0.800434498162249 | N80: 1
I81: 2 | J81: NNT trial 2 | K81: 72.3402148739964 | L81: 72.3402148739964 | M81: 0.914934374273432 | N81: 1.14304715298262
I82: 3 | J82: NNT transp trial 1 | K82: 102.670144966534 | L82: 63.2871659626944 | M82: 1.29853698948972 | N82: 1
I83: 3 | J83: NNT transp trial 2 | K83: 65.2442758321587 | L83: 40.2173904989765 | M83: 0.825187356540146 | N83: 0.635474663578447
I84: 4 | J84: NNT ref | K84: 79.0660149056519 | L84: 63.2871659626943 | M84: 1 | N84: 1
K88: NPE
K89: pop C trial 1 | L89: pop C trial 2 | M89: pop A trial 1 | N89: pop A trial 2
J90: average AB | K90: 1.24932146514917 | L90: 1.09297456530051 | M90: 0.999999999999998 | N90: 0.874854547680417

Sheet: 'efficacy%20metrics%20drug%202%20bis.fods'#NPE vs pop 1
B1: Two populations with different Rc distributions, same size (100,000), same average Rc (0,35102)
B2: Rc | C2: pop B | D2: pop A | E2: # events B | F2: # events A | G2: NPEs B | H2: NPEs A | J2: Rt pop B | K2: Rt pop A | L2: ABi pop B | M2: ABi pop A | N2: ni*Rci pop B | O2: ni*Rci pop A | P2: ni*Rti pop B | Q2: ni*Rti pop A | R2: ni*Abi pop B | S2: ni*Abi pop A | T2: NNTi pop B | U2: NNTi pop A | V2: ni NNTi pop B | W2: ni NNTi pop A
A3: 1 | B3: 0.0000000001 | C3: 10 | D3: 8290 | E3: 0.000000001 | F3: 0.000000829 | G3: 0.0000000000959793047712785 | H3: 0.0000000795668436553899 | J3: 0.0000000000904020695228722 | K3: 0.0000000000904020695228722 | L3: 0.00000000000959793047712785 | M3: 0.00000000000959793047712785 | N3: 0.000000001 | O3: 0.000000829 | R3: 0.0000000000959793047712785 | S3: 0.0000000795668436553899 | T3: 104189127268.949 | U3: 104189127268.949 | V3: 10.4189127268949 | W3: 1041891272689.49
A4: 2 | B4: 0.0250000001 | C4: 20 | D4: 6540 | E4: 0.500000002 | F4: 163.500000654 | G4: 0.046902452883545 | H4: 15.3371020929192 | I4: 0 | J4: 0.0226548774558228 | K4: 0.0226548774558228 | L4: 0.00234512264417725 | M4: 0.00234512264417725 | N4: 0.500000002 | O4: 163.500000654 | R4: 0.046902452883545 | S4: 15.3371020929192 | T4: 426.416930680755 | U4: 426.416930680755 | V4: 10.6604233096606 | W4: 8528.33861361511
A5: 3 | B5: 0.0500000001 | C5: 50 | D5: 5080 | E5: 2.500000005 | F5: 254.000000508 | G5: 0.229050052526564 | H5: 23.2714853366989 | I5: 0.3510212501 | J5: 0.0454189990494687 | K5: 0.0454189990494687 | L5: 0.00458100105053128 | M5: 0.00458100105053129 | N5: 2.500000005 | O5: 254.000000508 | R5: 0.229050052526564 | S5: 23.2714853366989 | T5: 218.292899078036 | U5: 218.292899078035 | V5: 10.9146449757311 | W5: 10914.6449539018
A6: 4 | B6: 0.0750000001 | C6: 100 | D6: 3700 | E6: 7.50000001 | F6: 277.50000037 | G6: 0.670684313795569 | H6: 24.8153196104361 | I6: 0.000000249999999868411 | J6: 0.0682931569620443 | K6: 0.0682931569620443 | L6: 0.00670684313795569 | M6: 0.00670684313795569 | N6: 7.50000001 | O6: 277.50000037 | R6: 0.670684313795569 | S6: 24.8153196104361 | T6: 149.101444514298 | U6: 149.101444514298 | V6: 11.1826083534825 | W6: 14910.1444514298
A7: 5 | B7: 0.1000000001 | C7: 200 | D7: 3250 | E7: 20.00000002 | F7: 325.000000325 | G7: 1.74436982792797 | H7: 28.3460097038295 | J7: 0.0912781509603602 | K7: 0.0912781509603602 | L7: 0.00872184913963987 | M7: 0.00872184913963987 | N7: 20.00000002 | O7: 325.000000325 | R7: 1.74436982792797 | S7: 28.3460097038296 | T7: 114.654585740896 | U7: 114.654585740896 | V7: 11.4654585855551 | W7: 22930.9171481792
A8: 6 | B8: 0.1250000001 | C8: 400 | D8: 3100 | E8: 50.00000004 | F8: 387.50000031 | G8: 4.25008460778207 | H8: 32.9381557103111 | J8: 0.114374788580545 | K8: 0.114374788580545 | L8: 0.0106252115194552 | M8: 0.0106252115194552 | N8: 50.00000004 | O8: 387.50000031 | R8: 4.25008460778207 | S8: 32.9381557103111 | T8: 94.1157734289768 | U8: 94.1157734289768 | V8: 11.7644716880337 | W8: 37646.3093715907
A9: 7 | B9: 0.1500000001 | C9: 800 | D9: 2850 | E9: 120.00000008 | F9: 427.500000285 | G9: 9.93289190190549 | H9: 35.3859274005383 | J9: 0.137583885222618 | K9: 0.137583885222618 | L9: 0.0124161148773819 | M9: 0.0124161148773819 | N9: 120.00000008 | O9: 427.500000285 | R9: 9.93289190190549 | S9: 35.3859274005383 | T9: 80.5404919232564 | U9: 80.5404919232564 | V9: 12.0810737965425 | W9: 64432.3935386053
A10: 8 | B10: 0.1750000001 | C10: 1600 | D10: 2700 | E10: 280.00000016 | F10: 472.50000027 | G10: 22.5499773656812 | H10: 38.0530868045871 | J10: 0.160906264246449 | K10: 0.160906264246449 | L10: 0.0140937358535508 | M10: 0.0140937358535508 | N10: 280.00000016 | O10: 472.50000027 | R10: 22.5499773656812 | S10: 38.0530868045871 | T10: 70.953508025912 | U10: 70.953508025912 | V10: 12.41686391163 | W10: 113525.612841459
A11: 9 | B11: 0.2000000001 | C11: 3000 | D11: 2650 | E11: 600.0000003 | F11: 530.000000265 | G11: 46.9717290926303 | H11: 41.4916940318234 | J11: 0.184342757069123 | K11: 0.184342757069123 | L11: 0.0156572430308768 | M11: 0.0156572430308768 | N11: 600.0000003 | O11: 530.000000265 | R11: 46.9717290926303 | S11: 41.4916940318234 | T11: 63.8682045126306 | U11: 63.8682045126306 | V11: 12.773640908913 | W11: 191604.613537892
A12: 10 | B12: 0.2250000001 | C12: 4500 | D12: 2600 | E12: 1012.50000045 | F12: 585.00000026 | G12: 76.9760857631668 | H12: 44.4750717742742 | J12: 0.207894203263741 | K12: 0.207894203263741 | L12: 0.0171057968362593 | M12: 0.0171057968362593 | N12: 1012.50000045 | O12: 585.00000026 | R12: 76.9760857631668 | S12: 44.4750717742742 | T12: 58.4597145384243 | U12: 58.4597145384243 | V12: 13.1534357769914 | W12: 263068.715422909
A13: 11 | B13: 0.2500000001 | C13: 6000 | D13: 2583 | E13: 1500.0000006 | F13: 645.7500002583 | G13: 110.631296641955 | H13: 47.6267732043618 | J13: 0.231561450659674 | K13: 0.231561450659674 | L13: 0.0184385494403259 | M13: 0.0184385494403259 | N13: 1500.0000006 | O13: 645.7500002583 | R13: 110.631296641955 | S13: 47.6267732043617 | T13: 54.2342011900869 | U13: 54.2342011900869 | V13: 13.5585503029452 | W13: 325405.207140522
A14: 12 | B14: 0.2750000001 | C14: 7350 | D14: 2578 | E14: 2021.250000735 | F14: 708.9500002578 | G14: 144.461638219341 | H14: 50.6696739223756 | J14: 0.255345355444307 | K14: 0.255345355444307 | L14: 0.0196546446556926 | M14: 0.0196546446556926 | N14: 2021.250000735 | O14: 708.9500002578 | R14: 144.461638219341 | S14: 50.6696739223756 | T14: 50.8785591150522 | U14: 50.8785591150522 | V14: 13.9916037617272 | W14: 373957.409495633
A15: 13 | B15: 0.3000000001 | C15: 8500 | D15: 2574 | E15: 2550.00000085 | F15: 772.2000002574 | G15: 176.402351586595 | H15: 53.4187827039878 | J15: 0.279246782266283 | K15: 0.279246782266283 | L15: 0.0207532178337171 | M15: 0.0207532178337171 | N15: 2550.00000085 | O15: 772.2000002574 | R15: 176.402351586595 | S15: 53.4187827039878 | T15: 48.1852986853601 | U15: 48.1852986853601 | V15: 14.4555896104266 | W15: 409575.038825561
A16: 14 | B16: 0.3250000001 | C16: 10500 | D16: 2570 | E16: 3412.50000105 | F16: 835.250000257 | G16: 228.20065547702 | H16: 55.8548271024707 | J16: 0.303266604340284 | K16: 0.303266604340284 | L16: 0.0217333957597162 | M16: 0.0217333957597162 | N16: 3412.50000105 | O16: 835.250000257 | R16: 228.20065547702 | S16: 55.8548271024707 | T16: 46.0121377743254 | U16: 46.0121377743254 | V16: 14.9539447812569 | W16: 483127.446630416
A17: 15 | B17: 0.3500000001 | C17: 12500 | D17: 2560 | E17: 4375.00000125 | F17: 896.000000256 | G17: 282.428706832801 | H17: 57.8413991593577 | J17: 0.327405703553376 | K17: 0.327405703553376 | L17: 0.0225942965466241 | M17: 0.0225942965466241 | N17: 4375.00000125 | O17: 896.000000256 | R17: 282.428706832801 | S17: 57.8413991593577 | T17: 44.2589570308802 | U17: 44.2589570308802 | V17: 15.490634965234 | W17: 553236.962886002
A18: 16 | B18: 0.3750000001 | C18: 15000 | D18: 2555 | E18: 5625.0000015 | F18: 958.1250002555 | G18: 350.025442905909 | H18: 59.6210004416398 | J18: 0.351664970572939 | K18: 0.351664970572939 | L18: 0.0233350295270606 | M18: 0.0233350295270606 | N18: 5625.0000015 | O18: 958.1250002555 | R18: 350.025442905909 | S18: 59.6210004416399 | T18: 42.8540276257351 | U18: 42.8540276257351 | V18: 16.0702603639361 | W18: 642810.414386026
A19: 17 | B19: 0.4000000001 | C19: 12975 | D19: 2548 | E19: 5190.0000012975 | F19: 1019.2000002548 | G19: 310.812169490614 | H19: 61.0365632263649 | J19: 0.376045304956215 | K19: 0.376045304956215 | L19: 0.0239546951437853 | M19: 0.0239546951437853 | N19: 5190.0000012975 | O19: 1019.2000002548 | R19: 310.812169490614 | S19: 61.0365632263649 | T19: 41.7454696875755 | U19: 41.7454696875755 | V19: 16.6981878792047 | W19: 541647.469196292
A20: 18 | B20: 0.4250000001 | C20: 4800 | D20: 2545 | E20: 2040.00000048 | F20: 1081.6250002545 | G20: 117.371447224828 | H20: 62.2313194139976 | J20: 0.400547615261494 | K20: 0.400547615261494 | L20: 0.0244523848385059 | M20: 0.0244523848385059 | N20: 2040.00000048 | O20: 1081.6250002545 | R20: 117.371447224828 | S20: 62.2313194139974 | T20: 40.895806548295 | U20: 40.895806548295 | V20: 17.380717787115 | W20: 196299.871431816
A21: 19 | B21: 0.4500000001 | C21: 2500 | D21: 2538 | E21: 1125.00000025 | F21: 1142.1000002538 | G21: 62.0679523475368 | H21: 63.0113852232193 | J21: 0.425172819160986 | K21: 0.425172819160985 | L21: 0.0248271809390146 | M21: 0.0248271809390147 | N21: 1125.00000025 | O21: 1142.1000002538 | R21: 62.0679523475366 | S21: 63.0113852232193 | T21: 40.2784352543447 | U21: 40.2784352543445 | V21: 18.1252958684829 | W21: 100696.088135861
A22: 20 | B22: 0.4750000001 | C22: 2250 | D22: 2535 | E22: 1068.750000225 | F22: 1204.1250002535 | G22: 56.4258522253992 | H22: 63.5731268406164 | J22: 0.449921843555378 | K22: 0.449921843555378 | L22: 0.0250781565446218 | M22: 0.0250781565446219 | N22: 1068.750000225 | O22: 1204.1250002535 | R22: 56.4258522253991 | S22: 63.5731268406164 | T22: 39.8753392507416 | U22: 39.8753392507414 | V22: 18.9407861480898 | W22: 89719.5133141684
A23: 21 | B23: 0.5000000001 | C23: 1700 | D23: 2535 | E23: 850.00000017 | F23: 1267.5000002535 | G23: 42.8474381967556 | H23: 63.8930916639855 | J23: 0.474795624690144 | K23: 0.474795624690144 | L23: 0.0252043754098562 | M23: 0.0252043754098562 | N23: 850.00000017 | O23: 1267.5000002535 | R23: 42.8474381967556 | S23: 63.8930916639855 | T23: 39.6756509034121 | U23: 39.6756509034121 | V23: 19.8378254556736 | W23: 67448.6065358006
A24: 22 | B24: 0.5250000001 | C24: 1100 | D24: 2530 | E24: 577.50000011 | F24: 1328.250000253 | G24: 27.7253810090436 | H24: 63.7683763208003 | J24: 0.499795108273597 | K24: 0.499795108273597 | L24: 0.0252048918264033 | M24: 0.0252048918264033 | N24: 577.50000011 | O24: 1328.250000253 | R24: 27.7253810090436 | S24: 63.7683763208003 | T24: 39.6748379992035 | U24: 39.6748379992035 | V24: 20.8292899535494 | W24: 43642.3217991239
A25: 23 | B25: 0.5500000001 | C25: 900 | D25: 2520 | E25: 495.00000009 | F25: 1386.000000252 | G25: 22.5708754529234 | H25: 63.1984512681856 | J25: 0.524921249596752 | K25: 0.524921249596752 | L25: 0.0250787505032483 | M25: 0.0250787505032483 | N25: 495.00000009 | O25: 1386.000000252 | R25: 22.5708754529234 | S25: 63.1984512681856 | T25: 39.8743948535425 | U25: 39.8743948535425 | V25: 21.9309171734359 | W25: 35886.9553681883
A26: 24 | B26: 0.5750000001 | C26: 800 | D26: 2515 | E26: 460.00000008 | F26: 1446.1250002515 | G26: 19.8599891559947 | H26: 62.4348409091585 | J26: 0.550175013655007 | K26: 0.550175013655007 | L26: 0.0248249864449934 | M26: 0.0248249864449934 | N26: 460.00000008 | O26: 1446.1250002515 | R26: 19.8599891559947 | S26: 62.4348409091585 | T26: 40.2819958115899 | U26: 40.2819958115899 | V26: 23.1621475956924 | W26: 32225.5966492719
A27: 25 | B27: 0.6000000001 | C27: 500 | D27: 2510 | E27: 300.00000005 | F27: 1506.000000251 | G27: 12.2213124141578 | H27: 61.3509883190722 | J27: 0.575557375271685 | K27: 0.575557375271685 | L27: 0.0244426248283156 | M27: 0.0244426248283156 | N27: 300.00000005 | O27: 1506.000000251 | R27: 12.2213124141578 | S27: 61.3509883190722 | T27: 40.9121363611304 | U27: 40.9121363611304 | V27: 24.5472818207695 | W27: 20456.0681805652
A28: 26 | B28: 0.6250000001 | C28: 400 | D28: 2500 | E28: 250.00000004 | F28: 1562.50000025 | G28: 9.57227235061304 | H28: 59.8267021913315 | J28: 0.601069319223468 | K28: 0.601069319223468 | L28: 0.0239306808765326 | M28: 0.0239306808765327 | N28: 250.00000004 | O28: 1562.50000025 | R28: 9.57227235061304 | S28: 59.8267021913318 | T28: 41.7873609680968 | U28: 41.7873609680967 | V28: 26.1171006092393 | W28: 16714.9443872387
A29: 27 | B29: 0.6500000001 | C29: 300 | D29: 2450 | E29: 195.00000003 | F29: 1592.500000245 | G29: 6.98644791967269 | H29: 57.0559913439936 | J29: 0.626711840367758 | K29: 0.626711840367758 | L29: 0.0232881597322423 | M29: 0.0232881597322423 | N29: 195.00000003 | O29: 1592.500000245 | R29: 6.98644791967269 | S29: 57.0559913439936 | T29: 42.9402757236978 | U29: 42.9402757236978 | V29: 27.9111792246976 | W29: 12882.0827171093
A30: 28 | B30: 0.6750000001 | C30: 200 | D30: 2400 | E30: 135.00000002 | F30: 1620.00000024 | G30: 4.50281126560059 | H30: 54.0337351872071 | J30: 0.652485943771997 | K30: 0.652485943771997 | L30: 0.022514056328003 | M30: 0.022514056328003 | N30: 135.00000002 | O30: 1620.00000024 | R30: 4.50281126560059 | S30: 54.0337351872071 | T30: 44.416696193311 | U30: 44.416696193311 | V30: 29.9812699349267 | W30: 8883.33923866221
A31: 29 | B31: 0.7000000001 | C31: 150 | D31: 2300 | E31: 105.000000015 | F31: 1610.00000023 | G31: 3.24110328825237 | H31: 49.6969170865363 | J31: 0.678392644844985 | K31: 0.678392644844985 | L31: 0.0216073552550158 | M31: 0.0216073552550158 | N31: 105.000000015 | O31: 1610.00000023 | R31: 3.24110328825237 | S31: 49.6969170865363 | T31: 46.2805367985916 | U31: 46.2805367985916 | V31: 32.3963757636422 | W31: 6942.08051978874
A32: 30 | B32: 0.7250000001 | C32: 135 | D32: 2150 | E32: 97.8750000135001 | F32: 1558.750000215 | G32: 2.77654913501983 | H32: 44.2191158540195 | J32: 0.704432969470224 | K32: 0.704432969470224 | L32: 0.0205670306297765 | M32: 0.0205670306297765 | N32: 97.8750000135001 | O32: 1558.750000215 | R32: 2.77654913501983 | S32: 44.2191158540195 | T32: 48.6215058459738 | U32: 48.6215058459738 | V32: 35.2505917431932 | W32: 6563.90328920646
A33: 31 | B33: 0.7500000001 | C33: 120 | D33: 1850 | E33: 90.0000000120001 | F33: 1387.500000185 | G33: 2.32704551503902 | H33: 35.8752850235182 | J33: 0.730607954141342 | K33: 0.730607954141342 | L33: 0.0193920459586584 | M33: 0.0193920459586585 | N33: 90.0000000120001 | O33: 1387.500000185 | R33: 2.32704551503901 | S33: 35.8752850235182 | T33: 51.5675345516344 | U33: 51.5675345516342 | V33: 38.6756509188826 | W33: 6188.1041461961
A34: 32 | B34: 0.7750000001 | C34: 110 | D34: 1670 | E34: 85.2500000110001 | F34: 1294.250000167 | G34: 1.98894894004273 | H34: 30.1958611806487 | J34: 0.756918646099612 | K34: 0.756918646099612 | L34: 0.0180813540003885 | M34: 0.0180813540003885 | N34: 85.2500000110001 | O34: 1294.250000167 | R34: 1.98894894004273 | S34: 30.1958611806487 | T34: 55.305592710508 | U34: 55.305592710508 | V34: 42.8618343561743 | W34: 6083.61519815589
A35: 33 | B35: 0.8000000001 | C35: 100 | D35: 1505 | E35: 80.0000000100001 | F35: 1204.0000001505 | G35: 1.66338966263789 | H35: 25.0340144227003 | J35: 0.783366103473622 | K35: 0.783366103473622 | L35: 0.0166338966263789 | M35: 0.0166338966263789 | N35: 80.0000000100001 | O35: 1204.0000001505 | R35: 1.66338966263789 | S35: 25.0340144227003 | T35: 60.1182045591259 | U35: 60.1182045591259 | V35: 48.0945636533124 | W35: 6011.82045591257
A36: 34 | B36: 0.825000000100001 | C36: 90 | D36: 1350 | E36: 74.250000009 | F36: 1113.750000135 | G36: 1.35437442109883 | H36: 20.3156163164825 | J36: 0.809951395421125 | K36: 0.809951395421125 | L36: 0.015048604678876 | M36: 0.0150486046788759 | N36: 74.250000009 | O36: 1113.750000135 | R36: 1.35437442109884 | S36: 20.3156163164825 | T36: 66.4513435856095 | U36: 66.45134358561 | V36: 54.8223584647729 | W36: 5980.62092270489
A37: 35 | B37: 0.850000000100001 | C37: 80 | D37: 980 | E37: 68.000000008 | F37: 833.000000098001 | G37: 1.06595182615073 | H37: 13.0579098703464 | J37: 0.836675602273117 | K37: 0.836675602273116 | L37: 0.013324397826884 | M37: 0.0133243978268841 | N37: 68.000000008 | O37: 833.000000098001 | R37: 1.06595182615072 | S37: 13.0579098703464 | T37: 75.0502959302482 | U37: 75.0502959302476 | V37: 63.7927515482161 | W37: 6004.02367441981
A38: 36 | B38: 0.875000000100001 | C38: 70 | D38: 755 | E38: 61.250000007 | F38: 660.6250000755 | G38: 0.802212909387819 | H38: 8.65243923696862 | J38: 0.863539815680175 | K38: 0.863539815680175 | L38: 0.011460184419826 | M38: 0.0114601844198259 | N38: 61.250000007 | O38: 660.6250000755 | R38: 0.802212909387819 | S38: 8.65243923696854 | T38: 87.2586306962051 | U38: 87.2586306962058 | V38: 76.3513018679054 | W38: 6108.10414873442
A39: 37 | B39: 0.900000000100001 | C39: 60 | D39: 575 | E39: 54.000000006 | F39: 517.5000000575 | G39: 0.567291680333804 | H39: 5.43654526986562 | J39: 0.890545138761104 | K39: 0.890545138761104 | L39: 0.00945486133889673 | M39: 0.00945486133889684 | N39: 54.000000006 | O39: 517.5000000575 | R39: 0.567291680333804 | S39: 5.43654526986568 | T39: 105.765697047937 | U39: 105.765697047935 | V39: 95.1891273537196 | W39: 6345.94182287613
A40: 38 | B40: 0.925000000100001 | C40: 50 | D40: 276 | E40: 46.250000005 | F40: 255.3000000276 | G40: 0.365365692303465 | H40: 2.01681862151513 | J40: 0.917692686253931 | K40: 0.917692686253931 | L40: 0.0073073138460692 | M40: 0.00730731384606942 | N40: 46.250000005 | O40: 255.3000000276 | R40: 0.36536569230346 | S40: 2.01681862151516 | T40: 136.849192612403 | U40: 136.849192612398 | V40: 126.585503180157 | W40: 6842.45963061992
A41: 39 | B41: 0.950000000100001 | C41: 40 | D41: 158 | E41: 38.000000004 | F41: 150.1000000158 | G41: 0.200656617228332 | H41: 0.792593638051911 | J41: 0.944983584669292 | K41: 0.944983584669292 | L41: 0.00501641543070819 | M41: 0.00501641543070819 | N41: 38.000000004 | O41: 150.1000000158 | R41: 0.200656617228327 | S41: 0.792593638051894 | T41: 199.345531448305 | U41: 199.345531448305 | V41: 189.378254895824 | W41: 7973.82125793219
A42: 40 | B42: 0.975000000100001 | C42: 30 | D42: 95 | E42: 29.250000003 | F42: 92.6250000095001 | G42: 0.0774308296124071 | H42: 0.245197627105956 | J42: 0.972418972446254 | K42: 0.972418972446254 | L42: 0.0025810276537469 | M42: 0.0025810276537469 | N42: 29.250000003 | O42: 92.6250000095001 | R42: 0.0774308296124071 | S42: 0.245197627105956 | T42: 387.442574878379 | U42: 387.442574878379 | V42: 377.756510545163 | W42: 11623.2772463514
A43: 41 | B43: 1.0000000001 | C43: 10 | D43: 30 | E43: 10.000000001 | F43: 30.000000003 | G43: -0.000000000106170627844904 | H43: -0.000000000318511883534711 | J43: 1.00000000011062 | K43: 1.00000000011062 | L43: -0.0000000000106170627844904 | M43: -0.0000000000106170627844904 | N43: 10.000000001 | O43: 30.000000003 | R43: -0.000000000106170627844904 | S43: -0.000000000318511883534711 | T43: -94188008519.7215 | U43: -94188008519.7215 | V43: -94188008529.1406 | W43: -941880085197.218
I44: averages | J44: 0.00000672037482932693 | K44: 0.00000672037482932694 | L44: 0.00000672037482932693 | M44: 0.00000672037482932694 | N44: 0.3510212501 | O44: 0.3510210001 | R44: 2164.91613661216 | S44: 1580.09919513455 | T44: 10001122124.4692 | U44: 10001122124.4692 | V44: -94188006877.1717 | W44: 100015952337.073
J46: NPE computated with current metrics | M46: % of the true NPE | P46: diagrams
C47: pop B | D47: pop A | G47: pop B | H47: pop A | K47: pop B | L47: pop A | M47: pop B | N47: pop A | Q47: pop B | R47: pop A
B48: N | C48: 100000 | D48: 100000 | F48: NPE | G48: 2164.91613661216 | H48: 1580.09919513455 | J48: OR | K48: 31873.9322965102 | L48: 32725.2246309229 | M48: 14.7229408832387 | N48: 20.7108672238367 | P48: OR | Q48: 14.7229408832387 | R48: 20.7108672238367
B49: taill cible | C49: 100000 | D49: 100000 | F49: average AB | G49: 0.0216491613661216 | H49: 0.0158009919513455 | J49: RR | K49: 32937.2088733879 | L49: 33522.0008148655 | M49: 15.2140807287486 | N49: 21.2151242897196 | P49: RR | Q49: 15.2140807287486 | R49: 21.2151242897196
B50: écart | C50: 0 | D50: 0 | J50: average AB | K50: 2164.91613661216 | L50: 1580.09919513455 | M50: 1 | N50: 1 | P50: average AB | Q50: 1 | R50: 1
E51: pop B | F51: pop A
D52: total events | E52: 35102.12501 | F52: 35102.10001
D53: average Rc | E53: 0.3510212501 | F53: 0.3510210001
D54: average Rt | E54: 0.329372088733879 | F54: 0.335220008148655
J55: pop A NPE computated with current metrics and trial 1 summary data | M55: % of the true NPE
K56: pop B | L56: pop A | M56: pop B | N56: pop A | Q56: pop B | R56: pop A
J57: OR | K57: 32725.247938093 | L57: 32725.2246309229 | M57: 15.1161735019003 | N57: 20.7108672238367 | P57: OR | Q57: 15.1161735019003 | R57: 20.7108672238367
J58: RR | K58: 33522.024689506 | L58: 33522.0008148655 | M58: 15.4842139714308 | N58: 21.2151242897196 | P58: RR | Q58: 15.4842139714308 | R58: 21.2151242897196
J59: average AB | K59: 1580.09919513455 | L59: 1580.09919513455 | M59: 0.729866237501108 | N59: 0.999999999999998 | P59: average AB | Q59: 0.729866237501108 | R59: 0.999999999999998
D62: trial 1 Rc | E62: 0.3510210001 | J62: pop A NPE computated with current metrics and trial 2 summary data | M62: % of the true NPE
D63: trial 1 Rt | E63: 0.335220008148655 | K63: pop B | L63: pop A | M63: pop B | N63: pop A | Q63: pop B | R63: pop A
J64: OR | K64: 32064.9114740624 | L64: 32064.888637189 | M64: 14.8111563916006 | N64: 20.2929592875709 | P64: OR | Q64: 14.8111563916006 | R64: 20.2929592875709
J65: RR | K65: 32615.6367028247 | L65: 32615.6134737205 | M65: 15.065542794588 | N65: 20.6414974288644 | P65: RR | Q65: 15.065542794588 | R65: 20.6414974288644
D66: trial 2 Rc | E66: 0.195149387639399 | J66: average AB | K66: 1382.35696664963 | L66: 1382.35696664963 | M66: 0.63852679707624 | N66: 0.874854547680417 | P66: average AB | Q66: 0.63852679707624 | R66: 0.874854547680417
D67: trial 2 Rt | E67: 0.181325817972903
C69: trial 2 summary data | J69: comparing the five NNTs (trial 2) | M69: % of the ref NNT
C70: N | D70: 52983 | K70: pop B | L70: pop A | M70: pop B | N70: pop A
C71: NPE | D71: 732.414191639973 | I71: 1 | J71: NNT ave | K71: 46.1911657033 | L71: 63.2871659626944 | M71: 1 | N71: 1
C72: trial 2 AB | D72: 0.0138235696664963 | I72: 2 | J72: NNT ave sec | K72: 1.48801223949015 | L72: 1.48801223949015 | M72: 0.0322142170874862 | N72: 0.0235120694196875
C73: total events | D73: 10339.6000052983 | I73: 3 | J73: NNT transp trial 2 | K73: 40.2173618558456 | L73: 40.2173904989765 | M73: 0.870672156536903 | N73: 0.635474663578447
C74: trial 2 Rc | D74: 0.195149387639399 | I74: 4 | J74: NNT ref | K74: 46.1911657032999 | L74: 63.2871659626943 | M74: 1 | N74: 1
C75: trial 2 Rt | D75: 0.181325817972903 | I75: 5 | J75: NNT 5 | K75: -1.06170629696419E-016 | L75: 9.99840502072917E-017 | M75: -2.29850509464052E-018 | N75: 1.57984717258834E-018
J78: comparing NNT pop with NNT trials | M78: % of the ref NNT
K79: pop B | L79: pop A | M79: pop B | N79: pop A
I80: 1 | J80: NNT trial 1 | K80: 63.2871659626944 | L80: 63.2871659626944 | M80: 1.37011406833089 | N80: 1
I81: 2 | J81: NNT trial 2 | K81: 72.3402148739964 | L81: 72.3402148739964 | M81: 1.56610498506706 | N81: 1.14304715298262
I82: 3 | J82: NNT transp trial 1 | K82: 63.2871208890942 | L82: 63.2871659626944 | M82: 1.37011309252524 | N82: 1
I83: 3 | J83: NNT transp trial 2 | K83: 40.2173618558456 | L83: 40.2173904989765 | M83: 0.870672156536903 | N83: 0.635474663578447
I84: 4 | J84: NNT ref | K84: 46.1911657032999 | L84: 63.2871659626943 | M84: 1 | N84: 1
K88: NPE
K89: pop B trial 1 | L89: pop B trial 2 | M89: pop A trial 1 | N89: pop A trial 2
J90: average AB | K90: 0.729866237501108 | L90: 0.63852679707624 | M90: 0.999999999999998 | N90: 0.874854547680417

Sheet: 'efficacy%20metrics%20drug%202%20bis.fods'#NPE vs pop 2
G48: 1264.7659063041 | H48: 1580.09919513455
G49: 0.012647659063041
E54: 0.203726091036959 | F54: 0.335220008148655
M57: 15.9493856482097
M58: 16.33771271934
M59: 1.24932146514917
M64: 15.6275558199889
M65: 15.8959641472946
M66: 1.09297456530051
M82: 1.29853698948972
M83: 0.825187356540146

Sheet: 'efficacy%20metrics%20drug%202%20bis.fods'#NPE vs pop 1
G48: 2164.91613661216
G49: 0.0216491613661216 | H49: 0.0158009919513455
E54: 0.329372088733879
M57: 15.1161735019003 | N57: 20.7108672238367
M58: 15.4842139714308 | N58: 21.2151242897196
M59: 0.729866237501108 | N59: 0.999999999999998
E62: 0.3510210001
E63: 0.335220008148655
M64: 14.8111563916006 | N64: 20.2929592875709
M65: 15.065542794588 | N65: 20.6414974288644
M66: 0.63852679707624 | N66: 0.874854547680417
D74: 0.195149387639399
D75: 0.181325817972903
M82: 1.37011309252524 | N82: 1
M83: 0.870672156536903 | N83: 0.635474663578447